idx,cartoonstock_id,contest_number,description,caption,element,pass_rate,num_attempts
514,CC123065,,"Inside a workshop-like room, three elves in pointy hats sit at a long table with open laptop computers. The middle elf appears distressed and is speaking, while the two elves on either side look toward him.","It’s from Santa, and it goes way, way beyond jolly.","""Beyond Jolly"" is a Santa-specific way of describing romantic advances",0.0,24
182,,144.0,"In a therapist’s office, a man reclines on a couch, wearing a fishing hat and waders, speaking to the therapist as if explaining something. The therapist sits nearby in an armchair, holding a notepad and pen, listening attentively. The room is filled with fish floating in the air, swimming around as though it were underwater. Both the therapist and the patient appear unfazed by the surreal presence of the fish.",You think this is bad? I used to be a proctologist.,"The man sees the subject of his profession in his sleep, which for proctology, would be the gastrointestinal tract",0.0,12
490,CC123065,,"Inside a workshop-like room, three elves in pointy hats sit at a long table with open laptop computers. The middle elf appears distressed and is speaking, while the two elves on either side look toward him.","It’s from Santa, and it goes way, way beyond jolly.",This frames Santa as a boss making an inappropriate advance on an employee,0.0,24
517,CC135060,,"Two elderly men, seen from behind, sit side by side at a bar lined with multiple liquor bottles. They each have a drink (in martini glasses) in front of them. Nearby, framed pictures hang on a brick-patterned wall. One man is speaking to the other","This time, when the swinging sixties come around, I'm not going to miss them.",He implies that he preferred the 1960's to the age range of 60s,0.08333333333333333,12
310,,41.0,"In a grand church, there is a large bar stocked with bottles of liquor. A few patrons are seated at the bar, and sunbeams stream through the stained glass windows, dramatically illuminating one of the patrons. A couple dressed in formal church attire stands at the open doors, with the husband speaking.",Finally—a faith-based initiative I can embrace.,The government funding the church to run a bar would be illegal and absurd,0.08333333333333333,24
472,CS166113,,"Two men in a lab-like setting stand facing each other at a table with laboratory items—such as a flask and containers—spread out in front. One man, wearing a tie and glasses, hands a piece of paper while speaking to the other man, who has a beard and is also wearing a tie and jacket. Behind them, a woman works at a computer, and on the wall is a large chart displaying a fluctuating graph.",My diabetic research shows that test subjects are 98% more likely to take their diabetic pills if the pills are covered in chocolate.,"Diabetic people are often overweight, implying they like chocolate",0.08333333333333333,12
53,,41.0,"In a grand church, there is a large bar stocked with bottles of liquor. A few patrons are seated at the bar, and sunbeams stream through the stained glass windows, dramatically illuminating one of the patrons. A couple dressed in formal church attire stands at the open doors, with the husband speaking.",Finally—a faith-based initiative I can embrace.,"This refers to President George W. Bush's ""Faith-Based and Community Initiatives,"" a program that funds cetrain faith-based organizations",0.08333333333333333,24
364,,117.0,"In an unusually large and sparsely furnished room, a circular, solid barrier decorated with stars encloses a small seating area. Inside the enclosure, two individuals, appearing very small in comparison to the vast room, sit in armchairs, each holding a glass of wine, seemingly engaged in a casual conversation. The enclosed space includes side tables with lamps, emphasizing a cozy yet isolated atmosphere within the expansive and minimally decorated surroundings.",The people who lived here before had lions.,"Lions are indeed cats, and suit the circus setting",0.125,24
144,,117.0,"In an unusually large and sparsely furnished room, a circular, solid barrier decorated with stars encloses a small seating area. Inside the enclosure, two individuals, appearing very small in comparison to the vast room, sit in armchairs, each holding a glass of wine, seemingly engaged in a casual conversation. The enclosed space includes side tables with lamps, emphasizing a cozy yet isolated atmosphere within the expansive and minimally decorated surroundings.",The people who lived here before had lions.,This is a twist on a common situation of previous tennants owning cats,0.125,24
266,,702.0,"In a barbershop, a barber holding scissors and a towel stands near a door with a ""SORRY WE'RE CLOSED"" sign. He looks at a customer who has a bird nesting on his curly hair. The customer stands with his hands in his pockets, seemingly unfazed by the bird on his head. The customer is speaking.",Just be glad I didn’t come here when I had a ponytail.,"This implies that, like the bird, the man literally had a horse on his head for his “ponytail”",0.16666666666666666,12
105,,86.0,"Two golfers stand on a grassy field, each holding golf clubs in bags slung over their shoulders. However, instead of a golf course, they are looking at a field filled with barbed wire, tanks, and machine guns. A golf flag is visible in the background, alongside scattered trees and clouds.","Tom, I think you should stop shouting ‘Bombs away!’ every time you drive the ball.","The military must have interpreted the man's ""Bombs away!"" literally, and responded with force.",0.16666666666666666,12
44,,34.0,"In a woman's bedroom, a vampire is walking out of the door to the outside, spreading his cape as if to take flight, looking back at the woman who is sitting up in her bed, naked. The woman is speaking with a mildly disappointed look, and the vampire is looking back at her with a slight frown.",And where do you think you're going with those curtains?,"This offers a different interpretation of the scene, suggesting that the man is not a vampire but rather her partner, just acting silly by pretending to be a vampire.",0.16666666666666666,12
80,,61.0,"A doctor wearing a head mirror and standing behind a desk is in a typical doctor's offide. However, a giant hand is reaching through the doorway, facing up. The doctor is reaching over the desk to check the enormous hand's pulse.",I don't know why you're so jolly—your cholesterol is through the roof.,"This is a play on words. While ""through the roof"" typically means very elevated levels, here the giant patient is literally breaking through the roof.",0.16666666666666666,12
54,,46.0,"The cartoon depicts a shareholder meeting, with a banner reading “Welcome Stockholders.” However, the board members sitting on stage are all completely naked, and one man, also naked, is speaking at the podium. ","If all goes well, we'll get them back after the audit.",The board members specifically are naked because they had to lose their clothes for “transparency” during the audit.,0.16666666666666666,12
58,,47.0,"In an office setting, two people are sitting calmly at a desk, seemingly engaged in a business conversation. Meanwhile, through the large glass window behind them, a chaotic chase is unfolding as individuals dressed in business attire armed with various weapons— a hammer, bat, and gun—are running after another man, with his tie trailing him. One man sitting down is speaking to the other.",How soon can you start?,This directly implies that the employee being chased in the background is leaving a vacancy at the company.,0.16666666666666666,12
286,,15.0,"In a restaurant, a man and a woman are sitting down to eat dressed in nice clothing. The man is leaning over the table with his hand on a glass looking at the woman with a soft smile. However, the man is bald, and has a cartoonishly large forehead, with the outline of the woman visible on his forehead. The woman, siting upright, is speaking.","Well, it's a lovely gesture, but I still think we should start seeing other people.","The woman suggesting that they see other people implies that the man got the tattoo as a gesture to save the relationship, but that it wasn't enough, emphasizing the catastrophic mistake the man has made by getting such a visible tattoo.",0.20833333333333334,24
17,,15.0,"In a restaurant, a man and a woman are sitting down to eat dressed in nice clothing. The man is leaning over the table with his hand on a glass looking at the woman with a soft smile. However, the man is bald, and has a cartoonishly large forehead, with the outline of the woman visible on his forehead. The woman, siting upright, is speaking.","Well, it's a lovely gesture, but I still think we should start seeing other people.","This implies that the image on his forehead is a tattoo, as getting a tattoo of your significant other is a common practice",0.20833333333333334,24
164,,129.0,"In a hospital room, a patient sits upright in bed with a neutral expression, listening to a doctor who is speaking to him. Next to the doctor stands a person wearing a full deep-sea diving suit, complete with a helmet and portholes, adding an odd and surreal element to the scene. On the bed, a couple of books lie near the patient, and a coffee pot and cups sit on the bedside table.","Actually, the preferred term is ‘adventure surgery’","The diver is literally exploring the patient's body, explaining the suit",0.25,12
510,CS174848,,"On one mountain peak, a robed, bearded man sits cross-legged, holding a tablet or scroll and pointing into the distance. A hiker wearing a cap and backpack, holding a walking stick, stands on the mountainside looking up at him. On another nearby peak, a lone figure sits in a meditative pose.",Truth and enlightenment are on another peak. I do medicare explanations.,This jokes that Medicare is as mysterious as truth and enlightenment,0.25,24
85,,65.0,"In a business setting, a mixure of business people and cartoonish robots sit around a board room table, taking a vote. All of the robots are raising their hands, while only one human is nervously raising his hand, sitting between two robots. At the head of the table, an old man leading the table leans over and yells furiously at the human raising his hand.","You're voting with your pacemaker again, Hargrove!","This is a direct twist on ""voting with your heart""",0.25,12
198,,158.0,"In a beach setting near the water’s edge, a man in swim trunks stands with his feet buried in the sand, looking down at a head protruding from the sand to his left, which appears to be speaking to him. Several other heads emerge from the sand around them, each with a distinct expression. A small bucket with a shovel rests nearby, and the ocean stretches across the horizon","You got that? Three bottled waters, two sodas, one coffee, and six straws.","The people buried in the sand need straws because their arms are buried, so they can't hold their drinks.",0.25,12
51,,41.0,"In a grand church, there is a large bar stocked with bottles of liquor. A few patrons are seated at the bar, and sunbeams stream through the stained glass windows, dramatically illuminating one of the patrons. A couple dressed in formal church attire stands at the open doors, with the husband speaking.",Just don't order a Bloody Mary.,"This is a play on the dual meaning of ""Bloody Mary"", referring to both the alcoholic drink and the ghost of Mary I. of England, a common horror/supernatural character known for persecuting Protestants",0.25,12
494,CC38926,,"Two dogs sit outdoors, facing each other on a patch of grass with a tree in the background. One dog, older than the other, is speaking.",My advice is to learn all the tricks you can while you’re young.,"This references the idiom ""you can't teach an old dog new tricks""",0.25,12
483,CS174848,,"On one mountain peak, a robed, bearded man sits cross-legged, holding a tablet or scroll and pointing into the distance. A hiker wearing a cap and backpack, holding a walking stick, stands on the mountainside looking up at him. On another nearby peak, a lone figure sits in a meditative pose.",Truth and enlightenment are on another peak. I do medicare explanations.,Navigating medicare is notoriously difficult or frustrating,0.25,24
27,,25.0,"In a social setting, several people are standing in a room wearing business attire and holding drinks. Two couples face each other, but the man in one of the couples is dressed in a full, vintage-style deep-sea diving suit, complete with a helmet and a hose attached to the back, looking somewhat uncomfortable.",This suit looked way better in the store.,"This is a play on words on ""suit,"" as in a formal suit or a diving suit.",0.25,12
128,,109.0,"In an airplane cabin, a woman, a man, and a human-sized microbe with spots and flagella are sitting in a row, all wearing seatbelts. The man is turned to the woman, angrily pointing back at the giant microbe.  Passengers in the rows in front and behind seem undisturbed.",This guys wife lets him drink on the plane!,"He is implying the microbe is just a drunk passanger, who looks like that when he's drunk",0.2916666666666667,24
349,,109.0,"In an airplane cabin, a woman, a man, and a human-sized microbe with spots and flagella are sitting in a row, all wearing seatbelts. The man is turned to the woman, angrily pointing back at the giant microbe.  Passengers in the rows in front and behind seem undisturbed.",This guys wife lets him drink on the plane!,"The man is annoyed that the woman, his wife, won't let him drink.",0.2916666666666667,24
288,,16.0,"As a group of people exits a grand church doorway dressed in typical church attire, a pastor in a typical black suit and roman collar stands next to the Devil, complete with horns, trident, robe, and tail. They watch the procession pass by, as the pastor is explaining something to the devil. One passerby tips his hat at the pastor and devil.",Keep your eye out for a blond kid with a laser pointer.,"The caption implies the pastor was so upset at a kid disrupting the church that he identifies him to the devil to be condemned, a seemingly extreme punishment for a mundane offense. ",0.3333333333333333,12
218,,669.0,"A baby leans over the side of a crib to a microphone on a stand, as if ready to give a speech or perform. The crib has a block with letters. A mobile with boats and airplanes hangs above the crib. A teddy bear lies on the floor. In the background, a couple stands in the doorway, looking at the baby with expressions of surprise and curiosity. The woman is speaking with a smile.",I love his bedtime routine.,"This is an explicit play on the dual meaning of the word “routine"", which could be either a child's “bedtime routine” or a comedian's “stand-up routine”",0.3333333333333333,12
176,,142.0,"In an elegantly furnished sitting room, three men in suits are seated in armchairs, each holding a drink as they converse. The room features framed portraits on the walls, a chandelier hanging from the ceiling, and table lamps providing warm lighting. However, a taxi is inexplicably parked at the top of the staircase, partially visible through an open railing. The men appear unfazed, continuing their conversation as if nothing is out of the ordinary.","I'll concede I'm drunk, but you could have just taken my keys from me.",One of the men called the taxi to prevent him from driving drunk,0.3333333333333333,12
106,,86.0,"Two golfers stand on a grassy field, each holding golf clubs in bags slung over their shoulders. However, instead of a golf course, they are looking at a field filled with barbed wire, tanks, and machine guns. A golf flag is visible in the background, alongside scattered trees and clouds.","If we truly believe in golf, I don't think we have much of a choice.",This is something a soldier would say before going into battle.,0.3333333333333333,12
291,,20.0,"In a living room cocktail party setting, two couples in nice clothes are standing in a circle, holding champagne glasses. However one of the men is miniature, only reaching knee-hight. The other couple looks down on the tiny man, while the woman he is with is cheerfully speaking to the other couple. ",Larry can't tell you about his current project—it's top secret.,Government top-secret miniaturization projects are a well-established trope.,0.3333333333333333,24
50,,40.0,"The cartoon shows a woman in her underwear sitting up in bed, looking forward with a disgruntled expression. A large snow globe with a snowman inside is positioned next to her on the bed. The woman is speaking.",I think the Manhattan skyline is getting suspicious,"This implies that she is cheating on her partner, a snowglobe of the manhattan skyline, with the snowman",0.3333333333333333,24
308,,40.0,"The cartoon shows a woman in her underwear sitting up in bed, looking forward with a disgruntled expression. A large snow globe with a snowman inside is positioned next to her on the bed. The woman is speaking.",I think the Manhattan skyline is getting suspicious,The manhattan skyline snowglobe is another common knickknack,0.3333333333333333,24
24,,23.0,"Two butterflies stand on adjascent twigs. While the butterfly on the left appears normal, the butterfly on the left's wings are replaced with the pattern of Piet Mondrian iconic ""Composition with Red, Blue and Yellow"". The butterfly on the right is speaking to the other butterfly.",But how will we raise the kids?,This is a reference to a common conversation had in mixed race/ethnicity/religion households,0.3333333333333333,12
23,,20.0,"In a living room cocktail party setting, two couples in nice clothes are standing in a circle, holding champagne glasses. However one of the men is miniature, only reaching knee-hight. The other couple looks down on the tiny man, while the woman he is with is cheerfully speaking to the other couple. ",Larry can't tell you about his current project—it's top secret.,This implies that the man's top-secret project caused him to become tiny.,0.3333333333333333,24
29,,25.0,"In a social setting, several people are standing in a room wearing business attire and holding drinks. Two couples face each other, but the man in one of the couples is dressed in a full, vintage-style deep-sea diving suit, complete with a helmet and a hose attached to the back, looking somewhat uncomfortable.","We don't have much of a sex life, but he's good at finding keys in the swimming pool.","The woman implies that the man never takes off the suit, even at home",0.3611111111111111,36
443,,25.0,"In a social setting, several people are standing in a room wearing business attire and holding drinks. Two couples face each other, but the man in one of the couples is dressed in a full, vintage-style deep-sea diving suit, complete with a helmet and a hose attached to the back, looking somewhat uncomfortable.","We don't have much of a sex life, but he's good at finding keys in the swimming pool.",The woman attempts to justify a very unusual relationship ,0.3611111111111111,36
294,,25.0,"In a social setting, several people are standing in a room wearing business attire and holding drinks. Two couples face each other, but the man in one of the couples is dressed in a full, vintage-style deep-sea diving suit, complete with a helmet and a hose attached to the back, looking somewhat uncomfortable.","We don't have much of a sex life, but he's good at finding keys in the swimming pool.","Having sex in the suit would be impossible, but brings to mind an absurd image.",0.3611111111111111,36
233,,680.0,"In a fancy restaurant, a drenched bear stands dripping water onto the floor, forming a puddle. Across from the bear, a man in a suit sits at a table, calmly reading a menu labeled ""Market St"" with a glass of wine and a basket of bread in front of him. The bear appears to be waiting for something, while the man orders from the menu, unfazed by the bear's presence. ","Well, don't put it on the menu if you can't catch one.",This references seafood restaurant menus often listing availability-limited fish,0.375,24
420,,680.0,"In a fancy restaurant, a drenched bear stands dripping water onto the floor, forming a puddle. Across from the bear, a man in a suit sits at a table, calmly reading a menu labeled ""Market St"" with a glass of wine and a basket of bread in front of him. The bear appears to be waiting for something, while the man orders from the menu, unfazed by the bear's presence. ","Well, don't put it on the menu if you can't catch one.",This implies that the bear catches everything they serve,0.375,24
333,,86.0,"Two golfers stand on a grassy field, each holding golf clubs in bags slung over their shoulders. However, instead of a golf course, they are looking at a field filled with barbed wire, tanks, and machine guns. A golf flag is visible in the background, alongside scattered trees and clouds.","I support our troops as much as the next guy, but do we have to let them play through?",The person behind you at the course going faster than you is a common frustration for golfers,0.3888888888888889,36
104,,86.0,"Two golfers stand on a grassy field, each holding golf clubs in bags slung over their shoulders. However, instead of a golf course, they are looking at a field filled with barbed wire, tanks, and machine guns. A golf flag is visible in the background, alongside scattered trees and clouds.","I support our troops as much as the next guy, but do we have to let them play through?",The army is also playing on the golf course,0.3888888888888889,36
449,,86.0,"Two golfers stand on a grassy field, each holding golf clubs in bags slung over their shoulders. However, instead of a golf course, they are looking at a field filled with barbed wire, tanks, and machine guns. A golf flag is visible in the background, alongside scattered trees and clouds.","I support our troops as much as the next guy, but do we have to let them play through?","Doing favors for military members is a common practice, but can sometimes be taken advantage of",0.3888888888888889,36
152,,124.0,"In a scorching desert landscape under a blazing sun, a group of people is crawling on the ground, clearly parched and desperate. However, while half of the group is crawling in one direction, the other half is crawling in the opposite direction. The desert is dotted with cacti and sparse vegetation, emphasizing the harsh and barren conditions. One man in the center is speaking to another crawling the same direction.",What disease are you crawling for?,This frames the crawling as a fundraising event for a disease,0.4166666666666667,24
151,,124.0,"In a scorching desert landscape under a blazing sun, a group of people is crawling on the ground, clearly parched and desperate. However, while half of the group is crawling in one direction, the other half is crawling in the opposite direction. The desert is dotted with cacti and sparse vegetation, emphasizing the harsh and barren conditions. One man in the center is speaking to another crawling the same direction.","I don't know about you, but I'd be willing to pitch in for a new contact lens.","This suggests that the people are crawling opposite directions because they all 
simply don't have the right prescription to see, which could be fixed by one person getting one contact lens",0.4166666666666667,24
425,,686.0,"In a living room, a bald man is sitting on a giant egg, looking content. Two old women sipping tea, seated on a couch, are staring at him. The room is furnished with a coffee table, lamps, and a framed picture on the wall. One old woman is speaking.",I don’t know how to tell him it’s not his.,It mirrors the common situation where infidelity raises questions about paternity,0.4166666666666667,36
369,,124.0,"In a scorching desert landscape under a blazing sun, a group of people is crawling on the ground, clearly parched and desperate. However, while half of the group is crawling in one direction, the other half is crawling in the opposite direction. The desert is dotted with cacti and sparse vegetation, emphasizing the harsh and barren conditions. One man in the center is speaking to another crawling the same direction.",What disease are you crawling for?,"If they are crawling away from a diseased place, then they would be crawling towards whatever diseased place people crawling the opposite direction are leaving",0.4166666666666667,24
462,,686.0,"In a living room, a bald man is sitting on a giant egg, looking content. Two old women sipping tea, seated on a couch, are staring at him. The room is furnished with a coffee table, lamps, and a framed picture on the wall. One old woman is speaking.",I don’t know how to tell him it’s not his.,"It should be obvious to him that the egg isn't his specifically because he's human, and humans don’t lay eggs",0.4166666666666667,36
368,,124.0,"In a scorching desert landscape under a blazing sun, a group of people is crawling on the ground, clearly parched and desperate. However, while half of the group is crawling in one direction, the other half is crawling in the opposite direction. The desert is dotted with cacti and sparse vegetation, emphasizing the harsh and barren conditions. One man in the center is speaking to another crawling the same direction.","I don't know about you, but I'd be willing to pitch in for a new contact lens.",Both contact lenses and money would be impossible to come by in this barren setting,0.4166666666666667,24
