idx,cartoonstock_id,contest_number,description,caption,element,explanation,autograder_judgment,autograder_reasoning,explainer_model,explainer_usage,autograder_model,autograder_usage,source_file
109,,92.0,"A man and a woman stand on a city sidewalk. The man is reaching into his pocket as if to give something to a dolphin standing upright on its tail, which is holding out a cup in a begging gesture. The woman, appearing angry, is yelling at the man, likely in protest of his action.","Give him money, and you feed him today; teach him how to earn money by somersaulting on cue, and you feed him for life.","This is a play on the addage about ""Give a man a fish...""","The line parodies the old proverb “Give a man a fish, and you feed him for a day; teach a man to fish, and you feed him for a lifetime.” Here the bit player isn’t a hungry human but an upright, cup-holding dolphin panhandling on a city sidewalk. By swapping “fish” for “money” and suggesting the dolphin be taught crowd-pleasing tricks (“somersaulting on cue”) as a self-employment scheme, the caption comically applies self-help logic to an already absurd situation: a marine mammal begging like a street person. The humor comes from the incongruous mash-up of a familiar moral adage, urban panhandling, and a highly anthropomorphized sea creature—plus the implication that the woman thinks the real problem is the dolphin’s job skills, not the fact that it’s a dolphin on a sidewalk.",PASS,"The student's answer explicitly identifies the parody of the proverb ""Give a man a fish,"" which is the anticipated comedic element. They further elaborate on the comedic situation with detailed analysis, aligning with the anticipated answer point.",o3,"{""tokens_in"": 0, ""tokens_out"": 0}",gpt-4o,"{""tokens_in"": 541, ""tokens_out"": 58}",20250506_180913_o3_high_exp-o3_ag-gpt_4o.csv
112,,96.0,"A pregnant woman, wearing primitive clothing, sits on a large tree branch or vine, holding her belly and speaking. Tarzan, shirtless and wearing a loincloth, stands nearby, leaning against a tree. The background features trees and jungle foliage.","Well, you'll be a monkey's uncle.","This a literal twist on the idiom, ""well I'll be a monkey's uncle""","The joke hinges on the idiom “Well, I’ll be a monkey’s uncle,” a stock expression of astonishment. Because Tarzan was raised by apes, those monkeys are effectively his immediate family. The pregnant woman tweaks the phrase to “Well, you’ll be a monkey’s uncle,” telling Tarzan that when her baby arrives he will literally become an uncle in his extended simian clan. The caption thus converts a purely figurative saying into a literal fact of Tarzan’s jungle family tree, letting the humor arise from that unexpected, dead-pan literalization of a familiar cliché.",PASS,"The student's answer successfully captures the key comedic element: the literal twist on the idiom ""I'll be a monkey's uncle"" by explaining how it applies to Tarzan's situation with his jungle family. The explanation acknowledges the transformation from a figurative saying to a literal fact due to Tarzan's background, which aligns with the anticipated answer point.",o3,"{""tokens_in"": 0, ""tokens_out"": 0}",gpt-4o,"{""tokens_in"": 449, ""tokens_out"": 85}",20250506_180913_o3_high_exp-o3_ag-gpt_4o.csv
118,,102.0,"In an outdoor setting, two dogs are sitting on the grass, watching as another dog, standing upright like a human, throws a stick into the distance. The upright dog appears to mimic the typical action of a person playing fetch with dogs. The seated dogs look confused or uncertain.",He's his own best friend.,"This plays on the common phrase, ""A dog is a man's best friend""","The standard dynamic is that a human throws a stick and a dog, “man’s best friend,” retrieves it. Here, one dog has taken over the human role: standing upright and hurling the stick for himself to chase. By doing both the throwing (human) and the fetching (dog) parts, he eliminates the need for a human partner. The caption twists the familiar saying “A dog is man’s best friend” into “He’s his own best friend,” capturing the absurdity that the dog is simultaneously owner and pet. The seated dogs’ puzzled looks underline how odd it is for a dog to supply his own companionship, reinforcing the gag through anthropomorphism and role-reversal.",PASS,"The student's answer explicitly discusses the role reversal with the dog taking on both roles (human and pet) and connects this directly to the twist on the common phrase ""A dog is man's best friend."" This captures the anticipated answer point that the humor plays on this phrase.",o3,"{""tokens_in"": 0, ""tokens_out"": 0}",gpt-4o,"{""tokens_in"": 472, ""tokens_out"": 69}",20250506_180913_o3_high_exp-o3_ag-gpt_4o.csv
121,,104.0,"Two angels, complete with wings and halos, sit on a street curb against a brick wall, drinking from bottles. A police car with two officers, also angels with wings and halos, drives in front of them. The scene is parially a dirty city with trash cans and a boarded up window, and partially swirling clouds reminiscent of heaven.","Except here it's always good cop, good cop.","While the typical phrase is ""good cop, bad cop,"" because everyone in heaven is presumably good, there is only good cop","The joke riffs on the familiar police-interrogation cliché “good cop, bad cop,” where one officer acts kindly while the other is menacing. In this cartoon every character—loitering “street people” and the patrolling officers alike—is an angel, the visual shorthand for perfect moral goodness. Because Heaven (or a heaven-earth mash-up) contains no “bad” beings, the standard routine can never include a “bad cop.” So one angel comments that in this realm it’s “always good cop, good cop,” a playful acknowledgment that the usual dramatic contrast is impossible when everyone is literally saintly. The humor comes from transplanting gritty, earthly police tropes into an all-good celestial setting and highlighting the absurd mismatch.",PASS,"The student's answer accurately captures and explains the key comedic element: the juxtaposition of the typical ""good cop, bad cop"" routine with the context of an all-good heaven where only ""good cop, good cop"" can exist. This explanation addresses the anticipated answer point effectively by highlighting why the usual contrast between good and bad is humorously absent in this scenario.",o3,"{""tokens_in"": 0, ""tokens_out"": 0}",gpt-4o,"{""tokens_in"": 505, ""tokens_out"": 88}",20250506_180913_o3_high_exp-o3_ag-gpt_4o.csv
123,,106.0,"In a laboratory, a man in a lab coat is holding a stack of papers and reading from one of them, with a clipboard under one arm. Beside him, a monkey is using a typewrighter on a desyk, with half of a page sticking out. Behind them, several monkeys are in cages stacked on top of each other, holding the bars of the cage. One monkey in a cage is reading from a stack of papers. ",Have you considered writing this story in the third monkey rather than the first monkey?,"This is a subversion of the typical phrases ""first person"" and ""third person,"" where the writer is a monkey, not a person","The classic phrase for narrative voice is “first person” vs. “third person.”  Here the scientist treats his test subjects—typewriter-pounding lab monkeys—as real authors and applies the same workshop jargon, but swaps “person” for “monkey.”  The suggestion to try telling the story “in the third monkey rather than the first monkey” is a pun that riffs on both literary terminology and the familiar “infinite monkeys with typewriters” trope.  The humor comes from (1) imagining monkeys producing a manuscript sophisticated enough to merit stylistic advice, and (2) the absurd literalization of grammatical terms: instead of narrator vs. outsider perspective, the speaker is talking about which numbered monkey—Monkey #1 or Monkey #3—should narrate.  Treating animal test subjects like creative writing students creates the incongruous, deadpan tone typical of New Yorker cartoons.",PASS,"The student's answer correctly identifies the subversion of ""first person"" and ""third person"" narrative conventions by pointing out the use of ""monkey"" instead of ""person."" They explain how the joke relies on imagining monkeys as authors worthy of stylistic critique, which covers the anticipated answer point about the monkeys replacing human writers in the traditional phrase.",o3,"{""tokens_in"": 0, ""tokens_out"": 0}",gpt-4o,"{""tokens_in"": 569, ""tokens_out"": 85}",20250506_180913_o3_high_exp-o3_ag-gpt_4o.csv
127,,108.0,"A caveman is sweeping inside his garage-like wooden structure with a shop-like display, while two others stand inside a rock cave, speaking to each other. Volcanic activity in the background emphasizes the prehistoric setting",He's always thinking outside the rock.,"This is a play on the phrase ""thinking outside the box""","The gag riffs on the modern business cliché “thinking outside the box,” which praises creative, unconventional ideas. In the Stone Age setting, “box” is swapped for “rock,” the material that defines prehistoric life (caves, stone tools). The inventive caveman has built a wooden, storefront-style workshop instead of living in a simple cave. The observing cavemen use the updated phrase to note his innovative streak—he’s literally operating outside the usual rock dwelling—and the punny substitution ties the familiar corporate saying to the Stone Age world. The humor comes from the anachronism (Stone Age characters parroting modern office jargon) and the wordplay on “box” → “rock.”",PASS,"The student's answer clearly addresses the key comedic element, which is the play on the phrase ""thinking outside the box."" The answer explains the substitution of ""rock"" for ""box"" while highlighting the setting and innovation depicted in the cartoon, which reflects the usage of the phrase. Additionally, it discusses the anachronism and wordplay involved, aligning well with the anticipated comedic point. Therefore, the student effectively captures the anticipated answer point.",o3,"{""tokens_in"": 0, ""tokens_out"": 0}",gpt-4o,"{""tokens_in"": 455, ""tokens_out"": 104}",20250506_180913_o3_high_exp-o3_ag-gpt_4o.csv
134,,112.0,"In a prehistoric setting, two cavemen look into the barrel of an enormous revolver gun lying on the ground. One caveman is on his hands and knees peering into the gun with his spear on the ground next to him, speaking to the other, who is kneeling.",We're gonna need a bigger spear.,"This is a play on the famous quote from the movie Jaws, ""we're gonna need a bigger boat""","The joke plays on two incongruities. First, the scene is prehistoric, yet the cavemen have stumbled upon a giant, modern revolver—an absurd, time-warping mismatch. Second, the caption parodies the famous movie line “You’re gonna need a bigger boat” from Jaws. By swapping “boat” for “spear,” the speaker reacts to this overwhelming new threat with his only frame of reference: primitive weaponry. The humor comes from imagining that, when faced with a colossal gun they can’t possibly understand or use, the caveman’s solution is simply to scale up his Stone-Age tool, a laughably inadequate response that highlights both the technological gulf and the timeless instinct to fight bigger with bigger.",PASS,"The student's answer explicitly covers the key comedic element by explaining the parody of the famous movie line from Jaws, swapping ""boat"" for ""spear."" The student correctly identifies the humor in using this line to address the mismatch of technology and the inadequate response by the cavemen.",o3,"{""tokens_in"": 0, ""tokens_out"": 0}",gpt-4o,"{""tokens_in"": 489, ""tokens_out"": 73}",20250506_180913_o3_high_exp-o3_ag-gpt_4o.csv
141,,115.0,"In a bar setting, two individuals sit next to each other at the counter. One is a man in a suit and tie, holding a martini glass and speaking to the person beside him. The other person is wearing a full hazmat suit, complete with a helmet and radioactive symbol, and is holding a glass of liquid on a coaster. The bar features standard items like napkins, bottles, and a coffee pot, while a window behind them provides a view of the outside world.","The way I see it, I'm the miner, and you're the canary.","This refers to the idea of a ""canary in a coal mine,"" an early warning system that sacrifices itself to warn others of danger","The joke riffs on the old coal-mining practice of taking a canary underground; the bird, being more sensitive to toxic gas, would die first and thus warn the miners to flee. In the cartoon, a perfectly normal bar is treated as though it might be lethally contaminated: one patron wears an over-the-top hazmat suit, while the other sits in regular business attire. By telling the suited patron “I’m the miner, and you’re the canary,” the businessman is saying he’ll treat the hazmat-clad stranger as his living warning system—if that person keels over, he’ll know the bar isn’t safe. The humor comes from transplanting life-or-death mine safety logic to a mundane cocktail setting and recasting a fully grown human as a disposable little bird.",PASS,"The student’s answer explicitly covers the anticipated answer point by explaining the reference to the ""canary in a coal mine"" as an early warning system. It interprets the humor as deriving from using this mine safety logic in a normal bar setting and recasting the hazmat-suited person as a ""canary,"" aligning perfectly with the comedic element emphasized in the anticipated answer point.",o3,"{""tokens_in"": 0, ""tokens_out"": 0}",gpt-4o,"{""tokens_in"": 556, ""tokens_out"": 92}",20250506_180913_o3_high_exp-o3_ag-gpt_4o.csv
142,,117.0,"In an unusually large and sparsely furnished room, a circular, solid barrier decorated with stars encloses a small seating area. Inside the enclosure, two individuals, appearing very small in comparison to the vast room, sit in armchairs, each holding a glass of wine, seemingly engaged in a casual conversation. The enclosed space includes side tables with lamps, emphasizing a cozy yet isolated atmosphere within the expansive and minimally decorated surroundings.",Welcome to the greatest living room on Earth!,"This directly mimics the phrase “Greatest Show on Earth,” associated with circuses","The circular barricade festooned with stars makes the little seating nook look exactly like a circus ring plunked down in an otherwise empty arena-sized room. The caption riffs on Ringling Bros.’ famous slogan “The Greatest Show on Earth,” swapping in “living room” for “show.” By greeting a guest with “Welcome to the greatest living room on Earth!” the speaker treats their oddly cordoned-off furniture arrangement as if it were a dazzling circus spectacle, poking fun at the absurd grandeur—and pointlessness—of fencing off a couple of armchairs in a cavernous space. The joke lies in the mismatch between the small, ordinary activity (sipping wine and chatting) and the overblown circus-style hype implied by the phrase.",PASS,"The student's answer correctly identifies the key comedic element: the play on Ringling Bros.' slogan ""The Greatest Show on Earth"" by replacing ""show"" with ""living room."" The student explains how the caption humorously treats the ordinary living room setup as a grandiose circus event, which directly aligns with the anticipated answer point.",o3,"{""tokens_in"": 0, ""tokens_out"": 0}",gpt-4o,"{""tokens_in"": 514, ""tokens_out"": 81}",20250506_180913_o3_high_exp-o3_ag-gpt_4o.csv
145,,120.0,"In a bar setting, a man in a suit and tie sits at the counter, glancing curiously at the patron next to him—a life-sized Mr. Potato Head figure. The Mr. Potato Head is outfitted with exaggerated facial features, including a large nose, oversized ears, and a small bowler hat. It rests its potato-shaped arms on the counter, casually holding a beer mug as if it’s just another customer. The bar","If I start to drink too much, just pull off my lips.",Mr. Potato Head's facial features are removable parts,"The gag hinges on Mr. Potato Head’s toy-world trait: every facial feature pops off and snaps back on. Placed in an adult bar scene, he worries about over-imbibing like any human drinker. Instead of the usual solutions—cutting him off, taking away the glass—he offers a uniquely “potato-head” fix: simply detach his plastic lips so he physically can’t drink. The humor comes from applying a child’s toy mechanic (removable parts) to an adult problem (drinking too much), creating an absurd yet perfectly logical solution within Mr. Potato Head’s reality.",PASS,"The student's answer explicitly covers the anticipated answer point by discussing the comedic element of Mr. Potato Head's facial features being removable, which is central to the humor of the caption.",o3,"{""tokens_in"": 0, ""tokens_out"": 0}",gpt-4o,"{""tokens_in"": 492, ""tokens_out"": 52}",20250506_180913_o3_high_exp-o3_ag-gpt_4o.csv
151,,124.0,"In a scorching desert landscape under a blazing sun, a group of people is crawling on the ground, clearly parched and desperate. However, while half of the group is crawling in one direction, the other half is crawling in the opposite direction. The desert is dotted with cacti and sparse vegetation, emphasizing the harsh and barren conditions. One man in the center is speaking to another crawling the same direction.","I don't know about you, but I'd be willing to pitch in for a new contact lens.","This suggests that the people are crawling opposite directions because they all 
simply don't have the right prescription to see, which could be fixed by one person getting one contact lens","The scene looks like classic “lost in the desert” desperation—everyone is on hands and knees as if dying of thirst. The caption abruptly reframes that posture: they aren’t crawling toward water, they’re combing the sand for a tiny, misplaced contact lens. Half the party crawls one way, half the other, like a search grid. The speaker’s line—“I’d be willing to pitch in for a new contact lens”—says the ordeal has become so punishing that it would be cheaper and saner just to buy a replacement instead of continuing this absurd, Sahara-wide scavenger hunt. The joke comes from the wild mismatch between the epic survival imagery (scorching sun, cactus, life-or-death atmosphere) and the trivial first-world problem (a lost piece of plastic that costs a few bucks). Their extreme suffering is revealed to be self-inflicted over something minor, which flips the expected “dying of thirst” narrative into a farcical statement about misplaced priorities and penny-pinching.",FAIL,"The student's answer focuses on the comedic element of the absurdity of the situation and the triviality of the ""problem"" being addressed, but it does not capture the specific comedic element of the anticipated answer point. The anticipated point emphasizes the lack of correct prescription due to the need for a singular contact lens, leading to ineffective searching. The student's answer does not mention the eye prescription or the specific reason for crawling in opposite directions related to vision, as highlighted in the anticipated answer point. Therefore, the key comedic element regarding vision correction and contact lens is not addressed.",o3,"{""tokens_in"": 0, ""tokens_out"": 0}",gpt-4o,"{""tokens_in"": 595, ""tokens_out"": 128}",20250506_180913_o3_high_exp-o3_ag-gpt_4o.csv
152,,124.0,"In a scorching desert landscape under a blazing sun, a group of people is crawling on the ground, clearly parched and desperate. However, while half of the group is crawling in one direction, the other half is crawling in the opposite direction. The desert is dotted with cacti and sparse vegetation, emphasizing the harsh and barren conditions. One man in the center is speaking to another crawling the same direction.",What disease are you crawling for?,This frames the crawling as a fundraising event for a disease,"The scene looks like classic “lost in the desert” desperation, where crawling is a last-ditch effort to reach water. The speaker, however, treats the crawl as if it were a charity “-thon”—a walk-a-thon, bike-a-thon, etc.—in which participants move a long distance “for” (i.e., to raise money for) a particular disease. By asking, “What disease are you crawling for?” he dead-seriously re-labels their life-or-death struggle as an organized fund-raiser. The humor comes from that collision of contexts: survival crawling versus altruistic sponsored crawling. The split group crawling in opposite directions now looks like different teams in a charity event, heightening the absurdity. The joke hinges on the double meaning of “for”—literally fleeing death vs. figuratively supporting a cause—and the incongruity of polite small talk about philanthropy in a lethal, waterless desert.",PASS,"The student's answer captures the key comedic element by explaining that the situation is humorously framed as a charity event, where crawling is treated as if it were a fundraiser for a disease. This matches the anticipated answer point that focuses on framing the crawling as a fundraising event, highlighting the collision between dire desperation and organized altruism.",o3,"{""tokens_in"": 0, ""tokens_out"": 0}",gpt-4o,"{""tokens_in"": 545, ""tokens_out"": 80}",20250506_180913_o3_high_exp-o3_ag-gpt_4o.csv
153,,124.0,"In a scorching desert landscape under a blazing sun, a group of people is crawling on the ground, clearly parched and desperate. However, while half of the group is crawling in one direction, the other half is crawling in the opposite direction. The desert is dotted with cacti and sparse vegetation, emphasizing the harsh and barren conditions. One man in the center is speaking to another crawling the same direction.","If we had just started wandering fifteen minutes earlier, we would have missed most of this traffic.",This frames the desert crawling like modern traffic,"The gag comes from treating a life-or-death desert situation as if it were an ordinary rush-hour commute. The speaker, crawling through blistering sand and desperate for water, complains that they hit “traffic” and wishes they’d “left fifteen minutes earlier”—the stock gripe of urban drivers who want to beat congestion. The absurdity is twofold: 1) calling a handful of dehydrated wanderers “traffic” equates their agonized, inch-by-inch crawl with cars on a highway; 2) he’s focusing on minor commuter strategy instead of the truly urgent problem—finding water and surviving. That everyday complaint transplanted into an extreme, incongruous setting creates the humor.",PASS,"The student's answer does explicitly cover the anticipated answer point by discussing how the desert situation is humorously framed like modern traffic. The student notes the treatment of the life-or-death situation as an ordinary rush-hour commute, thus capturing the key comedic logic of framing the desert ordeal as ""traffic"".",o3,"{""tokens_in"": 0, ""tokens_out"": 0}",gpt-4o,"{""tokens_in"": 502, ""tokens_out"": 75}",20250506_180913_o3_high_exp-o3_ag-gpt_4o.csv
161,,128.0,"In a cozy living room, a man and a woman lounge comfortably in armchairs, separated by a small table with a lamp and a coffee mug on it. The man is reading a newspaper, while the woman is reclining with her legs draped over the armrest, reading a book. Behind them looms their enormous dog, so large that it takes up nearly the entire room, its massive head resting on the back of the woman’s chair. The woman is speaking with a concerned look","Well, what did you think a labrapotamus was?",The term labrapotamus is a combination of labradore and hippopotamus,"Designer dog breeds often get cutesy mash-up names—labraDoodle, cockaPoo, etc.—that still describe a normal-sized pet. The caption invents an even catchier name, “labrapotamus,” blending “Labrador” with “hippopotamus.” The speaker’s rhetorical “Well, what did you think a labrapotamus was?” mocks anyone who ordered such an animal and is now surprised that it’s enormous: of course something part hippopotamus would be huge. The joke hinges on the absurd literalization of the hybrid name: instead of a slightly different dog, they’ve ended up with a living-room-filling behemoth that dwarfs the furniture and the couple. The humor comes from skewering the fad for boutique crossbreeds and from the visual incongruity of treating a colossal creature as an ordinary household pet.",PASS,"The student's answer explicitly covers the anticipated answer point by discussing how the term ""labrapotamus"" is a blend of ""Labrador"" and ""hippopotamus."" This is the key comedic element noted in the anticipated answer point. Furthermore, the student explains the literal and humorous implications of such a hybrid name, aligning with the anticipated comedic interpretation.",o3,"{""tokens_in"": 0, ""tokens_out"": 0}",gpt-4o,"{""tokens_in"": 562, ""tokens_out"": 88}",20250506_180913_o3_high_exp-o3_ag-gpt_4o.csv
