idx,cartoonstock_id,contest_number,description,caption,element,explanation,autograder_judgment,autograder_reasoning,explainer_model,explainer_usage,autograder_model,autograder_usage,source_file
291,,20.0,"In a living room cocktail party setting, two couples in nice clothes are standing in a circle, holding champagne glasses. However one of the men is miniature, only reaching knee-hight. The other couple looks down on the tiny man, while the woman he is with is cheerfully speaking to the other couple. ",Larry can't tell you about his current project—it's top secret.,Government top-secret miniaturization projects are a well-established trope.,"The caption sets up the familiar social-party line “I’m working on a project I can’t talk about—it’s top secret.” In this scene, however, the “secret” is plainly visible: Larry himself has been miniaturized to knee height. His size all but shouts that he’s involved in some classified shrinking experiment, yet the woman treats it as confidential insider information. The incongruity between the blatant, absurd evidence (a tiny man standing there) and the polite, conventional secrecy of cocktail-party small talk creates the joke.",FAIL,"The student's answer focuses on the incongruity between Larry's visible small size and the social norm of not discussing ""top secret"" projects, highlighting the absurdity of the situation. However, it does not explicitly mention the trope of government top-secret miniaturization projects, which is the anticipated answer point. Therefore, the student's answer does not explicitly cover the expected comedic element.",o3,"{""tokens_in"": 171, ""tokens_out"": 187}",gpt-4o,"{""tokens_in"": 451, ""tokens_out"": 91}",20250506_185500_o3_low_exp-o3_ag-gpt_4o.csv
292,,23.0,"Two butterflies stand on adjascent twigs. While the butterfly on the left appears normal, the butterfly on the left's wings are replaced with the pattern of Piet Mondrian iconic ""Composition with Red, Blue and Yellow"". The butterfly on the right is speaking to the other butterfly.","It's not traditional, but I find it attracts a more mature type of female.",This references the fact that butterflies use fancy patterns to attract mates.,"The caption treats a male butterfly’s wing coloration the way a human might talk about personal style to impress dates. Instead of the usual natural pattern, his wings look like a Piet Mondrian painting—an icon of sophisticated, modern art. He brags that this “non-traditional” design helps him lure “a more mature type of female,” as if female butterflies judge mates by refined artistic taste the way cultured humans might. The humor comes from the incongruity of applying human notions of avant-garde fashion and dating strategy to insect courtship, and from the visual pun that the butterfly’s wings literally are modern art.",PASS,"The student's answer explicitly discusses the humorous element where butterflies' wing patterns are used to attract mates. The student explains the comedic scenario of the butterfly using a Mondrian art design instead of traditional patterns to attract a mature female, paralleling the human use of style to impress dates. This aligns with the anticipated answer point regarding butterflies attracting mates through wing patterns.",o3,"{""tokens_in"": 168, ""tokens_out"": 203}",gpt-4o,"{""tokens_in"": 463, ""tokens_out"": 86}",20250506_185500_o3_low_exp-o3_ag-gpt_4o.csv
292,,23.0,"Two butterflies stand on adjascent twigs. While the butterfly on the left appears normal, the butterfly on the left's wings are replaced with the pattern of Piet Mondrian iconic ""Composition with Red, Blue and Yellow"". The butterfly on the right is speaking to the other butterfly.","It's not traditional, but I find it attracts a more mature type of female.","This mocks modern art enjoyers for thinking of themselves as “more mature”, which is a trope.","The joke hinges on mating displays. Male butterflies use colorful, species-typical wing patterns to lure females. Here, however, the male’s wings look like an austere Mondrian painting—blocky primary colors and black lines—something an art-gallery visitor, not a butterfly, would appreciate. The speaker treats this avant-garde, “non-traditional” design the way a human might discuss a trendy profile picture or couture outfit that draws “a more mature type of female.” The humor comes from applying human art criticism and dating-market language to butterflies, implying that sophisticated lady butterflies prefer modernist abstract art over ordinary wing patterns. It’s the incongruous mash-up of insect biology with highbrow aesthetic taste and pickup strategy that makes the caption funny.",FAIL,"The student's answer elaborates extensively on the comedic elements in the cartoon, specifically focusing on the application of human attitudes towards art and dating to the world of butterflies. However, it does not explicitly address the key anticipated point, which is the mockery of modern art enjoyers for thinking of themselves as ""more mature."" The student discusses the sophistication attributed to the modernist design but does not connect it directly to the trope involving modern art connoisseurs considering themselves more mature.",o3,"{""tokens_in"": 168, ""tokens_out"": 233}",gpt-4o,"{""tokens_in"": 498, ""tokens_out"": 110}",20250506_185500_o3_low_exp-o3_ag-gpt_4o.csv
300,,30.0,"In a doctor’s office, a doctor wearing a lab coat and head mirror is speaking to a patient seated across the desk. The patient, dressed in a suit, is facing the doctor, seemingly engaged in conversation. However, standing behind the doctor is a mysterious figure wearing a trench coat, hat, and dark glasses, with their hands in their pockets. The desk between them holds a stethoscope, a notepad, a pen on a stand, and another small object.",Good news! We have a solid lead on who stole your liver.,This references the trope of having your organs stolen,"The setup looks like a routine check-up: patient on one side, white-coated doctor on the other. But the presence of a shadowy, trench-coated stranger turns the scene into a crime tableau. The caption flips what we expect the doctor to say (“Good news, your tests look fine”) into a cop-style report: “We have a solid lead on who stole your liver.” The humor comes from three incongruities: 1) treating a missing internal organ as stolen property in a detective case; 2) calling it “good news,” even though having one’s liver stolen is horrific; and 3) the visual payoff—the mysterious figure behind the doctor could be the detective with the “lead” or even the thief himself, making the doctor’s upbeat assurance absurdly premature. Mixing medical office clichés with police-procedural language produces the comic twist.",PASS,"The student's answer explicitly discusses the comedic element of treating a missing internal organ as stolen property in a detective case. This aligns with the anticipated answer point of referencing the trope of having your organs stolen. Additionally, the student's detailed explanation covers the same comedic logic, capturing the essential comedic twist intended by the cartoon.",o3,"{""tokens_in"": 205, ""tokens_out"": 256}",gpt-4o,"{""tokens_in"": 547, ""tokens_out"": 77}",20250506_185500_o3_low_exp-o3_ag-gpt_4o.csv
301,,32.0,"In the cartoon, a person dressed in a full rabbit costume, carrying a briefcase and reading a sheet of paper, walks down a hallway in a typical office setting. Two business-suited colleagues stand nearby, looking somewhat puzzled, while another person peeks out from an office doorway.","Well, there he goes—the first casualty of the War on Easter.","This references the notion of ""War on Christmas""","The caption echoes the politically charged phrase “the War on Christmas,” which alleges that secular forces are attacking a holiday. It transfers that rhetoric to Easter, whose pop-culture mascot is the Easter Bunny. In the office scene the employee in a full rabbit suit is leaving with a briefcase and paperwork, as if he’s just been laid off or reassigned. Calling him “the first casualty of the War on Easter” mock-dramatically treats a mundane workplace termination as a battlefield death and frames the firing of the Easter Bunny himself as evidence of a larger, imaginary assault on the holiday. The humor comes from (1) the incongruity of solemn war terminology applied to an office HR action, and (2) the exaggeration that eliminating a costumed employee equals waging war on Easter.",PASS,The student’s answer successfully addresses the anticipated answer point by explicitly discussing the transfer of the politically charged phrase “the War on Christmas” to Easter. This demonstrates their understanding of the key comedic element.,o3,"{""tokens_in"": 166, ""tokens_out"": 173}",gpt-4o,"{""tokens_in"": 494, ""tokens_out"": 57}",20250506_185500_o3_low_exp-o3_ag-gpt_4o.csv
304,,34.0,"In a woman's bedroom, a vampire is walking out of the door to the outside, spreading his cape as if to take flight, looking back at the woman who is sitting up in her bed, naked. The woman is speaking with a mildly disappointed look, and the vampire is looking back at her with a slight frown.",I guess this rules out a church wedding.,"In traditional folklore, vampires are unable to walk into churches or any consecrated ground, making a chruch wedding impossible","The caption treats the night’s hookup as the start of a serious relationship. After a one-night stand with a vampire, the woman dryly notes that they now can’t have a “church wedding.” The humor comes from combining two ideas: 1) traditional wedding etiquette (many couples dream of church ceremonies) and 2) classic vampire lore that vampires can’t enter consecrated ground or endure crosses. By jumping straight from casual sex to hypothetical wedding logistics, she exposes the absurd mismatch of expectations, while the vampire’s incompatibility with churches supplies the punch line. The incongruity between romantic convention and supernatural taboo is the joke.",PASS,"The student's answer captures the key comedic element of the joke: the incongruity arising from combining traditional vampire lore about not entering churches with the idea of having a church wedding. The explanation clearly links the concept of a church wedding with the vampire's inability to enter consecrated ground, capturing the essence of the punchline.",o3,"{""tokens_in"": 169, ""tokens_out"": 141}",gpt-4o,"{""tokens_in"": 480, ""tokens_out"": 81}",20250506_185500_o3_low_exp-o3_ag-gpt_4o.csv
317,,57.0,"Two men in a living room stand by a fireplace, above which a large, mounted fish is displayed. One man’s hand is inside the fish’s open mouth—indicating the fish is biting him. The other man stands nearby, holding a cup and looking on.","It's painful, but I couldn't stand another chorus of ‘Take Me to the River.’",The man was so annoyed by the singing fish that he would rather lose his hand plugging its mouth than keep listening to it.,"The caption alludes to the novelty wall toy “Big Mouth Billy Bass,” a mounted fish that springs to life and repeatedly sings Al Green’s “Take Me to the River.” In the cartoon the wall-mounted fish is apparently real and has clamped onto the man’s hand. He explains that the pain is worth it because jamming his hand in the fish’s mouth stops it from launching into yet another rendition of the song. The humor comes from: 1) recognizing the over-familiar, mildly annoying singing-fish gag; 2) turning the inert trophy into an aggressive, living creature; and 3) the comic exaggeration that physical injury is preferable to hearing that corny tune one more time.",PASS,"The student's answer explicitly covers the anticipated answer point. It acknowledges the comedic element where the man finds the singing fish so annoying that he willingly endures physical injury to stop the song, aligning with the anticipation that he would rather lose use of his hand than continue listening.",o3,"{""tokens_in"": 166, ""tokens_out"": 225}",gpt-4o,"{""tokens_in"": 492, ""tokens_out"": 69}",20250506_185500_o3_low_exp-o3_ag-gpt_4o.csv
337,,96.0,"A pregnant woman, wearing primitive clothing, sits on a large tree branch or vine, holding her belly and speaking. Tarzan, shirtless and wearing a loincloth, stands nearby, leaning against a tree. The background features trees and jungle foliage.","Well, you'll be a monkey's uncle.","It implies that Tarzan is the woman’s brother, meaning she was impregnated by an actual monkey—not Tarzan—making him, quite literally, a “monkey’s uncle”","The woman is announcing her pregnancy to Tarzan. The old idiom “Well, I’ll be a monkey’s uncle!” is normally just an exclamation of surprise. Here she adapts it to “you’ll be a monkey’s uncle,” because Tarzan was raised by (and still lives with) apes. If he becomes a father, the baby will be treated as family by the jungle’s monkeys, making Tarzan—quite literally—a monkey’s uncle. The joke is the literalization of a familiar expression in the perfect setting of Tarzan’s ape-filled world.",FAIL,"The student's answer interprets the joke as Tarzan becoming a monkey's uncle through a literal connection to apes and a familiar expression, but does not address the implication that Tarzan is the woman's brother and she was impregnated by a monkey. This key comedic element is missing in the student's answer.",o3,"{""tokens_in"": 154, ""tokens_out"": 193}",gpt-4o,"{""tokens_in"": 465, ""tokens_out"": 76}",20250506_185500_o3_low_exp-o3_ag-gpt_4o.csv
345,,106.0,"In a laboratory, a man in a lab coat is holding a stack of papers and reading from one of them, with a clipboard under one arm. Beside him, a monkey is using a typewrighter on a desyk, with half of a page sticking out. Behind them, several monkeys are in cages stacked on top of each other, holding the bars of the cage. One monkey in a cage is reading from a stack of papers. ",We'll have to run it by our infinite number of editors.,"This imagines a literal implementation of the infinite monkey theorem, of a publisher using an infinite number of writers and an infinite number of editors","The cartoon evokes the famous “infinite-monkey theorem” that says an infinite number of monkeys banging on typewriters will eventually produce the complete works of Shakespeare. Here, a lab of typing monkeys is apparently cranking out manuscripts. The scientist’s line, “We’ll have to run it by our infinite number of editors,” twists the theorem: if you need infinite monkeys to write literature, perhaps you need an equally infinite staff of editors to sift through the gibberish and find the accidental masterpieces. The humor comes from applying bureaucratic publishing reality—endless editorial review—to the absurd, mathematical thought experiment, and from the exaggeration that the red-tape solution must match the monkeys in infinity.",PASS,"The student's answer effectively addresses the anticipation point. The student describes the humor derived from a literal interpretation of the infinite monkey theorem, where an infinite number of monkeys are writing, and the idea of needing an infinite number of editors. This aligns with the anticipated explanation of a publisher using an infinite number of both writers and editors.",o3,"{""tokens_in"": 198, ""tokens_out"": 219}",gpt-4o,"{""tokens_in"": 524, ""tokens_out"": 80}",20250506_185500_o3_low_exp-o3_ag-gpt_4o.csv
346,,106.0,"In a laboratory, a man in a lab coat is holding a stack of papers and reading from one of them, with a clipboard under one arm. Beside him, a monkey is using a typewrighter on a desyk, with half of a page sticking out. Behind them, several monkeys are in cages stacked on top of each other, holding the bars of the cage. One monkey in a cage is reading from a stack of papers. ","Sorry, guys. It's another rejection letter.","This specifically points out that in the infinite monkey theorem, along with writing a masterpiece, they will also produce a near infinite amount of bad work.","The scene riffs on the “infinite-monkey theorem,” the old idea that a roomful of monkeys randomly pounding typewriters will eventually produce great literature (e.g., Shakespeare). Here the researcher treats the caged monkeys not as test animals but as aspiring authors whose drafts he submits to publishers. His announcement—“Sorry, guys. It’s another rejection letter.”—applies the all-too-familiar misery of human writers to the monkeys: despite their tireless typing, their work is still being turned down. The humor comes from the incongruity of mixing a scientific experiment with the mundane heartbreak of the literary world, and from the implication that even an infinite supply of simian labor can’t escape the slush-pile blues.",FAIL,"The student's answer thoroughly explores the infinite monkey theorem concept and its application to the cartoon, focusing on the monkeys producing work and facing rejection—similar to human writers. However, it fails to explicitly discuss how the infinite monkey theorem inherently leads to a vast amount of bad work. While the student touches on general literary rejection, they omit the anticipated point's specific focus on the ""near infinite amount of bad work"" produced among the monkeys' attempts. This aspect of the humor is crucial to the anticipated answer's comedic understanding.",o3,"{""tokens_in"": 195, ""tokens_out"": 226}",gpt-4o,"{""tokens_in"": 529, ""tokens_out"": 119}",20250506_185500_o3_low_exp-o3_ag-gpt_4o.csv
361,,115.0,"In a bar setting, two individuals sit next to each other at the counter. One is a man in a suit and tie, holding a martini glass and speaking to the person beside him. The other person is wearing a full hazmat suit, complete with a helmet and radioactive symbol, and is holding a glass of liquid on a coaster. The bar features standard items like napkins, bottles, and a coffee pot, while a window behind them provides a view of the outside world.","Trust me, background radiation—it's the new secondhand smoke.","A ""secondhand smoke"" in this setting means something common that is only later discovered to be harmful, humorously suggesting that background radiation (which has always been present) was discovered to be harmful","The humor comes from equating two very different everyday dangers. Second-hand cigarette smoke went from being largely ignored to being treated as a serious health threat; the suited drinker speaks as if he’s spotting the next public-health menace before everyone else. His proclamation that “background radiation” is “the new secondhand smoke” is funny because background radiation is unavoidable, miniscule, and normally nothing people worry about in a bar—yet his companion is dressed in an absurdly over-the-top hazmat suit, as if casual exposure is already a crisis. The contrast between the relaxed cocktail chatter and the extreme protective gear exaggerates the comparison and highlights the speaker’s mock trend-spotting insight, creating the joke.",PASS,"The student's answer explicitly discusses the comedic element of comparing background radiation to secondhand smoke, emphasizing the absurdity and exaggeration in suggesting that background radiation could be a newly discovered common danger. This captures the core ironic twist present in the anticipated answer point.",o3,"{""tokens_in"": 206, ""tokens_out"": 287}",gpt-4o,"{""tokens_in"": 547, ""tokens_out"": 66}",20250506_185500_o3_low_exp-o3_ag-gpt_4o.csv
371,,125.0,"In a large bedroom, a couple sits at the center of an oversized bed, propped up against pillows. The woman is holding an open book, while the man sits beside her, watching TV. On either side of the couple, two men in suits sit upright, making four suited men in total, all facing the television with neutral expressions. At the foot of the bed, a piece of TV equipment with wires rests on top of the television",So this is what it's like to be a Nielsen family.,"Nielsen sent an enterage of people to record their watching habits, far more extreme than the typical box ","The Nielsen company measures TV ratings by installing monitoring devices in selected “Nielsen families’” homes to track what they watch. In reality, the monitoring is silent and unseen, but the cartoon literalizes the idea: four somber Nielsen representatives sit right in bed with the couple, staring at the screen, plus a tangle of equipment at the foot of the TV. The captioned remark treats this absurd invasion as if it were the normal, mildly interesting experience of being a ratings family. The humor comes from exaggerating the data-gathering process—turning an invisible electronic box into a squad of suited auditors sharing the couple’s most private space—and from the couple’s deadpan acceptance of the ridiculous situation.",PASS,"The student's answer explicitly captures the key comedic element by discussing how the cartoon exaggerates the data-gathering process of the Nielsen rating system. It describes the literalization of the monitoring process with the presence of the suited men, which aligns with the anticipated answer point about Nielsen sending an entourage, rather than just using a box. The humor from this exaggeration is clearly articulated in the student's answer.",o3,"{""tokens_in"": 197, ""tokens_out"": 220}",gpt-4o,"{""tokens_in"": 519, ""tokens_out"": 95}",20250506_185500_o3_low_exp-o3_ag-gpt_4o.csv
386,,141.0,"Two angels stand facing each other in heaven, surrounded by a cloud-filled landscape. One angel has white, feathered wings and stands silently, listening. The other angel, with black, bat-like wings, is speaking to the white-winged angel. Both wear long white robes.",It just looked so uncool to wear a seat belt in the Batmobile.,"Batman, who is the epitome of ""cool,"" refused to use a seatbelt, causing his avoidable death","The angel with black, bat-like wings is implicitly Batman (or Robin), now dead and in heaven. He explains that he skipped wearing a seat belt in the Batmobile because it “looked uncool,” suggesting he died in a crash and wound up in the afterlife. The humor comes from connecting the visual gag—an angel sporting literal bat wings—to the Batman universe and to a mundane, real-world safety message. Mixing cosmic consequences (being dead in heaven) with a very ordinary bit of advice (“wear your seat belt”) produces the punch line: even a superhero can meet an unheroic end if he worries too much about looking cool.",PASS,"The student's answer captures the key comedic element by explaining that the bat-winged angel is implicitly Batman and emphasizing that Batman avoided wearing a seatbelt in the Batmobile because it ""looked uncool,"" leading to his death. This aligns with the anticipated answer point which highlights Batman's refusal to use a seatbelt, resulting in an avoidable death. The student's answer effectively links Batman's iconic ""cool"" persona to the ironic outcome of his death due to negligence, thereby covering the comedic device of juxtaposing cosmic consequences with mundane advice.",o3,"{""tokens_in"": 167, ""tokens_out"": 209}",gpt-4o,"{""tokens_in"": 480, ""tokens_out"": 123}",20250506_185500_o3_low_exp-o3_ag-gpt_4o.csv
390,,146.0,"In an office setting, a stick figure with a simple, smiling face sits across a desk from a businessman in a suit. The businessman, holding a document, is speaking to the stick figure. A desk phone sits in the foreground, and framed artwork decorates the walls, adding to the formal atmosphere.","I'm sorry, this is Tic-Tac-Toe—applications for Hangman are down the hall.",This stick figure is applying to be the character in hangman,"The humor hinges on treating children’s paper-and-pencil games as corporate departments with formal hiring processes. The “candidate” is literally a stick figure—the drawing that appears in the word-guessing game Hangman. In that context, a stick figure would indeed be the final product. But the interviewer says this office is “Tic-Tac-Toe,” where the only marks allowed are X’s and O’s, so a stick figure is out of place. By redirecting the figure “down the hall,” the caption mock-seriously imagines a bureaucracy where even simple doodles must apply to the correct game, blending a childlike pastime with the stiff formality of an office job interview. The absurd mismatch supplies the joke.",PASS,"The student’s answer explicitly mentions that the humor involves the stick figure being the character needed for the game of Hangman. The explanation includes how the stick figure is out of place in Tic-Tac-Toe and should apply for Hangman, which captures the anticipated answer point regarding the character's alignment with Hangman.",o3,"{""tokens_in"": 176, ""tokens_out"": 227}",gpt-4o,"{""tokens_in"": 493, ""tokens_out"": 79}",20250506_185500_o3_low_exp-o3_ag-gpt_4o.csv
