idx,cartoonstock_id,contest_number,description,caption,element,explanation,autograder_judgment,autograder_reasoning,explainer_model,explainer_usage,autograder_model,autograder_usage,source_file
228,,677.0,"A man, appearing to be sleepwalking with his arms extended, is heading towards a refrigerator in a kitchen. His eyes are half-closed, and he looks disheveled. On the kitchen counter, a cat with glowing eyes is sitting and staring directly at the man, emitting beams of light from its eyes that illuminate the refrigerator. The scene is surreal and humorous, with the cat seemingly guiding the sleepwalker.",Look what I dragged in.,"This is the phrase ""look what the cat dragged in"" from the cat's perspective","The stock phrase “Look what the cat dragged in” is what you say when a rumpled, bedraggled person shows up. Here the bedraggled person is a literal sleep-walker, and the cat is not just incidental—it’s actively “dragging him in” with its eerie head-lamp eye-beams, steering him toward the fridge. By dropping the words “the cat” and shifting to first person—“Look what I dragged in”—the caption turns the cliché into the cat’s own boast. The humor comes from merging the figurative idiom with a literal, surreal version: the cat really is responsible for the disheveled human’s arrival, so the pun becomes visually true.",PASS,"The student's answer explicitly captures the key comedic element of the cartoon, which is the twist on the phrase ""look what the cat dragged in"" by presenting it from the cat's perspective. The student explains how the caption turns the cliché into the cat's boast and humorously literalizes the idiom. Therefore, the anticipated answer point is covered.",o3,"{""tokens_in"": 0, ""tokens_out"": 0}",gpt-4o,"{""tokens_in"": 505, ""tokens_out"": 86}",20250506_180913_o3_high_exp-o3_ag-gpt_4o.csv
230,,678.0,"Two giraffes stand in a barren landscape with their necks twisted and intertwined. Their heads emerge from the tangled mess, looking in different directions. The background features gentle rolling hills, adding to the absurdity of the situation. One giraffe is speaking to the other.",I always knew we'd wind up together.,"While this is a common saying, here they are literally wound up together","The line “I always knew we’d wind up together” is funny because it plays on the double meaning of the phrase “wind up.” In ordinary speech it means “ultimately end up,” the way someone might talk about finding their life-partner. But the drawing shows the giraffes’ impossibly long necks literally wound and twisted around each other like coils. So the speaker is simultaneously describing their romantic fate and the very literal, absurd predicament the two animals are in. The pun—using “wind” as both “conclude” and “twist”—turns a standard sentimental remark into a visual gag, making the cliché suddenly fresh and ridiculous.",PASS,"The student's answer explicitly covers the anticipated answer point by explaining the dual meaning of the phrase ""wind up,"" highlighting both the literal and figurative aspects of the giraffes' situation. The explanation acknowledges the comedic element of the giraffes being physically wound up, thereby capturing the key comedic device in the caption.",o3,"{""tokens_in"": 0, ""tokens_out"": 0}",gpt-4o,"{""tokens_in"": 463, ""tokens_out"": 77}",20250506_180913_o3_high_exp-o3_ag-gpt_4o.csv
231,,678.0,"Two giraffes stand in a barren landscape with their necks twisted and intertwined. Their heads emerge from the tangled mess, looking in different directions. The background features gentle rolling hills, adding to the absurdity of the situation. One giraffe is speaking to the other.",I'm trying to see it from your point of view.,"By switching neck positions, they are literally switching point of view","The everyday phrase “I’m trying to see it from your point of view” means “I’m attempting to understand your perspective.” In the drawing, the giraffes’ famously long necks are knotted together, as though each animal has physically twisted itself around the other in an effort to literally look out of the other’s eyes. The caption turns the idiom into a literal, visual gag: the giraffe claims it’s “trying” to see from the other’s viewpoint, and the picture shows an absurd, impractical attempt to do exactly that. The mismatch between the normal figurative use of the phrase and the impossible, slapstick reality of intertwined giraffe necks supplies the joke’s humor.",PASS,"The student's answer captures the key comedic element by explaining how the caption and the drawing work together to create humor. The student notes that the phrase ""I'm trying to see it from your point of view"" is turned into a literal gag by showing giraffes with twisted necks, attempting to achieve a physical act of seeing from each other's perspective, which is an impractical attempt. This aligns with the anticipated answer point about literally switching points of view.",o3,"{""tokens_in"": 0, ""tokens_out"": 0}",gpt-4o,"{""tokens_in"": 473, ""tokens_out"": 105}",20250506_180913_o3_high_exp-o3_ag-gpt_4o.csv
235,,681.0,"In a black-and-white cartoon, a man in a long-sleeve shirt and shorts, with large red crab claws instead of hands walks down a city street beside a woman who has her arms crossed and looks annoyed. The man appears frustrated. The background features a brick building with large windows. The woman is speaking.",You pinch me one more time and you’re going to find yourself in hot water.,"Typically ""hot water"" means being in trouble, but here literally means boiling him","The joke hinges on a pun that combines a normal couple’s spat with crab-related wordplay. The man literally has crab claws, so any affectionate hand-holding can turn into a painful “pinch.” The woman’s warning uses the idiom “in hot water,” which ordinarily just means “in trouble,” but for a crab it also literally describes the pot of boiling water in which crabs are cooked. Her threat therefore operates on two levels at once: if he pinches again he’ll be in domestic trouble, and, more darkly, she might toss him into a cooking pot. The humor comes from that double meaning and from treating a fantastical situation (a man with crustacean claws) as an everyday relationship annoyance.",PASS,"The student's answer explicitly discusses the idiom ""in hot water"" and how it plays on two levels: trouble in a relationship and literally being boiled as a crab would be. This captures the anticipated answer point of the dual meaning of the phrase with the context of the man having crab claws.",o3,"{""tokens_in"": 0, ""tokens_out"": 0}",gpt-4o,"{""tokens_in"": 499, ""tokens_out"": 75}",20250506_180913_o3_high_exp-o3_ag-gpt_4o.csv
239,,684.0,"A group of various monsters and creatures, including a dragon, an alien, and a polka-dotted, one-eyed being, are seated around a conference table. A human man in a suit stands smiling at the corner of the table, looking somewhat out of place among the fantastical beings. The scene appears to be a business meeting or discussion. The dragon, at the head of the table, is speaking.","Good, Human Resources is here.","""Human resources"" typically regards personell, but here, is literally the only human in the room of monsters","In an ordinary office, someone announcing “Human Resources is here” simply means the HR rep has joined the meeting. In this conference room, however, everyone present is a literal monster—non-human creatures who would never need an HR department devoted to “humans.” The single man in a suit is therefore both: 1) the conventional HR person and 2) a literal “human resource” among monsters, possibly a resource to be managed, studied, or even eaten. The caption hinges on that double meaning of “Human Resources,” turning a bland corporate phrase into a darkly comic statement of possession: the monsters have acquired their human. The incongruity of formal business etiquette mixed with fantasy predators creates the punch line.",PASS,"The student's answer correctly identifies the double meaning of ""Human Resources"" as both the typical office role and the literal presence of a human among monsters. The student explains how the phrase is a darkly comic twist, matching the anticipated answer point of it being a literal human among non-humans. Thus, the key comedic element is covered.",o3,"{""tokens_in"": 0, ""tokens_out"": 0}",gpt-4o,"{""tokens_in"": 512, ""tokens_out"": 84}",20250506_180913_o3_high_exp-o3_ag-gpt_4o.csv
242,,685.0,"In a forest, two hikers with backpacks and beanies look startled as they encounter a giant honey bear bottle, complete with a dispenser on its head, angrily approaching them. One hiker, a woman with braids, is speaking to the other, a man with a beard and glasses. ",I think we’re O.K.—honey doesn’t go bad.,"""Go bad"" typically means for food to spoil, but here refers to the bear being aggressive","The hikers are being charged by an enormous, animated squeeze-bottle shaped like the classic plastic “honey bear.” Visually, it acts like a real, angry bear, something hikers definitely should fear. The woman, however, treats it purely as a food item and trots out the common kitchen factoid: “Honey never goes bad.” She conflates the two meanings of “go bad”: 1) spoil or expire, and 2) become dangerous or evil. Her logic—since honey can’t spoil, a honey bear can’t “turn bad”—is absurdly literal and comically useless in the face of an evidently furious, life-size condiment. The humor comes from the pun, the misplaced confidence, and the incongruity of applying pantry rules to wilderness survival.",PASS,"The student's answer explicitly captures the key comedic element of the caption, which is the dual meaning of ""go bad"" referring both to food spoiling and the bear being aggressive. The explanation includes the pun and the absurdity of applying that logic to a giant honey bear acting like a real bear. This matches the anticipated answer point regarding the wordplay and situational irony.",o3,"{""tokens_in"": 0, ""tokens_out"": 0}",gpt-4o,"{""tokens_in"": 504, ""tokens_out"": 90}",20250506_180913_o3_high_exp-o3_ag-gpt_4o.csv
246,,688.0,"At a formal gathering, a stern-looking military officer with numerous medals and a cartoonishly long, receipt-like ribbon on his uniform holds a glass of wine. A woman in a black dress, also holding a glass of wine, is leaning in and speaking to him. Other guests are mingling in the background. The officer is speaking.",I was stationed at CVS during the war on drugs.,This imagines the war on drugs as a literal war with generals over drugs at a pharmacy,"The uniform ribbon is absurdly long—so long it resembles the notoriously interminable paper receipts given at CVS pharmacies. The caption pretends this is no coincidence: the officer claims he “was stationed at CVS during the war on drugs.” It mash-ups two ideas. First, military lingo: being “stationed” somewhere during a “war.” Second, the retail pharmacy CVS, whose primary business is legal “drugs” (medications) and is famous for issuing epically long receipts. By calling the federal campaign against narcotics the “war on drugs,” then saying he fought it from a drugstore, the speaker turns a serious geopolitical phrase into a literal, mundane posting. His absurd “medals” are really a drugstore receipt, implying his combat achievements were everyday coupon printouts. The humor comes from conflating martial heroism with trivial shopping errands and poking fun at CVS’s ridiculous receipts in the process.",PASS,"The student's answer effectively captures the key comedic element by explaining how the cartoon humorously reimagines the ""war on drugs"" as a literal military operation taking place at a CVS pharmacy. The student thoroughly addresses the absurdity of the situation by discussing the officer's claim of being stationed at CVS, the use of military language, and the absurdly long receipt as a medal, thus aligning with the anticipated answer point.",o3,"{""tokens_in"": 0, ""tokens_out"": 0}",gpt-4o,"{""tokens_in"": 537, ""tokens_out"": 99}",20250506_180913_o3_high_exp-o3_ag-gpt_4o.csv
247,,688.0,"At a formal gathering, a stern-looking military officer with numerous medals and a cartoonishly long, receipt-like ribbon on his uniform holds a glass of wine. A woman in a black dress, also holding a glass of wine, is leaning in and speaking to him. Other guests are mingling in the background. The officer is speaking.",It’s the price of freedom.,"While the ""price of freedon"" typically refers to sacrifices to uphold liberty, here is interpreted as a literal price with a receipt.","The officer’s chest ribbon looks less like a standard row of decorations and more like a ridiculously long cash-register receipt. The woman has presumably just asked what that odd scroll is or why it’s so extensive. His reply, “It’s the price of freedom,” plays on a familiar patriotic cliché: soldiers’ sacrifices are “the cost of our freedom.” The joke is that he answers the question as though the ribbon really is an itemized bill—complete with the length one associates with a grocery receipt—so the “cost” is rendered literally. By collapsing the solemn metaphorical cost of military service into an absurd physical price tag, the caption blends gravitas with visual silliness, creating the comic effect.",PASS,"The student's answer captures the anticipated answer point by explaining that the phrase “It’s the price of freedom” usually refers to military sacrifices for liberty, but in the cartoon, it’s humorously interpreted as a literal price with a receipt. This interpretation combines the solemn concept of freedom with the absurdity of it being a literal itemized bill, which aligns with the anticipated comedic device.",o3,"{""tokens_in"": 0, ""tokens_out"": 0}",gpt-4o,"{""tokens_in"": 495, ""tokens_out"": 92}",20250506_180913_o3_high_exp-o3_ag-gpt_4o.csv
248,,689.0,"A knight in full armor, riding a checkered horse, is holding a lance that has skewered a car door. The knight faces a police officer who is holding a notepad and pen, seemingly about to write a ticket or report. The knight is speaking, possibly explaining himself.","But, officer, he did not yield!","This is a play on ""yield,"" meaning either to back down from a fight or stop in traffic ","The gag lies in the absurd collision of two eras’ rules of the road. In today’s traffic, “yield” means give right-of-way; in medieval combat, failure to yield could invite a lance. The knight treats a routine driving infraction exactly as a jousting challenge, so when the car supposedly didn’t yield, he literally speared its door. He now offers the standard modern excuse—“He did not yield”—to a police officer, as though impaling a vehicle is a normal, legally defensible response. The humor comes from the incongruity: a medieval knight applies jousting logic to contemporary traffic law, turning what should be a ticketable fender-bender into a lance attack while speaking with the earnest self-justification of any everyday motorist.",PASS,"The student's answer effectively captures the key comedic element: the dual meaning of ""yield"" in both traffic and medieval contexts. The explanation focuses on the incongruity between the knight's medieval understanding of yielding and the modern traffic expectation, aligning well with the anticipated answer point, which hinges on the wordplay involving ""yield."" Therefore, the student’s analysis directly and explicitly covers the anticipated comedic device of the cartoon caption.",o3,"{""tokens_in"": 0, ""tokens_out"": 0}",gpt-4o,"{""tokens_in"": 498, ""tokens_out"": 99}",20250506_180913_o3_high_exp-o3_ag-gpt_4o.csv
249,,689.0,"A knight in full armor, riding a checkered horse, is holding a lance that has skewered a car door. The knight faces a police officer who is holding a notepad and pen, seemingly about to write a ticket or report. The knight is speaking, possibly explaining himself.",It used to be chivalrous to open doors for people.,"Chivalry is often associated with medieval times, but here also means polite courtesy","The caption plays on the dual meaning of “chivalry.” In medieval times, knights followed a code of chivalry, and today “chivalrous” behavior mainly means small courtesies like opening doors. The cartoon mashes these two eras together: a literal knight has tried to perform the modern courtesy of opening a car door, but he’s done it with a jousting lance, spearing and ripping the door off. When he tells the cop, “It used to be chivalrous to open doors for people,” he’s defending himself by invoking the social rule—but he’s hilariously oblivious to how his medieval method turns courtesy into vandalism. The joke comes from the contrast between the refined social nicety and the violent, anachronistic way the knight executes it, plus the sight gag of a policemen treating a costumed knight as if this were an everyday traffic accident.",PASS,"The student's answer explicitly covers the anticipated answer point by explaining the dual meaning of ""chivalry,"" connecting the medieval connotation with the modern-day courteous act of opening doors. This ties directly into the key comedic element of the caption and cartoon.",o3,"{""tokens_in"": 0, ""tokens_out"": 0}",gpt-4o,"{""tokens_in"": 523, ""tokens_out"": 65}",20250506_180913_o3_high_exp-o3_ag-gpt_4o.csv
250,,690.0,"An astronaut in full space gear stands inside an elevator, facing a surprised bellhop who is holding the elevator door open. The scene takes place in a building lobby, with a potted plant and a directory visible on the wall. The bellhop is speaking to the astronaut.",Please watch your small step.,"This references Neil Armstrong's famous ""One small step for man"" quote","The bellhop is giving the standard safety reminder “Watch your step” to someone entering an elevator. He tweaks the phrase to “small step,” echoing Neil Armstrong’s iconic moon-landing line, “That’s one small step for man, one giant leap for mankind.” Because the person he’s addressing is wearing a full astronaut suit, the bellhop treats the mundane act of stepping over the elevator sill as the astronaut’s famous “small step.” The humor comes from smashing together epic space-exploration language with an everyday hotel courtesy, reducing an historic lunar moment to an elevator warning.",PASS,"The student's answer explicitly captures the key comedic element by referencing Neil Armstrong’s iconic moon-landing line. The answer explains how the bellhop's phrase ""small step"" is a play on Armstrong's famous words, creating humor by juxtaposing the grandeur of space exploration with the mundane act of entering an elevator. This matches the anticipated answer point about the reference to Neil Armstrong’s quote.",o3,"{""tokens_in"": 0, ""tokens_out"": 0}",gpt-4o,"{""tokens_in"": 447, ""tokens_out"": 92}",20250506_180913_o3_high_exp-o3_ag-gpt_4o.csv
252,,691.0,"A couple is sitting in their living room, with the man using a laptop and the woman knitting. Outside the window, a large crowd of snowmen, some wearing hats and scarves, are peering in, seemingly watching the couple. The scene is set at night, with bare trees visible in the background. The woman knitting on the couch against the window looks back at the snowmen with a concerned expression, but the man, who is speaking, appears unfazed.","Well, he did say he’d be back again someday.","""I'll be back someday"" is a lyric from Frosty the Snowman","The caption quotes the final line of the Christmas song “Frosty the Snowman” (“He waved goodbye, saying, ‘Don’t you cry, I’ll be back again someday’”). In the song it’s a sweet promise that the jolly snowman will return next winter. The drawing turns that innocent lyric into a mildly creepy reality: not only has Frosty come back, he’s apparently multiplied into an entire mob of snowmen pressing their faces to the couple’s window at night. The man’s calm remark treats the bizarre scene as the perfectly logical fulfillment of Frosty’s pledge, while the woman’s worried look highlights how unsettling the situation actually is. The clash between the cozy holiday sentiment and the eerie visual—combined with the man’s deadpan understatement—creates the humor.",PASS,"The student’s answer references the lyric “I’ll be back again someday” from the song “Frosty the Snowman,” which is the anticipated answer point. The student specifically discusses how the cartoon caption uses this lyric, fulfilling the requirement to capture the key comedic element.",o3,"{""tokens_in"": 0, ""tokens_out"": 0}",gpt-4o,"{""tokens_in"": 534, ""tokens_out"": 72}",20250506_180913_o3_high_exp-o3_ag-gpt_4o.csv
256,,695.0,"A slice of bread with a face, arms, and legs, wearing a bow tie, stands in front of a restaurant podium. Behind the podium is a surprised-looking host with a bald head and a bow tie, holding a pen and a notepad. The host is speaking to the bread, who looks disappointed.",You’re in luck. A slot for you just opened up in our kitchen.,The slot he is referring to is a toaster slot,"The slice of bread is acting like a restaurant customer, waiting to be “seated” at a table. The host’s line mimics the reassuring phrase a maître d’ might use—“Good news, a spot just opened up”—but the “slot” he offers isn’t a dining table; it’s the slot of a kitchen toaster. The joke hinges on that double meaning of “slot” and the role-reversal: instead of eating, the bread will be the thing that gets cooked and eaten. The cheery “You’re in luck” adds dark irony, because from the bread’s perspective this is very bad luck.",PASS,"The student's answer explicitly mentions that the ""slot"" refers to the slot of a kitchen toaster and explains the role reversal where the bread, instead of eating, will be the one getting cooked. This includes the key comedic element of the joke.",o3,"{""tokens_in"": 0, ""tokens_out"": 0}",gpt-4o,"{""tokens_in"": 471, ""tokens_out"": 65}",20250506_180913_o3_high_exp-o3_ag-gpt_4o.csv
259,,697.0,"A man in tattered clothes and a blindfold ""walks the plank"" from a subway train onto the platform, while typical pirate captain with an eye patch, hat, parrot, and peg leg, along with a shirtless crew member with a bandana watch from the train's doorway. The scene is absurdly set in a modern subway station. The crew member is speaking from behind the captain.",No one crosses the Pirates of Penn Station.,"This replaces ""Penzance"" with ""Penn Station"" to address the train setting","The caption riffs on the Gilbert & Sullivan operetta title “The Pirates of Penzance.” Swapping “Penzance” for “Penn Station” relocates the famously bumbling Victorian pirates to New York’s dingy transit hub, matching the cartoon’s incongruous image of 18th-century buccaneers riding a subway. The warning “No one crosses the Pirates of Penn Station” works two ways: (1) idiomatically—no one dares betray or defy them, as with real pirates, and (2) literally—any passenger who tries to “cross” their path is forced to walk the plank onto the platform, as we see the blindfolded victim doing. The humor comes from the cultural pun plus the absurd mash-up of seafaring piracy and mundane commuter rail.",PASS,"The student's answer explicitly covers the anticipated answer point by explaining the pun involved in replacing ""Penzance"" with ""Penn Station"" to match the subway train setting in the cartoon. The explanation elaborates on how this wordplay contributes to the humor, thus capturing the key comedic element.",o3,"{""tokens_in"": 0, ""tokens_out"": 0}",gpt-4o,"{""tokens_in"": 526, ""tokens_out"": 74}",20250506_180913_o3_high_exp-o3_ag-gpt_4o.csv
262,,700.0,"A centaur, dressed in a suit, stands at a pharmacy counter holding a coffee cup, speaking to a pharmacist behind the counter holding a pill bottle. The pharmacy shelves are filled with various bottles and boxes of medication. There is a bench to the right of the centaur. The pharmacist is speaking, unfazed by the centaur.","They didn’t specify which one, but your insurance will only cover half.","Covering half typically means paying for half of the cost, but here refers to the two halves of the man","The humor plays on the centaur’s literal makeup—half-human, half-horse—and the familiar frustration of health-insurance fine print. The pharmacist says the insurer will “only cover half,” a phrase that normally means they’ll reimburse just fifty percent of the prescription cost. But with a two-species patient, “cover half” can also be read literally: the policy will pay benefits for only one of the creature’s two halves (human or equine) because the claim form didn’t specify which. The double meaning—financial coverage versus bodily coverage—turns bureaucratic insurance-speak into an absurd problem unique to a mythological hybrid, exposing how arbitrary and penny-pinching insurance rules can feel.",PASS,"The student's answer addresses the key comedic element by explaining the double meaning of ""cover half"" regarding the centaur's two halves and the dual interpretation involving insurance coverage. This aligns with the anticipated answer point focusing on the comedic play between typical insurance phrasing and the centaur's literal anatomy.",o3,"{""tokens_in"": 0, ""tokens_out"": 0}",gpt-4o,"{""tokens_in"": 501, ""tokens_out"": 74}",20250506_180913_o3_high_exp-o3_ag-gpt_4o.csv
