idx,cartoonstock_id,contest_number,description,caption,element,explanation,autograder_judgment,autograder_reasoning,explainer_model,explainer_usage,autograder_model,autograder_usage,source_file
487,CC124814,,"Inside a cave, three cavemen are dressed in ragged animal-skin garments. One caveman lies on the ground under a crude blanket, looking up at the other two. Another caveman stands nearby holding a large wooden club, while the third caveman stands between them with an outstretched hand, speaking to the one lying down.","I'll be performing the operation, and this is the anesthesiologist.","The caveman will knock him unconscious with the club as his ""anesthesia""","The humor in this caption comes from the anachronistic juxtaposition of modern medical roles within prehistoric caveman society. The joke hinges on the incongruity between the formal, professional language of modern healthcare (""performing the operation,"" ""anesthesiologist"") and the primitive reality depicted in the cartoon. The caveman with the outstretched hand is introducing himself as a surgeon, while reframing the threatening club-wielding figure as an ""anesthesiologist"" - implying the patient is about to be knocked unconscious with a blunt instrument rather than receiving sophisticated medication. The comedy emerges from this clever recontextualization of primitive violence as a professional medical procedure, creating an absurd parallel between contemporary medical practice and crude caveman problem-solving.",PASS,"The student's answer explicitly captures the key comedic element, which is the use of the club as a form of anesthesia. The response discusses the recontextualization of primitive violence in the form of a medical procedure and suggests that the threatening club-wielding figure is humorously positioned as an ""anesthesiologist."" This aligns with the anticipated point that the caveman will knock the other unconscious with the club. Therefore, the student’s answer adequately covers the anticipated answer point.",claude-3-7-sonnet-latest,"{""tokens_in"": 220, ""tokens_out"": 466}",gpt-4o,"{""tokens_in"": 505, ""tokens_out"": 112}",20250416_200436_claude_thinking_budget_2048_exp-claude_3_7_sonnet_latest_ag-gpt_4o.csv
490,CC123065,,"Inside a workshop-like room, three elves in pointy hats sit at a long table with open laptop computers. The middle elf appears distressed and is speaking, while the two elves on either side look toward him.","It’s from Santa, and it goes way, way beyond jolly.",This frames Santa as a boss making an inappropriate advance on an employee,"The joke centers on the juxtaposition between Santa's established character and an implied breach of that character. Santa is famously known as ""jolly"" - it's his defining trait in popular culture. The caption suggests Santa has sent a message to his elves that dramatically exceeds normal ""jolly"" boundaries, implying something wildly inappropriate, possibly profane, sexual, or enraged. 

The humor comes from transforming Santa from a wholesome, child-friendly figure into someone who might send shocking communications to his subordinates. The distressed elf's reaction reinforces this, suggesting whatever Santa sent is alarming or uncomfortable.

The joke also modernizes the North Pole operation as a contemporary workplace with digital communications, making Santa analogous to an unpredictable boss sending inappropriate emails to staff. This creates comedy through the clash between the magical, innocent Christmas myth and mundane, problematic office dynamics.",FAIL,"The student's answer discusses the comedic element of Santa sending a message that goes beyond his typical ""jolly"" persona, implying that it may be wildly inappropriate or shocking. However, the anticipated answer point specifically emphasizes Santa making an inappropriate advance on an employee, a nuance not explicitly covered in the student's answer. While the student's response covers inappropriate behavior in general, it does not specifically address the notion of an inappropriate advance, which is central to the anticipated point.",claude-3-7-sonnet-latest,"{""tokens_in"": 195, ""tokens_out"": 518}",gpt-4o,"{""tokens_in"": 491, ""tokens_out"": 106}",20250416_200436_claude_thinking_budget_2048_exp-claude_3_7_sonnet_latest_ag-gpt_4o.csv
508,CS197002,,"A person wearing a helmet and a harness labeled “PARACHUTE” falls off the edge of a cliff, flailing their arms. Another person stands on the cliff behind him, pushing them off the edge, speaking with a smile. The person pushing is wearing a tie.",Great coaching is about helping others move forward.....,The cartoon downplays the dangerous act of pushing someone off a cliff as “great coaching.”,"The joke plays on corporate motivational language by juxtaposing it with a literal, dangerous situation. The humor comes from the ironic contrast between the positive framing of ""great coaching"" and ""helping others move forward"" with the visual of someone forcibly pushing another person off a cliff. Business coaches and motivational speakers often use phrases about ""moving forward"" and ""taking leaps,"" but the cartoon takes these metaphors to a literal extreme. The person in the tie represents authority (like a manager or coach) who believes they're being helpful while actually putting someone in peril. The trailing ellipsis adds to the dark humor, suggesting there's something important being left unsaid about this dubious ""coaching"" method. It satirizes how corporate encouragement can sometimes feel like being pushed into dangerous situations against one's will, all under the guise of professional development.",PASS,"The student's answer captures the key comedic element by explaining how the cartoon humorously contrasts the serious corporate language about ""great coaching"" and ""helping others move forward"" with the dangerous act of pushing someone off a cliff. The description notes that the statement is used ironically to satirize corporate encouragement, which aligns with the anticipated answer point about downplaying the dangerous act as “great coaching.”",claude-3-7-sonnet-latest,"{""tokens_in"": 199, ""tokens_out"": 503}",gpt-4o,"{""tokens_in"": 501, ""tokens_out"": 95}",20250416_200436_claude_thinking_budget_2048_exp-claude_3_7_sonnet_latest_ag-gpt_4o.csv
11,,8.0,"A woman is speaking on the phone, smiling while looking into a fish bowl. Inside the fishbowl are three fish, as well as a miniature desert island with two little palm trees. On the island, a tiny bald man in glasses is sitting with a straight face, his hands on his knees.","He's the cutest little thing, and when you get tired of him you just flush him down the toilet",The woman is talking about the man as if he's a pet fish,"The joke plays on the disturbing incongruity between how people treat pets versus humans. The caption portrays the woman speaking about the tiny man in the fishbowl exactly as someone might discuss a pet goldfish to a friend – cute, novel, and ultimately disposable. The humor emerges from the casual cruelty of treating a human being (albeit miniaturized) as a temporary amusement that can be flushed away when the novelty wears off. 

This caption creates tension between the woman's cheery tone (""cutest little thing"") and the callous disposal method she casually mentions. It references the common but ethically questionable practice of flushing unwanted fish, but applies it to what appears to be a tiny person, complete with glasses and a dejected expression that suggests he's aware of his precarious situation.

The comedy comes from this dehumanization – the fundamental joke is about the woman's complete disregard for the humanity of this tiny man, reducing him to the status of a temporary pet rather than a being with dignity.",PASS,"The student's answer explicitly covers the anticipated answer point. It describes how the woman treats the tiny man as if he were a pet, explicitly drawing the comparison to being like a pet goldfish. The student notes the passive tone in discussing the man's disposability, paralleling how one might speak of a pet. This aligns with the key comedic element captured in the anticipated answer point.",claude-3-7-sonnet-latest,"{""tokens_in"": 220, ""tokens_out"": 593}",gpt-4o,"{""tokens_in"": 548, ""tokens_out"": 91}",20250416_204832_claude_thinking_budget_4096_exp-claude_3_7_sonnet_latest_ag-gpt_4o.csv
12,,8.0,"A woman is speaking on the phone, smiling while looking into a fish bowl. Inside the fishbowl are three fish, as well as a miniature desert island with two little palm trees. On the island, a tiny bald man in glasses is sitting with a straight face, his hands on his knees.",You wouldn't believe it! I met a man at the pet store.,"This subverts the typical meaning of the phrase. Typically, this would mean that she met a normal man as a potential dating partner, but here, she purchased him as a pet.","The joke plays on the double meaning of ""meeting a man"" - typically a romantic encounter versus literally acquiring a miniature man as a pet. The woman is treating what should be an extraordinary, scientifically impossible situation (a tiny human in a fishbowl) as if it were a mundane dating prospect. Her cheerful phone conversation suggests she's sharing exciting news about a potential romantic interest, completely overlooking the absurdity that this ""man"" is actually a tiny figure trapped on a desert island in her fishbowl. The humor stems from this cognitive dissonance: she's discussing him as if he were a normal dating prospect she encountered while shopping, rather than acknowledging the bizarre reality that she purchased a miniature human being alongside fish at a pet store. There's also an implicit commentary on dating desperation - she's so excited about ""meeting a man"" that she's overlooking the highly unusual circumstances of their ""meeting.""",PASS,"The student's answer captures the anticipated comedic element by discussing the subversion of the typical meaning of ""meeting a man."" The student explicitly mentions the woman's cheerful conversation as if discussing a romantic interest, which aligns with the anticipated answer point of subverting the typical meaning and the absurdity of purchasing a miniature human. This shows they understand the comedic device at play.",claude-3-7-sonnet-latest,"{""tokens_in"": 213, ""tokens_out"": 569}",gpt-4o,"{""tokens_in"": 542, ""tokens_out"": 87}",20250416_204832_claude_thinking_budget_4096_exp-claude_3_7_sonnet_latest_ag-gpt_4o.csv
13,,13.0,"In an intimate bedroomsetting, a couple is in bed. The man is lying back on his helbows, while the woman is straddling him in a nightdress. However, the woman is wearing an antenna headband from a costume, the man is wearing a full-faced football helmet, and a tennis racket lies next to them on the bed. The woman's eyebrows are slightly furrowed.","Okay. Now you be the naughty mosquito, and I'll be the tormented sporting goods salesman.",The caption attempts to explain the collection of goods as a sexual roleplay,"The joke hinges on the absurdity of an overly specific, bizarrely elaborate sexual role-play scenario. The couple has turned their intimate moment into a theatrical production complete with costumes and props that correspond to their chosen characters—she's the ""naughty mosquito"" (wearing antenna) while he's the ""tormented sporting goods salesman"" (with football helmet and tennis racket nearby). 

The humor derives from the incongruity between sex (typically portrayed as passionate and spontaneous) and this highly contrived, non-erotic scenario they've orchestrated. The caption reveals that what we're witnessing isn't just weird bedroom attire, but an intentional performance with designated roles.

Additionally funny is the woman's slight hesitation (furrowed eyebrows) suggesting this might be more his fantasy than hers, and the implication that they've already tried other equally bizarre scenarios before this one (indicated by ""Now you be...""). The specificity of ""tormented"" sporting goods salesman adds another layer of ridiculous complexity to their sexual theater.",PASS,"The student's answer successfully explains that the attire and items in the scene are part of a bizarre and elaborate sexual roleplay, satisfying the anticipated answer point.",claude-3-7-sonnet-latest,"{""tokens_in"": 247, ""tokens_out"": 570}",gpt-4o,"{""tokens_in"": 564, ""tokens_out"": 47}",20250416_204832_claude_thinking_budget_4096_exp-claude_3_7_sonnet_latest_ag-gpt_4o.csv
14,,13.0,"In an intimate bedroomsetting, a couple is in bed. The man is lying back on his helbows, while the woman is straddling him in a nightdress. However, the woman is wearing an antenna headband from a costume, the man is wearing a full-faced football helmet, and a tennis racket lies next to them on the bed. The woman's eyebrows are slightly furrowed.",I think we need a new sex therapist,This caption suggests that the odd situation is the result of an unusual sexual roleplay.,"The joke relies on the absurd juxtaposition between intimacy and the random, mismatched props the couple is using. By suggesting they ""need a new sex therapist,"" the caption instantly provides context: these bizarre elements (antenna headband, football helmet, tennis racket) are misguided recommendations from a professional meant to spice up their love life. The humor comes from how wildly inappropriate and nonsensical these items are for intimacy, implying either the therapist is completely incompetent or the couple has comically misinterpreted the advice. The woman's furrowed expression perfectly captures their dawning realization that this approach isn't working. The caption cleverly transforms an otherwise inexplicable scene into a relatable moment of ""this professional advice is clearly not helping,"" creating humor through the contrast between serious therapy and its ridiculous implementation.",PASS,"The student's answer explicitly discusses the comedic element of the unusual situation being a result of a misguided or bizarre attempt at sexual roleplay. They mention how the props and setting are part of an absurd attempt to enhance intimacy, which aligns with the suggested unusual roleplay. Thus, the answer includes the anticipated key comedic element.",claude-3-7-sonnet-latest,"{""tokens_in"": 231, ""tokens_out"": 518}",gpt-4o,"{""tokens_in"": 516, ""tokens_out"": 79}",20250416_204832_claude_thinking_budget_4096_exp-claude_3_7_sonnet_latest_ag-gpt_4o.csv
18,,16.0,"As a group of people exits a grand church doorway dressed in typical church attire, a pastor in a typical black suit and roman collar stands next to the Devil, complete with horns, trident, robe, and tail. They watch the procession pass by, as the pastor is explaining something to the devil. One passerby tips his hat at the pastor and devil.",I think it's important for them to hear both sides of the debate.,It downplays the seriousness of religion by portraying the Devil as merely the “other side” in a casual debate,"The humor in this caption centers on the absurd juxtaposition of religious absolutism with modern pluralistic values. The pastor has done something unthinkable—invited the literal Devil to church—but justifies it with the casual, politically-neutral language of ""hearing both sides."" The joke subverts religious expectations, where good versus evil is supposed to be the clearest moral distinction possible, not a debatable topic with valid perspectives on both sides. There's delicious irony in a religious leader presenting Satan not as the enemy to be feared and rejected, but as simply the other half of a balanced discussion, as if eternal damnation were just an alternative viewpoint that deserves equal time at Sunday service. The nonchalance of the churchgoer tipping his hat enhances this absurdity, suggesting the congregation has normalized what should be a shocking theological breach, all in the name of fairness and open-mindedness.",PASS,"The student's answer captures the key comedic element by highlighting the absurdity and irony of presenting the Devil, a symbol of ultimate evil, as an equal participant in a balanced debate, akin to modern pluralistic values. This explicitly discusses the downplaying of the seriousness of religion, aligning with the anticipated answer point.",claude-3-7-sonnet-latest,"{""tokens_in"": 226, ""tokens_out"": 615}",gpt-4o,"{""tokens_in"": 541, ""tokens_out"": 77}",20250416_204832_claude_thinking_budget_4096_exp-claude_3_7_sonnet_latest_ag-gpt_4o.csv
20,,16.0,"As a group of people exits a grand church doorway dressed in typical church attire, a pastor in a typical black suit and roman collar stands next to the Devil, complete with horns, trident, robe, and tail. They watch the procession pass by, as the pastor is explaining something to the devil. One passerby tips his hat at the pastor and devil.","O.K., they're yours, but I still don't know where you got that fourth ace.","This implies a backstory that the pastor and devil were playing poker, the pastor lost, and the people were the bet.","The joke creates a darkly humorous scenario where the pastor and the Devil apparently played a card game with the congregation's souls as the stakes. The pastor's line reveals he has lost the game to the Devil—likely through cheating, as the ""fourth ace"" reference suggests an impossibility in a fair card game. 

The humor stems from several elements: the inappropriate gambling of parishioners' souls, the pastor's casual acceptance of their damnation, and his oddly specific complaint about the Devil's cheating method rather than the horrific outcome. It subverts expectations by treating the eternal fate of souls as merely the result of a poker game gone wrong, while portraying the pastor as more concerned with the rules of card playing than with his spiritual responsibilities. The caption cleverly transforms the solemn religious setting into an absurd gambling aftermath.",PASS,"The student's answer captures the anticipated comedic element by explaining that the pastor and the Devil played a card game with the congregation's souls as stakes, which is consistent with the implied backstory of a poker game where the pastor lost. The elements of gambling and losing the people match the anticipated answer point, even though the student's explanation is more detailed.",claude-3-7-sonnet-latest,"{""tokens_in"": 232, ""tokens_out"": 520}",gpt-4o,"{""tokens_in"": 533, ""tokens_out"": 84}",20250416_204832_claude_thinking_budget_4096_exp-claude_3_7_sonnet_latest_ag-gpt_4o.csv
37,,30.0,"In a doctor’s office, a doctor wearing a lab coat and head mirror is speaking to a patient seated across the desk. The patient, dressed in a suit, is facing the doctor, seemingly engaged in conversation. However, standing behind the doctor is a mysterious figure wearing a trench coat, hat, and dark glasses, with their hands in their pockets. The desk between them holds a stethoscope, a notepad, a pen on a stand, and another small object.","Instead of an expensive, invasive procedure, we've decided to beat it out of you.","This plays on the phrase “beat it out of you,” taking it as literally removing something instead of its figurative meaning of coercing information.","The humor in this caption stems from the jarring contrast between professional healthcare and violent intimidation. The doctor is presenting physical violence (to be carried out by the mysterious figure behind them) as if it were a legitimate medical alternative to surgery. The caption recontextualizes the mysterious figure in the trench coat as a hired thug rather than a medical professional. 

The joke works on multiple levels - it subverts our expectations of proper medical care, presents violence as a cost-saving alternative in a clinical, matter-of-fact way, and creates dark humor around the concept of ""getting something out"" of a patient. There's also subtle commentary on healthcare costs, suggesting that employing muscle might be more economical than actual medical procedures.

The phrasing mimics genuine medical speak (""expensive, invasive procedure"") before pivoting to the shocking alternative, creating a perfect setup and punchline structure that maximizes the surprise.",PASS,"The student's answer explicitly covers the crucial comedic element by discussing how the phrase ""beat it out of you"" is recontextualized in the setting of a doctor's office, where it is presented as a literal alternative to a medical procedure rather than its typical figurative meaning of coercing information. The student also mentions how this creates a surprising and humorous contrast, which aligns with the anticipated answer point.",claude-3-7-sonnet-latest,"{""tokens_in"": 250, ""tokens_out"": 572}",gpt-4o,"{""tokens_in"": 575, ""tokens_out"": 95}",20250416_204832_claude_thinking_budget_4096_exp-claude_3_7_sonnet_latest_ag-gpt_4o.csv
38,,30.0,"In a doctor’s office, a doctor wearing a lab coat and head mirror is speaking to a patient seated across the desk. The patient, dressed in a suit, is facing the doctor, seemingly engaged in conversation. However, standing behind the doctor is a mysterious figure wearing a trench coat, hat, and dark glasses, with their hands in their pockets. The desk between them holds a stethoscope, a notepad, a pen on a stand, and another small object.",Good news! We have a solid lead on who stole your liver.,This plays on the trope of stolen organs and suggests the man in the trench coat is investigating it,"The joke hinges on the absurd premise of organ theft being treated as a routine matter in a doctor's office. The humor comes from the incongruity between the doctor's casual ""good news"" delivery and the alarming concept of a stolen liver. The mysterious figure lurking behind the doctor creates perfect visual support for this punchline—they're clearly meant to be either the detective investigating the theft or, more humorously, the actual liver thief themselves (which would make the doctor's ""solid lead"" ironically obvious to the viewer but not to the characters). The caption cleverly transforms what would typically be a standard medical consultation into an unexpected crime investigation scenario. The dark humor works because it combines the medical setting with elements of a detective noir, with the absurdity amplified by treating a horrific situation (organ theft) as something that can be resolved with normal investigative procedures—as if finding a stolen liver is as routine as diagnosing the flu.",PASS,The student's answer captures the key comedic element by discussing the absurdity of treating organ theft as a routine matter in a doctor's office and identifies the mysterious figure as either investigating or being the liver thief. This aligns with the anticipated answer point which involves the trope of stolen organs and the suggestion that the man in the trench coat is involved in the investigation or theft.,claude-3-7-sonnet-latest,"{""tokens_in"": 246, ""tokens_out"": 594}",gpt-4o,"{""tokens_in"": 563, ""tokens_out"": 87}",20250416_204832_claude_thinking_budget_4096_exp-claude_3_7_sonnet_latest_ag-gpt_4o.csv
56,,46.0,"The cartoon depicts a shareholder meeting, with a banner reading “Welcome Stockholders.” However, the board members sitting on stage are all completely naked, and one man, also naked, is speaking at the podium. ","First, I'd like to thank the podium.",The man appreciates the podium because it's the only thing providing him with cover,"The humor in this caption works through functional irony in a naked shareholder meeting. While a speaker might normally thank people or organizations at the beginning of a presentation, this naked presenter instead thanks an inanimate object—the podium—because it's serving a crucial practical purpose: covering their genitals. The joke hinges on the unstated but visually obvious reason for gratitude. In a room where everyone is completely exposed, the podium becomes the only thing providing the speaker with a modicum of privacy or dignity. The formal corporate meeting language (""First, I'd like to thank..."") contrasts amusingly with the bizarre naked circumstance, and the speaker acknowledges the podium's unexpected role as modesty shield while maintaining professional meeting decorum. The caption cleverly draws attention to the podium's new function without explicitly mentioning nakedness at all.",PASS,The student's answer explicitly mentions the function of the podium as providing a modicum of privacy or dignity to the speaker by covering their genitals. This directly aligns with the anticipated answer point that the man appreciates the podium for providing cover. The student captures the key comedic element by explaining how the podium is acknowledged for its unexpected role as a modesty shield in a humorous manner.,claude-3-7-sonnet-latest,"{""tokens_in"": 189, ""tokens_out"": 520}",gpt-4o,"{""tokens_in"": 479, ""tokens_out"": 90}",20250416_204832_claude_thinking_budget_4096_exp-claude_3_7_sonnet_latest_ag-gpt_4o.csv
