idx,cartoonstock_id,contest_number,description,caption,element,explanation,autograder_judgment,autograder_reasoning,explainer_model,explainer_usage,autograder_model,autograder_usage,source_file
403,,167.0,"In a forest clearing with tall tree trunks, a man in a suit with an American flag pin stands speaking at a podium with a decorative drape on the front, speaking. Two other men in suits stand close by behind him. Various woodland animals— including a deer, a snake on the ground, a frog, a bird, and other creatures—surround the scene, peeking from behind trees or looking on.","As a weasel, I need your vote.",This references the common insult of calling politicians weasels.,"The joke operates on the dual meaning of ""weasel"" - both as a literal woodland animal and as a metaphor for someone who is sly, untrustworthy, or deceptive. The humor emerges from the politician's startling honesty about his dishonest nature. Politicians typically present themselves as trustworthy while voters often suspect otherwise; here, the candidate baldly admits to being a ""weasel"" while still expecting support. This creates ironic self-awareness that subverts typical political discourse. The forest setting with animal constituents reinforces the literal meaning while the formal political setup (podium, flag pin, suits) emphasizes the metaphorical meaning, creating a perfect environment for this wordplay. The caption effectively satirizes political campaigns by suggesting that even when politicians admit their untrustworthiness, they still expect your vote.",PASS,"The student's answer captures the key comedic element of the anticipated answer point by discussing ""weasel"" as both a literal animal and a metaphor for someone untrustworthy, specifically politicians. This aligns with the anticipated point about the common insult of calling politicians weasels.",claude-3-7-sonnet-latest,"{""tokens_in"": 233, ""tokens_out"": 538}",gpt-4o,"{""tokens_in"": 518, ""tokens_out"": 69}",20250416_204832_claude_thinking_budget_4096_exp-claude_3_7_sonnet_latest_ag-gpt_4o.csv
403,,167.0,"In a forest clearing with tall tree trunks, a man in a suit with an American flag pin stands speaking at a podium with a decorative drape on the front, speaking. Two other men in suits stand close by behind him. Various woodland animals— including a deer, a snake on the ground, a frog, a bird, and other creatures—surround the scene, peeking from behind trees or looking on.","As a weasel, I need your vote.","Uses the word “weasel” both literally (as an animal) and as the common pejorative for politicians, creating a pun.","The joke plays on the dual meaning of ""weasel"" - both as the literal woodland animal potentially in the audience and as a metaphorical term for someone who is dishonest or untrustworthy (a common stereotype of politicians). The humor comes from the politician's startling honesty in admitting his own untrustworthiness (""As a weasel"") while simultaneously asking for support. It's funny because politicians typically try to present themselves as honest and reliable, not openly acknowledge their deceptive nature. There's an absurd self-awareness in the statement that creates irony - he's being honest about being dishonest. Additionally, the forest setting with animal constituents adds another layer, suggesting either that this human politician is bizarrely identifying himself as a literal weasel or that he's addressing actual weasels as potential voters. Either interpretation creates a surreal political scenario that satirizes the pandering and disingenuous nature of political campaigns.",PASS,"The student's answer explicitly covers the anticipated answer point by discussing the dual meaning of ""weasel"" as both a literal animal and a metaphor for untrustworthiness. The explanation captures the pun involved in the cartoon, aligns with the anticipated answer point, and elaborates on the comedic device used.",claude-3-7-sonnet-latest,"{""tokens_in"": 233, ""tokens_out"": 567}",gpt-4o,"{""tokens_in"": 551, ""tokens_out"": 74}",20250416_204832_claude_thinking_budget_4096_exp-claude_3_7_sonnet_latest_ag-gpt_4o.csv
404,,660.0,"A doctor, wearing a lab coat and stethoscope, is reading from a clipboard while standing next to a patient who is dressed as a king, complete with a crown and a fur-lined robe. The king is sitting on an examination table, looking up at the doctor. The setting appears to be a typical doctor's office. The doctor is speaking.",Worse than a cold. It's a common cold.,"In this context, ""common"" is good news, but it's presented as bad news","The joke plays on the double meaning of ""common"" in the phrase ""common cold."" In medical terms, a ""common cold"" is simply an ordinary viral infection. But for a king—whose entire identity is based on being exceptional, royal, and decidedly NOT common—being diagnosed with something ""common"" represents a particularly insulting diagnosis.

The humor comes from this wordplay: the doctor isn't just telling the king he has a cold, but emphasizes it's a ""common"" cold, as if the commonness makes it worse specifically for this royal patient. The irony lies in how a monarch, who stands above commoners in social hierarchy, is suffering from the most democratic of all illnesses—one that afflicts royalty and subjects alike. What makes this diagnosis ""worse"" isn't the medical severity but the blow to royal dignity of having contracted something so ordinary and plebeian.",PASS,"The student's answer thoroughly discusses the comedic element of the double meaning of ""common."" It explains how, for a king, the term ""common"" is an insult due to his royal status, making the diagnosis worse in terms of dignity rather than health. This aligns with the anticipated answer point, as the student captures the irony of presenting ordinary news as bad news in this specific context.",claude-3-7-sonnet-latest,"{""tokens_in"": 218, ""tokens_out"": 500}",gpt-4o,"{""tokens_in"": 527, ""tokens_out"": 92}",20250416_204832_claude_thinking_budget_4096_exp-claude_3_7_sonnet_latest_ag-gpt_4o.csv
408,,662.0,"A wedding ceremony is taking place, but the bride and groom are dressed as vikings, complete with animal skins, viking helmet, wrapped footwear, and one holding a spear while the other holds a sword. They stand under a decorated archway, facing a minister who is reading from a book. On the left, bridesmaids in traditional dresses hold bouquets, and on the right, groomsmen in tuxedos stand attentively. One of the bridesmaids is turned back, speaking to another bridesmaid.",It’s about time they settled down and razed a village.,"This is a pun, specifically, replacing the word ""raise"" with the word “raze""","The joke plays on the common expression ""settling down"" used when people get married and establish a more stable lifestyle. However, instead of the typical ending like ""and starting a family,"" the caption subverts expectations by using ""and razed a village"" – referencing the stereotypical Viking behavior of pillaging and destroying settlements. 

The humor comes from this clever wordplay that connects the civilized institution of marriage with uncivilized Viking activities, suggesting that for this couple, domestic bliss includes destruction. It implies the couple's idea of settling into married life still incorporates their Viking identity and lifestyle. 

The caption works particularly well because it sounds like something a friend might actually say at a wedding (""It's about time they settled down""), but the punchline transforms it into something absurdly inappropriate yet fitting for the Viking-themed scenario.",FAIL,"The student's answer identifies the joke as a play on expectations around ""settling down"" and links marriage themes to Viking imagery. However, it does not explicitly mention the specific pun of using ""raze"" instead of ""raise,"" which is the anticipated answer point focusing on wordplay.",claude-3-7-sonnet-latest,"{""tokens_in"": 261, ""tokens_out"": 529}",gpt-4o,"{""tokens_in"": 553, ""tokens_out"": 74}",20250416_204832_claude_thinking_budget_4096_exp-claude_3_7_sonnet_latest_ag-gpt_4o.csv
417,,675.0,"At a crowded party, a deep-sea diver and an astronaut, both in full gear covering their bodies and heads, stand holding drinks. A woman with a drink in hand is playfully tapping the astronaut's backpack. The other partygoers in the background are engaged in conversation, creating a lively atmosphere. The woman is speaking.",Didn’t I say you wouldn’t be the only one wearing a suit?,"Instead of formal ""suits,"" they are in heavy-duty protective suits","The joke plays on the double meaning of the word ""suit."" The astronaut and deep-sea diver are both wearing specialized protective ""suits"" (a space suit and diving suit, respectively) at what appears to be a cocktail party where others are in regular clothes. The caption suggests the woman had previously reassured the astronaut about their attire choice, implying the astronaut was worried about standing out in their unusual outfit.

The humor stems from treating these highly specialized, bulky survival gear as if they were merely fashion choices equivalent to formal attire one might wear to a party. It creates comedy through the incongruity of applying normal social anxiety about dress codes to absurdly inappropriate attire. The joke further works because it implies these characters have a pre-existing relationship where they discussed party attire, grounding this surreal scenario in relatable human interaction.

The caption cleverly transforms what would normally be an outlandish situation into something treated as merely slightly unconventional by the characters involved.",PASS,"The student's answer captures the key comedic element of the cartoon by highlighting the use of the word ""suit"" and the incongruity of treating specialized, protective suits as if they were typical formalwear for a party. This indicates that the humor arises from both the double meaning and the absurdity of the attire, aligning with the anticipated answer point.",claude-3-7-sonnet-latest,"{""tokens_in"": 223, ""tokens_out"": 591}",gpt-4o,"{""tokens_in"": 540, ""tokens_out"": 86}",20250416_204832_claude_thinking_budget_4096_exp-claude_3_7_sonnet_latest_ag-gpt_4o.csv
427,,687.0,"A woman holding a wine glass stands on a rooftop in a city, delighted, looking back at a man sitting at a table with a bottle and glass. Behind them, an enormous face peers over the building, looking similar to the man. The woman is speaking with a smile.","It’s a perfect likeness, George. Right down to the hot air.","She's implying the face is a giant balloon, hence the hot air","The joke plays on the double meaning of ""hot air."" The enormous face peering over the building is apparently some kind of inflatable or balloon representation of George. The woman's comment that it's ""a perfect likeness"" establishes this connection. But the punchline, ""right down to the hot air,"" works on two levels:

1) Literally, the giant face would be filled with air if it's an inflatable object
2) Figuratively, ""full of hot air"" is an idiom meaning someone who speaks pompously or makes empty boasts

The woman is cleverly disguising an insult as a compliment. She's telling George that the balloon not only looks like him physically but also captures his personality trait of being full of hot air (being boastful or talking excessively without substance). The humor comes from this dual meaning and the subtle put-down delivered with a smile in what superficially appears to be an appreciative comment.",PASS,"The student's answer explicitly captures the key comedic element of the anticipated answer point. They thoroughly explain both the literal and figurative meanings of ""hot air,"" connecting it to the idea of the face being a giant balloon and the idiomatic insult. This aligns with the anticipated answer point about the face being a giant balloon, hence the hot air. The explanation matches the anticipated comedic logic and includes the necessary elements.",claude-3-7-sonnet-latest,"{""tokens_in"": 207, ""tokens_out"": 581}",gpt-4o,"{""tokens_in"": 519, ""tokens_out"": 97}",20250416_204832_claude_thinking_budget_4096_exp-claude_3_7_sonnet_latest_ag-gpt_4o.csv
428,,688.0,"At a formal gathering, a stern-looking military officer with numerous medals and a cartoonishly long, receipt-like ribbon on his uniform holds a glass of wine. A woman in a black dress, also holding a glass of wine, is leaning in and speaking to him. Other guests are mingling in the background. The officer is speaking.",I was stationed at CVS during the war on drugs.,Pharmacies often give very long receipts,"The joke hinges on the visual gag of the officer's cartoonishly long ribbon resembling the infamously lengthy receipts from CVS pharmacy. CVS is widely mocked in popular culture for producing absurdly long receipts even for minor purchases. The caption cleverly connects this visual element to military service by suggesting the ribbon isn't a decoration but actually a CVS receipt.

Additionally, the caption plays with the phrase ""war on drugs"" - a real U.S. policy initiative against illegal narcotics - but subverts it by implying the officer was ""fighting"" this war from behind a pharmacy counter that legally dispenses medications. The humor comes from this unexpected juxtaposition of military gravitas (medals, formal uniform, serious demeanor) with the mundane reality of retail pharmacy work.

The joke succeeds through this perfect marriage of visual cue (long ribbon/receipt) and wordplay that connects military service terminology (""stationed,"" ""war"") with the civilian context of a drugstore, deflating the officer's presumed heroism into something utterly ordinary.",PASS,"The student's answer explicitly covers the anticipated answer point by discussing the visual gag of the officer's ribbon resembling a CVS receipt, which is known for being comically long. This directly captures the key comedic element related to pharmacies giving long receipts.",claude-3-7-sonnet-latest,"{""tokens_in"": 216, ""tokens_out"": 587}",gpt-4o,"{""tokens_in"": 543, ""tokens_out"": 63}",20250416_204832_claude_thinking_budget_4096_exp-claude_3_7_sonnet_latest_ag-gpt_4o.csv
429,,689.0,"A knight in full armor, riding a checkered horse, is holding a lance that has skewered a car door. The knight faces a police officer who is holding a notepad and pen, seemingly about to write a ticket or report. The knight is speaking, possibly explaining himself.",It used to be chivalrous to open doors for people.,"It's chivalrous to open doors, but not in such a violent way","The humor stems from the collision of medieval chivalry with modern society. The knight has literally ""opened"" a car door by violently skewering it with his lance, then attempts to justify this destruction as an act of courtesy. The caption plays on the traditional chivalrous gesture of opening doors for others—a small politeness in modern times—by reframing the knight's destructive action as merely an outdated expression of gentlemanly behavior. The joke works through this absurd misapplication of ancient codes of conduct to contemporary situations, suggesting the knight is bewildered by how his well-intentioned courtesy is now being treated as vandalism worthy of police attention. The humor lies in the vast disconnect between the knight's medieval understanding of chivalry and the modern context where impaling car doors is clearly criminal damage, not gallantry.",PASS,"The student's answer explicitly discusses the comedic clash between the knight's medieval understanding of chivalry and its violent application in the modern context, highlighting the absurdity of skewering a car door as an act of chivalry. This aligns with the anticipated answer point, which focuses on the inversion of the chivalrous act through unexpected violence.",claude-3-7-sonnet-latest,"{""tokens_in"": 203, ""tokens_out"": 543}",gpt-4o,"{""tokens_in"": 504, ""tokens_out"": 84}",20250416_204832_claude_thinking_budget_4096_exp-claude_3_7_sonnet_latest_ag-gpt_4o.csv
434,,705.0,"Two cowboys on horseback survey a chaotic scene in the desert where a large, modern espresso machine has been overturned, spilling coffee beans and equipment everywhere. A campfire burns nearby, and cacti dot the landscape. One cowboy appears to be speaking to the other.",Americanos.,Americano is a type of coffee,"The joke plays on the double meaning of ""Americanos."" On one level, it's a type of coffee made with espresso and water, directly referring to the overturned espresso machine in this Wild West scene. On another level, ""Americanos"" refers to Americans themselves—specifically these cowboys who represent traditional American frontier identity. 

The humor emerges from the cultural clash between the rugged, primitive cowboy lifestyle and the sophisticated, modern coffee culture the espresso machine represents. The single-word caption mimics the laconic speaking style typical of Western characters while simultaneously identifying both the spilled beverage and the bewildered observers.

There's also subtle irony since the Americano drink was actually created when American servicemen in Italy diluted espresso to more closely resemble the coffee they were used to back home—now these quintessential Americans are encountering European coffee culture in their native landscape, completing a cultural circle.",PASS,"The student's answer explicitly covers the key comedic element by discussing how ""Americano"" is a type of coffee, directly referring to the overturned espresso machine, which aligns with the anticipated answer point.",claude-3-7-sonnet-latest,"{""tokens_in"": 195, ""tokens_out"": 569}",gpt-4o,"{""tokens_in"": 489, ""tokens_out"": 54}",20250416_204832_claude_thinking_budget_4096_exp-claude_3_7_sonnet_latest_ag-gpt_4o.csv
438,,708.0,"In a chaotic kitchen, a chef stands in front of a stove with a pot boiling over, spilling its contents. The kitchen is a mess, with open cabinets and a blender that appears to have overflowed. The chef, looking frustrated, is looking back at a knight in full plate armor standing nearby, which is observing the scene.",I heard dinner needed rescuing.,"To rescue a dinner typically refers to fixing a cooking mistake, but here could be interpreted literally","The joke plays on the medieval knight's traditional role as a heroic rescuer, but applies it to a mundane kitchen disaster. When someone says cooking is ""going badly"" or ""dinner needs saving,"" it's typically a figure of speech about food preparation problems. The humor emerges from the knight taking this figurative language literally, appearing in full battle armor ready to ""rescue"" dinner as if it were a damsel in distress or kingdom under siege.

The incongruity is strengthened by the visual contrast between the practical problem (boiling over pots, kitchen mess) and the impractical solution (a knight in armor who would be completely ineffective at cooking). There's also humor in the knight's misplaced confidence - as if vanquishing a dragon and salvaging overcooked pasta require the same skill set.

Finally, the timing adds to the comedy since the knight has apparently arrived after the disaster has already occurred, rendering his heroic intervention both late and irrelevant.",PASS,"The student's answer captures the key comedic element by explicitly discussing how the knight interprets the phrase ""dinner needed rescuing"" literally, thus taking the figurative language about a cooking mistake and treating it as a situation calling for a knight's intervention. This explanation aligns with the anticipated answer point about the literal interpretation of rescuing dinner.",claude-3-7-sonnet-latest,"{""tokens_in"": 215, ""tokens_out"": 591}",gpt-4o,"{""tokens_in"": 538, ""tokens_out"": 83}",20250416_204832_claude_thinking_budget_4096_exp-claude_3_7_sonnet_latest_ag-gpt_4o.csv
441,,711.0,"In a living room, a woman sits on a couch, covering her face in distress as a baseball game unfolds around her. A batter, catcher, and pitcher, all in full baseball gear, are positioned as if in the middle of a game. A cat peeks out from behind the catcher. The room is furnished with curtains, a lamp, and a framed picture on the wall. The woman is speaking.",All his pitches have been inside.,"Because they are indoors, the pitch is literally ""inside""","The joke operates on a clever play on words with ""inside."" In baseball terminology, an ""inside pitch"" means the ball is thrown close to the batter's body. However, the caption brilliantly repurposes this term to comment on the absurd literal situation—a baseball game being played inside someone's living room. The humor comes from the woman's oddly specific complaint about pitch location rather than the more obvious issue that an entire baseball game is happening in her home. She's treating this surreal domestic invasion as if it were a normal baseball situation where the only problem is the pitcher's technique. The caption works through this dual meaning and the deliberate understatement of the bizarre circumstances, creating a perfect intersection of baseball jargon and domestic intrusion.",PASS,"The student's answer effectively captures the key comedic element, which is the play on the word ""inside."" The explanation acknowledges the dual meaning—how ""inside"" refers to the location of the pitch within baseball jargon, and simultaneously refers to the absurd quality of playing baseball inside a living room. This aligns well with the anticipated answer point concerning the literal and figurative use of ""inside.""",claude-3-7-sonnet-latest,"{""tokens_in"": 231, ""tokens_out"": 485}",gpt-4o,"{""tokens_in"": 496, ""tokens_out"": 92}",20250416_204832_claude_thinking_budget_4096_exp-claude_3_7_sonnet_latest_ag-gpt_4o.csv
460,,167.0,"In a forest clearing with tall tree trunks, a man in a suit with an American flag pin stands speaking at a podium with a decorative drape on the front, speaking. Two other men in suits stand close by behind him. Various woodland animals— including a deer, a snake on the ground, a frog, a bird, and other creatures—surround the scene, peeking from behind trees or looking on.",Read my lips—no new taxidermy.,The man is a politicial candidate giving a speech to the animals,"The joke plays on the famous political quote ""Read my lips: no new taxes"" from George H.W. Bush, replacing ""taxes"" with ""taxidermy."" The humor works on multiple levels: first, it's a clever wordplay substituting a similar-sounding word that completely changes the meaning; second, it creates perfect contextual relevance since the politician is addressing woodland animals who would naturally be concerned about being stuffed and mounted after death. The caption transforms a standard political promise into one specifically tailored to this unusual forest constituency's existential concerns. The absurdity of a politician campaigning to wildlife while addressing their most pressing survival issue (not being turned into decorative displays) creates an incongruity that drives the humor. It satirizes political pandering by showing how campaign rhetoric might be adapted for a non-human audience.",PASS,"The student's answer describes the context of the cartoon, including that the man is a politician addressing the animals. This aligns with the anticipated answer point, which specifies that the man is a political candidate giving a speech to the animals. The student's inclusion of wordplay and political context further supports the understanding of the humor, but the key component of recognizing the speaker as a politician addressing the animals is fully met.",claude-3-7-sonnet-latest,"{""tokens_in"": 232, ""tokens_out"": 555}",gpt-4o,"{""tokens_in"": 527, ""tokens_out"": 96}",20250416_204832_claude_thinking_budget_4096_exp-claude_3_7_sonnet_latest_ag-gpt_4o.csv
