idx,cartoonstock_id,contest_number,description,caption,element,explanation,autograder_judgment,autograder_reasoning,explainer_model,explainer_usage,autograder_model,autograder_usage,source_file
321,,62.0,"In an office setting, a man in a suit is seated behind his desk, observing a chaotic scene. Another man, bent forward with an expression of rage, is being ridden by a woman who’s perched on his back like a rodeo rider, arm raised triumphantly, holding on to his tie. The man behind the desk is speaking.",Just five more seconds and you'll break the record set by Tex and Dolly Rosenberg in Accounting.,This implies that employees riding each other like a bull is a common occurance in the office,"The humor in this caption comes from reframing the chaotic office scene as an organized competitive event rather than inappropriate workplace behavior. By suggesting there's an established record for office ""rodeo riding"" that employees are trying to break, the caption creates a surreal alternate reality where such antics are not only tolerated but tracked and celebrated within the company culture.

The specificity adds layers of comedy – naming previous record holders (""Tex and Dolly Rosenberg"") gives the absurd situation a false sense of legitimacy and history, while placing them ""in Accounting"" creates an amusing contrast between stereotypically dull departmental work and wild rodeo behavior. 

The casual, matter-of-fact delivery from the boss figure normalizes the bizarre scene, suggesting this is just another day at this dysfunctional workplace. The humor ultimately lies in the incongruity between professional office decorum and this ridiculous competition, with the implication that this company has somehow institutionalized inappropriate behavior into measurable achievements.",PASS,"The student's answer accurately captures the anticipated answer point by highlighting that the caption reframes the chaotic scene as a competitive event, suggesting that such behavior is normalized and tracked like a competition in this office environment. The description of the situation as an ""organized competitive event"" and the casual attitude of the boss implies that this kind of behavior is a common occurrence in the office.",claude-3-7-sonnet-latest,"{""tokens_in"": 231, ""tokens_out"": 484}",gpt-4o,"{""tokens_in"": 545, ""tokens_out"": 89}",20250416_193729_claude_thinking_budget_1024_exp-claude_3_7_sonnet_latest_ag-gpt_4o.csv
324,,71.0,"A doctor stands in an examination room, clipboard in hand, speaking to a patient who is physically separated into three parts—head, torso with crossed arms, and lower body—all resting on an exam table. The patient’s head, wearing glasses, is on one side of the torso, and the legs dangle at the other end. Despite the unusual situation, the doctor is casually reading from a clipboard.",The good news is all the pieces fit.,"Saying ""the good news is..."" is done along with divulging the ""bad news,"" presumably being that the man in chopped into three pieces.","The joke plays on the absurd situation of a patient being physically separated into three parts by treating this surreal, impossible scenario as a mundane medical case. The humor comes from the doctor's extreme understatement and clinical detachment—as if the most pressing medical concern is whether the dismembered parts can fit back together, rather than the fact that the patient is in pieces. The caption suggests a darkly comic ""good news/bad news"" medical scenario where the doctor finds a trivial positive aspect in a catastrophic situation. It parodies the way medical professionals sometimes reduce complex problems to simple, clinical assessments while maintaining professional composure in disturbing circumstances. The punchline treats the human body like a puzzle or kit with assembly requirements, creating comedy through the incongruity between the horrifying situation and the doctor's matter-of-fact delivery.",PASS,"The student's answer explicitly covers the key comedic element by describing the doctor's understatement and clinical detachment in the context of the surreal situation. It elaborates on the dark humor and the incongruity present in the doctor's casual assessment as if dealing with a simple medical issue. The student's explanation aligns with the anticipated answer point of the comedic structure involving ""good news"" in a bad situation.",claude-3-7-sonnet-latest,"{""tokens_in"": 227, ""tokens_out"": 419}",gpt-4o,"{""tokens_in"": 533, ""tokens_out"": 92}",20250416_193729_claude_thinking_budget_1024_exp-claude_3_7_sonnet_latest_ag-gpt_4o.csv
331,,82.0,"A naked man and woman are in a lush, tropical setting resembling the biblical Garden of Eden. The man is holding a phone to his ear and looking backward at a large hand extending from a cloud, which is pointing accusatorily downward at him. The woman looks alarmed or confused as she runs alongside him through tall grass away from the hand. In the background, a snake is wrapped around a tree trunk. Rays of light shine down dramatically.","Listen, Satan, can I call you back?",The casual tone downplays the seriousness of God and Satan,"The humor in this caption comes from a clever subversion of the biblical Eden narrative. By having Adam speak on the phone with Satan while God's hand accusingly points at him, the caption creates an unexpected conspiracy between Adam and the devil. The joke transforms the traditional fall from grace into something more deliberate—suggesting Adam was actively coordinating with Satan when caught by God.

The comedy lies in the casual, modern phrasing (""can I call you back?"") juxtaposed against this momentous theological event. Adam treats divine judgment as merely an inconvenient interruption to his phone call, implying an ongoing relationship with Satan that needs to be temporarily paused due to the more pressing matter of being expelled from paradise.

This humorous reframing transforms Adam from an innocent who was tempted into a calculating figure who got caught mid-scheme, with the phone serving as an anachronistic prop that further heightens the absurdity of the situation.",PASS,"The student’s answer captures the key comedic element by describing how the casual tone of Adam’s interaction with Satan on the phone downplays the seriousness of the biblical narrative, converting a major theological event into a mundane interruption. This aligns with the anticipated answer point that highlights the casual tone contrast.",claude-3-7-sonnet-latest,"{""tokens_in"": 236, ""tokens_out"": 480}",gpt-4o,"{""tokens_in"": 548, ""tokens_out"": 73}",20250416_193729_claude_thinking_budget_1024_exp-claude_3_7_sonnet_latest_ag-gpt_4o.csv
334,,92.0,"A man and a woman stand on a city sidewalk. The man is reaching into his pocket as if to give something to a dolphin standing upright on its tail, which is holding out a cup in a begging gesture. The woman, appearing angry, is yelling at the man, likely in protest of his action.","Come on, George. You know he's only going to spend it on more oxygen.",This compares the dolphin's need to frequently resurface for oxygen with the consumption habits of an addict,"This caption plays on the common rationale people use to avoid giving money to panhandlers: ""They'll just spend it on alcohol/drugs."" Here, the woman applies this same dismissive logic to a dolphin, but with a biological twist—oxygen instead of substances. 

The humor works on multiple levels. First, there's the absurdity of a dolphin begging on a city street. Second, oxygen is actually essential for the dolphin's survival, unlike alcohol for humans, making the woman's objection especially callous and illogical. She's essentially saying, ""Don't support this creature's basic need to breathe,"" which reveals her as unreasonably stingy.

The caption also cleverly plays with our knowledge that dolphins are aquatic mammals who must surface for air. By framing oxygen as if it were an addiction or wasteful expense, the joke creates a delightful cognitive dissonance between human social judgments and animal biological necessities. The woman's attitude toward the dolphin mirrors human indifference to others' essential needs, making this a subtle social commentary wrapped in absurdist humor.",PASS,"The student's answer effectively captures the comedic element by discussing the comparison of the dolphin's biological need for oxygen to human addiction habits. It highlights the comparison of needing oxygen to addiction by mentioning the woman's illogical objection, suggesting oxygen as an ""addiction or wasteful expense,"" which adheres to the anticipated answer that the dolphin's need is compared to an addict's consumption habits.",claude-3-7-sonnet-latest,"{""tokens_in"": 217, ""tokens_out"": 517}",gpt-4o,"{""tokens_in"": 560, ""tokens_out"": 91}",20250416_193729_claude_thinking_budget_1024_exp-claude_3_7_sonnet_latest_ag-gpt_4o.csv
337,,96.0,"A pregnant woman, wearing primitive clothing, sits on a large tree branch or vine, holding her belly and speaking. Tarzan, shirtless and wearing a loincloth, stands nearby, leaning against a tree. The background features trees and jungle foliage.","Well, you'll be a monkey's uncle.","It implies that Tarzan is the woman’s brother, meaning she was impregnated by an actual monkey—not Tarzan—making him, quite literally, a “monkey’s uncle”","This caption plays with the common expression ""Well, I'll be a monkey's uncle,"" which is traditionally an exclamation of surprise. Here, the phrase is cleverly transformed from figurative to literal through the jungle context. The pregnant woman is informing Tarzan - who was famously raised by apes - that he will actually become an uncle to her child. Since Tarzan is often portrayed as having a familial connection to monkeys/apes (his jungle family), the phrase ""monkey's uncle"" takes on a literal meaning.

The humor works through this dual interpretation: what would normally be just a figure of speech becomes an actual announcement of family status in the jungle setting. There's also an implied relationship being revealed - either the woman is Tarzan's sister or she's pregnant by Tarzan's brother, creating an unexpected family dynamic in the wilderness. The casual delivery of this news using such a common idiom creates the comic juxtaposition between everyday language and the extraordinary circumstance of jungle family planning.",FAIL,"The student's answer correctly captures the comedic element of the caption transforming the figurative expression ""monkey's uncle"" into a literal context due to the jungle setting and Tarzan's ties with apes. The explanation includes the crucial point about Tarzan becoming an uncle, which aligns with implying a familial connection. However, the anticipated answer point specifically highlights that Tarzan is the woman’s brother, suggesting she was impregnated by an actual monkey, a detail the student does not explicitly state. Thus, the student's interpretation lacks the critical detail of an actual monkey being involved.",claude-3-7-sonnet-latest,"{""tokens_in"": 199, ""tokens_out"": 521}",gpt-4o,"{""tokens_in"": 545, ""tokens_out"": 131}",20250416_193729_claude_thinking_budget_1024_exp-claude_3_7_sonnet_latest_ag-gpt_4o.csv
338,,101.0,"On the ledge of a tall building in an urban cityscape, a man in a suit standing inside a window speaks to three individuals precariously standing on the ledge: a clergyman, a police officer, and a firefighter, all dressed in their respective uniforms, and positioned like they might jump off.","I know this may not be a good time, but the rioters are burning down the cathedral!","It ""might not be a good time"" because all three characters are about to commit suicide, replacing this dire situation with a somehow more urgent one","The humor in this caption comes from the jarring juxtaposition of personal crisis and professional duty. Three emergency responders and moral authorities (clergyman, police officer, firefighter) are at their breaking point—literally on a ledge contemplating suicide—when they're confronted with an emergency that specifically requires their professional expertise. The speaker acknowledges the terrible timing (""I know this may not be a good time"") but proceeds anyway with news that creates an impossible moral dilemma: should these individuals address their own mental health crisis or respond to their professional calling? The burning cathedral specifically targets the clergyman's sense of duty, while also involving situations requiring police and firefighters. The joke works by highlighting the cruel irony that those who dedicate their lives to helping others in crisis are themselves in crisis, creating an absurd tension between personal needs and professional obligations.",PASS,"The student's answer captures the key comedic element by discussing the irony and tension between personal crisis and professional duty. They specifically mention that the humor arises from the acknowledgment of bad timing (""I know this may not be a good time"") and the juxtaposition of the characters' suicidal situation with the urgent professional demand they face. This mirrors the anticipated answer point regarding the inopportune timing of the situation.",claude-3-7-sonnet-latest,"{""tokens_in"": 219, ""tokens_out"": 441}",gpt-4o,"{""tokens_in"": 532, ""tokens_out"": 96}",20250416_193729_claude_thinking_budget_1024_exp-claude_3_7_sonnet_latest_ag-gpt_4o.csv
339,,101.0,"On the ledge of a tall building in an urban cityscape, a man in a suit standing inside a window speaks to three individuals precariously standing on the ledge: a clergyman, a police officer, and a firefighter, all dressed in their respective uniforms, and positioned like they might jump off.","Fellas, your empathy for victims is outstanding.",These are the exact professions that would be involved when responding to a situation involving a suicidal individual threatening to jump off a ledge.,"The humor comes from a dark ironic role reversal. Typically, clergymen, police officers, and firefighters are first responders who assist people in crisis—including potential jumpers on ledges. In this caption, the suited man inside is praising these professionals for taking their empathy to an extreme and literal level: they've placed themselves in the exact position of the victims they normally help. The joke hinges on the absurdity of professionals demonstrating ""outstanding"" empathy by actually standing outside on a ledge, seemingly ready to jump themselves. There's further humor in the casual, workplace-evaluation tone (""Fellas, your empathy is outstanding"") being used to address what appears to be a life-threatening situation, as if their potentially suicidal positioning is just an admirable professional development exercise rather than a crisis requiring intervention.",PASS,"The student's answer accurately identifies the comedic element of ironic role reversal, emphasizing that typically the clergyman, police officer, and firefighter would be responding to someone threatening to jump. This matches the anticipated answer point about these professions being involved in such crisis situations. The student also recognizes the humor in the absurdity and the tone of the situation, which aligns with the anticipated comedic device.",claude-3-7-sonnet-latest,"{""tokens_in"": 210, ""tokens_out"": 460}",gpt-4o,"{""tokens_in"": 510, ""tokens_out"": 92}",20250416_193729_claude_thinking_budget_1024_exp-claude_3_7_sonnet_latest_ag-gpt_4o.csv
354,,112.0,"In a prehistoric setting, two cavemen look into the barrel of an enormous revolver gun lying on the ground. One caveman is on his hands and knees peering into the gun with his spear on the ground next to him, speaking to the other, who is kneeling.",What did you say happened to the last tenant?,"Presumably, the gun fired, killing the last tenant","The humor in this caption comes from merging a prehistoric setting with a modern lethal object, creating a darkly comical misunderstanding. The cavemen are peering into a gun barrel as if it were some kind of dwelling or cave rather than a deadly weapon. By referring to a ""last tenant,"" the caption suggests the cavemen misinterpret the purpose of the gun entirely, believing it to be a habitat rather than a firearm. 

The comedy lies in the dramatic irony: viewers know looking into a gun barrel is extremely dangerous, while the cavemen have no concept of firearms. The caption implies someone (""the last tenant"") has already discovered this danger the hard way. This creates tension through the cavemen's naive investigation of something we recognize as potentially deadly, with the punchline suggesting that anyone who previously occupied this ""dwelling"" likely met a sudden and violent end—a fact completely lost on our prehistoric protagonists.",PASS,"The student's answer captures the anticipated answer point by explaining that the humor arises from the cavemen misunderstanding the gun as a dwelling, and the dramatic irony and implication that the last tenant met a deadly fate suggests that the gun fired, killing the last tenant. The student's explanation aligns with the key comedic element of the anticipated answer point regarding the outcome for the last tenant.",claude-3-7-sonnet-latest,"{""tokens_in"": 202, ""tokens_out"": 452}",gpt-4o,"{""tokens_in"": 514, ""tokens_out"": 88}",20250416_193729_claude_thinking_budget_1024_exp-claude_3_7_sonnet_latest_ag-gpt_4o.csv
357,,113.0,"In a hotel hallway scene, a man in a suit and glasses stands outside a room door, unlocking it with his key, with a small suitcase on the ground next to him. Nearby, a hotel maid with curly hair and an apron stands upright behind the doorway, positioned as if using it for cover. She holds a silenced pistol at the ready, giving the impression of preparing for a confrontation. A cleaning cart filled with supplies is parked nearby, adding to the typical hotel corridor setting with multiple doors visible along the hallway. The maid is speaking.","Oh, now you want to talk, when all week it was all 'Do Not Disturb.’","She is referring to the man's use of the ""Do Not Disturb"" sign as him avoiding a confrontation, until finally she threatened him with a gun","The joke plays on the absurd escalation of a mundane hotel interaction. The humor lies in the maid's deadly overreaction to a common hotel situation – a guest using the ""Do Not Disturb"" sign. She's personalized what is simply standard hotel protocol, treating it as if the guest had been deliberately ignoring or slighting her personally.

The caption creates comedy through the stark contrast between the maid's casual, relationship-like complaint about communication issues and the extreme measure she's taking (preparing to assassinate the guest). It transforms the impersonal hotel staff-guest relationship into a bizarrely intimate one with dangerous consequences.

The punchline turns the ""Do Not Disturb"" sign – a symbol of privacy and boundary-setting – into evidence of a perceived personal rejection that has pushed the maid to murderous revenge, highlighting the absurdity of taking customer service grievances to their most illogical conclusion.",PASS,"The student's answer explicitly captures the anticipated answer point by highlighting the comedic element: the maid's extreme overreaction to the ""Do Not Disturb"" sign. The student discusses how the maid interprets the sign as a personal slight and responds with disproportionate escalation, which aligns with the concept of avoiding confrontation until threatened. The explanation addresses the absurdity of the maid treating a standard hotel protocol as a personal rejection, culminating in a threatened violent confrontation.",claude-3-7-sonnet-latest,"{""tokens_in"": 279, ""tokens_out"": 530}",gpt-4o,"{""tokens_in"": 588, ""tokens_out"": 105}",20250416_193729_claude_thinking_budget_1024_exp-claude_3_7_sonnet_latest_ag-gpt_4o.csv
358,,113.0,"In a hotel hallway scene, a man in a suit and glasses stands outside a room door, unlocking it with his key, with a small suitcase on the ground next to him. Nearby, a hotel maid with curly hair and an apron stands upright behind the doorway, positioned as if using it for cover. She holds a silenced pistol at the ready, giving the impression of preparing for a confrontation. A cleaning cart filled with supplies is parked nearby, adding to the typical hotel corridor setting with multiple doors visible along the hallway. The maid is speaking.",I can fluff your pillow the easy way or the hard way.,Her comment suggests that the person inside is resisting having the pillow fluffed,"The humor in this caption lies in the juxtaposition of mundane hotel hospitality with thinly veiled threatening language. By combining the innocent service of ""pillow fluffing"" with the classic tough-guy ultimatum structure of ""the easy way or the hard way,"" the caption creates an absurd contradiction. The maid, armed with a silenced pistol, is clearly not there to provide turndown service, yet she frames her lethal intentions in the language of hotel amenities. The joke plays on the contrast between the expected behaviors in a hotel setting (helpful service staff) and the visual elements of an assassination or crime scenario. The humor emerges from this incongruity - we recognize both the familiar hospitality phrase and the menacing undertone, creating a darkly comic collision between the service industry and organized crime.",FAIL,"The student's answer does not explicitly cover the anticipated answer point about the person inside resisting having the pillow fluffed. Instead, it focuses on the incongruity and absurd contradiction between hotel services and threatening language, but does not mention resistance from the person inside.",claude-3-7-sonnet-latest,"{""tokens_in"": 272, ""tokens_out"": 418}",gpt-4o,"{""tokens_in"": 553, ""tokens_out"": 67}",20250416_193729_claude_thinking_budget_1024_exp-claude_3_7_sonnet_latest_ag-gpt_4o.csv
362,,115.0,"In a bar setting, two individuals sit next to each other at the counter. One is a man in a suit and tie, holding a martini glass and speaking to the person beside him. The other person is wearing a full hazmat suit, complete with a helmet and radioactive symbol, and is holding a glass of liquid on a coaster. The bar features standard items like napkins, bottles, and a coffee pot, while a window behind them provides a view of the outside world.","The way I see it, I'm the miner, and you're the canary.","The man is implying that if there were some hazard, the other man would be harmed before himself.","The joke plays on the historical practice of coal miners using canaries as early warning systems for toxic gases. In the cartoon, the person in the hazmat suit is declaring themselves the ""miner"" (protected, prepared) while identifying the unprotected regular person as the ""canary"" (vulnerable, expendable). 

The humor derives from the callous role assignment and the ironic reversal of the traditional dynamic. Unlike actual miners who faced dangers alongside their canaries, this ""miner"" has sealed themselves away from whatever environmental threat they're concerned about while leaving the other person exposed. 

The caption creates comedy through the contrast between the hazmat person's casual bar demeanor and their apparent belief that apocalyptic conditions exist outside. It's a darkly humorous commentary on self-preservation at others' expense and paranoia in modern society, with the added layer that the ""miner"" is freely sharing their survival strategy with the very person they're using as their disposable early warning system.",PASS,"The student's answer explicitly captures the anticipated answer point. They clearly explain that the person in the hazmat suit has assigned the role of ""canary"" to the other individual, indicating that the person without protection would be exposed to danger first. This aligns with the concept that if there were a hazard, the unprotected person would be harmed before the person in the hazmat suit.",claude-3-7-sonnet-latest,"{""tokens_in"": 251, ""tokens_out"": 493}",gpt-4o,"{""tokens_in"": 579, ""tokens_out"": 93}",20250416_193729_claude_thinking_budget_1024_exp-claude_3_7_sonnet_latest_ag-gpt_4o.csv
