idx,cartoonstock_id,contest_number,description,caption,element,explanation,autograder_judgment,autograder_reasoning,explainer_model,explainer_usage,autograder_model,autograder_usage,source_file
445,,32.0,"In the cartoon, a person dressed in a full rabbit costume, carrying a briefcase and reading a sheet of paper, walks down a hallway in a typical office setting. Two business-suited colleagues stand nearby, looking somewhat puzzled, while another person peeks out from an office doorway.","Well, at least somebody remembered about casual Good Friday.","Good Friday directly preceeds Easter, connecting to the rabbit costume","The humor comes from conflating “Casual Friday,” a workplace tradition where employees dress more casually, with “Good Friday,” the religious holiday before Easter. The punchline imagines someone interpreting “casual Good Friday” literally by donning an Easter‐bunny costume in an office setting. The absurdity lies in treating a solemn Christian observance as if it were a corporate dress‐down day—and then taking it to the next level with a goofy rabbit suit. It’s a play on words and cultural customs, merging secular office rituals with religious festivity for comic contrast.",PASS,The student's answer covers the anticipated answer point by acknowledging the connection between Good Friday and Easter through the mention of the Easter-bunny costume. The explanation links the cultural and religious elements that contribute to the humor of the situation.,o4-mini,"{""tokens_in"": 163, ""tokens_out"": 194}",gpt-4o,"{""tokens_in"": 450, ""tokens_out"": 60}",20250506_190750_o4-mini_low_exp-o4_mini_ag-gpt_4o.csv
446,,34.0,"In a woman's bedroom, a vampire is walking out of the door to the outside, spreading his cape as if to take flight, looking back at the woman who is sitting up in her bed, naked. The woman is speaking with a mildly disappointed look, and the vampire is looking back at her with a slight frown.",I bet the bride of Frankenstein gets to cuddle.,The woman's snarky comparison shows her discontent.,"The joke hinges on comparing the short‐lived intimacy with a vampire to the more enduring relationship one might have with the Bride of Frankenstein. Vampires are stereotypically insatiable, transient lovers who vanish at dawn, leaving partners high and dry. By invoking the Bride of Frankenstein—a monster who, unlike the vampire, is known as his permanent mate—the punch line highlights the woman’s disappointment with the vampire’s abrupt departure and her wistful longing for a cuddly, committed partner instead of a fleeting nocturnal fling.",PASS,"The student's answer discusses the woman's disappointment and compares the short-lived intimacy with the vampire to a more committed relationship, which aligns with the anticipated answer point about her snarky comparison and discontent.",o4-mini,"{""tokens_in"": 170, ""tokens_out"": 182}",gpt-4o,"{""tokens_in"": 443, ""tokens_out"": 55}",20250506_190750_o4-mini_low_exp-o4_mini_ag-gpt_4o.csv
447,,82.0,"A naked man and woman are in a lush, tropical setting resembling the biblical Garden of Eden. The man is holding a phone to his ear and looking backward at a large hand extending from a cloud, which is pointing accusatorily downward at him. The woman looks alarmed or confused as she runs alongside him through tall grass away from the hand. In the background, a snake is wrapped around a tree trunk. Rays of light shine down dramatically.",I gotta go. ‘Mr. Wonderful’ is having one of his episodes.,Mixing sacred imagery with casual dismissive language created dissonance,"The humor comes from mixing a primeval, awe-inspiring scene—Adam and Eve literally fleeing the wrath of God in Eden—with a totally modern, mundane phone call. The man treats God’s accusatory finger (the big hand in the clouds) like an annoying boss or loud TV personality nicknamed “Mr. Wonderful,” and blames his abrupt exit on “one of his episodes,” as if God has mood swings or temper tantrums rather than divine judgment. This contrast between epic biblical imagery and the casual, sarcastic tone of a disgruntled employee or talk-show host lampoons both workplace jargon and our tendency to reduce profound experiences into banal pop-culture references.",PASS,"The student's answer captures the key comedic element of mixing sacred imagery with casual dismissive language, as it discusses the contrast between the biblical scene and the modern, mundane phone call. The student also points out the sarcasm in treating God's divine judgment as a mere temper tantrum, which aligns with the anticipated answer point of creating dissonance through contrasting tones.",o4-mini,"{""tokens_in"": 201, ""tokens_out"": 279}",gpt-4o,"{""tokens_in"": 507, ""tokens_out"": 87}",20250506_190750_o4-mini_low_exp-o4_mini_ag-gpt_4o.csv
458,,155.0,"In a group therapy setting, a counselor sits at the center with hands folded, leading a discussion among a circle of participants. Among them are a large, lion-like figure, a metallic individual holding an axe, a straw-stuffed figure in a floppy hat, a woman holding a small dog, and two additional participants—an adult man and woman—who appear dressed in everyday clothing. Chairs are arranged in a ring, and the background features framed art and window blinds, suggesting a typical therapy room. The counselor is speaking",And my hourly fee is six hundred dollars. You're not in Kansas anymore.,The characters present are the cast of the Wizard of Oz,"This caption riffs on The Wizard of Oz by plopping the Lion, Tin Man, Scarecrow and Dorothy (with her dog) into modern group therapy. The counselor’s line “You’re not in Kansas anymore” echoes Dorothy’s famous remark on arriving in Oz. Here it’s flipped: the characters are back in the “real” world, paying a therapist’s steep rate. The humor comes from merging a classic film line with the absurdity of iconic fantasy figures shelling out big bucks for counseling, highlighting the clash between Oz’s whimsy and today’s clinical, commercialized therapy culture.",PASS,"The student's answer explicitly mentions and identifies the Lion, Tin Man, Scarecrow, and Dorothy (with her dog) as figures from The Wizard of Oz. Therefore, it captures the anticipated answer point about the characters present being the cast of the Wizard of Oz.",o4-mini,"{""tokens_in"": 215, ""tokens_out"": 325}",gpt-4o,"{""tokens_in"": 505, ""tokens_out"": 69}",20250506_190750_o4-mini_low_exp-o4_mini_ag-gpt_4o.csv
460,,167.0,"In a forest clearing with tall tree trunks, a man in a suit with an American flag pin stands speaking at a podium with a decorative drape on the front, speaking. Two other men in suits stand close by behind him. Various woodland animals— including a deer, a snake on the ground, a frog, a bird, and other creatures—surround the scene, peeking from behind trees or looking on.",Read my lips—no new taxidermy.,The man is a politicial candidate giving a speech to the animals,"This caption plays on the famous political pledge “Read my lips—no new taxes,” substituting “taxidermy” for “taxes.” The humor comes from the pun (taxidermy vs. taxes) and the absurdity of a politician reassuring wild animals that there won’t be more stuffed victims. It combines political rhetoric with a forest setting full of live animals, who naturally dread being turned into mounts. The incongruity of a formal press conference in the woods, plus animals eavesdropping on a promise about their own preservation, underlines the playful twist on campaign promises and the literal stakes for the cartoon’s audience.",PASS,"The student's answer explicitly captures the anticipated answer point by identifying the man in a suit as making a political promise, which is humorously directed at the woodland animals. The student discusses the play on words and the context of a political speech impacting the animals, aligning with the idea of a politician speaking to animals. This fulfills the requirement to address the setting of a candidate giving a speech to animals.",o4-mini,"{""tokens_in"": 190, ""tokens_out"": 208}",gpt-4o,"{""tokens_in"": 492, ""tokens_out"": 94}",20250506_190750_o4-mini_low_exp-o4_mini_ag-gpt_4o.csv
463,,688.0,"At a formal gathering, a stern-looking military officer with numerous medals and a cartoonishly long, receipt-like ribbon on his uniform holds a glass of wine. A woman in a black dress, also holding a glass of wine, is leaning in and speaking to him. Other guests are mingling in the background. The officer is speaking.",I was stationed at CVS during the war on drugs.,The war on drugs typically refers to anti-narcotics government initiatives,"The humor comes from conflating a real military “war on drugs” with the everyday experience of buying pharmaceuticals at CVS, a drugstore chain notorious for its long, receipt-like purchase tickets. The officer’s cartoonishly long, receipt-like ribbon is reinterpreted as proof of service at CVS rather than battlefield bravery. By claiming he was “stationed at CVS during the war on drugs,” the caption plays on the double meaning of “drugs” (illegal narcotics vs. pharmacy prescriptions) and “stationed” (military deployment vs. retail assignment), turning a serious-sounding wartime statement into a punchline about mundane retail work and comically excessive store receipts.",PASS,"The student's answer explicitly covers the key comedic element by explaining the conflation of the military ""war on drugs"" with the everyday experience at a CVS drugstore. It highlights the double meaning of “drugs” (illegal narcotics vs. pharmacy prescriptions) and interprets the caption as turning a serious wartime reference into a punchline about mundane activities. This coverage includes the key point about ""the war on drugs"" typically referring to anti-narcotics initiatives.",o4-mini,"{""tokens_in"": 173, ""tokens_out"": 214}",gpt-4o,"{""tokens_in"": 481, ""tokens_out"": 109}",20250506_190750_o4-mini_low_exp-o4_mini_ag-gpt_4o.csv
466,CS173253,,"A man stands at a podium marked “FDA,” holding a stack of papers and speaking, with an American flag behind him. Seated to his left are a man in a T-shirt who holds a drink, and a woman with crossed arms. To the right, another man in a suit is seated and looking at a sheet of paper. Behind them on the wall are framed images.","We’ve heard that laughter is the best medicine, so beginning Monday we’ll be regulating it.",It would be absurd to regulate something as mundane as laughter,"The caption plays on the phrase “laughter is the best medicine” by combining it with the FDA’s role in regulating drugs. It’s funny because it imagines the FDA taking the idiom literally and moving to control something intangible and universally positive—laughter—as if it were a prescription drug. The humor lies in the absurdity of bureaucratic overreach: an agency known for strict rules on real medicines now targeting an age-old, benign remedy.",PASS,"The student's answer captures the anticipated answer point. It discusses the absurdity of the FDA regulating laughter, emphasizing that it is an intangible and universally positive concept. This mirrors the anticipated point about the absurdity of regulating something as mundane as laughter.",o4-mini,"{""tokens_in"": 191, ""tokens_out"": 103}",gpt-4o,"{""tokens_in"": 452, ""tokens_out"": 65}",20250506_190750_o4-mini_low_exp-o4_mini_ag-gpt_4o.csv
468,CS171793,,"A dog sits upright at a table in a restaurant, holding a menu with its paws. The dog is speaking to a waiter who stands beside the table in a bow tie, leaning slightly forward to listen. A small candle sits on the table.",Is the homework fresh?,"""My dog ate my homework"" is a classic trope for explaining missing homework","The humor hinges on a role reversal and a classic schoolyard excuse. Dogs notoriously “eat your homework,” and here an actual dog in a restaurant is treating homework as if it were a menu item, politely asking if it’s “fresh” like a cut of fish or steak. The absurdity of a dog applying fine-dining etiquette to devour homework—and students’ perennial lament that “the dog ate my homework”—creates a playful, pun-driven twist.",PASS,"The student’s answer explicitly mentions the classic trope of ""the dog ate my homework"" and connects it to the humor of the cartoon, noting the role reversal and absurdity. Therefore, it captures the anticipated answer point.",o4-mini,"{""tokens_in"": 149, ""tokens_out"": 237}",gpt-4o,"{""tokens_in"": 415, ""tokens_out"": 61}",20250506_190750_o4-mini_low_exp-o4_mini_ag-gpt_4o.csv
475,CC125765,,"A man in a suit and tie sits behind a desk in an office, holding a telephone receiver to his mouth as he speaks. Piles of papers and a computer are on the desk, and a framed picture and a plant are visible in the background. Large windows behind him reveal the outlines of buildings outside.",Right now I think the wisest strategy is to diversify among your mattresses.,Storing money in a mattress is a trope for avoiding financial institutions,"This joke hinges on mixing financial jargon with a homey image: “diversify among your mattresses” riffs on standard investment advice (“diversify your portfolio”). Instead of spreading money across stocks or bonds, the speaker absurdly suggests hiding cash under multiple mattresses. The humor arises from the incongruity of treating mattresses like financial assets and from the underlying trope of stashing cash under a mattress during economic uncertainty. By placing this advice in an office setting, it parodies serious financial counsel and highlights how people might resort to ridiculous measures to protect their savings.",PASS,"The student's answer explicitly covers the anticipated answer point by discussing the absurdity of treating mattresses as financial assets, linking it to the trope of stashing cash under a mattress instead of using financial institutions. The answer highlights the incongruity of the suggestion, which aligns with the anticipated explanation of the humor derived from this trope.",o4-mini,"{""tokens_in"": 172, ""tokens_out"": 254}",gpt-4o,"{""tokens_in"": 456, ""tokens_out"": 80}",20250506_190750_o4-mini_low_exp-o4_mini_ag-gpt_4o.csv
499,CS173253,,"A man stands at a podium marked “FDA,” holding a stack of papers and speaking, with an American flag behind him. Seated to his left are a man in a T-shirt who holds a drink, and a woman with crossed arms. To the right, another man in a suit is seated and looking at a sheet of paper. Behind them on the wall are framed images.","We’ve heard that laughter is the best medicine, so beginning Monday we’ll be regulating it.",This mocks the FDA's tendency to overregulate regulate medicine,"The joke plays on the saying “laughter is the best medicine” by imagining the FDA—the agency that regulates drugs—deciding to regulate laughter itself. It derives humor from the absurdity of applying bureaucratic oversight to something intangible and universally benign: laughter. The image of the FDA formally preparing to “approve” or “control” laughter satirizes government regulation gone overboard, turning a harmless, natural human response into a subject for paperwork and policies. The contrast between the solemnity of the FDA setting and the idea of licensing laughter highlights the silliness of excessive red tape applied to everyday life.",PASS,The student's answer captures the anticipated answer point by focusing on the absurdity of the FDA regulating laughter as if it were a drug. They discuss the humorous notion of government overregulation and the incongruity of applying bureaucratic control to something as simple and harmless as laughter. This aligns with the comedic critique of the FDA's regulatory tendencies.,o4-mini,"{""tokens_in"": 191, ""tokens_out"": 133}",gpt-4o,"{""tokens_in"": 483, ""tokens_out"": 84}",20250506_190750_o4-mini_low_exp-o4_mini_ag-gpt_4o.csv
517,CC135060,,"Two elderly men, seen from behind, sit side by side at a bar lined with multiple liquor bottles. They each have a drink (in martini glasses) in front of them. Nearby, framed pictures hang on a brick-patterned wall. One man is speaking to the other","This time, when the swinging sixties come around, I'm not going to miss them.",He implies that he preferred the 1960's to the age range of 60s,"The humor hinges on the double meaning of “the swinging sixties.” Historically, this phrase refers to the exuberant 1960s cultural era. Here, an elderly man treats it literally as if it’s another cyclical phase of life he’ll actually reach—despite already having lived through it. The joke is that he’s so old he “missed” the 1960s swinging years (or at least metaphorically slept through them), and now he’s determined not to “miss” turning sixty again. This incongruous mixing of a cultural milestone with personal aging creates the punchline.",FAIL,"The student's answer focuses on the dual interpretation of ""the swinging sixties,"" relating it to both the historical era and personal aging, but it misses the specific comedic implication that the character preferred the cultural vibe of the 1960s to being in his sixties age-wise. The anticipated answer point specifically identifies the preference for the era over the age range, which the student does not address.",o4-mini,"{""tokens_in"": 170, ""tokens_out"": 200}",gpt-4o,"{""tokens_in"": 469, ""tokens_out"": 94}",20250506_190750_o4-mini_low_exp-o4_mini_ag-gpt_4o.csv
18,,16.0,"As a group of people exits a grand church doorway dressed in typical church attire, a pastor in a typical black suit and roman collar stands next to the Devil, complete with horns, trident, robe, and tail. They watch the procession pass by, as the pastor is explaining something to the devil. One passerby tips his hat at the pastor and devil.",I think it's important for them to hear both sides of the debate.,It downplays the seriousness of religion by portraying the Devil as merely the “other side” in a casual debate,"The caption plays on the phrase “hearing both sides of the debate” by treating a pastor’s sermon—and the Devil’s role as the ultimate counterpoint—as if it were a neutral public forum. The humor comes from the absurd literalness: instead of inviting opposing theologians, the churchgoers are about to receive a sermon from God’s representative and Hell’s boss himself. It subverts expectations about balanced debate, conflating civic politesse with a cosmic showdown between good and evil.",PASS,The student's answer captures the key comedic element by discussing the absurdity of treating the pastor and the Devil as if they are just two sides of a neutral public debate. This mirrors the anticipated answer point about downplaying the seriousness of religion by considering the Devil as merely the other side. The student effectively conveys the idea that the cartoon subverts expectations by presenting a cosmic conflict in the context of a balanced debate.,o4-mini,"{""tokens_in"": 182, ""tokens_out"": 368}",gpt-4o,"{""tokens_in"": 461, ""tokens_out"": 97}",20250506_191011_o4-mini_medium_exp-o4_mini_ag-gpt_4o.csv
26,,23.0,"Two butterflies stand on adjascent twigs. While the butterfly on the left appears normal, the butterfly on the left's wings are replaced with the pattern of Piet Mondrian iconic ""Composition with Red, Blue and Yellow"". The butterfly on the right is speaking to the other butterfly.",You think this is weird? My sister looks like a soup can.,"This implies there is a family of butterflies with patterns of famous paintings, in this case, Andy Warhol's soup can.","The joke plays on mixing famous modern art styles with butterfly wing patterns. One butterfly has a Piet Mondrian–style grid of red, blue and yellow, and the other deflects criticism by saying her sister’s wings look like a Campbell’s soup can—a nod to Andy Warhol’s iconic pop-art image. The humor comes from the absurdity of insects sporting high-art designs and the playful competition between modern art movements: geometric abstraction versus pop art. By anthropomorphizing butterflies as art critics, the caption satirizes art world pretensions and the unexpected collision of fine art and nature.",PASS,"The student's answer captures the key comedic element by explaining the absurdity of butterflies having wing patterns like famous artworks and references the Andy Warhol soup can, which connects directly with the anticipated answer point about the family of butterflies with famous painting patterns. The mention of a ""sister"" looking like a soup can aligns with the concept of such a family and matches the anticipated answer point.",o4-mini,"{""tokens_in"": 166, ""tokens_out"": 328}",gpt-4o,"{""tokens_in"": 469, ""tokens_out"": 93}",20250506_191011_o4-mini_medium_exp-o4_mini_ag-gpt_4o.csv
31,,27.0,"Several men in suits are seated around a boardroom table with coffee mugs and documents. At the head of the table, one man is standing with his arms crossed. Everyone seated has a parrot sitting on their shoulder. One seated person with a parrot is speaking angrily to the man to his left.","Well, it's not my fault booty revenues are down this quarter.","Parrots and ""booty"" are both concepts tied to pirates, implying that the company is actually a pirate operation","The humor hinges on mixing pirate tropes with corporate jargon. The parrots on everyone’s shoulders instantly evoke pirates—who chase “booty” as treasure—yet the setting is a modern boardroom discussing quarterly revenues. By complaining that “booty revenues are down,” the speaker treats pirate loot like corporate profit, absurdly applying business metrics and blame-shifting to a pirate crew. This clash between swashbuckling adventure and dry financial reporting creates the comedic contrast.",PASS,"The student's answer accurately captures the key comedic element of the cartoon caption, which is the juxtaposition of pirate themes (parrots and ""booty"") with a corporate setting. The explanation discusses how parrots evoke pirates and how ""booty"" refers to pirate treasure, while the boardroom scenario and talk of ""revenues"" brings in the corporate angle, aligning well with the anticipated answer point that these elements suggest the company might be a pirate operation.",o4-mini,"{""tokens_in"": 170, ""tokens_out"": 300}",gpt-4o,"{""tokens_in"": 446, ""tokens_out"": 107}",20250506_191011_o4-mini_medium_exp-o4_mini_ag-gpt_4o.csv
43,,34.0,"In a woman's bedroom, a vampire is walking out of the door to the outside, spreading his cape as if to take flight, looking back at the woman who is sitting up in her bed, naked. The woman is speaking with a mildly disappointed look, and the vampire is looking back at her with a slight frown.",I bet the bride of Frankenstein gets to cuddle.,"This references the famous ""Bride of Frankenstine” character","The humor comes from contrasting a stereotypical vampire’s all-night passion (and all-too-brief post-coital exit at sunrise) with the idea that the Bride of Frankenstein—another classic monster figure—would actually stick around and cuddle. The woman’s disappointed look implies she’s used to being abandoned at dawn, so she quips that Frankenstein’s bride must get the affectionate aftermath she’s missing. It’s funny because it plays on monster-romance clichés (vampires fleeing sunrise, the unspoken perks of monster matchmaking) and subverts gothic horror by turning it into a domestic gripe about cuddling.",PASS,"The student's answer explicitly refers to the Bride of Frankenstein, indicating an understanding of the anticipated answer point focused on this character. The student also correctly explains the comedic juxtaposition between different monster stereotypes and the expectation of post-coital behavior.",o4-mini,"{""tokens_in"": 170, ""tokens_out"": 391}",gpt-4o,"{""tokens_in"": 462, ""tokens_out"": 62}",20250506_191011_o4-mini_medium_exp-o4_mini_ag-gpt_4o.csv
46,,36.0,"The cartoon shows two men in office attire. One man, standing with his arms crossed, looks at the other, who is visibly pregnant, with his shirt stretched tightly over his large belly. The pregnant man is speaking, seemingly addressing the other with a comment.",No one expects an immaculate conception until it happens to him.,The immaculate conception involved a virgin inexplicably getting pregnant. This caption plays on that to explain the man's inexplicable pregnancy.,"The humor hinges on twisting the religious term “immaculate conception” (Mary conceives without a man) by applying it to a visibly pregnant man in an office. It combines the shock of male pregnancy with the absurdity of a “miraculous” conception, pushing the biological impossibility into a deadpan corporate setting. The punchline also parodies the phrasing “No one expects…” (echoing “No one expects the Spanish Inquisition”), heightening the surprise factor. The contrast between the solemn religious concept and the banal workplace context, plus the role reversal of a man experiencing pregnancy, creates the comedic dissonance.",PASS,"The student's answer explicitly covers the anticipated answer point by explaining the twist on the term ""immaculate conception"" and applying it to the context of a man being inexplicably pregnant. The use of religious concept in a surprising context also aligns with the anticipated comedic device.",o4-mini,"{""tokens_in"": 159, ""tokens_out"": 397}",gpt-4o,"{""tokens_in"": 469, ""tokens_out"": 69}",20250506_191011_o4-mini_medium_exp-o4_mini_ag-gpt_4o.csv
