idx,cartoonstock_id,contest_number,description,caption,element,explanation,autograder_judgment,autograder_reasoning,explainer_model,explainer_usage,autograder_model,autograder_usage,source_file
209,,662.0,"A wedding ceremony is taking place, but the bride and groom are dressed as vikings, complete with animal skins, viking helmet, wrapped footwear, and one holding a spear while the other holds a sword. They stand under a decorated archway, facing a minister who is reading from a book. On the left, bridesmaids in traditional dresses hold bouquets, and on the right, groomsmen in tuxedos stand attentively. One of the bridesmaids is turned back, speaking to another bridesmaid.",It’s about time they settled down and razed a village.,Vikings are known for destroying (razing) villages,"The speaker uses the familiar cliché “It’s about time they settled down and raise a family,” but swaps in the Viking-appropriate homophone “raze a village.” Vikings are stereotypically known for pillaging and burning (“razing”) settlements, so in this context that destructive activity becomes their equivalent of the domestic, post-wedding milestone of starting a family. The humor comes from the wordplay (raise vs. raze) and from treating violent Viking behavior as if it were a wholesome, expected next step for a newlywed couple.",PASS,"The student's answer explicitly covers the anticipated answer point by explaining that ""Vikings are stereotypically known for pillaging and burning ('razing') settlements."" This demonstrates that they understand the key comedic element, which is the association of Vikings with destroying villages.",o3,"{""tokens_in"": 210, ""tokens_out"": 186}",gpt-4o,"{""tokens_in"": 488, ""tokens_out"": 67}",20250506_185500_o3_low_exp-o3_ag-gpt_4o.csv
210,,663.0,"A man and a woman stand in a kitchen, looking perplexed while holding open a pizza box on the table. Inside the box, on the center of the pizza, there is a miniature scene of two people sitting at a small table, having a meal with wine glasses. The miniature man is speaking up to the regular-sized couple. ",Remember us from your wedding cake?,Wedding cake toppers are often miniature people,"The caption pretends that the tiny couple now seated on the pizza are the same miniature bride-and-groom figures that traditionally sit atop a wedding cake. By having them speak—“Remember us from your wedding cake?”—the caption supplies a back-story and punch line at once. It turns an inanimate decoration into living characters who have inexplicably relocated from one celebratory food to another. The absurdity of a talking cake topper now dining on the couple’s pizza, and acting as if this is a normal reunion, creates the humor.",PASS,"The student's answer captures the key comedic element by explaining that the tiny couple on the pizza are imagined as the same figures from the wedding cake, now animated and speaking. This directly addresses the anticipated answer point about the wedding cake toppers being miniature people, extending this concept into a humorous scenario.",o3,"{""tokens_in"": 170, ""tokens_out"": 188}",gpt-4o,"{""tokens_in"": 446, ""tokens_out"": 74}",20250506_185500_o3_low_exp-o3_ag-gpt_4o.csv
212,,664.0,"In a courtroom, a judge leans forward, angrily speaking to a man dressed in a magician's outfit complete with a top hat and wand, who is seated in the witness stand. A woman stands nearby holding a document, observing the interaction. The scene is set with the American flag and another flag in the background, adding to the formal courtroom atmosphere. The judge is speaking.",When was the last time you saw either half of her?,This references the classic magic trick of sawing an assistant in half,"The caption pretends that the magician’s classic “sawing a woman in half” illusion actually resulted in two separate, still-missing body halves. The judge’s question—“When was the last time you saw either half of her?”—parodies standard courtroom language (“When was the last time you saw her?”) but adds “either half,” treating the stage trick as a literal dismemberment. The humor comes from mixing the solemn, literal-minded world of a criminal court with the obviously theatrical conventions of magic, producing an absurd legal scenario in which the magician must account for a possibly homicidal illusion.",PASS,"The student's answer explicitly references the classic magic trick of ""sawing a woman in half,"" which is the key comedic element in the anticipated answer point. The explanation also elaborates on how the caption plays with courtroom language, highlighting the absurdity of the situation where the magic trick is taken literally.",o3,"{""tokens_in"": 184, ""tokens_out"": 202}",gpt-4o,"{""tokens_in"": 480, ""tokens_out"": 76}",20250506_185500_o3_low_exp-o3_ag-gpt_4o.csv
219,,671.0,"Two woolly mammoths are standing in a cave. One mammoth has several tiny cavemen on its back, each holding a spear and appearing to be attacking the mammoth. The mammoth without cavemen looks at the other mammoth, who is speaking with a slight grimace. The scene is set against a backdrop of cave walls.",It didn’t really bother me until they discovered fire.,Cavemen are associated with discovering fire,"The cartoon imagines the Ice-Age hunt from the mammoth’s point of view. One mammoth is already tolerating a nuisance—miniature cavemen jabbing him with spears—yet he downplays it, saying it “didn’t really bother me until they discovered fire.” The humor comes from: 1) absurd understatement: even with a swarm of armed humans on his back, he treats it as only mildly annoying; 2) escalation: the invention of fire will make the hunters far more dangerous (torches, cooked meat, eventual extinction), so that’s the point when annoyance turns to real concern; and 3) role reversal/anthropomorphism: the mammoths converse like modern people gossiping about pests. The joke hinges on the historical milestone—humans mastering fire—as the punchline that re-contextualizes the cavemen’s presence from pesky to truly threatening.",PASS,"The student's answer explicitly discusses how the discovery of fire by the cavemen escalates the situation from a mere nuisance to a serious threat. This captures the anticipated answer point, as the comedic element relies on the association of cavemen with the discovery of fire. Thus, the student's response aligns with the anticipated point and covers the key element of the joke.",o3,"{""tokens_in"": 175, ""tokens_out"": 196}",gpt-4o,"{""tokens_in"": 524, ""tokens_out"": 86}",20250506_185500_o3_low_exp-o3_ag-gpt_4o.csv
228,,677.0,"A man, appearing to be sleepwalking with his arms extended, is heading towards a refrigerator in a kitchen. His eyes are half-closed, and he looks disheveled. On the kitchen counter, a cat with glowing eyes is sitting and staring directly at the man, emitting beams of light from its eyes that illuminate the refrigerator. The scene is surreal and humorous, with the cat seemingly guiding the sleepwalker.",Look what I dragged in.,"This is the phrase ""look what the cat dragged in"" from the cat's perspective","The caption riffs on the familiar expression “Look what the cat dragged in,” usually said when someone shows up looking bedraggled. Here, the cat is literally present and seems to be controlling or “dragging” the disheveled, half-awake man toward the refrigerator with its laser-like stare. By shortening the phrase to “Look what I dragged in,” the speaker is implicitly the cat, boasting about having brought in an unusual “catch”—a full-grown human instead of the typical mouse or bird. The joke comes from the role-reversal: the cat, not the man, is in charge, and the human has become the cat’s trophy. Wordplay on the well-known idiom plus the surreal visual of a mind-controlling pet makes the scene funny.",PASS,"The student's answer explicitly highlights that the caption plays on the familiar expression ""Look what the cat dragged in,"" and describes the cat's implied perspective in ""Look what I dragged in."" This captures the anticipated answer point of the phrase being from the cat's perspective.",o3,"{""tokens_in"": 185, ""tokens_out"": 237}",gpt-4o,"{""tokens_in"": 517, ""tokens_out"": 68}",20250506_185500_o3_low_exp-o3_ag-gpt_4o.csv
244,,687.0,"A woman holding a wine glass stands on a rooftop in a city, delighted, looking back at a man sitting at a table with a bottle and glass. Behind them, an enormous face peers over the building, looking similar to the man. The woman is speaking with a smile.",How much did you spend at Macy’s this year?,This implies the enormous person is a balloon for the Macy's day parade,"The looming, balloon-sized likeness of the man resembles one of the gigantic character floats in Macy’s Thanksgiving Day Parade. The woman teases him that his personal spending at Macy’s has been so extravagant that the store has rewarded (or shamed) him by giving him his own parade balloon, which now hovers over their rooftop. The humor comes from exaggerating loyalty-card marketing—“big spender” status—into a literal, absurdly huge tribute that peeps over buildings.",PASS,"The student's answer correctly identifies that the enormous likeness of the man resembles a gigantic character float from Macy’s Thanksgiving Day Parade, which covers the anticipated answer point that the enormous person is a balloon for the parade. The answer explains the humor by connecting the spending at Macy’s to being rewarded with a parade balloon, which aligns with the comedic element of the anticipated answer point.",o3,"{""tokens_in"": 162, ""tokens_out"": 239}",gpt-4o,"{""tokens_in"": 431, ""tokens_out"": 89}",20250506_185500_o3_low_exp-o3_ag-gpt_4o.csv
246,,688.0,"At a formal gathering, a stern-looking military officer with numerous medals and a cartoonishly long, receipt-like ribbon on his uniform holds a glass of wine. A woman in a black dress, also holding a glass of wine, is leaning in and speaking to him. Other guests are mingling in the background. The officer is speaking.",I was stationed at CVS during the war on drugs.,This imagines the war on drugs as a literal war with generals over drugs at a pharmacy,"The officer’s medal ribbon is absurdly long, dangling like one of CVS Pharmacy’s famously endless receipts. The caption invents a backstory that justifies the visual gag: during the “war on drugs” he was “stationed at CVS,” a pharmacy chain that literally dispenses drugs and prints comically lengthy receipts. So his out-of-scale service ribbon becomes the physical manifestation of a CVS receipt earned in that tongue-in-cheek assignment. The humor comes from blending military heroism with mundane retail, and from the double meaning of “drugs” (illicit substances vs. prescription meds), making his grand decoration seem ridiculous and petty rather than noble.",PASS,"The student's answer explicitly addresses the comedic element by explaining that the cartoon merges military themes with retail elements. It highlights the absurdity of the officer's long ribbon by comparing it to CVS receipts, while the context of the ""war on drugs"" is interpreted literally with the officer positioned at a CVS. This aligns with the anticipated answer point, capturing the notion of a literal war waged with generals over drugs at a pharmacy.",o3,"{""tokens_in"": 173, ""tokens_out"": 148}",gpt-4o,"{""tokens_in"": 482, ""tokens_out"": 100}",20250506_185500_o3_low_exp-o3_ag-gpt_4o.csv
250,,690.0,"An astronaut in full space gear stands inside an elevator, facing a surprised bellhop who is holding the elevator door open. The scene takes place in a building lobby, with a potted plant and a directory visible on the wall. The bellhop is speaking to the astronaut.",Please watch your small step.,"This references Neil Armstrong's famous ""One small step for man"" quote","The standard elevator safety phrase is “Watch your step.”  The bellhop tweaks it for the astronaut, alluding to Neil Armstrong’s famous moon-landing line, “That’s one small step for man, one giant leap for mankind.”  In the lobby the astronaut’s next move is literally just a short step into the elevator, so it’s only a “small step,” not a “giant leap.”  The joke comes from merging the mundane elevator caution with the iconic space-exploration quote and the visual incongruity of an astronaut in an ordinary hotel.",PASS,"The student's answer captures the key comedic element by directly referencing Neil Armstrong's famous moon-landing quote. It describes how the bellhop's phrase tweaks the standard elevator caution to humorously echo Armstrong's words, considering the astronaut's presence. The explanation includes the iconic quote and the visual and contextual incongruity, aligning well with the anticipated answer point.",o3,"{""tokens_in"": 156, ""tokens_out"": 193}",gpt-4o,"{""tokens_in"": 444, ""tokens_out"": 86}",20250506_185500_o3_low_exp-o3_ag-gpt_4o.csv
252,,691.0,"A couple is sitting in their living room, with the man using a laptop and the woman knitting. Outside the window, a large crowd of snowmen, some wearing hats and scarves, are peering in, seemingly watching the couple. The scene is set at night, with bare trees visible in the background. The woman knitting on the couch against the window looks back at the snowmen with a concerned expression, but the man, who is speaking, appears unfazed.","Well, he did say he’d be back again someday.","""I'll be back someday"" is a lyric from Frosty the Snowman","The line alludes to the children’s song “Frosty the Snowman,” whose last lyric is “Frosty the Snowman … waved goodbye, saying, ‘Don’t you cry, I’ll be back again someday.’” The speaker treats the throng of snowmen outside as the literal fulfillment of Frosty’s promise—as though Frosty has not only returned but brought an army of fellow snowmen. The humor comes from applying the casual, cheery lyric to a creepy, horror-movie visual: instead of one friendly snowman magically reappearing, a silent mob now presses against their window at night. The husband’s calm, matter-of-fact remark contrasts with the unnerving scene, heightening the absurdity.",PASS,"The student's answer explicitly references the ""Frosty the Snowman"" song and the specific lyric, ""I’ll be back again someday."" This directly covers the anticipated answer point regarding the line's origin from the song.",o3,"{""tokens_in"": 201, ""tokens_out"": 226}",gpt-4o,"{""tokens_in"": 524, ""tokens_out"": 60}",20250506_185500_o3_low_exp-o3_ag-gpt_4o.csv
253,,692.0,"In a surreal costume shop, a wolf dressed in a sheep costume stands on a pedestal, admiring itself in a mirror. Nearby, a man in a suit is holding various animal costumes, including a zebra, goat, and unicorn. The scene is filled with an array of animal disguises, some hanging from the ceiling and others draped over furniture. The wolf is speaking.",I'll take this and the granny dress.,"This references Little Red Riding Hood, where the wolf disguises himself as the grandma","The image literalizes “a wolf in sheep’s clothing”: the wolf is in a costume shop trying on a sheep outfit as if shopping for any ordinary disguise. Its line, “I’ll take this and the granny dress,” layers a second famous wolf ruse—when the Big Bad Wolf dons Grandma’s clothes in “Little Red Riding Hood.” The humor comes from the predator casually purchasing both classic deception outfits at once, treating centuries-old literary tricks as fashionable wardrobe options. Seeing a dangerous animal behave like a picky shopper and openly planning multiple schemes creates the comic incongruity.",PASS,"The student's answer explicitly mentions the connection to ""Little Red Riding Hood"" and the classic ruse of the wolf donning Grandma's clothes, which directly addresses the key comedic element involving this specific reference. Thus, it captures the anticipated answer point about the wolf disguising himself as the grandma.",o3,"{""tokens_in"": 179, ""tokens_out"": 192}",gpt-4o,"{""tokens_in"": 469, ""tokens_out"": 74}",20250506_185500_o3_low_exp-o3_ag-gpt_4o.csv
259,,697.0,"A man in tattered clothes and a blindfold ""walks the plank"" from a subway train onto the platform, while typical pirate captain with an eye patch, hat, parrot, and peg leg, along with a shirtless crew member with a bandana watch from the train's doorway. The scene is absurdly set in a modern subway station. The crew member is speaking from behind the captain.",No one crosses the Pirates of Penn Station.,"This replaces ""Penzance"" with ""Penn Station"" to address the train setting","The humor hinges on a pun on the famous Gilbert & Sullivan operetta title “The Pirates of Penzance.” Swapping “Penzance” for “Penn Station,” a real New York rail hub served by the subway in the drawing, relocates swash-buckling buccaneers to modern mass transit. The phrase “No one crosses the Pirates of Penn Station” carries a double meaning: 1) the cliché pirate warning that no one should “cross” (defy) them, and 2) the literal act of the victim being forced to “cross” from the subway car to the platform as though walking a plank. The absurd blend of high-seas piracy with a mundane commuter setting, capped by the operetta-based wordplay, supplies the comic twist.",PASS,"The student's answer explicitly addresses the key comedic element of the pun, replacing ""Penzance"" with ""Penn Station,"" and explains the humor derived from this wordplay within the context of the cartoon's setting. The comedic shift from the operetta to a modern subway station is thoroughly analyzed, satisfying the anticipated answer point.",o3,"{""tokens_in"": 186, ""tokens_out"": 237}",gpt-4o,"{""tokens_in"": 520, ""tokens_out"": 80}",20250506_185500_o3_low_exp-o3_ag-gpt_4o.csv
260,,698.0,"In a black and white cartoon, a man wearing a yellow crown and a red royal robe walks down a city sidewalk with a woman. They pass by a person walking a dog and another couple engaged in conversation. The scene is set against a backdrop of buildings with windows and a door under an arched entrance. The man with the crown appears out of place in the otherwise ordinary urban setting. The woman is speaking.","Harry, the whole point of leaving England was to blend in.",This reference's Prince Harry's famous departure from the UK,"The woman is addressing the crowned, robed man as “Harry,” evoking Prince Harry, who famously left the U.K. monarchy to live a more “normal,” low-profile life abroad. Yet Harry is strolling through an ordinary city street dressed in full, unmistakable royal regalia. The caption highlights the contradiction: they supposedly moved to escape royal scrutiny and “blend in,” but Harry is doing the opposite, advertising his royalty in the most conspicuous way possible. The clash between his intention (anonymity) and his action (wearing a crown and cape) supplies the joke’s comic incongruity.",PASS,"The student’s answer explicitly mentions Prince Harry's departure from the UK monarchy and highlights the comedic incongruity of his attire in an ordinary setting, which directly addresses the anticipated answer point.",o3,"{""tokens_in"": 191, ""tokens_out"": 202}",gpt-4o,"{""tokens_in"": 485, ""tokens_out"": 53}",20250506_185500_o3_low_exp-o3_ag-gpt_4o.csv
270,,707.0,"A man dressed as the mythological figure Atlas, complete with sandals and a toga, is struggling to carry a large globe on his back as he exits a house. Inside the room, a woman in a bathrobe and slippers, holding a cup of coffee, watches him with a nonchalant expression. Man is speaking back to the woman with a strained expression.",It’s mostly water weight.,This plays on the well known fact that most of Earth's surface is covered in water,"Atlas’s burden is literally the whole Earth. People trying to downplay heaviness often shrug, “Don’t worry, it’s mostly water weight,” meaning the pounds you can shed quickly because they’re just water. Atlas uses the same diet cliché to explain the crushing mass on his shoulders. The line is funny because 1) Earth really is about 70 % water, so the remark is technically true; 2) treating the astronomical load of the planet like a few extra pounds someone is fretting about trivializes his mythic ordeal; and 3) the casual domestic setting (wife in robe with coffee) contrasts with the epic labor, heightening the absurdity.",PASS,"The student's answer explicitly covers the anticipated answer point by noting that ""Earth really is about 70 % water,"" which aligns with the comedic element of the Earth's surface being mostly water. The student extends the comedic analysis with additional points, but does not omit the key fact required by the anticipated answer point.",o3,"{""tokens_in"": 174, ""tokens_out"": 150}",gpt-4o,"{""tokens_in"": 485, ""tokens_out"": 76}",20250506_185500_o3_low_exp-o3_ag-gpt_4o.csv
271,,707.0,"A man dressed as the mythological figure Atlas, complete with sandals and a toga, is struggling to carry a large globe on his back as he exits a house. Inside the room, a woman in a bathrobe and slippers, holding a cup of coffee, watches him with a nonchalant expression. Man is speaking back to the woman with a strained expression.","Next week, I'll move Heaven for you.","To ""move heaven and earth"" is an idiom meaning to working hard","The joke hinges on the idiom “move heaven and earth,” which means to do absolutely everything possible for someone. Atlas, the titan condemned to carry the Earth, is shown literally lugging a globe out the door—he’s already “moving Earth.” His strained promise, “Next week, I’ll move Heaven for you,” comically literalizes the second half of the phrase. The humor comes from (1) the visual pun of Atlas actually relocating the planet, (2) the idea that even mythic labor is treated like a household chore scheduled for later, and (3) the contrast between the woman’s casual morning routine and her partner’s world-shifting exertion. The caption turns an overused expression into a literal to-do list, highlighting both Atlas’s superhuman burden and the everyday dynamics of couples’ promises.",PASS,"The student's answer explicitly discusses the idiom ""move heaven and earth,"" noting its meaning as doing everything possible for someone. This aligns with the anticipated answer point that highlights understanding the idiom's meaning. Thus, the key comedic element is addressed.",o3,"{""tokens_in"": 177, ""tokens_out"": 246}",gpt-4o,"{""tokens_in"": 518, ""tokens_out"": 65}",20250506_185500_o3_low_exp-o3_ag-gpt_4o.csv
273,,708.0,"In a chaotic kitchen, a chef stands in front of a stove with a pot boiling over, spilling its contents. The kitchen is a mess, with open cabinets and a blender that appears to have overflowed. The chef, looking frustrated, is looking back at a knight in full plate armor standing nearby, which is observing the scene.",I heard dinner needed rescuing.,This references that Knights are known for rescuing things,"The humor comes from applying the medieval “knight-in-shining-armor” trope—someone who rides in to rescue a damsel in distress—to an overcooked meal. The kitchen is a disaster and the chef is desperate, so the knight says, “I heard dinner needed rescuing.” He’s treating the ruined food as if it were the captive maiden that a heroic knight would save. The incongruity of a fully armored knight appearing in a modern kitchen to “rescue” spaghetti instead of a princess creates the joke.",PASS,"The student's answer explicitly compares the scenario to the ""knight-in-shining-armor"" trope, where knights are known for rescuing damsels in distress. This clearly aligns with the anticipated answer point that focuses on knights being known for rescuing things.",o3,"{""tokens_in"": 169, ""tokens_out"": 122}",gpt-4o,"{""tokens_in"": 446, ""tokens_out"": 67}",20250506_185500_o3_low_exp-o3_ag-gpt_4o.csv
287,,16.0,"As a group of people exits a grand church doorway dressed in typical church attire, a pastor in a typical black suit and roman collar stands next to the Devil, complete with horns, trident, robe, and tail. They watch the procession pass by, as the pastor is explaining something to the devil. One passerby tips his hat at the pastor and devil.",I think it's important for them to hear both sides of the debate.,This plays on the trope of good and evil being personified as a devil and angel arguing,"The caption pretends the priest is giving the Devil equal “speaking time,” just as a moderator might invite two opposing pundits to present “both sides” of a political issue. In religion, however, the Devil isn’t an ordinary alternate viewpoint—he is the embodiment of evil. Offering him the floor for balance is absurd, so the priest’s earnest commitment to fairness collides with the obvious inappropriateness of letting Satan address churchgoers. The humor comes from applying the secular ideal of equal-time debate to the extreme, black-and-white moral universe of church doctrine, producing a ridiculous literalism: treating God vs. Devil like just another policy dispute.",FAIL,"The student's answer focuses on the absurdity of giving the Devil equal time in a religious context, which is a comedic element, but it does not specifically mention or explicitly cover the anticipated answer point about the trope of good and evil being personified as a devil and angel arguing.",o3,"{""tokens_in"": 182, ""tokens_out"": 213}",gpt-4o,"{""tokens_in"": 493, ""tokens_out"": 71}",20250506_185500_o3_low_exp-o3_ag-gpt_4o.csv
