idx,cartoonstock_id,contest_number,description,caption,element,explanation,autograder_judgment,autograder_reasoning,explainer_model,explainer_usage,autograder_model,autograder_usage,source_file
18,,16.0,"As a group of people exits a grand church doorway dressed in typical church attire, a pastor in a typical black suit and roman collar stands next to the Devil, complete with horns, trident, robe, and tail. They watch the procession pass by, as the pastor is explaining something to the devil. One passerby tips his hat at the pastor and devil.",I think it's important for them to hear both sides of the debate.,It downplays the seriousness of religion by portraying the Devil as merely the “other side” in a casual debate,"The pastor just escorted his flock through a sermon meant to win souls for God, yet he is now standing shoulder-to-shoulder with Satan as though they are guest panelists. By saying the congregants must “hear both sides of the debate,” he treats eternal salvation versus damnation like a modern talk-show issue that demands equal airtime for opposing viewpoints. The humor comes from transplanting the media/political mantra of “balanced coverage” into a church, where giving the Devil the floor is the last thing expected. The absurd visual of a polite parishioner tipping his hat to a horned, trident-wielding Devil underscores how far the ideal of impartial discourse has been stretched, mocking our tendency to force “both-sides” symmetry even when one side is literally evil.",PASS,"The student's answer explicitly captures the anticipated answer point by highlighting how the humor derives from portraying the serious religious matter of salvation versus damnation as a casual debate, which parallels modern ""balanced coverage"" debates. This mirrors the anticipated answer's note about downplaying the seriousness of religion by treating the Devil as the ""other side.""",o3,"{""tokens_in"": 182, ""tokens_out"": 238}",gpt-4o,"{""tokens_in"": 521, ""tokens_out"": 81}",20250506_185500_o3_low_exp-o3_ag-gpt_4o.csv
26,,23.0,"Two butterflies stand on adjascent twigs. While the butterfly on the left appears normal, the butterfly on the left's wings are replaced with the pattern of Piet Mondrian iconic ""Composition with Red, Blue and Yellow"". The butterfly on the right is speaking to the other butterfly.",You think this is weird? My sister looks like a soup can.,"This implies there is a family of butterflies with patterns of famous paintings, in this case, Andy Warhol's soup can.","The speaker notes that this butterfly’s wings look like a Mondrian painting—high-art patterning appearing unexpectedly in nature. He then ups the ante by claiming his sister resembles a “soup can,” a wink at Andy Warhol’s iconic Campbell’s-soup-can pop art. The humor comes from treating famous modern-art images as hereditary butterfly traits: one sibling bears a Mondrian abstraction, another supposedly has Warhol branding. It’s the absurd collision of art-history references with everyday butterfly chit-chat—presenting masterpieces as quirky family resemblances—that makes the line funny.",PASS,"The student's answer explains the comedic element by referencing how modern art images are humorously treated as hereditary traits among butterflies. It covers the notion of a family of butterflies having famous artwork patterns, specifically referencing both Mondrian and Warhol's works, which aligns with the anticipated answer point regarding a family of butterflies with famous painting patterns.",o3,"{""tokens_in"": 166, ""tokens_out"": 197}",gpt-4o,"{""tokens_in"": 464, ""tokens_out"": 81}",20250506_185500_o3_low_exp-o3_ag-gpt_4o.csv
31,,27.0,"Several men in suits are seated around a boardroom table with coffee mugs and documents. At the head of the table, one man is standing with his arms crossed. Everyone seated has a parrot sitting on their shoulder. One seated person with a parrot is speaking angrily to the man to his left.","Well, it's not my fault booty revenues are down this quarter.","Parrots and ""booty"" are both concepts tied to pirates, implying that the company is actually a pirate operation","The visual gag turns the button-down boardroom into a band of pirates in disguise: every executive sports the classic pirate accessory—a shoulder parrot. The caption reinforces the mash-up by using “booty revenues,” pirate slang for stolen treasure, in the dry language of quarterly financial reporting. The speaker’s defensive, corporate-jargon tone (“It’s not my fault … revenues are down this quarter”) is exactly what you’d expect at a real earnings meeting, but the subject—plundering booty—belongs to the pirate world the parrots hint at. Comedy comes from the incongruous blend of two domains: ruthless seafaring outlaws still worrying about Q-to-Q performance metrics like any modern corporation.",PASS,"The student's answer explicitly covers the anticipated answer point by explaining that the parrots and the use of ""booty revenues"" imply the executives are akin to pirates. This indicates a pirate operation, aligning with the anticipated answer point about the connection to pirates.",o3,"{""tokens_in"": 170, ""tokens_out"": 223}",gpt-4o,"{""tokens_in"": 494, ""tokens_out"": 66}",20250506_185500_o3_low_exp-o3_ag-gpt_4o.csv
43,,34.0,"In a woman's bedroom, a vampire is walking out of the door to the outside, spreading his cape as if to take flight, looking back at the woman who is sitting up in her bed, naked. The woman is speaking with a mildly disappointed look, and the vampire is looking back at her with a slight frown.",I bet the bride of Frankenstein gets to cuddle.,"This references the famous ""Bride of Frankenstine” character","The scene riffs on the stereotypical post-hook-up complaint that a man bolts instead of staying to “cuddle.”  Here the departing cad is Dracula.  The woman snarks that “the Bride of Frankenstein gets to cuddle,” comparing her own situation to another famous movie monster couple.  The gag comes from treating Universal-horror characters like ordinary boyfriends: she assumes that Frankenstein’s monster, stitched-together brute though he is, sticks around for post-coital affection, while suave, caped Dracula behaves like a selfish playboy.  The incongruity of applying modern relationship grievances and monster-to-monster envy to gothic creatures supplies the humor.",PASS,"The student's answer explicitly mentions ""the Bride of Frankenstein"" as part of the comparison made by the woman, which captures the key comedic element of referencing the ""Bride of Frankenstein"" character. The connection to the modern relationship grievance is an expansion that supports the student's understanding without omission or contradiction of the anticipated answer point.",o3,"{""tokens_in"": 170, ""tokens_out"": 213}",gpt-4o,"{""tokens_in"": 472, ""tokens_out"": 78}",20250506_185500_o3_low_exp-o3_ag-gpt_4o.csv
46,,36.0,"The cartoon shows two men in office attire. One man, standing with his arms crossed, looks at the other, who is visibly pregnant, with his shirt stretched tightly over his large belly. The pregnant man is speaking, seemingly addressing the other with a comment.",No one expects an immaculate conception until it happens to him.,The immaculate conception involved a virgin inexplicably getting pregnant. This caption plays on that to explain the man's inexplicable pregnancy.,"The joke hinges on the absurd sight of a male office worker who is obviously pregnant. He tries to rationalize the impossibility by invoking “the immaculate conception,” the biblical event in which Mary became pregnant without intercourse. The line “No one expects an immaculate conception until it happens to him” humorously flips both biology and theology: (1) only women can get pregnant, so a man claiming it happened to “him” is inherently ridiculous; (2) the phrase “no one expects…” echoes clichés like “it can’t happen to me,” making his calm acceptance funnier. The caption’s deadpan tone treats a miracle as just another workplace surprise, highlighting the absurdity and producing the humor.",PASS,"The student's answer explicitly covers the key comedic element of the cartoon and caption, which is the absurdity of a man being pregnant and rationalizing it with the concept of ""immaculate conception."" The answer discusses the absurdity of a man being pregnant, the theological reference, and the humor in the situation. Thus, it encompasses the anticipated answer point effectively.",o3,"{""tokens_in"": 159, ""tokens_out"": 217}",gpt-4o,"{""tokens_in"": 483, ""tokens_out"": 87}",20250506_185500_o3_low_exp-o3_ag-gpt_4o.csv
48,,40.0,"The cartoon shows a woman in her underwear sitting up in bed, looking forward with a disgruntled expression. A large snow globe with a snowman inside is positioned next to her on the bed. The woman is speaking.","Well, that was abominable.","This plays on the phrase ""abominable snowman,"" a mythical creature","The scene mimics a classic “morning after” complaint: a lover turns out to have been terrible in bed. Here the partner is literally a snowman inside a snow globe. The woman’s line “Well, that was abominable” delivers a double meaning. On one level she’s saying the experience was awful. On the other, the word evokes the “Abominable Snowman,” the folkloric cousin of a snowman. The punny overlap between “bad sex” and “abominable snow-man” ties the odd visual—sharing a bed with a snow figure—to her judgment, generating the joke.",PASS,"The student's answer captures the key comedic element by explaining the double entendre of ""abominable,"" noting both its literal use regarding a poor experience and its connection to the ""Abominable Snowman,"" which is a snowman-related pun integral to the joke.",o3,"{""tokens_in"": 148, ""tokens_out"": 204}",gpt-4o,"{""tokens_in"": 449, ""tokens_out"": 68}",20250506_185500_o3_low_exp-o3_ag-gpt_4o.csv
51,,41.0,"In a grand church, there is a large bar stocked with bottles of liquor. A few patrons are seated at the bar, and sunbeams stream through the stained glass windows, dramatically illuminating one of the patrons. A couple dressed in formal church attire stands at the open doors, with the husband speaking.",Just don't order a Bloody Mary.,"This is a play on the dual meaning of ""Bloody Mary"", referring to both the alcoholic drink and the ghost of Mary I. of England, a common horror/supernatural character known for persecuting Protestants","The cartoon’s gag comes from the absurd mash-up of settings: a solemn, cathedral-like church has been turned into a cocktail lounge. The husband warns, “Just don't order a Bloody Mary.” In a normal bar, a Bloody Mary is simply a vodka-tomato-juice cocktail. In a church, however, “Mary” evokes the Virgin Mary and anything described as “bloody” inside a sanctuary sounds sacrilegious. The line therefore functions as a playful etiquette tip: you might get away with ordering any drink at this bizarre church-bar, but invoking a “Bloody Mary” would cross a theological line and risk divine (or congregational) disapproval. The humor hinges on the double meaning of the drink’s name and the incongruous collision of bar culture with religious reverence.",FAIL,"The student's answer focuses on the play on words with ""Bloody Mary,"" but explains it through the lens of religious and cultural inappropriateness within the church setting rather than the dual meaning relating to Mary I of England. The student misses the anticipated historical and supernatural association with Mary I, thereby not explicitly covering the anticipated answer point.",o3,"{""tokens_in"": 163, ""tokens_out"": 240}",gpt-4o,"{""tokens_in"": 526, ""tokens_out"": 83}",20250506_185500_o3_low_exp-o3_ag-gpt_4o.csv
53,,41.0,"In a grand church, there is a large bar stocked with bottles of liquor. A few patrons are seated at the bar, and sunbeams stream through the stained glass windows, dramatically illuminating one of the patrons. A couple dressed in formal church attire stands at the open doors, with the husband speaking.",Finally—a faith-based initiative I can embrace.,"This refers to President George W. Bush's ""Faith-Based and Community Initiatives,"" a program that funds cetrain faith-based organizations","The humor hinges on the absurd mash-up of two normally separate institutions: a reverent church sanctuary and a fully stocked cocktail bar. The speaker borrows the political phrase “faith-based initiative,” usually meaning a program that channels government support through religious groups, and repurposes it to describe this boozy house of worship. He claims he can “embrace” this particular initiative—not out of piety, but because it caters to his love of alcohol. The joke is the incongruity: religious devotion is replaced by drinking, so the man’s enthusiasm reveals shallow motives while poking fun at both political jargon and opportunistic spirituality.",FAIL,"The student's answer effectively captures the key comedic element by addressing the absurd combination of a church with a bar and the use of the political phrase ""faith-based initiative"" in a humorous context. However, it does not explicitly mention President George W. Bush's ""Faith-Based and Community Initiatives"" as anticipated, focusing instead on the incongruity and irony of the scene itself.",o3,"{""tokens_in"": 165, ""tokens_out"": 141}",gpt-4o,"{""tokens_in"": 477, ""tokens_out"": 91}",20250506_185500_o3_low_exp-o3_ag-gpt_4o.csv
60,,49.0,"In a bar, the bartender is talking on a wall phone phone behind the bar. A patron sitting at the bar looks behind him at a Catholic Priest, Protestant Pastor and Jewish Rabbi all walking into the bar.",I thought I told you to stop sending me jokes at work,"The setting strongly resembles a ""walks into a bar"" joke setup","The scene literalizes the classic setup “A priest, a minister, and a rabbi walk into a bar…,” the stock opening of countless jokes. The bartender, seeing this trio actually stride in, assumes someone is deliberately foisting another corny bar joke on him during his shift. His phone complaint—“I thought I told you to stop sending me jokes at work”—treats the arrival of flesh-and-blood clergy as if they were a texted gag, blurring reality and joke-telling. The humor comes from that meta twist: the bartender is fed up with being made the unwitting straight man in yet another hackneyed joke, and the caption acknowledges the overused formula while poking fun at workplace spam and unwanted messages.",PASS,"The student's answer explicitly identifies the classic ""A priest, a minister, and a rabbi walk into a bar…"" setup as the central comedic device in the cartoon, which matches the anticipated answer point emphasizing this familiar joke structure.",o3,"{""tokens_in"": 150, ""tokens_out"": 229}",gpt-4o,"{""tokens_in"": 475, ""tokens_out"": 61}",20250506_185500_o3_low_exp-o3_ag-gpt_4o.csv
62,,49.0,"In a bar, the bartender is talking on a wall phone phone behind the bar. A patron sitting at the bar looks behind him at a Catholic Priest, Protestant Pastor and Jewish Rabbi all walking into the bar.",Stop me if you've heard this one.,This acknowledges the common joke setup of different faith leaders walking into a bar,"The classic set-up for countless bar jokes is “A priest, a minister, and a rabbi walk into a bar….” Here, that opening line has come to life: the trio is literally walking into a bar. The patron recognizes that he is witnessing the physical embodiment of a well-worn joke and quips, “Stop me if you’ve heard this one,” a phrase storytellers use when launching into an old joke. The humor comes from the self-referential twist—rather than someone telling the joke, the joke’s characters appear in reality, and the patron treats the unfolding scene itself as the familiar gag that listeners may already know.",PASS,"The student's answer explicitly covers the anticipated answer point by acknowledging the classic setup of a joke involving a priest, a minister, and a rabbi walking into a bar. The answer effectively explains the self-referential twist of the joke characters appearing in reality.",o3,"{""tokens_in"": 145, ""tokens_out"": 209}",gpt-4o,"{""tokens_in"": 449, ""tokens_out"": 67}",20250506_185500_o3_low_exp-o3_ag-gpt_4o.csv
67,,53.0,"A man-sized bug with antennae and a hairy body is sitting upright in a bed next to a woman. The woman is reading a book, while the bug is reading a newspaper with four hands visible holding the sides of the newspaper. They appear to be a couple sharing a bed, each reading their own material under the covers, with a nightstand and lamp on either side of the bed. The woman is speaking.","Well, it's another thrilling night at the Samsas’.","The woman is drawing attention to the fact that despite her partner being a monster, their lives have become mundane","The caption riffs on Kafka’s “The Metamorphosis,” whose hero, Gregor Samsa, wakes up transformed into a giant insect. By calling the bedroom scene “another thrilling night at the Samsas’,” the speaker treats that bizarre transformation as if it were perfectly routine marital life—two spouses quietly reading in bed. The humor comes from the contrast between the extraordinary (sharing a bed with a human-sized bug) and the deadpan understatement “another thrilling night,” a phrase normally used to describe dull domestic evenings. Literary reference + mundane tone = joke.",PASS,"The student's answer captures the key comedic element by discussing how the extraordinary scenario of living with a giant insect is treated as mundane. The answer effectively connects the literary reference to Kafka's ""The Metamorphosis"" with the understated tone of normalcy, aligning with the anticipated point that the couple's life is depicted as ordinary despite the partner being a monster.",o3,"{""tokens_in"": 190, ""tokens_out"": 193}",gpt-4o,"{""tokens_in"": 483, ""tokens_out"": 87}",20250506_185500_o3_low_exp-o3_ag-gpt_4o.csv
68,,53.0,"A man-sized bug with antennae and a hairy body is sitting upright in a bed next to a woman. The woman is reading a book, while the bug is reading a newspaper with four hands visible holding the sides of the newspaper. They appear to be a couple sharing a bed, each reading their own material under the covers, with a nightstand and lamp on either side of the bed. The woman is speaking.",Would your mother find chilled larvae in a light honey glaze too waspy?,"This plays on the dual meaning of ""waspy,"" which could refer to the insect or the slang ""WASP,"" meaning White Anglo-Saxon Protestant.","The cartoon sets up an everyday domestic scene—a couple in bed discussing what to serve a visiting mother­-in-law—but the couple is interspecies: the husband is a human-sized insect. The wife’s menu idea, “chilled larvae in a light honey glaze,” is presented as if it were a normal hors d’oeuvre, yet it’s made entirely from insect-related ingredients (larvae, honey). Her question, “too waspy?” delivers the punch line.  

1. Literal insect meaning: The husband looks like a wasp, so larvae and honey are quite on-brand bug cuisine. She’s asking if it’s excessively wasp-like food for his wasp mother.  
2. Social meaning: In human slang, “WASP” stands for White Anglo-Saxon Protestant, stereotypically associated with understated, genteel tastes. Hostesses sometimes worry a dish might be “too WASP-y.”  

The joke hinges on that double entendre. She’s simultaneously worrying about insect authenticity and referencing a human social cliché, treating exotic bug fare with the same mild culinary anxiety people have about impressing a prim suburban parent. The normal marital tone colliding with the absurd interspecies context and the pun on “waspy” creates the humor.",PASS,"The student's answer explicitly discusses the dual meaning of ""waspy"" by addressing both the literal insect context and the social context related to the slang ""WASP."" This coverage aligns with the anticipated answer point that centers on the pun and double entendre involved.",o3,"{""tokens_in"": 194, ""tokens_out"": 399}",gpt-4o,"{""tokens_in"": 634, ""tokens_out"": 67}",20250506_185500_o3_low_exp-o3_ag-gpt_4o.csv
71,,57.0,"Two men in a living room stand by a fireplace, above which a large, mounted fish is displayed. One man’s hand is inside the fish’s open mouth—indicating the fish is biting him. The other man stands nearby, holding a cup and looking on.","It's painful, but I couldn't stand another chorus of ‘Take Me to the River.’","This references Big Mouth Billy Bass, a classic novelty prop of a singing fish, singing ""Take Me to the River"" ","The caption imagines the wall-mounted fish as one of those novelty “singing fish” plaques that endlessly belt out the song “Take Me to the River.” Tired of hearing the chorus on repeat, the owner decides the only way to silence it is to jam his hand into the fish’s mouth—letting it bite him rather than endure the tune one more time. The humor comes from combining the familiar irritation of an overplayed musical gag with the absurd image of a taxidermy trophy suddenly animate and retaliatory. Physical pain is treated as the lesser annoyance compared to the fish’s nonstop singing, flipping normal priorities for comic effect.",PASS,"The student's answer explicitly covers the anticipated answer point by referencing the novelty ""singing fish"" plaques known for singing ""Take Me to the River,"" closely aligning with the comedic element of the caption. The student identifies the key comedic element of the annoying song and the absurdity of preferring physical pain over listening to it, which matches the anticipated answer point.",o3,"{""tokens_in"": 166, ""tokens_out"": 206}",gpt-4o,"{""tokens_in"": 478, ""tokens_out"": 88}",20250506_185500_o3_low_exp-o3_ag-gpt_4o.csv
98,,82.0,"A naked man and woman are in a lush, tropical setting resembling the biblical Garden of Eden. The man is holding a phone to his ear and looking backward at a large hand extending from a cloud, which is pointing accusatorily downward at him. The woman looks alarmed or confused as she runs alongside him through tall grass away from the hand. In the background, a snake is wrapped around a tree trunk. Rays of light shine down dramatically.",I gotta go. ‘Mr. Wonderful’ is having one of his episodes.,"By referring to God as ""Mr. Wonderful"" and calling the divine judgement an ""episode,"" Adam is characterizing God as a flawed, overly dramatic individual","The scene is the moment God catches Adam and Eve after they’ve eaten the forbidden fruit. Instead of treating it as the earth-shaking, world-altering event it is, Adam behaves like a frazzled suburban spouse on his cell phone. He refers to the Almighty—whose huge hand is thundering down from the clouds—as “Mr. Wonderful,” a sarcastic nickname people use for a partner who’s acting anything but wonderful. By adding “is having one of his episodes,” Adam further reduces divine wrath to a recurring, slightly embarrassing mood swing, the kind of domestic drama you’d complain about to a friend while ducking out of a party. The comedy comes from the stark mismatch: epic biblical judgment vs. blasé modern small talk, plus the absurdity of Adam owning a phone before technology—or even clothes—existed.",PASS,"The student's answer explicitly captures the anticipated comedic elements by discussing how Adam's behavior diminishes the gravity of divine judgment by treating it as a minor domestic issue. The student's explanation aligns with the anticipated answer point on characterizing God as ""Mr. Wonderful"" and referring to the divine drama as an ""episode,"" effectively portraying God as a flawed individual prone to dramatic episodes.",o3,"{""tokens_in"": 201, ""tokens_out"": 312}",gpt-4o,"{""tokens_in"": 560, ""tokens_out"": 89}",20250506_185500_o3_low_exp-o3_ag-gpt_4o.csv
