idx,cartoonstock_id,contest_number,description,caption,element,explanation,autograder_judgment,autograder_reasoning,explainer_model,explainer_usage,autograder_model,autograder_usage,source_file
189,,148.0,"In a police lineup room, five figures stand in a row behind a glass pane. The lineup features a mix of mythological, religious, and supernatural figures, including a robed bearded man, a devil holding a trident, a Buddha-like figure, and others dressed in elaborate or deity-like attire. In front of the glass, a woman points toward the lineup while the police officer beside her, in uniform, speaks to her","By the way, we are not allowed to show the face or image of No. 6.","In Islam, it is forbidden to depict the Prophet Muhammad","The caption turns a routine police lineup into a gag about religious image bans. By including saints, gods and demons as suspects, it absurdly treats deities like criminals. The punchline—“we are not allowed to show the face or image of No. 6”—alludes to Islamic prohibitions on depicting Muhammad. It’s funny because a police station wouldn’t normally police religious iconography, yet here the officers defer to a sacred-image taboo, blending the bureaucratic seriousness of law enforcement with the solemnity of divine image restrictions.",PASS,"The student's answer explicitly mentions the Islamic prohibition on depicting Muhammad, which is the key comedic element in the anticipated answer point. They effectively capture this by discussing the allusion to Islamic prohibitions within the context of the cartoon's police lineup.",o4-mini,"{""tokens_in"": 203, ""tokens_out"": 696}",gpt-4o,"{""tokens_in"": 481, ""tokens_out"": 64}",20250506_191022_o4-mini_high_exp-o4_mini_ag-gpt_4o.csv
194,,153.0,"In a courtroom setting, a judge speaks from behind a desk, addressing two men in suits who stand before him. One of the men appears pleased, while the other looks downcast. Behind the smiling man, a row of can-can dancers in matching costumes performs high kicks, adding a lively contrast to the formal proceedings. Several onlookers are positioned in the background, watching the scene unfold.","Overruled, counseler. This is sweeps week.","During sweeps week, networks schedule special programming to attract more viewers","The caption jokes that the judge is treating the trial like a TV show during “sweeps week,” when networks air flashy content to boost ratings. By saying “Overruled, counseler. This is sweeps week,” he dismisses any legal objection in favor of spectacle—hence the can-can dancers in court. The humor comes from the absurd blend of courtroom seriousness and television sensationalism, satirizing how ratings can trump substance.",PASS,"The student's answer captures the key comedic element by explaining that the judge is prioritizing spectacle over legal matters during ""sweeps week,"" likening the courtroom to a TV show aiming to attract viewers, which mirrors the idea of networks scheduling special programming for higher ratings.",o4-mini,"{""tokens_in"": 187, ""tokens_out"": 551}",gpt-4o,"{""tokens_in"": 449, ""tokens_out"": 69}",20250506_191022_o4-mini_high_exp-o4_mini_ag-gpt_4o.csv
195,,155.0,"In a group therapy setting, a counselor sits at the center with hands folded, leading a discussion among a circle of participants. Among them are a large, lion-like figure, a metallic individual holding an axe, a straw-stuffed figure in a floppy hat, a woman holding a small dog, and two additional participants—an adult man and woman—who appear dressed in everyday clothing. Chairs are arranged in a ring, and the background features framed art and window blinds, suggesting a typical therapy room. The counselor is speaking",And my hourly fee is six hundred dollars. You're not in Kansas anymore.,"""We're not in Kansas anymore"" is a classic line from the Wizard of Oz","The caption plays on Dorothy’s famous line (“Toto, I don’t think we’re in Kansas anymore”) by transplanting the Wizard of Oz characters—Lion, Tin Man, Scarecrow, Dorothy with Toto—into a contemporary group therapy circle. The counselor’s “six hundred dollars an hour” remark satirizes the cost and formality of modern psychotherapy while cheekily reminding Dorothy she’s far from Kansas. The humor arises from the absurd collision of a cherished 1939 movie catchphrase with today’s mental‐health industry, plus the visual gag of fairy‐tale figures earnestly spilling their feelings in a suburban counseling office.",PASS,"The student's answer explicitly references the classic line ""We're not in Kansas anymore"" by mentioning Dorothy's famous line from the Wizard of Oz, as well as placing the Wizard of Oz characters in a contemporary group therapy setting, which aligns with the anticipated answer point.",o4-mini,"{""tokens_in"": 215, ""tokens_out"": 909}",gpt-4o,"{""tokens_in"": 519, ""tokens_out"": 67}",20250506_191022_o4-mini_high_exp-o4_mini_ag-gpt_4o.csv
197,,157.0,"In a spacious interior with a wood-patterned floor, a man sits in an armchair on the left, next to a standing lamp, speaking. Nearby, another individual sits in a separate chair, crossing their legs and appearing to sip a glass of wine. Slightly to the right, a couple shares another seat, also facing forward. Instead of a typical wall, the entire background is a vast, star-filled sky scattered with planets—one ringed—lending a surreal, cosmic atmosphere to the otherwise ordinary living-room setting.",Five hundred billion galaxies and nothing’s on.,"This is a play on the common phrase ""x channels and nothing's on"" about scrolling through television a large number of channels and not finding anything of interest","The joke lies in the play on everyday TV-watching lingo applied to the cosmos. In the utilitarian living room set against an infinite starry sky, the speaker laments “nothing’s on,” as if scanning channels for programs. But with “five hundred billion galaxies” there is literally an incomprehensible expanse of worlds, yet “nothing’s on” conjures both “no broadcast” and the idea that no stellar bodies are lit or active. It’s a pun contrasting the trivial frustration of channel surfing with the mind-boggling scale of the universe, highlighting the absurdity of treating the cosmos like a household entertainment device.",PASS,"The student's answer captures the key comedic element by explaining the play on the everyday TV-watching phrase ""nothing's on"" applied to the vast cosmos, aligning with the anticipated answer point's focus on the phrase and its context.",o4-mini,"{""tokens_in"": 211, ""tokens_out"": 973}",gpt-4o,"{""tokens_in"": 530, ""tokens_out"": 61}",20250506_191022_o4-mini_high_exp-o4_mini_ag-gpt_4o.csv
200,,165.0,"In a stone-walled balcony scene, a robed king wearing a crown stands within an arched recess. In front of him, two attendants in medieval-style clothing each hold large baskets and scatter paper currency down to a crowd with outstretched arms. Two other men, also in medieval clothing, stand off to the side on the balcony, speaking to each other.",Looks like another ye olde stimulus package.,"In this time period, they would have no concept of stimulus packages","The joke hinges on calling a medieval king’s coin-tossing “another ye olde stimulus package,” merging archaic imagery with modern economic jargon. We laugh at the incongruity: instead of a bureaucratic relief bill, a monarch literally throws money from a castle balcony. The use of “ye olde” playfully mocks both the antiquated setting and the overused phrase for government bailouts, spotlighting how handing out cash to calm the populace feels timelessly theatrical, whether by kings or policymakers.",PASS,"The student's answer captures the comedic element by highlighting the incongruity of merging medieval imagery with modern economic jargon, specifically the concept of a ""stimulus package."" While not stated explicitly, the student's discussion of the incongruity and the ""timelessly theatrical"" aspect implicitly covers the anticipated answer point about the historical inconsistency with the term ""stimulus package.""",o4-mini,"{""tokens_in"": 178, ""tokens_out"": 948}",gpt-4o,"{""tokens_in"": 453, ""tokens_out"": 89}",20250506_191022_o4-mini_high_exp-o4_mini_ag-gpt_4o.csv
202,,167.0,"In a forest clearing with tall tree trunks, a man in a suit with an American flag pin stands speaking at a podium with a decorative drape on the front, speaking. Two other men in suits stand close by behind him. Various woodland animals— including a deer, a snake on the ground, a frog, a bird, and other creatures—surround the scene, peeking from behind trees or looking on.",Read my lips—no new taxidermy.,"This mirrors George H W Bush's famous ""read my lips-no new taxes""","The joke riffs on George H.W. Bush’s famous line “Read my lips—no new taxes,” swapping “taxes” for “taxidermy.” By placing a politician in a forest addressing live animals, it absurdly promises not to kill and stuff them. The pun hinges on the similar sound of “taxes” and “taxidermy,” turning a standard political pledge into a darkly comic reassurance to wildlife. It satirizes campaign rhetoric by applying it in a literal, animal-centric context.",PASS,"The student's answer captures the key comedic element by acknowledging the joke's riff on George H.W. Bush's famous line ""Read my lips—no new taxes"" and explaining how the joke substitutes ""taxes"" with ""taxidermy"" for comedic effect.",o4-mini,"{""tokens_in"": 190, ""tokens_out"": 949}",gpt-4o,"{""tokens_in"": 469, ""tokens_out"": 69}",20250506_191022_o4-mini_high_exp-o4_mini_ag-gpt_4o.csv
203,,167.0,"In a forest clearing with tall tree trunks, a man in a suit with an American flag pin stands speaking at a podium with a decorative drape on the front, speaking. Two other men in suits stand close by behind him. Various woodland animals— including a deer, a snake on the ground, a frog, a bird, and other creatures—surround the scene, peeking from behind trees or looking on.","As a weasel, I need your vote.",References the classic political tactic of pandering by claiming to be “one of you” ,"The humor hinges on the double meaning of “weasel”: both a forest creature and a sneaky, untrustworthy person—often used to criticize politicians. Placing a literal weasel at a campaign podium among woodland animals satirizes political speeches, suggesting that electing a “weasel” (in the derogatory sense) is as absurd as a wild animal seeking votes. The incongruity of formal campaigning in a forest and the pun on a sleazy candidate embodied by an actual weasel underscore the joke’s playful critique of political rhetoric and personality.",FAIL,"The student's answer focuses on the double meaning of ""weasel"" and the absurdity of the situation but does not specifically address the anticipated answer point about the political tactic of pandering by claiming to be ""one of you."" The key comedic element of the claim to be ""one of you"" as a political maneuver is not explicitly covered in the student's explanation.",o4-mini,"{""tokens_in"": 189, ""tokens_out"": 447}",gpt-4o,"{""tokens_in"": 478, ""tokens_out"": 88}",20250506_191022_o4-mini_high_exp-o4_mini_ag-gpt_4o.csv
206,,661.0,"In a whimsical scene, a woman resembling Snow White stands in a field, surrounded by seven dwarfs who are all joyfully roller-skating. The dwarfs are smiling and appear to be having a great time, while a distant castle is visible on a hill in the background. Snow White looks surprised and amused by the dwarfs' antics. Snow White is speaking.",Workplace morale hasn't been this high since we introduced whistling.,"This references the song ""whistle while you work"" from Snow White","This joke riffs on the classic Disney song “Whistle While You Work,” recasting Snow White’s seven dwarfs as office employees whose productivity (and spirits) soared after management “introduced whistling” as a corporate perk. By treating whistling—a simple, old-fashioned gesture—from a fairy tale as if it were an HR initiative, the caption humorously blends a whimsical fantasy setting with modern workplace jargon. The dwarfs’ gleeful roller-skating symbolizes boosted “morale,” and Snow White’s amused remark parodies a manager praising a trivial policy as a major motivational breakthrough.",PASS,"The student's answer explicitly covers the anticipated answer point about the reference to the song ""Whistle While You Work"" from Snow White. The student mentions the classic Disney song and its reinterpretation as part of the comedic device. This matches the key comedic element in the anticipated answer point.",o4-mini,"{""tokens_in"": 182, ""tokens_out"": 520}",gpt-4o,"{""tokens_in"": 474, ""tokens_out"": 72}",20250506_191022_o4-mini_high_exp-o4_mini_ag-gpt_4o.csv
207,,661.0,"In a whimsical scene, a woman resembling Snow White stands in a field, surrounded by seven dwarfs who are all joyfully roller-skating. The dwarfs are smiling and appear to be having a great time, while a distant castle is visible on a hill in the background. Snow White looks surprised and amused by the dwarfs' antics. Snow White is speaking.",Let’s keep Clumsy in our prayers.,"This imagines a dwarf named ""clumsy""","The joke plays on the well‐known Seven Dwarfs, each named for a personality trait, by inventing an eighth dwarf—“Clumsy”—who’s in obvious danger as they all roller‐skate. Snow White’s line, “Let’s keep Clumsy in our prayers,” riffs on the idea that a skater who’s inherently uncoordinated is bound to wipe out spectacularly. It combines the fairytale setting with a modern, slapstick scenario and a mock‐solemn plea for divine protection, highlighting the contrast between the dwarfs’ carefree fun and the one whose defining trait practically guarantees a crash.",PASS,"The student's answer explicitly mentions the invention of an eighth dwarf named ""Clumsy,"" which is the core comedic element anticipated in the answer. This aligns with the expected play on the dwarfs' names and the situation's humor.",o4-mini,"{""tokens_in"": 178, ""tokens_out"": 526}",gpt-4o,"{""tokens_in"": 473, ""tokens_out"": 61}",20250506_191022_o4-mini_high_exp-o4_mini_ag-gpt_4o.csv
209,,662.0,"A wedding ceremony is taking place, but the bride and groom are dressed as vikings, complete with animal skins, viking helmet, wrapped footwear, and one holding a spear while the other holds a sword. They stand under a decorated archway, facing a minister who is reading from a book. On the left, bridesmaids in traditional dresses hold bouquets, and on the right, groomsmen in tuxedos stand attentively. One of the bridesmaids is turned back, speaking to another bridesmaid.",It’s about time they settled down and razed a village.,Vikings are known for destroying (razing) villages,"The joke hinges on a punning twist of a familiar phrase. Instead of saying a married couple will “settle down and raise a family,” the bridesmaid quips they’ll “settle down and raze a village.” “Raze” means to destroy, evoking Viking pillaging—so the line plays on the clash between a genteel wedding sentiment and the brutal, warlike imagery of the bride and groom’s Viking costumes. The humor comes from subverting the expected domestic outcome with stereotypical Viking behavior, highlighting the absurdity of these fierce warriors at a traditional ceremony.",PASS,"The student's answer explicitly covers the anticipated answer point by discussing the pun on the phrase ""raise a family"" versus ""raze a village,"" highlighting Vikings' known behavior of destroying and pillaging, which directly connects to the anticipated point about Vikings razing villages.",o4-mini,"{""tokens_in"": 210, ""tokens_out"": 450}",gpt-4o,"{""tokens_in"": 497, ""tokens_out"": 68}",20250506_191022_o4-mini_high_exp-o4_mini_ag-gpt_4o.csv
210,,663.0,"A man and a woman stand in a kitchen, looking perplexed while holding open a pizza box on the table. Inside the box, on the center of the pizza, there is a miniature scene of two people sitting at a small table, having a meal with wine glasses. The miniature man is speaking up to the regular-sized couple. ",Remember us from your wedding cake?,Wedding cake toppers are often miniature people,"The humor hinges on a pun and absurd literalism: wedding cake “toppers” are mini figurines placed atop a cake. Here, those tiny newlyweds have been inexplicably transplanted to a pizza box, now acting as pizza “toppings.” The miniature man’s line, “Remember us from your wedding cake?” plays on their dual identity as cake toppers and pizza toppings. The silliness comes from imagining these tiny figures expecting to be recognized and served wine on a pizza, blending the wedding cliché with food-service absurdity.",PASS,"The student's answer explicitly covers the anticipated answer point by mentioning ""wedding cake toppers are mini figurines,"" indicating the key comedic element that these figures transitioned from being on a cake to being on a pizza. The answer captures the absurdity of this transition and the recognition factor that the caption plays upon.",o4-mini,"{""tokens_in"": 170, ""tokens_out"": 444}",gpt-4o,"{""tokens_in"": 447, ""tokens_out"": 77}",20250506_191022_o4-mini_high_exp-o4_mini_ag-gpt_4o.csv
212,,664.0,"In a courtroom, a judge leans forward, angrily speaking to a man dressed in a magician's outfit complete with a top hat and wand, who is seated in the witness stand. A woman stands nearby holding a document, observing the interaction. The scene is set with the American flag and another flag in the background, adding to the formal courtroom atmosphere. The judge is speaking.",When was the last time you saw either half of her?,This references the classic magic trick of sawing an assistant in half,"The humor hinges on a pun around the verb “saw.” In a courtroom, the judge’s question “When was the last time you saw either half of her?” sounds like a routine inquiry about an alibi. But because the defendant is a magician known for sawing assistants in half, the judge unwittingly evokes the stage trick: “saw” as in “sawed in half,” and “either half” refers to the two pieces. The joke arises from blending legal seriousness with a magician’s iconic illusion.",PASS,"The student's answer clearly touches on the anticipated answer point. It identifies the pun involving ""saw"" and connects it to the magician's classic trick of sawing an assistant in half. The explanation includes the idea that the humor arises from this reference to the stage trick, aligning with the anticipated comedic element.",o4-mini,"{""tokens_in"": 184, ""tokens_out"": 438}",gpt-4o,"{""tokens_in"": 462, ""tokens_out"": 77}",20250506_191022_o4-mini_high_exp-o4_mini_ag-gpt_4o.csv
219,,671.0,"Two woolly mammoths are standing in a cave. One mammoth has several tiny cavemen on its back, each holding a spear and appearing to be attacking the mammoth. The mammoth without cavemen looks at the other mammoth, who is speaking with a slight grimace. The scene is set against a backdrop of cave walls.",It didn’t really bother me until they discovered fire.,Cavemen are associated with discovering fire,"This joke anthropomorphizes a mammoth lamenting an evolutionary arms race with early humans. At first the cavemen’s spears were merely irritating, but once they “discovered fire,” they could roast him—escalating the threat. The humor lies in the mammoth’s dry, understated complaint about technological progress, as if human innovation were an everyday annoyance rather than a life-or-death development. By flipping the perspective—having the prehistoric prey critique human ingenuity—the caption satirically highlights how each new weapon makes survival that much harder, all delivered in a deadpan style.",PASS,"The student's answer captures the key element of the cavemen discovering fire, escalating the threat level to the mammoth. The explanation elaborates on the comedic perspective of the mammoth and the anthropomorphic view, aligning with the key comedic element of the caption regarding the discovery of fire by the cavemen. Thus, the essential point is explicitly covered.",o4-mini,"{""tokens_in"": 175, ""tokens_out"": 708}",gpt-4o,"{""tokens_in"": 460, ""tokens_out"": 86}",20250506_191022_o4-mini_high_exp-o4_mini_ag-gpt_4o.csv
228,,677.0,"A man, appearing to be sleepwalking with his arms extended, is heading towards a refrigerator in a kitchen. His eyes are half-closed, and he looks disheveled. On the kitchen counter, a cat with glowing eyes is sitting and staring directly at the man, emitting beams of light from its eyes that illuminate the refrigerator. The scene is surreal and humorous, with the cat seemingly guiding the sleepwalker.",Look what I dragged in.,"This is the phrase ""look what the cat dragged in"" from the cat's perspective","The humor hinges on the familiar idiom “Look what I dragged in,” usually used to greet an unexpected or disheveled guest. Here the roles are flipped: the cat, beaming light from its eyes, has literally “dragged” the sleepwalking man to the refrigerator. By having the cat utter this phrase, the caption plays on both the literal act of guiding a half-awake human and the idiomatic quip one uses when someone stumbles in looking rough. The absurdity of a cat proudly claiming credit for hauling its owner around creates the comedic twist.",PASS,"The student’s answer captures the key comedic element by explaining the play on the idiom “look what I dragged in,” which is usually used when a disheveled person appears. The student correctly notes that the humor arises from the cat’s perspective, as it seemingly guides the sleepwalking man to the fridge, effectively reversing the roles. The explanation covers the comedic twist of the phrase as expected.",o4-mini,"{""tokens_in"": 185, ""tokens_out"": 450}",gpt-4o,"{""tokens_in"": 477, ""tokens_out"": 96}",20250506_191022_o4-mini_high_exp-o4_mini_ag-gpt_4o.csv
244,,687.0,"A woman holding a wine glass stands on a rooftop in a city, delighted, looking back at a man sitting at a table with a bottle and glass. Behind them, an enormous face peers over the building, looking similar to the man. The woman is speaking with a smile.",How much did you spend at Macy’s this year?,This implies the enormous person is a balloon for the Macy's day parade,"The joke plays on the idea of a credit‐card bill “looming” over a shopper. The enormous face behind the building is a literal, absurd magnification of the husband (or bank) watching her spending. By asking “How much did you spend at Macy’s this year?” the caption turns the romantic rooftop scene into one dominated by the specter of debt, exaggerating how a big purchase can hang over a relationship like a giant, disapproving presence.",FAIL,"The student's answer focuses on the concept of looming debt and spending at Macy’s, interpreting the enormous face as a metaphor rather than a literal balloon related to the Macy’s Day Parade. The anticipated answer point specifically highlights the balloon of an enormous person for the parade, which the student's answer does not capture or include. The student's response lacks the specific connection to the Macy's Day Parade balloon, thereby omitting the crucial comedic element related to the anticipated answer.",o4-mini,"{""tokens_in"": 162, ""tokens_out"": 619}",gpt-4o,"{""tokens_in"": 430, ""tokens_out"": 106}",20250506_191022_o4-mini_high_exp-o4_mini_ag-gpt_4o.csv
246,,688.0,"At a formal gathering, a stern-looking military officer with numerous medals and a cartoonishly long, receipt-like ribbon on his uniform holds a glass of wine. A woman in a black dress, also holding a glass of wine, is leaning in and speaking to him. Other guests are mingling in the background. The officer is speaking.",I was stationed at CVS during the war on drugs.,This imagines the war on drugs as a literal war with generals over drugs at a pharmacy,"The joke hinges on wordplay and incongruity: “the war on drugs” usually means a serious military campaign against illegal narcotics, and “stationed” evokes deployment to a battlefield. But here the officer claims he was posted to CVS, a retail pharmacy (“drugs” literally), turning the lofty phrase into a mundane retail assignment. The cartoon’s absurdly long, receipt-like ribbon underscores this gag, poking fun at CVS’s famously endless checkout slips and contrasting the gravity of military honors with the triviality of working at a drugstore.",PASS,"The student's answer captures the comedic element by discussing the wordplay and incongruity of interpreting the ""war on drugs"" literally, suggesting a military assignment to a CVS pharmacy. It also highlights the absurdity of the long receipt-like ribbon, which ties into the literal interpretation of the war's setting. These elements cover the anticipated point of imagining the war on drugs as a literal military engagement over drugs at a pharmacy.",o4-mini,"{""tokens_in"": 173, ""tokens_out"": 379}",gpt-4o,"{""tokens_in"": 461, ""tokens_out"": 99}",20250506_191022_o4-mini_high_exp-o4_mini_ag-gpt_4o.csv
