idx,cartoonstock_id,contest_number,description,caption,element,explanation,autograder_judgment,autograder_reasoning,explainer_model,explainer_usage,autograder_model,autograder_usage,source_file
155,,125.0,"In a large bedroom, a couple sits at the center of an oversized bed, propped up against pillows. The woman is holding an open book, while the man sits beside her, watching TV. On either side of the couple, two men in suits sit upright, making four suited men in total, all facing the television with neutral expressions. At the foot of the bed, a piece of TV equipment with wires rests on top of the television",So this is what it's like to be a Nielsen family.,A Nielsen household participates in TV research by recording their watching habits,"The “Nielsen family” is the small group of households whose viewing habits are electronically tracked to create TV ratings. People joke that being in the sample means “the networks are watching you.”  
The cartoon takes that idea literally: instead of an unobtrusive meter, four stone-faced men in business suits (standing in for network or Nielsen executives) are actually sitting in the couple’s bed, staring at the screen with them. The caption’s line—“So this is what it's like to be a Nielsen family”—explains the scene: the speaker expected some minor gadget but discovers an absurdly intrusive entourage. The humor comes from the exaggerated, physical manifestation of something that in reality is invisible, highlighting how creepy constant surveillance would feel if taken to the extreme.",PASS,"The student's answer accurately captures the key comedic element by explaining that the cartoon literalizes and exaggerates the idea of being a Nielsen family, where viewing habits are tracked. They mention that being part of a Nielsen family involves TV rating tracking, which is the core concept of the anticipated answer point.",o3,"{""tokens_in"": 197, ""tokens_out"": 295}",gpt-4o,"{""tokens_in"": 521, ""tokens_out"": 74}",20250506_185500_o3_low_exp-o3_ag-gpt_4o.csv
163,,129.0,"In a hospital room, a patient sits upright in bed with a neutral expression, listening to a doctor who is speaking to him. Next to the doctor stands a person wearing a full deep-sea diving suit, complete with a helmet and portholes, adding an odd and surreal element to the scene. On the bed, a couple of books lie near the patient, and a coffee pot and cups sit on the bedside table.",I wanted you to meet our colon specialist before we miniaturized him.,The caption references the trope exploring the insides of a body after being miniaturized.,"The man in the absurd deep-sea diving outfit is visually jarring in a hospital room. The caption turns that incongruity into a joke by treating him as a gastroenterologist who will literally “dive” inside the patient’s colon. “Before we miniaturized him” evokes sci-fi movies like “Fantastic Voyage,” where doctors are shrunk to travel through a body. So the gag combines: 1) the ordinary anxiety of a colonoscopy, 2) the visual pun of a diver prepared for an internal “deep dive,” and 3) the ridiculous escalation that the crew will actually shrink him first. The humor comes from taking the figurative idea of a specialist exploring your insides and making it comically literal.",PASS,"The student's answer explicitly discusses the comedic element involving the idea of a specialist exploring the inside of the body after being miniaturized. They reference the deep-sea diving suit as a visual pun for diving into the patient's colon and connect it to the sci-fi trope of miniaturization for internal exploration, which aligns well with the anticipated answer point.",o3,"{""tokens_in"": 196, ""tokens_out"": 228}",gpt-4o,"{""tokens_in"": 522, ""tokens_out"": 85}",20250506_185500_o3_low_exp-o3_ag-gpt_4o.csv
165,,129.0,"In a hospital room, a patient sits upright in bed with a neutral expression, listening to a doctor who is speaking to him. Next to the doctor stands a person wearing a full deep-sea diving suit, complete with a helmet and portholes, adding an odd and surreal element to the scene. On the bed, a couple of books lie near the patient, and a coffee pot and cups sit on the bedside table.","Well, you are sixty-per-cent water.","The doctor references the well-known fact that the human body is about 60% water, connecting it to the presence of the deep-sea diver, who is symbolically associated with water.","The gag hinges on the well-known fact that the human body is roughly 60 % water. The doctor uses that statistic literally, as if the patient were a miniature ocean that requires a professional diver. The absurd presence of a full deep-sea diver beside a hospital bed visualizes this over-literal interpretation, creating incongruity between normal medical practice and underwater exploration. The caption is the doctor’s deadpan justification: since the patient is “sixty-per-cent water,” it supposedly makes sense to bring in someone equipped to work in a watery environment. The humor comes from taking a familiar scientific figure and pushing it to a ridiculous, visual extreme.",PASS,"The student's answer explicitly mentions the connection between the human body's water content (60%) and the presence of the deep-sea diver. It explains that the humor arises from taking this fact literally, leading to the presence of the diver in a hospital setting. This aligns perfectly with the anticipated answer point that highlights the link between the doctor's statement and the diver's symbolic association with water.",o3,"{""tokens_in"": 190, ""tokens_out"": 146}",gpt-4o,"{""tokens_in"": 516, ""tokens_out"": 91}",20250506_185500_o3_low_exp-o3_ag-gpt_4o.csv
174,,141.0,"Two angels stand facing each other in heaven, surrounded by a cloud-filled landscape. One angel has white, feathered wings and stands silently, listening. The other angel, with black, bat-like wings, is speaking to the white-winged angel. Both wear long white robes.",It just looked so uncool to wear a seat belt in the Batmobile.,The angel with bat wings is implied to be batman,"The scene is the classic “new arrival in Heaven explaining how he died” setup. One angel has normal white wings; the other has dark, leathery, bat-like wings—so we mentally link him to Batman. His line—“It just looked so uncool to wear a seat belt in the Batmobile”—fills in the missing story: he was presumably Batman’s passenger (maybe even Batman himself), refused to buckle up for style reasons, and was killed in a crash. The joke comes from three converging incongruities: 1) A superhero famous for high-tech caution dies from an everyday safety lapse. 2) The speaker’s bat wings visually reinforce the Batmobile reference. 3) The mundane vanity of wanting to “look cool” contrasts with the epic, heroic image of Batman—and with the ultimate consequence, standing in Heaven as proof of the bad decision.",PASS,"The student's answer explicitly mentions that the angel with dark, bat-like wings is linked to Batman and discusses how this connection to Batman is central to the humor in the caption. This aligns with the anticipated answer point.",o3,"{""tokens_in"": 167, ""tokens_out"": 320}",gpt-4o,"{""tokens_in"": 515, ""tokens_out"": 58}",20250506_185500_o3_low_exp-o3_ag-gpt_4o.csv
186,,146.0,"In an office setting, a stick figure with a simple, smiling face sits across a desk from a businessman in a suit. The businessman, holding a document, is speaking to the stick figure. A desk phone sits in the foreground, and framed artwork decorates the walls, adding to the formal atmosphere.","I'm sorry, this is Tic-Tac-Toe—applications for Hangman are down the hall.",The company must be in the business of pen-and-paper games,"The humor comes from merging a mundane office job-interview scene with two classic pad-and-paper games. The “applicant” is literally a stick-figure drawing, the kind that appears when you play Hangman. The businessman treats different paper games as separate corporate departments—this office supposedly handles Tic-Tac-Toe, while Hangman recruiting is “down the hall.” The joke is the absurd professionalism applied to simple doodle games and the misplaced stick figure: a Hangman character trying to get hired in the wrong game company. The incongruity of a drawing seeking employment and the bureaucratic tone about children’s games creates the punch line.",PASS,"The student's answer explicitly covers the anticipated answer point. It discusses the humor derived from treating pen-and-paper games as professional businesses and describes how different games are treated as separate corporate departments, which aligns with the idea that the company is in the business of pen-and-paper games.",o3,"{""tokens_in"": 176, ""tokens_out"": 208}",gpt-4o,"{""tokens_in"": 476, ""tokens_out"": 70}",20250506_185500_o3_low_exp-o3_ag-gpt_4o.csv
189,,148.0,"In a police lineup room, five figures stand in a row behind a glass pane. The lineup features a mix of mythological, religious, and supernatural figures, including a robed bearded man, a devil holding a trident, a Buddha-like figure, and others dressed in elaborate or deity-like attire. In front of the glass, a woman points toward the lineup while the police officer beside her, in uniform, speaks to her","By the way, we are not allowed to show the face or image of No. 6.","In Islam, it is forbidden to depict the Prophet Muhammad","The humor comes from mashing up two very different rules: a police lineup’s need to display every suspect clearly and certain religions’ prohibition against showing images of specific holy figures (most famously Islam’s ban on depicting the Prophet Muhammad). In the cartoon, all the other deities and supernatural beings stand in full view, but the officer casually warns the witness that “we are not allowed to show the face or image of No. 6.” The line treats a centuries-old, highly charged theological restriction as just another bureaucratic technicality—no different from advising “don’t touch the glass.” That incongruous, deadpan collision of sacred taboo with mundane police procedure creates the joke.",PASS,"The student's answer explicitly addresses the anticipated answer point by mentioning the religious prohibition against depicting certain holy figures, with specific reference to ""Islam’s ban on depicting the Prophet Muhammad."" It correctly identifies this as the source of humor by explaining how this religious restriction is presented as a mundane rule in the police lineup context.",o3,"{""tokens_in"": 203, ""tokens_out"": 214}",gpt-4o,"{""tokens_in"": 510, ""tokens_out"": 77}",20250506_185500_o3_low_exp-o3_ag-gpt_4o.csv
194,,153.0,"In a courtroom setting, a judge speaks from behind a desk, addressing two men in suits who stand before him. One of the men appears pleased, while the other looks downcast. Behind the smiling man, a row of can-can dancers in matching costumes performs high kicks, adding a lively contrast to the formal proceedings. Several onlookers are positioned in the background, watching the scene unfold.","Overruled, counseler. This is sweeps week.","During sweeps week, networks schedule special programming to attract more viewers","The humor comes from blending two worlds that normally don’t meet: the solemn decorum of a courtroom and the ratings-driven theatrics of television. “Sweeps week” is when TV networks pack shows with sensational stunts to inflate viewership numbers for advertising purposes. By having the judge say “Overruled, counselor. This is sweeps week,” the caption casts the trial as if it were a TV program desperate for ratings. The line explains why a line of high-kicking can-can dancers—an absurd, showbiz flourish—has been imported into a legal proceeding and why the judge is ignoring normal objections. The laugh arises from the incongruity of a supposedly dignified judge embracing cheap entertainment gimmicks to spice up court, implying the justice system itself is pandering for TV audiences.",PASS,"The student's answer explicitly covers the comedic element of ""sweeps week"" being associated with television networks scheduling special programming to boost viewership. The student explains that the courtroom is juxtaposed with TV ratings-driven theatrics, including the can-can dancers, as if the trial were striving for TV ratings. This captures the essence of ""sweeps week"" as a period focused on attracting viewers.",o3,"{""tokens_in"": 187, ""tokens_out"": 240}",gpt-4o,"{""tokens_in"": 519, ""tokens_out"": 95}",20250506_185500_o3_low_exp-o3_ag-gpt_4o.csv
195,,155.0,"In a group therapy setting, a counselor sits at the center with hands folded, leading a discussion among a circle of participants. Among them are a large, lion-like figure, a metallic individual holding an axe, a straw-stuffed figure in a floppy hat, a woman holding a small dog, and two additional participants—an adult man and woman—who appear dressed in everyday clothing. Chairs are arranged in a ring, and the background features framed art and window blinds, suggesting a typical therapy room. The counselor is speaking",And my hourly fee is six hundred dollars. You're not in Kansas anymore.,"""We're not in Kansas anymore"" is a classic line from the Wizard of Oz","The therapy group consists of the Wizard-of-Oz foursome—Cowardly Lion, Tin Man, Scarecrow, Dorothy with Toto—plus two ordinary people. The caption hijacks Dorothy’s famous movie line “Toto, I’ve a feeling we’re not in Kansas anymore,” which signals that they’ve left the safe, homespun Midwest for a strange world. The therapist replaces “Toto” with his rate: “My hourly fee is six hundred dollars,” then adds “You’re not in Kansas anymore.” The humor comes from equating the shock of landing in the fantastical land of Oz with the sticker shock of urban psychotherapy prices: the characters may have expected small-town affordability, but in this big-city office the costs are as unreal as Oz itself. It’s a mash-up of pop-culture quote and mundane modern expense.",PASS,"The student's answer explicitly identifies the famous line from ""The Wizard of Oz"" and explains its usage as a reference in the caption, thereby capturing the anticipated answer point.",o3,"{""tokens_in"": 215, ""tokens_out"": 251}",gpt-4o,"{""tokens_in"": 560, ""tokens_out"": 49}",20250506_185500_o3_low_exp-o3_ag-gpt_4o.csv
197,,157.0,"In a spacious interior with a wood-patterned floor, a man sits in an armchair on the left, next to a standing lamp, speaking. Nearby, another individual sits in a separate chair, crossing their legs and appearing to sip a glass of wine. Slightly to the right, a couple shares another seat, also facing forward. Instead of a typical wall, the entire background is a vast, star-filled sky scattered with planets—one ringed—lending a surreal, cosmic atmosphere to the otherwise ordinary living-room setting.",Five hundred billion galaxies and nothing’s on.,"This is a play on the common phrase ""x channels and nothing's on"" about scrolling through television a large number of channels and not finding anything of interest","The line riffs on the familiar complaint “Five hundred channels and nothing’s on,” said by people flipping through cable TV. Here, the “channels” are magnified to “five-hundred billion galaxies,” matching the living room’s wall that has become the entire universe. Even with an infinite cosmic spectacle literally in front of them, the sitter is still jaded and unentertained, treating the grandeur of the universe like boring TV programming. The joke is the mismatch between the awe-inspiring setting and the blasé, couch-potato attitude.",PASS,"The student's answer captures the key comedic element by referencing the familiar complaint about multiple TV channels with nothing to watch, and it connects this idea to the cosmic imagery in the cartoon. The student explains the humor in the mismatch between the grand universe depicted and the mundane attitude of the character, aligning with the anticipated answer point.",o3,"{""tokens_in"": 211, ""tokens_out"": 125}",gpt-4o,"{""tokens_in"": 511, ""tokens_out"": 79}",20250506_185500_o3_low_exp-o3_ag-gpt_4o.csv
200,,165.0,"In a stone-walled balcony scene, a robed king wearing a crown stands within an arched recess. In front of him, two attendants in medieval-style clothing each hold large baskets and scatter paper currency down to a crowd with outstretched arms. Two other men, also in medieval clothing, stand off to the side on the balcony, speaking to each other.",Looks like another ye olde stimulus package.,"In this time period, they would have no concept of stimulus packages","The scene shows a medieval king literally tossing money to the populace, yet the caption borrows the modern political-economic term “stimulus package”—government cash injections meant to boost the economy. Calling it “ye olde stimulus package” mashes together archaic phrasing (“ye olde,” the mock-Middle English seen on faux-medieval shop signs) with contemporary policy jargon. The humor lies in the anachronism: a feudal monarch practicing a 21st-century fiscal tactic, and courtiers describing it in today’s wonky language while pretending it’s been done since ancient times. The incongruous blend of eras and vocabulary creates the joke.",PASS,"The student's answer captures the key comedic element, which is the anachronism of a medieval king using a modern-day concept like a stimulus package. The student describes how the caption humorously blends archaic language with contemporary economic policy, noting the absurdity of a historical context applying modern fiscal tactics. Thus, the student explicitly covers the anticipated answer point of the incongruity of eras with no need to explicitly state they had no concept of stimulus packages in that era.",o3,"{""tokens_in"": 178, ""tokens_out"": 149}",gpt-4o,"{""tokens_in"": 483, ""tokens_out"": 110}",20250506_185500_o3_low_exp-o3_ag-gpt_4o.csv
202,,167.0,"In a forest clearing with tall tree trunks, a man in a suit with an American flag pin stands speaking at a podium with a decorative drape on the front, speaking. Two other men in suits stand close by behind him. Various woodland animals— including a deer, a snake on the ground, a frog, a bird, and other creatures—surround the scene, peeking from behind trees or looking on.",Read my lips—no new taxidermy.,"This mirrors George H W Bush's famous ""read my lips-no new taxes""","The caption spoofs George H. W. Bush’s famous 1988 campaign promise, “Read my lips—no new taxes.” By swapping “taxes” for “taxidermy,” the speaker (a politician at a podium) is addressing woodland animals instead of voters, assuring them he won’t have them killed and stuffed. The humor comes from:  
1) the recognizable political catchphrase, twisted by a single word;  
2) the incongruity of a suited politician giving a stump speech to forest creatures;  
3) the word “taxidermy,” which directly concerns the animals’ survival, making the pledge absurdly literal for the audience. The gag hinges on the pun and the notion that wildlife cares about legislative promises the way human constituents do.",PASS,"The student's answer explicitly discusses the spoof of George H. W. Bush's famous campaign promise by pointing out the substitution of ""taxes"" with ""taxidermy,"" effectively capturing the key comedic element of the caption. The identification of the political catchphrase and its twist aligns with the anticipated answer point.",o3,"{""tokens_in"": 190, ""tokens_out"": 235}",gpt-4o,"{""tokens_in"": 521, ""tokens_out"": 78}",20250506_185500_o3_low_exp-o3_ag-gpt_4o.csv
203,,167.0,"In a forest clearing with tall tree trunks, a man in a suit with an American flag pin stands speaking at a podium with a decorative drape on the front, speaking. Two other men in suits stand close by behind him. Various woodland animals— including a deer, a snake on the ground, a frog, a bird, and other creatures—surround the scene, peeking from behind trees or looking on.","As a weasel, I need your vote.",References the classic political tactic of pandering by claiming to be “one of you” ,"Calling someone a “weasel” is a common insult for a sneaky, untrustworthy person—exactly the stereotype often applied to politicians. In the cartoon the suited speaker is holding a stump-speech-style rally, but his audience is literally forest animals. By opening with “As a weasel, I need your vote,” he both admits and embraces the slur: he’s figuratively a political weasel and, in this woodland setting, might actually be one of the animals campaigning for office. The humor comes from the collision of two worlds: human electoral rhetoric placed in a wilderness town-hall, and the joke that politicians are shameless enough to straight-up identify themselves as the very creature people accuse them of being. The absurdity of animals having a democratic election, plus the self-owning honesty of the “weasel” politician, deliver the punch line.",FAIL,"The student's answer does not explicitly cover the anticipated answer point about the classic political tactic of pandering by claiming to be “one of you.” Instead, the student focuses on the humorous aspects of the setting and the metaphorical and literal interpretation of “weasel” in politics. While the answer is comprehensive, it misses the specific comedic element of pandering by claiming kinship with the audience.",o3,"{""tokens_in"": 189, ""tokens_out"": 255}",gpt-4o,"{""tokens_in"": 541, ""tokens_out"": 94}",20250506_185500_o3_low_exp-o3_ag-gpt_4o.csv
206,,661.0,"In a whimsical scene, a woman resembling Snow White stands in a field, surrounded by seven dwarfs who are all joyfully roller-skating. The dwarfs are smiling and appear to be having a great time, while a distant castle is visible on a hill in the background. Snow White looks surprised and amused by the dwarfs' antics. Snow White is speaking.",Workplace morale hasn't been this high since we introduced whistling.,"This references the song ""whistle while you work"" from Snow White","In Snow White, the dwarfs are miners who famously cheer themselves with the song “Whistle While You Work.” The caption treats their fairy-tale cottage as if it were a modern workplace, with Snow White evaluating “morale” like a corporate manager. She notes that the dwarfs haven’t been this happy since they started whistling—an allusion to the original song—implying that today’s new “program” is giving them roller skates. The humor comes from (1) the corporate-speak applied to storybook characters, and (2) the escalation from simple whistling to something absurdly giddy: seven miners zooming around on skates. The clash between HR jargon and fairy-tale whimsy delivers the joke.",PASS,"The student's answer explicitly mentions the song “Whistle While You Work” and relates it to the context of the fairy tale and the workplace analogy, which directly covers the anticipated reference to the song ""whistle while you work"" from Snow White.",o3,"{""tokens_in"": 182, ""tokens_out"": 234}",gpt-4o,"{""tokens_in"": 509, ""tokens_out"": 65}",20250506_185500_o3_low_exp-o3_ag-gpt_4o.csv
207,,661.0,"In a whimsical scene, a woman resembling Snow White stands in a field, surrounded by seven dwarfs who are all joyfully roller-skating. The dwarfs are smiling and appear to be having a great time, while a distant castle is visible on a hill in the background. Snow White looks surprised and amused by the dwarfs' antics. Snow White is speaking.",Let’s keep Clumsy in our prayers.,"This imagines a dwarf named ""clumsy""","The famous seven dwarfs are Doc, Grumpy, Happy, Sleepy, Bashful, Sneezy, and Dopey—no “Clumsy.” By jokingly adding a dwarf named Clumsy just as the others zoom around on roller-skates, Snow White predicts an inevitable wipe-out. Her mock-pious “Let’s keep Clumsy in our prayers” treats the certain crash as if it were a solemn church request, contrasting earnest concern with the silly fairy-tale scene and the made-up dwarf. The humor comes from (1) inventing a dwarf whose defining trait makes him the obvious skating casualty and (2) wrapping that foregone slapstick disaster in polite, exaggerated sympathy.",PASS,"The student's answer explicitly discusses the creation of an imaginary dwarf named ""Clumsy,"" noting how this character's introduction plays into the humor of the situation. This aligns with the anticipated answer point, which identifies the comedic element as the imagining of a dwarf named ""Clumsy.""",o3,"{""tokens_in"": 178, ""tokens_out"": 221}",gpt-4o,"{""tokens_in"": 486, ""tokens_out"": 70}",20250506_185500_o3_low_exp-o3_ag-gpt_4o.csv
