idx,cartoonstock_id,contest_number,description,caption,element,explanation,autograder_judgment,autograder_reasoning,explainer_model,explainer_usage,autograder_model,autograder_usage,source_file
343,,102.0,"In an outdoor setting, two dogs are sitting on the grass, watching as another dog, standing upright like a human, throws a stick into the distance. The upright dog appears to mimic the typical action of a person playing fetch with dogs. The seated dogs look confused or uncertain.",He's his own best friend.,"Because the dog is acting like a human, he can be both sides of the ""man's best friend"" phrase","The punch line twists the cliché “A dog is man’s best friend.”  In the drawing one dog has taken over the “man” role, standing upright and tossing a stick the way a human would during a game of fetch.  That leaves him simultaneously in both parts of the familiar pairing—he is the thrower (the “man”) and the fetcher (the “dog”).  So, instead of being “man’s best friend,” he’s literally “his own best friend.”  The caption highlights this absurd self-sufficiency, while the two normal dogs’ puzzled looks underscore how odd it is for a dog to supply both halves of the relationship.",PASS,"The student's answer effectively captures the anticipated answer point. It highlights the comedic twist of the dog fulfilling both the ""man"" and ""dog"" roles from the cliché ""man's best friend,"" and explains the absurdity and humor when he becomes ""his own best friend."" The response aligns with the specific emphasis on the dog's dual role as both human and dog.",o3,"{""tokens_in"": 0, ""tokens_out"": 0}",gpt-4o,"{""tokens_in"": 473, ""tokens_out"": 87}",20250506_180913_o3_high_exp-o3_ag-gpt_4o.csv
348,,108.0,"A caveman is sweeping inside his garage-like wooden structure with a shop-like display, while two others stand inside a rock cave, speaking to each other. Volcanic activity in the background emphasizes the prehistoric setting",He's always thinking outside the rock.,He is literally outside of the rock,"The humor hinges on a prehistoric twist on the modern cliché “thinking outside the box,” shorthand for creative, unconventional thinking. Cavemen would literally live inside rock caves, so substituting “box” with “rock” grounds the phrase in their Stone-Age world. Visually, the inventive caveman has already departed from the standard cave: he’s built (or moved into) a separate wooden, garage-like shop and is tidying it with a broom—another anachronistic sign of forward thinking. The onlookers inside the cave remark that “He’s always thinking outside the rock,” combining pun and situational irony: they still inhabit literal rock walls while admiring a peer whose creativity is both figurative (original ideas) and literal (moving outside rock dwellings). The mash-up of modern business jargon with prehistoric imagery produces the comic effect.",PASS,"The student's answer directly addresses the phrase ""thinking outside the box"" by explaining its adaptation to the prehistoric context as ""thinking outside the rock."" This explicitly captures the key comedic concept of the caveman being literally outside of the rock (cave) and the situational irony that forms the basis of the winning caption's humor.",o3,"{""tokens_in"": 0, ""tokens_out"": 0}",gpt-4o,"{""tokens_in"": 483, ""tokens_out"": 81}",20250506_180913_o3_high_exp-o3_ag-gpt_4o.csv
376,,128.0,"In a cozy living room, a man and a woman lounge comfortably in armchairs, separated by a small table with a lamp and a coffee mug on it. The man is reading a newspaper, while the woman is reclining with her legs draped over the armrest, reading a book. Behind them looms their enormous dog, so large that it takes up nearly the entire room, its massive head resting on the back of the woman’s chair. The woman is speaking with a concerned look","Well, what did you think a labrapotamus was?","This suggests their pet is a hybrid between a dog and a hippo, explaining the large size","The humor hinges on a pun that justifies the dog’s absurd size. The cartoon shows what’s clearly supposed to be a pet dog, but it’s hippopotamus-sized, filling the entire living room. The woman’s line, “Well, what did you think a labrapotamus was?” fuses “Labrador” with “hippopotamus,” inventing a breed name that literally predicts a gigantic, half-hippo dog. She’s chiding her partner for acting surprised: the outrageous proportions match the outlandish hybrid name. The joke is the mismatch between normal expectations for a household “Lab” and the comically literal result of crossing it with one of the biggest land animals imaginable.",PASS,"The student's answer clearly captures the anticipated answer point by explaining the humor derived from the idea of a ""labrapotamus"" being a hybrid between a Labrador and a hippopotamus, which justifies the dog's enormous size. The student discusses how this fusion of species explains the absurd size of the pet. Thus, the crucial comedic element of the hybrid nature is explicitly covered.",o3,"{""tokens_in"": 0, ""tokens_out"": 0}",gpt-4o,"{""tokens_in"": 530, ""tokens_out"": 91}",20250506_180913_o3_high_exp-o3_ag-gpt_4o.csv
381,,130.0,"Outside a snow-covered house, a large snowman stands with human arms sticking out of its body, wearing a top hat and sporting a carrot nose. Inside the house, two women are smiling as they look out the window at the unusual snowman.",It's mostly water weight.,"The snowman is literally mostly water, as it's made of snow","The stock excuse “It’s mostly water weight” is what people say when they want to write off extra pounds as temporary bloat rather than real fat. Here, the speaker is referring to the gigantic “body” of the snowman—which is quite literally water in frozen form. Because human arms stick out of the snowy torso, we infer a person is buried inside the snowman; the snow has made that person suddenly huge. Describing this comically swollen, all-snow figure as “mostly water weight” applies the dieting cliché in an absurdly literal way. The joke hinges on the double meaning: in dieting talk, “water weight” is a flimsy justification, but for a snowman it’s precisely correct, since snow is just water. The collision of a familiar human excuse with an outlandish, impossible scene produces the humor.",PASS,"The student's answer explicitly captures the anticipated answer point by explaining that the snowman is made of snow, which is frozen water, and applies the phrase ""It's mostly water weight"" literally. This aligns with the anticipated point of the snowman being literally mostly water because it's made of snow.",o3,"{""tokens_in"": 0, ""tokens_out"": 0}",gpt-4o,"{""tokens_in"": 493, ""tokens_out"": 73}",20250506_180913_o3_high_exp-o3_ag-gpt_4o.csv
390,,146.0,"In an office setting, a stick figure with a simple, smiling face sits across a desk from a businessman in a suit. The businessman, holding a document, is speaking to the stick figure. A desk phone sits in the foreground, and framed artwork decorates the walls, adding to the formal atmosphere.","I'm sorry, this is Tic-Tac-Toe—applications for Hangman are down the hall.",This stick figure is applying to be the character in hangman,"The businessman acts like a hiring manager for paper-and-pencil games. The visitor is a stick figure—the very drawing that gradually appears in the word-guessing game Hangman—so he’s clearly in the wrong place. The office the businessman represents handles “Tic-Tac-Toe,” a different kids’ doodle game made of X’s and O’s, so he redirects the applicant “down the hall” to the proper department. The laugh comes from treating rudimentary notebook games as formal businesses with separate HR offices, and from the visual pun: a stick figure (Hangman) sitting where an X or O (Tic-Tac-Toe) should be. Absurd bureaucratic formality applied to childish sketches creates the humor.",PASS,The student's answer captures the key comedic element by explaining that the stick figure represents the drawing from the Hangman game and is incorrectly applying at the office for Tic-Tac-Toe. This directly aligns with the anticipated answer point of the stick figure applying to be the character in Hangman.,o3,"{""tokens_in"": 0, ""tokens_out"": 0}",gpt-4o,"{""tokens_in"": 496, ""tokens_out"": 73}",20250506_180913_o3_high_exp-o3_ag-gpt_4o.csv
393,,151.0,"In an office setting, two men sit facing each other across a large desk. The man behind the desk is speaking, while the other listens. On the desk, an enormous pencil sharpener towers over both men, its handle prominently visible. Next to it, a massive container holds oversized pencils standing upright, further dominating the scene. The room appears otherwise normal, with a closed door in the background.",How many accountants does it take to sharpen a pencil?’ you ask? In this case five.,"""How many __ does it take to __ "" is a common joke setup","The caption riffs on the classic set-up “How many ­­­X does it take to change a light bulb?” but substitutes “accountants” and “sharpen a pencil.” Normally one accountant with a pocket sharpener would suffice, so the line sounds absurd—until the drawing is considered. The cartoon shows a gargantuan desktop sharpener and equally huge pencils. Because the equipment is comically oversized, operating it would indeed be a multi-person, almost industrial job. The punch line “In this case five” answers the mock question by treating the visual exaggeration literally: it really would take a crew of accountants to crank the handle, feed the pencil, steady the machine, etc. The humor comes from combining a familiar joke formula with the sight gag of outsized office tools, making the improbable answer suddenly make sense.",PASS,"The student's answer effectively captures the key comedic element of the ""How many __ does it take to __"" joke setup by explaining how the question is a play on a familiar joke formula. They also discuss how this setup is humorously applied in the context of the oversized objects in the cartoon, fulfilling the requirement of the anticipated answer point.",o3,"{""tokens_in"": 0, ""tokens_out"": 0}",gpt-4o,"{""tokens_in"": 535, ""tokens_out"": 83}",20250506_180913_o3_high_exp-o3_ag-gpt_4o.csv
395,,151.0,"In an office setting, two men sit facing each other across a large desk. The man behind the desk is speaking, while the other listens. On the desk, an enormous pencil sharpener towers over both men, its handle prominently visible. Next to it, a massive container holds oversized pencils standing upright, further dominating the scene. The room appears otherwise normal, with a closed door in the background.",Let's continue this discussion over a hot barrel of coffee.,"He replaces ""cup"" of coffee with the much larger ""barrel""","The laugh comes from exaggerated scale. In the scene, everyday desk items—the pencil sharpener and pencils—are absurdly gigantic. The speaking executive treats this as normal office equipment. His line riffs on that same outsized scale: instead of the clichéd “Let’s continue this over a cup of coffee,” he proposes a “hot barrel of coffee,” escalating the size of the beverage to match the over-blown stationery. The caption shows the character unblinkingly embracing the ridiculous proportions, and the incongruity between normal office talk and comically huge objects delivers the joke.",PASS,"The student's answer explicitly addresses the ""anticipated answer point"" by explaining how the line ""hot barrel of coffee"" escalates the size from a typical ""cup"" to a much larger ""barrel,"" which matches the exaggerated scale of the other objects in the cartoon. This captures the key comedic element of replacing ""cup"" with ""barrel"" to contribute to the humor of the scene, adhering to the anticipated point.",o3,"{""tokens_in"": 0, ""tokens_out"": 0}",gpt-4o,"{""tokens_in"": 475, ""tokens_out"": 100}",20250506_180913_o3_high_exp-o3_ag-gpt_4o.csv
398,,155.0,"In a group therapy setting, a counselor sits at the center with hands folded, leading a discussion among a circle of participants. Among them are a large, lion-like figure, a metallic individual holding an axe, a straw-stuffed figure in a floppy hat, a woman holding a small dog, and two additional participants—an adult man and woman—who appear dressed in everyday clothing. Chairs are arranged in a ring, and the background features framed art and window blinds, suggesting a typical therapy room. The counselor is speaking",And my hourly fee is six hundred dollars. You're not in Kansas anymore.,"The phrase ""we're not in Kansas anymore"" is often used to mean that things aren't as they used to be, in this case referring to the counselor's charge.","The therapy-group members are the Wizard of Oz quartet: Cowardly Lion, Tin Man, Scarecrow and Dorothy with Toto. Dorothy’s famous movie line after landing in Oz is “Toto, I’ve a feeling we’re not in Kansas anymore.” The therapist adopts that line to announce his Manhattan-sized hourly rate: “My hourly fee is six hundred dollars. You’re not in Kansas anymore.” The humor comes from mashing together two realms: 1) the pop-culture fantasy world of Oz, associated with wholesome Midwestern Kansas simplicity, and 2) the real-world stereotype of eye-watering New York therapy costs. By hijacking Dorothy’s line, the counselor signals that the group has left the inexpensive comforts of home and entered an expensive urban reality, turning a cherished cinematic quote into a blunt billing notice. The joke rests on the incongruity of fairy-tale characters seeking modern psychotherapy and the playful twist on a line every viewer already knows.",PASS,"The student's answer explicitly discusses the counselor's use of Dorothy's famous line to highlight the difference between Kansas (symbolizing simplicity) and the new, costly reality of the therapy session. It captures the comedic element of the line being used to refer to the high fee, matching the humorous twist on the original quote.",o3,"{""tokens_in"": 0, ""tokens_out"": 0}",gpt-4o,"{""tokens_in"": 601, ""tokens_out"": 78}",20250506_180913_o3_high_exp-o3_ag-gpt_4o.csv
403,,167.0,"In a forest clearing with tall tree trunks, a man in a suit with an American flag pin stands speaking at a podium with a decorative drape on the front, speaking. Two other men in suits stand close by behind him. Various woodland animals— including a deer, a snake on the ground, a frog, a bird, and other creatures—surround the scene, peeking from behind trees or looking on.","As a weasel, I need your vote.",This references the common insult of calling politicians weasels.,"The scene mimics a campaign rally, but the “voters” are woodland animals. Politicians are often derided as “weasels”—slick, untrustworthy operators. The human candidate leans into that insult and literally introduces himself as a weasel while asking the animals for their votes, as though species solidarity should win them over. The laugh comes from 1) the blunt, shameless admission of a trait politicians usually deny, and 2) the absurdity of a suited man treating the forest’s creatures as a normal constituency.",PASS,"The student's answer captures the anticipated answer point by explaining that the human candidate is embracing the common insult used against politicians by introducing himself as a weasel. This directly relates to the comedic element of the joke, which plays on the stereotype of politicians being untrustworthy, much like weasels.",o3,"{""tokens_in"": 0, ""tokens_out"": 0}",gpt-4o,"{""tokens_in"": 470, ""tokens_out"": 75}",20250506_180913_o3_high_exp-o3_ag-gpt_4o.csv
403,,167.0,"In a forest clearing with tall tree trunks, a man in a suit with an American flag pin stands speaking at a podium with a decorative drape on the front, speaking. Two other men in suits stand close by behind him. Various woodland animals— including a deer, a snake on the ground, a frog, a bird, and other creatures—surround the scene, peeking from behind trees or looking on.","As a weasel, I need your vote.","Uses the word “weasel” both literally (as an animal) and as the common pejorative for politicians, creating a pun.","The scene already looks like a stump speech—literally on a forest “stump.” The caption has the politician announce, “As a weasel, I need your vote.” Calling a politician a “weasel” is a common insult for someone slippery or untrustworthy. The joke combines that figurative slur with a literal forest setting where actual animals are the electorate. By self-identifying as a weasel, the speaker both flatters the animal audience (“I’m one of you”) and unwittingly confirms the popular suspicion that politicians are weaselly. The humor comes from the double meaning and the absurd image of a campaigning politician pandering to woodland creatures.",PASS,"The student's answer discusses the dual meaning of the word ""weasel"" both as a literal animal and as a figurative slur for an untrustworthy politician. This aligns with the anticipated answer point, which focuses on the pun derived from the double meaning. The student further elaborates on the comedic effect of the politician self-identifying as a weasel and campaigning to animals, which is consistent with the humor identified in the anticipated answer point.",o3,"{""tokens_in"": 0, ""tokens_out"": 0}",gpt-4o,"{""tokens_in"": 511, ""tokens_out"": 105}",20250506_180913_o3_high_exp-o3_ag-gpt_4o.csv
404,,660.0,"A doctor, wearing a lab coat and stethoscope, is reading from a clipboard while standing next to a patient who is dressed as a king, complete with a crown and a fur-lined robe. The king is sitting on an examination table, looking up at the doctor. The setting appears to be a typical doctor's office. The doctor is speaking.",Worse than a cold. It's a common cold.,"In this context, ""common"" is good news, but it's presented as bad news","The gag hinges on the double meaning of “common.” Medically, a “common cold” is the mildest, least worrisome diagnosis. Socially, “common” is the exact opposite of what a king wants to be—he’s anything but common. The doctor tells the royal patient that what’s “worse than a cold” is that it’s a “common cold.” For an ordinary person that statement would be nonsense—the common cold is not worse, it’s trivial. But for this king the humiliation of being called “common” outweighs the illness itself, so, in his worldview, the doctor’s ranking actually makes sense. The joke plays on the clash between medical terminology and aristocratic vanity, using the pun on “common” to flip expectations.",PASS,"The student's answer clearly captures the anticipated comedic element by explaining the pun on the word ""common"" and how it plays on the king's aristocratic vanity versus the medical terminology. It explicitly notes that a ""common cold"" medically isn't severe but humorously represents bad news for the king because of the ""common"" aspect he would find humiliating. Thus, the student has addressed the crucial element of the joke.",o3,"{""tokens_in"": 0, ""tokens_out"": 0}",gpt-4o,"{""tokens_in"": 507, ""tokens_out"": 98}",20250506_180913_o3_high_exp-o3_ag-gpt_4o.csv
408,,662.0,"A wedding ceremony is taking place, but the bride and groom are dressed as vikings, complete with animal skins, viking helmet, wrapped footwear, and one holding a spear while the other holds a sword. They stand under a decorated archway, facing a minister who is reading from a book. On the left, bridesmaids in traditional dresses hold bouquets, and on the right, groomsmen in tuxedos stand attentively. One of the bridesmaids is turned back, speaking to another bridesmaid.",It’s about time they settled down and razed a village.,"This is a pun, specifically, replacing the word ""raise"" with the word “raze""","The bridesmaid borrows a stock phrase about newlyweds—“It’s about time they settled down and raised a family”—but replaces “raised a family” with the homophone “razed a village.” The swap suits the couple’s full Viking regalia, evoking the stereotype that Vikings “raze” (burn and loot) coastal villages. The joke hinges on the collision of two incompatible life milestones: the domestic calm implied by “settling down” and the violent marauding associated with Vikings. The verbal pun plus the visual incongruity of a Viking wedding in a modern ceremony creates the humor.",PASS,"The student's answer captures the key comedic element of the pun by describing the replacement of ""raised"" with ""razed,"" recognizing it as a homophone switch. This addresses the anticipated answer point about the wordplay involved.",o3,"{""tokens_in"": 0, ""tokens_out"": 0}",gpt-4o,"{""tokens_in"": 512, ""tokens_out"": 60}",20250506_180913_o3_high_exp-o3_ag-gpt_4o.csv
417,,675.0,"At a crowded party, a deep-sea diver and an astronaut, both in full gear covering their bodies and heads, stand holding drinks. A woman with a drink in hand is playfully tapping the astronaut's backpack. The other partygoers in the background are engaged in conversation, creating a lively atmosphere. The woman is speaking.",Didn’t I say you wouldn’t be the only one wearing a suit?,"Instead of formal ""suits,"" they are in heavy-duty protective suits",The astronaut presumably worried about looking ridiculous if he showed up in full space gear. The woman reminds him she did say he wouldn’t be “the only one wearing a suit.” In everyday party talk that promise would mean “You won’t be the only guy in a business suit.” But the cartoon literalizes the word: “suit” refers to head-to-toe protective rigs—his space suit and the diver’s wet-suit/helmet. So technically she was truthful: someone else is likewise encased in a weird suit. The joke hinges on the double meaning of “suit”—formal attire vs. specialized life-support outfit—and on the absurdity of treating these bulky costumes as normal party wear.,PASS,"The student's answer captures the key comedic element by explaining the dual meaning of ""suit"" and noting the literal interpretation that applies to the astronaut and deep-sea diver. This aligns with the anticipated answer point about the use of heavy-duty protective suits rather than formal suits.",o3,"{""tokens_in"": 0, ""tokens_out"": 0}",gpt-4o,"{""tokens_in"": 492, ""tokens_out"": 70}",20250506_180913_o3_high_exp-o3_ag-gpt_4o.csv
427,,687.0,"A woman holding a wine glass stands on a rooftop in a city, delighted, looking back at a man sitting at a table with a bottle and glass. Behind them, an enormous face peers over the building, looking similar to the man. The woman is speaking with a smile.","It’s a perfect likeness, George. Right down to the hot air.","She's implying the face is a giant balloon, hence the hot air","The huge head rising behind the couple is presumably a tethered hot-air balloon made to look like George. The woman praises the accuracy of the portrait: “It’s a perfect likeness, George.” Her follow-up line, “Right down to the hot air,” carries a double meaning. Literally, a hot-air balloon is filled with heated air, so the replica truly does contain “hot air.” Figuratively, “hot air” describes someone who is pompous or full of empty talk. By saying the likeness captures even that quality, she slyly insults George, implying he’s full of bluster. The humor comes from this pun—linking the physical substance that makes the balloon float with an unflattering personality trait—wrapped in what sounds like a polite compliment.",PASS,The student's answer explicitly covers the anticipated answer point by identifying the giant face as a tethered hot-air balloon and explaining the double meaning involving both the literal hot air in the balloon and the figurative implication that George is full of hot air. This aligns directly with the comedic device highlighted in the anticipated answer point.,o3,"{""tokens_in"": 0, ""tokens_out"": 0}",gpt-4o,"{""tokens_in"": 493, ""tokens_out"": 78}",20250506_180913_o3_high_exp-o3_ag-gpt_4o.csv
