idx,cartoonstock_id,contest_number,description,caption,element,explanation,autograder_judgment,autograder_reasoning,explainer_model,explainer_usage,autograder_model,autograder_usage,source_file
3,,2.0,"A group of adults dressed in business attire are seated around a table in a meeting. However, the scene is inside of a bus or subway car, with handles and windows. The person at the head of the table is speaking.","Frank called to say he'll be late, he's stuck at the office.",This is specifically a wordplay reversing the more common phrase “being late to the office while stuck in transit”.,"The humor in this caption stems from a clever role reversal that subverts our expectations about work and commuting. Normally, someone would call to say they're late to the office because they're stuck on public transportation. Here, that dynamic is flipped: the meeting is taking place ON public transportation, while Frank is ironically delayed because he's at the traditional office.

The joke works by establishing that for this group, the bus/subway has become their standard meeting venue, not an exceptional circumstance. It playfully comments on the evolution of modern workspaces and the blurring of boundaries between commute time and work time, taking it to an absurd extreme.

The caption creates a humorous incongruity - being ""stuck at the office"" is presented as the unusual situation preventing attendance at what appears to be a perfectly normal meeting venue (public transit). This reversal of the typical excuse highlights the absurdity of the scene while feeling surprisingly plausible in our increasingly mobile work culture.",PASS,"The student's answer captures the key comedic element of role reversal, subverting expectations about work and commuting. The explanation and interpretation align with the anticipated answer point regarding the reversal of the common phrase about being late due to transit.",claude-3-7-sonnet-latest,"{""tokens_in"": 195, ""tokens_out"": 535}",gpt-4o,"{""tokens_in"": 523, ""tokens_out"": 61}",20250416_204832_claude_thinking_budget_4096_exp-claude_3_7_sonnet_latest_ag-gpt_4o.csv
8,,7.0,"In a bedroom, a couple is in bed. The wife is sitting upright, while the husband who is speaking is laying down. Next to the bed is a nightstand under a window. Through the window is a view of outer space, with all of Earth visible. The window is open with the curtains drawn.",You always get like this when there's a full Earth.,"This caption reverses the idea of a ""full moon"" with a ""full earth""","The joke subverts the common earthly superstition that a full moon affects human behavior (hence ""lunacy""). Here, the situation is flipped: the couple is clearly living somewhere off-planet (perhaps the moon), and the husband is attributing his wife's current mood or behavior to the ""full Earth"" visible through their window. 

The humor operates on several levels. First, it domesticates an extraordinary situation (living in space) into a mundane marital complaint. Second, it cleverly reverses our typical perspective - instead of Earth dwellers blaming the moon for behavior, space dwellers blame Earth. Third, it plays on the relatable dynamic of one partner attributing the other's mood to external factors rather than addressing whatever might actually be bothering them.

The caption transforms what could be an awe-inspiring view of our home planet into just another excuse for relationship friction, suggesting that no matter how far humans travel from Earth, we bring our relationship patterns and superstitions with us.",PASS,"The student's answer explicitly addresses the reversal of the ""full moon"" concept by discussing how the ""full Earth"" is used similarly in the cartoon to explain behavior. The explanation aligns with the anticipated answer point by highlighting the inversion of typical Earth-bound superstitions applied in a space context.",claude-3-7-sonnet-latest,"{""tokens_in"": 209, ""tokens_out"": 544}",gpt-4o,"{""tokens_in"": 541, ""tokens_out"": 73}",20250416_204832_claude_thinking_budget_4096_exp-claude_3_7_sonnet_latest_ag-gpt_4o.csv
22,,20.0,"In a living room cocktail party setting, two couples in nice clothes are standing in a circle, holding champagne glasses. However one of the men is miniature, only reaching knee-hight. The other couple looks down on the tiny man, while the woman he is with is cheerfully speaking to the other couple. ",We met at the mini bar.,"This combines the typical phrase ""we met at a bar"" with the term minibar, because the man himself is miniature.","The humor in this caption centers on a clever pun that explains the unusual pairing. ""Mini bar"" typically refers to the small refrigerator of alcoholic beverages found in hotel rooms, but here it's repurposed as a witty origin story for how the normal-sized woman met her miniature partner. The wordplay works on multiple levels: it directly references the man's tiny stature (""mini"") while using a plausible meeting place for couples (""bar""). There's additional comedy in how casually the woman presents this information, as though her partner's diminutive size requires only the most minimal explanation. The caption efficiently addresses the central incongruity of the image (the size disparity) while implying there's an entire world where miniature people socialize, suggesting this pairing isn't as unusual as it appears to the other couple. It's a classic misdirection joke that pivots on a familiar phrase being recontextualized.",PASS,"The student's answer explicitly identifies the key comedic element of the caption, which is the pun involving the phrase ""mini bar."" It explains that ""mini bar"" plays on both the concept of a meeting place (bar) and the miniature size of the man. They address how the caption humorously resolves the incongruity in the image with the wordplay. The explanation aligns well with the anticipated answer point, emphasizing the recontextualization of the phrase due to the man's stature.",claude-3-7-sonnet-latest,"{""tokens_in"": 206, ""tokens_out"": 549}",gpt-4o,"{""tokens_in"": 520, ""tokens_out"": 112}",20250416_204832_claude_thinking_budget_4096_exp-claude_3_7_sonnet_latest_ag-gpt_4o.csv
27,,25.0,"In a social setting, several people are standing in a room wearing business attire and holding drinks. Two couples face each other, but the man in one of the couples is dressed in a full, vintage-style deep-sea diving suit, complete with a helmet and a hose attached to the back, looking somewhat uncomfortable.",This suit looked way better in the store.,"This is a play on words on ""suit,"" as in a formal suit or a diving suit.","The humor lies in the massive understatement about an obviously inappropriate outfit. The caption treats a full vintage deep-sea diving suit—complete with helmet and hose—as if it were just a regular business suit that proved disappointing after purchase. It transforms an absurd, inexplicable situation (wearing diving equipment to a cocktail party) into a relatable, everyday problem that anyone might experience with normal clothing. The joke works because it normalizes the completely abnormal, suggesting the wearer's main concern isn't that he's drastically overdressed in underwater equipment, but merely that the suit isn't as flattering as it appeared in the store. This creates a delightful incongruity between the extreme nature of the outfit and the casual, mundane disappointment expressed about it.",FAIL,"The student's answer focuses on the incongruity of the situation and the normalization of an absurd outfit rather than explicitly discussing the play on words involving the term ""suit."" The anticipated answer hinges specifically on the wordplay, which the student does not address directly. Therefore, the key comedic element is omitted.",claude-3-7-sonnet-latest,"{""tokens_in"": 207, ""tokens_out"": 499}",gpt-4o,"{""tokens_in"": 489, ""tokens_out"": 77}",20250416_204832_claude_thinking_budget_4096_exp-claude_3_7_sonnet_latest_ag-gpt_4o.csv
30,,27.0,"Several men in suits are seated around a boardroom table with coffee mugs and documents. At the head of the table, one man is standing with his arms crossed. Everyone seated has a parrot sitting on their shoulder. One seated person with a parrot is speaking angrily to the man to his left.",We have to find a better way to record our meetings.,Parrots are known to repeat language,"The joke plays on the well-known attribute of parrots as mimics who repeat what they hear. In this corporate setting, the caption reveals that these businesspeople are using parrots as literal ""recording devices"" for their meetings instead of minutes or audio recordings. The humor stems from the absurd impracticality of this system - parrots would make terrible meeting recorders, randomly squawking sensitive information, misquoting people, or revealing private comments at inappropriate times. The angry exchange between colleagues suggests this system is already failing spectacularly, likely because one person's parrot has repeated something embarrassing or confidential. It's a visual metaphor for office politics and the dangers of having your words repeated out of context, while simultaneously mocking corporate inefficiency and bizarre business ""solutions."" The formality of the business setting contrasted with the chaotic nature of using parrots creates the perfect comedic tension.",PASS,"The student's answer explicitly mentions the attribute of parrots as mimics that repeat what they hear, which captures the key comedic element of using parrots as recording devices in the cartoon. This aligns with the anticipated answer point, showing an understanding of the humor derived from this concept.",claude-3-7-sonnet-latest,"{""tokens_in"": 208, ""tokens_out"": 498}",gpt-4o,"{""tokens_in"": 510, ""tokens_out"": 71}",20250416_204832_claude_thinking_budget_4096_exp-claude_3_7_sonnet_latest_ag-gpt_4o.csv
33,,29.0,"A bald man in glasses and a suit points at a chart on an easel with a stick. The chart appears to be a map with two distinct cell-like patterns, one in the middle resembling clusters of ovals and another on the sides with a denser, smaller pattern. To the left, another man in a suit stands beside the easel, holding or steadying it, while on the right, a seated individual listens attentively. In the window in the background, the Washington Monument is visible.","The inland tortellini are still with you, sir, but you're losing support with the coastal risottos.",This caption interprets the blobs on the chart as representing a nation of pasta,"The joke parodies political polling and demographic analysis by replacing actual voter groups with pasta varieties. It satirizes how political strategists obsessively segment the electorate into increasingly specific and sometimes arbitrary categories. By substituting ""inland tortellini"" for middle America voters and ""coastal risottos"" for urban/coastal demographics, the caption cleverly mocks the reductive nature of political analysis.

The humor works on multiple levels: First, it plays on the real geographic divide in American politics between coastal and inland regions. Second, the pasta metaphor amusingly suggests that political consultants view voters as consumable items rather than people. Third, the deadpan delivery maintains the serious tone of an actual Washington briefing while discussing something completely absurd.

The Washington Monument visible through the window firmly establishes the political context, enhancing the satire of how political operatives dissect voter preferences with pseudo-scientific precision – all while speaking about pasta as if it were a voting bloc that needs to be courted.",PASS,"The student's answer explicitly addresses the key comedic element of interpreting demographic groups as types of pasta, aligning with the anticipated answer point that the blobs on the chart represent a nation of pasta. They effectively convey the humor through an analysis of how political strategists reduce voters to such categories, making the connection clear. Thus, the student's explanation covers the core element of the anticipated answer point.",claude-3-7-sonnet-latest,"{""tokens_in"": 263, ""tokens_out"": 577}",gpt-4o,"{""tokens_in"": 590, ""tokens_out"": 91}",20250416_204832_claude_thinking_budget_4096_exp-claude_3_7_sonnet_latest_ag-gpt_4o.csv
36,,30.0,"In a doctor’s office, a doctor wearing a lab coat and head mirror is speaking to a patient seated across the desk. The patient, dressed in a suit, is facing the doctor, seemingly engaged in conversation. However, standing behind the doctor is a mysterious figure wearing a trench coat, hat, and dark glasses, with their hands in their pockets. The desk between them holds a stethoscope, a notepad, a pen on a stand, and another small object.",That rash will need constant monitoring.,"While a private investigator typically monitors a person's whereabouts, in this setting, they are monitoring a rash.","The humor in this caption stems from the unexpected connection between a medical condition and surveillance. When the doctor says ""That rash will need constant monitoring,"" the presence of the mysterious figure in a trench coat and dark glasses behind the doctor transforms the innocent medical advice into something more sinister. 

The joke plays on the double meaning of ""monitoring"" - what should be routine medical observation is humorously reframed as actual surveillance by what appears to be a spy or government agent. The caption cleverly explains why this suspicious character is in the doctor's office - they're literally there to ""monitor"" the patient's rash.

The comedy emerges from the absurd mismatch between the trivial nature of a skin rash and the extreme response of putting someone under surveillance. It suggests a world where even minor medical conditions are treated as matters of national security, creating an unexpected and humorous juxtaposition that subverts our expectations of normal medical care.",PASS,"The student captures the key comedic element by explaining the unexpected and humorous situation of a mysterious figure surveilling a skin rash, which is the main absurdity highlighted in the anticipated answer point. The discussion of surveillance and the juxtaposition of the trivial nature of a rash with espionage-like monitoring aligns with the anticipated point about the private investigator monitoring the rash.",claude-3-7-sonnet-latest,"{""tokens_in"": 239, ""tokens_out"": 539}",gpt-4o,"{""tokens_in"": 554, ""tokens_out"": 87}",20250416_204832_claude_thinking_budget_4096_exp-claude_3_7_sonnet_latest_ag-gpt_4o.csv
37,,30.0,"In a doctor’s office, a doctor wearing a lab coat and head mirror is speaking to a patient seated across the desk. The patient, dressed in a suit, is facing the doctor, seemingly engaged in conversation. However, standing behind the doctor is a mysterious figure wearing a trench coat, hat, and dark glasses, with their hands in their pockets. The desk between them holds a stethoscope, a notepad, a pen on a stand, and another small object.","Instead of an expensive, invasive procedure, we've decided to beat it out of you.","This plays on the phrase “beat it out of you,” taking it as literally removing something instead of its figurative meaning of coercing information.","The humor in this caption stems from the jarring contrast between professional healthcare and violent intimidation. The doctor is presenting physical violence (to be carried out by the mysterious figure behind them) as if it were a legitimate medical alternative to surgery. The caption recontextualizes the mysterious figure in the trench coat as a hired thug rather than a medical professional. 

The joke works on multiple levels - it subverts our expectations of proper medical care, presents violence as a cost-saving alternative in a clinical, matter-of-fact way, and creates dark humor around the concept of ""getting something out"" of a patient. There's also subtle commentary on healthcare costs, suggesting that employing muscle might be more economical than actual medical procedures.

The phrasing mimics genuine medical speak (""expensive, invasive procedure"") before pivoting to the shocking alternative, creating a perfect setup and punchline structure that maximizes the surprise.",PASS,"The student's answer explicitly covers the crucial comedic element by discussing how the phrase ""beat it out of you"" is recontextualized in the setting of a doctor's office, where it is presented as a literal alternative to a medical procedure rather than its typical figurative meaning of coercing information. The student also mentions how this creates a surprising and humorous contrast, which aligns with the anticipated answer point.",claude-3-7-sonnet-latest,"{""tokens_in"": 250, ""tokens_out"": 572}",gpt-4o,"{""tokens_in"": 575, ""tokens_out"": 95}",20250416_204832_claude_thinking_budget_4096_exp-claude_3_7_sonnet_latest_ag-gpt_4o.csv
40,,32.0,"In the cartoon, a person dressed in a full rabbit costume, carrying a briefcase and reading a sheet of paper, walks down a hallway in a typical office setting. Two business-suited colleagues stand nearby, looking somewhat puzzled, while another person peeks out from an office doorway.","Well, at least somebody remembered about casual Good Friday.","Play on words, mixing ""casual friday"" with ""Good Friday""","The joke plays on the workplace tradition of ""Casual Friday"" by absurdly combining it with Good Friday (the Christian holiday before Easter Sunday). The person in the rabbit costume has comically misinterpreted what ""casual Good Friday"" might mean, showing up in full Easter Bunny attire instead of normal business casual clothes. The humor comes from multiple incongruities: the extreme inappropriateness of the costume in a professional setting, the nonsensical connection between dressing casually and dressing as an Easter symbol, and the speaker's deadpan comment suggesting this was actually a real workplace observance that everyone else simply forgot about. The caption creates humor through the collision of workplace conventions, religious holidays, and the absurd visual of someone taking the Easter connection way too literally.",PASS,"The student's answer clearly explains the comedic device of playing on words by mixing ""casual Friday"" with ""Good Friday."" It discusses how the humor arises from the absurdity of interpreting ""casual Good Friday"" as dressing in an Easter Bunny costume, highlighting the incongruity and amusing misinterpretation that is central to the joke.",claude-3-7-sonnet-latest,"{""tokens_in"": 203, ""tokens_out"": 516}",gpt-4o,"{""tokens_in"": 490, ""tokens_out"": 83}",20250416_204832_claude_thinking_budget_4096_exp-claude_3_7_sonnet_latest_ag-gpt_4o.csv
46,,36.0,"The cartoon shows two men in office attire. One man, standing with his arms crossed, looks at the other, who is visibly pregnant, with his shirt stretched tightly over his large belly. The pregnant man is speaking, seemingly addressing the other with a comment.",No one expects an immaculate conception until it happens to him.,The immaculate conception involved a virgin inexplicably getting pregnant. This caption plays on that to explain the man's inexplicable pregnancy.,"The humor in this caption comes from applying the religious concept of ""immaculate conception"" to a biological impossibility - male pregnancy. The joke creates a collision between the miraculous religious doctrine (often confused with virgin birth) and the physically impossible scenario depicted in the cartoon. 

The caption's casual, matter-of-fact tone when discussing something that would be an earth-shattering miracle adds to the absurdity. The phrase ""until it happens to him"" presents this impossible event as something that could happen to anyone, like catching a cold or getting a promotion, which heightens the comedic effect.

There's also an element of social commentary about how people often dismiss unusual experiences until they personally face them. By applying this relatable human tendency to an utterly impossible scenario, the caption creates a layer of ironic humor that plays against the visual absurdity of the pregnant man in an office setting.",PASS,"The student's answer explicitly captures the key comedic element by discussing how the cartoon humorously applies the concept of ""immaculate conception"" to the biologically impossible scenario of a male pregnancy. The student explains the collision of religious doctrine with physical impossibility and the ironic tone of treating this impossibility as an everyday occurrence, directly addressing the anticipated answer point about using the idea of the immaculate conception to explain the man's pregnancy.",claude-3-7-sonnet-latest,"{""tokens_in"": 201, ""tokens_out"": 524}",gpt-4o,"{""tokens_in"": 516, ""tokens_out"": 98}",20250416_204832_claude_thinking_budget_4096_exp-claude_3_7_sonnet_latest_ag-gpt_4o.csv
47,,36.0,"The cartoon shows two men in office attire. One man, standing with his arms crossed, looks at the other, who is visibly pregnant, with his shirt stretched tightly over his large belly. The pregnant man is speaking, seemingly addressing the other with a comment.",The ultrasound says it's a keg of Bud Light.,"This explains the man's large belly as a beer belly, not a pregnancy","This caption resolves the visual absurdity of a ""pregnant"" man through a clever beer belly joke. It subverts the expected ultrasound reveal formula (""It's a boy/girl!"") by replacing the baby with a keg of Bud Light. The humor stems from taking the common ""beer belly"" concept to an absurd literal extreme - suggesting that the man's protruding stomach isn't fat from drinking beer but actually contains an entire keg of beer.

The specificity of ""Bud Light"" enhances the joke by grounding it in a recognizable brand, while also implying a certain everyman quality to the character's beer consumption. The caption transforms a medical procedure (ultrasound) into a humorous diagnosis of excessive drinking, playing on male stereotypes while explaining the impossible biological scenario in the image.

The joke works by providing a ridiculous but internally consistent explanation for the visual incongruity, linking male office culture, drinking habits, and physical appearance in an unexpected punchline.",PASS,"The student's answer correctly identifies that the comedic element is the transformation of the ""pregnant"" appearance into a humorous twist on a beer belly, aligning with the comment ""it's a keg of Bud Light"" to explain the man's large belly. This captures the anticipated answer point about explaining the visual incongruity as a beer belly rather than a pregnancy.",claude-3-7-sonnet-latest,"{""tokens_in"": 203, ""tokens_out"": 574}",gpt-4o,"{""tokens_in"": 517, ""tokens_out"": 85}",20250416_204832_claude_thinking_budget_4096_exp-claude_3_7_sonnet_latest_ag-gpt_4o.csv
48,,40.0,"The cartoon shows a woman in her underwear sitting up in bed, looking forward with a disgruntled expression. A large snow globe with a snowman inside is positioned next to her on the bed. The woman is speaking.","Well, that was abominable.","This plays on the phrase ""abominable snowman,"" a mythical creature","The joke plays on the double meaning of ""abominable."" On one level, the woman is simply stating that whatever just transpired was terrible or unpleasant. But the wordplay connects to the ""Abominable Snowman"" (Yeti), cleverly referencing the snowman in the snow globe beside her.

The humor derives from the absurd implication that some kind of intimate encounter occurred between the woman and the snow globe/snowman, which has left her disappointed. The cartoon's bedroom setting, her state of undress, and her disgruntled expression all contribute to this suggestive narrative.

The caption creates a surreal scenario that's sophisticated in its understatement—it's suggestive without being explicit, leaving the specific details to the viewer's imagination while providing just enough context for the joke to land. The incongruity between an intimate adult situation and a childlike object (snow globe) adds to the comedic effect.",PASS,"The student's answer explicitly addresses the key comedic element by explaining the play on the word ""abominable"" and its connection to the ""Abominable Snowman,"" thereby capturing the anticipated answer point regarding the phrase. The additional elements mentioned by the student do not detract from the core comedic point emphasized.",claude-3-7-sonnet-latest,"{""tokens_in"": 187, ""tokens_out"": 578}",gpt-4o,"{""tokens_in"": 504, ""tokens_out"": 77}",20250416_204832_claude_thinking_budget_4096_exp-claude_3_7_sonnet_latest_ag-gpt_4o.csv
