idx,cartoonstock_id,contest_number,description,caption,element,explanation,autograder_judgment,autograder_reasoning,explainer_model,explainer_usage,autograder_model,autograder_usage,source_file
11,,8.0,"A woman is speaking on the phone, smiling while looking into a fish bowl. Inside the fishbowl are three fish, as well as a miniature desert island with two little palm trees. On the island, a tiny bald man in glasses is sitting with a straight face, his hands on his knees.","He's the cutest little thing, and when you get tired of him you just flush him down the toilet",The woman is talking about the man as if he's a pet fish,"The joke is playing with the disturbing contrast between how the woman treats something that's actually a tiny human being as if he were a disposable pet. She's callously discussing disposing of a miniature person the way someone might talk about getting rid of an unwanted goldfish. The humor comes from the casual cruelty in her treating what appears to be a sentient, intelligent being (note he wears glasses, suggesting intelligence) as an amusing temporary pet rather than a person deserving of dignity. The punchline about flushing him down the toilet when she gets ""tired of him"" highlights the dark absurdity of objectifying this tiny human. It's funny because it reveals the woman's shocking moral blindness while she speaks about it as if it's perfectly normal.",PASS,"The student's answer explicitly captures the anticipated answer point by discussing how the woman treats the tiny man like a disposable pet, similar to a goldfish, highlighting the humor in such a casual and objectifying manner. This matches the anticipated comedic element of the woman treating the man as if he were a pet fish.",claude-3-7-sonnet-latest,"{""tokens_in"": 192, ""tokens_out"": 169}",gpt-4o,"{""tokens_in"": 493, ""tokens_out"": 77}",20250409_231147_claude_explainer_vs_gpt4o_grader_exp-claude_3_7_sonnet_latest_ag-gpt_4o.csv
12,,8.0,"A woman is speaking on the phone, smiling while looking into a fish bowl. Inside the fishbowl are three fish, as well as a miniature desert island with two little palm trees. On the island, a tiny bald man in glasses is sitting with a straight face, his hands on his knees.",You wouldn't believe it! I met a man at the pet store.,"This subverts the typical meaning of the phrase. Typically, this would mean that she met a normal man as a potential dating partner, but here, she purchased him as a pet.","The humor lies in subverting expectations about dating and pet ownership. The woman is enthusiastically telling someone she ""met a man at the pet store,"" implying a romantic encounter with another customer or employee. However, the visual reveals she's actually referring to the tiny human figure inside her fishbowl—clearly not a conventional dating prospect but rather an unusual ""pet"" she purchased. The joke plays on the dual meaning of ""meeting someone"" (romantic encounter versus acquiring a miniature person as a pet) and the absurdity that she sees this bizarre situation as normal enough to happily share with a friend. The tiny man's straight face and posture suggest he's unamused by his situation, creating additional comedic tension between her excitement and his apparent displeasure at being treated as a pet store acquisition.",PASS,"The student's answer explicitly covers the anticipated answer point by indicating the humor subverts the typical meaning of the phrase ""met a man,"" contrasting a usual dating context with the absurdity of purchasing a man as a pet and highlighting the comedic tension created by the situation.",claude-3-7-sonnet-latest,"{""tokens_in"": 185, ""tokens_out"": 180}",gpt-4o,"{""tokens_in"": 523, ""tokens_out"": 68}",20250409_231147_claude_explainer_vs_gpt4o_grader_exp-claude_3_7_sonnet_latest_ag-gpt_4o.csv
13,,13.0,"In an intimate bedroomsetting, a couple is in bed. The man is lying back on his helbows, while the woman is straddling him in a nightdress. However, the woman is wearing an antenna headband from a costume, the man is wearing a full-faced football helmet, and a tennis racket lies next to them on the bed. The woman's eyebrows are slightly furrowed.","Okay. Now you be the naughty mosquito, and I'll be the tormented sporting goods salesman.",The caption attempts to explain the collection of goods as a sexual roleplay,"The joke plays on the bizarre, impromptu nature of the couple's roleplay scenario. The caption reveals they're engaging in sexual roleplay using random items at hand (antenna headband, football helmet, tennis racket) to construct an absurdly specific and nonsensical fantasy. The humor comes from the incongruity between passionate intimacy and the ridiculously contrived scenario they've invented. The caption also pokes fun at how sexual roleplaying can become increasingly elaborate and arbitrary as couples try to keep things interesting. There's comedy in the juxtaposition of something as mundane as a sporting goods salesman being paired with something as random as a ""naughty mosquito"" - highlighting how their bedroom creativity has reached absurd levels. The woman's furrowed brows suggest she's questioning whether they've gone too far down this rabbit hole of increasingly bizarre sexual scenarios.",PASS,"The student's answer effectively describes the core comedic element of the cartoon, which is the sexual roleplay scenario using random household and sports-related items. It covers the explanation of these items being used for an unusually elaborate and nonsensical fantasy, directly touching on the anticipated answer point. The explanation includes both the specific roles (""naughty mosquito"" and ""tormented sporting goods salesman"") and acknowledges their creativity in combining them, fulfilling the comedic logic needed for a PASS.",claude-3-7-sonnet-latest,"{""tokens_in"": 219, ""tokens_out"": 192}",gpt-4o,"{""tokens_in"": 532, ""tokens_out"": 108}",20250409_231147_claude_explainer_vs_gpt4o_grader_exp-claude_3_7_sonnet_latest_ag-gpt_4o.csv
14,,13.0,"In an intimate bedroomsetting, a couple is in bed. The man is lying back on his helbows, while the woman is straddling him in a nightdress. However, the woman is wearing an antenna headband from a costume, the man is wearing a full-faced football helmet, and a tennis racket lies next to them on the bed. The woman's eyebrows are slightly furrowed.",I think we need a new sex therapist,This caption suggests that the odd situation is the result of an unusual sexual roleplay.,"The humor in this caption lies in the implication that the couple's awkward sexual encounter is the result of misguided professional advice. The presence of random, non-sexual items (football helmet, antenna headband, tennis racket) during their intimate moment suggests they're following bizarre instructions from their current sex therapist in an attempt to spice up their love life. The woman's furrowed brows indicate frustration or confusion about these strange recommendations. The joke works by revealing that what we're witnessing is the absurd outcome of therapy gone wrong, highlighting the gap between professional advice and practical application in intimate relationships. The deadpan delivery of ""I think we need a new sex therapist"" underscores their recognition that their current therapy is clearly not working.",PASS,The student's answer captures the key comedic element by explaining that the couple's odd behavior and use of random items are due to the bizarre instructions from a misguided sex therapist. The humor is derived from the absurdity of this situation being the result of an unusual roleplay or therapy. This aligns with the anticipated answer point about the unusual situation being caused by unconventional roleplay recommendations.,claude-3-7-sonnet-latest,"{""tokens_in"": 203, ""tokens_out"": 170}",gpt-4o,"{""tokens_in"": 500, ""tokens_out"": 90}",20250409_231147_claude_explainer_vs_gpt4o_grader_exp-claude_3_7_sonnet_latest_ag-gpt_4o.csv
18,,16.0,"As a group of people exits a grand church doorway dressed in typical church attire, a pastor in a typical black suit and roman collar stands next to the Devil, complete with horns, trident, robe, and tail. They watch the procession pass by, as the pastor is explaining something to the devil. One passerby tips his hat at the pastor and devil.",I think it's important for them to hear both sides of the debate.,It downplays the seriousness of religion by portraying the Devil as merely the “other side” in a casual debate,"This caption lands its humor by portraying the pastor and the Devil as two balanced sides of a theological debate, rather than representing good versus evil. The joke subverts religious expectations by suggesting the church is taking a surprisingly neutral, even democratic approach to salvation by giving Satan equal platform with clergy. It creates cognitive discomfort by treating eternal damnation as just another reasonable perspective that parishioners should consider, similar to how schools might present balanced views on mundane topics. The pastor's matter-of-fact tone implies this arrangement is perfectly normal, while the visual of churchgoers politely tipping their hats to the Devil heightens the absurdity. The humor comes from applying modern concepts of fairness and ""hearing both sides"" to the ultimate moral dichotomy in Christian theology.",PASS,"The student's answer explicitly covers the anticipated comedic element by discussing how the humor arises from treating the pastor and Devil as two balanced sides in a debate, which subverts religious expectations and downplays the seriousness of the good versus evil dichotomy. The student's description aligns with the anticipated point about downplaying religion by treating the Devil as just another side of the debate.",claude-3-7-sonnet-latest,"{""tokens_in"": 198, ""tokens_out"": 174}",gpt-4o,"{""tokens_in"": 514, ""tokens_out"": 87}",20250409_231147_claude_explainer_vs_gpt4o_grader_exp-claude_3_7_sonnet_latest_ag-gpt_4o.csv
20,,16.0,"As a group of people exits a grand church doorway dressed in typical church attire, a pastor in a typical black suit and roman collar stands next to the Devil, complete with horns, trident, robe, and tail. They watch the procession pass by, as the pastor is explaining something to the devil. One passerby tips his hat at the pastor and devil.","O.K., they're yours, but I still don't know where you got that fourth ace.","This implies a backstory that the pastor and devil were playing poker, the pastor lost, and the people were the bet.","The joke hinges on portraying the pastor as having lost his congregation to the Devil in a card game. The phrase ""I don't know where you got that fourth ace"" implies the Devil cheated at poker, suggesting the pastor gambled with the souls of his congregation and lost. This creates humor through the incongruity of a religious leader engaging in gambling (a sin) with the Devil himself, and being more concerned about the fairness of the game than the fate of his flock. The caption transforms the solemn church exit into the aftermath of a spiritual wager, with the Devil now ""owning"" the churchgoers as they politely tip their hats, unaware of their new master. The humor lies in the casual business transaction approach to eternal damnation.",PASS,"The student's answer captures the key comedic element by describing the implied backstory where the pastor lost a card game (specifically poker) to the Devil, with the congregation being the wager. The explanation includes the idea of the Devil cheating, which aligns with the detail ""I don't know where you got that fourth ace"" from the caption, and addresses the humor derived from this scenario. Thus, the student’s answer explicates the anticipated comedic element effectively.",claude-3-7-sonnet-latest,"{""tokens_in"": 204, ""tokens_out"": 170}",gpt-4o,"{""tokens_in"": 518, ""tokens_out"": 106}",20250409_231147_claude_explainer_vs_gpt4o_grader_exp-claude_3_7_sonnet_latest_ag-gpt_4o.csv
37,,30.0,"In a doctor’s office, a doctor wearing a lab coat and head mirror is speaking to a patient seated across the desk. The patient, dressed in a suit, is facing the doctor, seemingly engaged in conversation. However, standing behind the doctor is a mysterious figure wearing a trench coat, hat, and dark glasses, with their hands in their pockets. The desk between them holds a stethoscope, a notepad, a pen on a stand, and another small object.","Instead of an expensive, invasive procedure, we've decided to beat it out of you.","This plays on the phrase “beat it out of you,” taking it as literally removing something instead of its figurative meaning of coercing information.","The humor lies in disrupting expectations about medical treatment with the absurd suggestion of physical violence. The caption suddenly transforms the mysterious figure from a strange presence into an enforcer or thug, revealing they're working with the doctor (""we've"") to extract something from the patient by force rather than through standard medical means. 

The joke plays on the contrast between professional healthcare (which should be ethical and scientific) and criminal intimidation tactics. The formal, clinical phrase ""expensive, invasive procedure"" juxtaposed with the brutal colloquialism ""beat it out of you"" creates a jarring comedic dissonance. It also satirizes healthcare costs by implying violence might be a cost-cutting alternative.

The humor works because it offers an unexpected explanation for the cartoon's most mysterious element (the suspicious figure) while parodying medical consultation conversations.",PASS,"The student's answer explicitly covers the anticipated answer point by discussing how the phrase ""beat it out of you"" involves the literal removal of something, as opposed to its figurative meaning. The student recognizes the unexpected action involving physical violence instead of a medical procedure, capturing the key comedic element of taking a phrase literally.",claude-3-7-sonnet-latest,"{""tokens_in"": 222, ""tokens_out"": 187}",gpt-4o,"{""tokens_in"": 560, ""tokens_out"": 78}",20250409_231147_claude_explainer_vs_gpt4o_grader_exp-claude_3_7_sonnet_latest_ag-gpt_4o.csv
38,,30.0,"In a doctor’s office, a doctor wearing a lab coat and head mirror is speaking to a patient seated across the desk. The patient, dressed in a suit, is facing the doctor, seemingly engaged in conversation. However, standing behind the doctor is a mysterious figure wearing a trench coat, hat, and dark glasses, with their hands in their pockets. The desk between them holds a stethoscope, a notepad, a pen on a stand, and another small object.",Good news! We have a solid lead on who stole your liver.,This plays on the trope of stolen organs and suggests the man in the trench coat is investigating it,"The humor comes from the unexpected revelation that the doctor is investigating the theft of the patient's liver, rather than treating a medical condition. This sets up a comedic juxtaposition between a normal doctor's visit and a crime investigation. The punchline is heightened by the suspicious-looking figure standing behind the doctor, who appears to be a detective or investigator (dressed in stereotypical noir detective attire), suggesting they are the ""solid lead"" mentioned. The joke plays on the absurdity of someone's liver being stolen, which is both impossible and alarming, while the doctor's casual ""good news"" delivery of this information creates ironic understatement. The caption cleverly recontextualizes the cartoon's visual elements into a surreal crime scenario.",PASS,"The student's answer explicitly discusses the comedic juxtaposition and highlights the absurdity of the scenario, mentioning the trope of organ theft and identifying the man in the trench coat as part of the investigation, aligning with the anticipated point.",claude-3-7-sonnet-latest,"{""tokens_in"": 218, ""tokens_out"": 168}",gpt-4o,"{""tokens_in"": 523, ""tokens_out"": 60}",20250409_231147_claude_explainer_vs_gpt4o_grader_exp-claude_3_7_sonnet_latest_ag-gpt_4o.csv
56,,46.0,"The cartoon depicts a shareholder meeting, with a banner reading “Welcome Stockholders.” However, the board members sitting on stage are all completely naked, and one man, also naked, is speaking at the podium. ","First, I'd like to thank the podium.",The man appreciates the podium because it's the only thing providing him with cover,"The joke hinges on both visual and verbal play with nakedness in a formal business setting. In a shareholder meeting where everyone is inexplicably nude, the speaker expresses gratitude to the podium itself - the only thing providing him any modesty or covering his exposed genitals. The humor comes from acknowledging the awkward situation (complete nudity at a corporate event) while maintaining formal business meeting decorum. Rather than addressing the obvious absurdity of everyone being naked, the speaker continues with meeting formalities, but with a twist - thanking an inanimate object for its practical function of hiding his private parts. It's funny because it acknowledges the embarrassing situation indirectly while maintaining the pretense that this is a normal professional gathering.",PASS,"The student's answer captures the anticipated answer point by explaining that the man appreciates the podium because it covers his nakedness, which is the key comedic element. The student highlights the humor deriving from the juxtaposition of formality with the absurdity of nudity, and the function of the podium in this context aligns with the anticipated point.",claude-3-7-sonnet-latest,"{""tokens_in"": 161, ""tokens_out"": 165}",gpt-4o,"{""tokens_in"": 462, ""tokens_out"": 82}",20250409_231147_claude_explainer_vs_gpt4o_grader_exp-claude_3_7_sonnet_latest_ag-gpt_4o.csv
57,,47.0,"In an office setting, two people are sitting calmly at a desk, seemingly engaged in a business conversation. Meanwhile, through the large glass window behind them, a chaotic chase is unfolding as individuals dressed in business attire armed with various weapons— a hammer, bat, and gun—are running after another man, with his tie trailing him. One man sitting down is speaking to the other.",Our conflict-resolution seminar ended a bit early today,"The caption implies that the violent chase was part of an office training, but that it got out of hand.","The humor stems from the stark contrast between ""conflict resolution"" and the violent chase occurring outside. The caption implies that the very people who should be learning to resolve disputes peacefully (attendees of a conflict-resolution seminar) have abandoned the training and resorted to extreme violence. The deadpan delivery suggesting the seminar merely ""ended a bit early"" wildly understates the chaotic scene - the participants aren't just disagreeing, they're literally hunting a colleague with weapons. The irony is heightened by the calm business conversation happening indoors, oblivious or indifferent to the failure of professional development happening right outside their window. The joke plays on the common cynicism about corporate training programs' effectiveness and the gap between workplace ideals and human nature.",PASS,"The student's answer captures the key comedic element of the caption by discussing the irony and contrast between the concept of a ""conflict-resolution seminar"" and the violent chase happening outside. The humor in the understatement of the seminar ending ""a bit early"" is also addressed, which ties back to the anticipated answer point about the situation getting out of hand. Therefore, the student's answer explicitly covers the anticipated comedic device.",claude-3-7-sonnet-latest,"{""tokens_in"": 198, ""tokens_out"": 166}",gpt-4o,"{""tokens_in"": 505, ""tokens_out"": 97}",20250409_231147_claude_explainer_vs_gpt4o_grader_exp-claude_3_7_sonnet_latest_ag-gpt_4o.csv
63,,51.0,"In a courtroom setting, a man is sitting in a chair in the witness stand. One of the man's hands is replaced by a metal hook. A lawyer is standing in front of the man and the judge, reading from a document. The judge is looking at the witness.",Can you please identify which hand was mistakenly amputated?,"Given that one hand is replaced by a hook, it should be obvious which hand was amputated","The humor in this caption stems from the jarring contrast between a horrific medical error and the matter-of-fact courtroom proceedings. The lawyer's question reveals this is a medical malpractice lawsuit about a wrongful amputation - the ultimate surgical ""wrong site"" error. 

The absurdity lies in asking the victim to identify which hand was ""mistakenly"" amputated when it's visually obvious to everyone in the courtroom that one hand is now a hook. The question is simultaneously redundant (everyone can see which hand) and callous in its bureaucratic formality.

The caption also plays on the common courtroom trope of attorneys asking witnesses to identify or point to things in evidence, but twists it into dark comedy when the very ability to point has been compromised by the error being litigated.

The hook hand - a dramatic visual element - becomes both the evidence and the reason for the proceedings, creating a circular irony that amplifies the dark humor of the situation.",PASS,"The student's answer captures the key comedic element by highlighting the absurdity and irony of asking which hand was amputated when it is visually obvious due to one hand being a hook. The student discusses the redundancy and callousness of the question, which aligns with the anticipated answer point about the hook making it obvious.",claude-3-7-sonnet-latest,"{""tokens_in"": 175, ""tokens_out"": 219}",gpt-4o,"{""tokens_in"": 528, ""tokens_out"": 78}",20250409_231147_claude_explainer_vs_gpt4o_grader_exp-claude_3_7_sonnet_latest_ag-gpt_4o.csv
68,,53.0,"A man-sized bug with antennae and a hairy body is sitting upright in a bed next to a woman. The woman is reading a book, while the bug is reading a newspaper with four hands visible holding the sides of the newspaper. They appear to be a couple sharing a bed, each reading their own material under the covers, with a nightstand and lamp on either side of the bed. The woman is speaking.",Would your mother find chilled larvae in a light honey glaze too waspy?,"This plays on the dual meaning of ""waspy,"" which could refer to the insect or the slang ""WASP,"" meaning White Anglo-Saxon Protestant.","The humor derives from the woman's attempt to serve food that the bug-husband's mother would enjoy. The joke plays on the idea of meeting a partner's parents and wanting to make a good impression with appropriate food, but with a twist: since her partner is a bug-like creature, traditional food would be replaced with insect cuisine - specifically larvae in honey glaze.

The punchline turns on a clever double meaning of ""waspy"" - referring both to:
1. The insect species ""wasp"" (implying the larvae dish might be associated with a different insect type than her partner)
2. The social term ""WASP"" (White Anglo-Saxon Protestant), suggesting class/cultural concerns about the food being too pretentious or not aligned with the mother-in-law's preferences

This creates a humorous parallel between human social anxieties about impressing in-laws and the absurd scenario of accommodating insect dietary preferences.",PASS,"The student's answer explicitly covers the anticipated answer point by discussing the dual meaning of ""waspy."" It mentions both the insect species and the social term ""WASP,"" aligning with the comedic element captured in the anticipated answer point.",claude-3-7-sonnet-latest,"{""tokens_in"": 209, ""tokens_out"": 210}",gpt-4o,"{""tokens_in"": 566, ""tokens_out"": 61}",20250409_231147_claude_explainer_vs_gpt4o_grader_exp-claude_3_7_sonnet_latest_ag-gpt_4o.csv
78,,61.0,"A doctor wearing a head mirror and standing behind a desk is in a typical doctor's offide. However, a giant hand is reaching through the doorway, facing up. The doctor is reaching over the desk to check the enormous hand's pulse.",Take three thousand Tylenol and call me in the morning.,"While a doctor might typically tell a patient to take a few Tylenol, given the enormity of the hand, he suggests they take an absurdly large dose. ","The humor in this caption comes from transforming a standard doctor's advice trope—""take two aspirin and call me in the morning""—into an absurdly proportioned version that matches the gigantic scale of the patient's hand. The joke plays with the logical consequence of treating a massive patient: if a normal-sized human might take two Tylenol, then a giant would naturally require a substantially larger dose (three thousand). The caption maintains the familiar dismissive tone of a doctor giving routine care while acknowledging the clearly unusual circumstance of treating a giant. The humor lies in the matter-of-fact application of normal medical protocol to an abnormal situation, creating an incongruity between the mundane medical advice and the extraordinary patient.",PASS,"The student's answer captures the key comedic element, which is the transformation of a standard medical directive to match the exaggerated context of a gigantic patient. The student details the irony and absurdity of applying a familiar medical routine to an oversized scenario, aligning well with the anticipated answer point.",claude-3-7-sonnet-latest,"{""tokens_in"": 168, ""tokens_out"": 163}",gpt-4o,"{""tokens_in"": 490, ""tokens_out"": 72}",20250409_231147_claude_explainer_vs_gpt4o_grader_exp-claude_3_7_sonnet_latest_ag-gpt_4o.csv
