idx,cartoonstock_id,contest_number,description,caption,element,explanation,autograder_judgment,autograder_reasoning,explainer_model,explainer_usage,autograder_model,autograder_usage,source_file
18,,16.0,"As a group of people exits a grand church doorway dressed in typical church attire, a pastor in a typical black suit and roman collar stands next to the Devil, complete with horns, trident, robe, and tail. They watch the procession pass by, as the pastor is explaining something to the devil. One passerby tips his hat at the pastor and devil.",I think it's important for them to hear both sides of the debate.,It downplays the seriousness of religion by portraying the Devil as merely the “other side” in a casual debate,"The laugh comes from applying the modern “both-sides” ideal of balanced debate to the last place you’d expect it: church doctrine. A minister, whose job is to present God’s word, is standing with Satan—the ultimate opposing viewpoint—and says parishioners must “hear both sides.” Treating the Devil as if he’s just another panelist in a reasoned discussion parodies media and academic insistence that every topic deserves equal airtime, even when one side is blatantly destructive. The absurd equivalence between holy teaching and literal evil creates the comic incongruity.",PASS,"The student's answer captures the anticipated answer point by discussing the irony of treating the Devil as just another perspective in a reasoned discussion, akin to the ""both-sides"" debate approach. This effectively downplays the seriousness of religion, aligning with the anticipated answer point.",o3,"{""tokens_in"": 0, ""tokens_out"": 0}",gpt-4o,"{""tokens_in"": 480, ""tokens_out"": 69}",20250506_180913_o3_high_exp-o3_ag-gpt_4o.csv
26,,23.0,"Two butterflies stand on adjascent twigs. While the butterfly on the left appears normal, the butterfly on the left's wings are replaced with the pattern of Piet Mondrian iconic ""Composition with Red, Blue and Yellow"". The butterfly on the right is speaking to the other butterfly.",You think this is weird? My sister looks like a soup can.,"This implies there is a family of butterflies with patterns of famous paintings, in this case, Andy Warhol's soup can.","The cartoon shows a butterfly whose wings mimic Piet Mondrian’s famous grid painting. The other butterfly treats this as an odd but not unprecedented mutation, joking that it has a sibling who resembles a soup can—an allusion to Andy Warhol’s iconic Campbell’s-soup-can art. The humor comes from mixing high-art references with the natural world and from the escalation: if a Mondrian-winged butterfly is strange, a butterfly shaped like a Warhol soup can is even more absurd. The caption packs two well-known modern-art images into a casual family anecdote, parodying how people compare relatives while creating a visual mash-up of modern art and entomology.",PASS,"The student's answer covers the key comedic element by identifying the allusions to famous artworks (Mondrian's painting and Warhol's soup can) and explaining the humor as arising from mixing these high-art references with the concept of a butterfly's wing pattern. The student correctly discusses the visual mash-up of modern art and nature, capturing the implied family of butterflies with famous art patterns.",o3,"{""tokens_in"": 0, ""tokens_out"": 0}",gpt-4o,"{""tokens_in"": 483, ""tokens_out"": 91}",20250506_180913_o3_high_exp-o3_ag-gpt_4o.csv
31,,27.0,"Several men in suits are seated around a boardroom table with coffee mugs and documents. At the head of the table, one man is standing with his arms crossed. Everyone seated has a parrot sitting on their shoulder. One seated person with a parrot is speaking angrily to the man to his left.","Well, it's not my fault booty revenues are down this quarter.","Parrots and ""booty"" are both concepts tied to pirates, implying that the company is actually a pirate operation","The sight gag already blends two worlds: everyone in a button-down corporate boardroom has a pirate’s shoulder parrot. The caption pushes that mash-up further by swapping standard business lingo (“revenues are down this quarter”) with pirate vocabulary (“booty”). The speaker defends himself exactly the way a modern executive would in a quarterly earnings meeting, but he’s talking about plunder. The laugh comes from the incongruity of treating piratical treasure like a line item on a financial report and from hearing a suit-and-tie professional use the word “booty” with total seriousness.",PASS,"The student's answer captures the key comedic element of blending corporate and pirate worlds through the parrots and the use of ""booty"" instead of typical corporate jargon. The student explicitly highlights the incongruity of the situation, indicating an understanding of the implication that the company operates like a pirate operation.",o3,"{""tokens_in"": 0, ""tokens_out"": 0}",gpt-4o,"{""tokens_in"": 472, ""tokens_out"": 75}",20250506_180913_o3_high_exp-o3_ag-gpt_4o.csv
43,,34.0,"In a woman's bedroom, a vampire is walking out of the door to the outside, spreading his cape as if to take flight, looking back at the woman who is sitting up in her bed, naked. The woman is speaking with a mildly disappointed look, and the vampire is looking back at her with a slight frown.",I bet the bride of Frankenstein gets to cuddle.,"This references the famous ""Bride of Frankenstine” character","The scene mirrors a familiar human gripe: a lover who bolts right after sex instead of sticking around to cuddle. Here the disappearing lover happens to be a vampire, who, like many stereotypical cads, is throwing on his “cape” and heading for the door before dawn. The woman bitterly compares her situation to that of another classic movie monster couple, the Bride of Frankenstein and Frankenstein’s monster, assuming that even a sewn-together corpse manages some post-romantic snuggling. The humor comes from applying ordinary bedroom expectations to iconic horror characters and from the absurd jealousy that a modern woman could feel toward a 1930s horror-film bride.",PASS,"The student's answer explicitly mentions both the ""Bride of Frankenstein"" and ""Frankenstein’s monster,"" capturing the key comedic element of the cartoon. The anticipated answer point is referenced directly, fulfilling the requirement.",o3,"{""tokens_in"": 0, ""tokens_out"": 0}",gpt-4o,"{""tokens_in"": 471, ""tokens_out"": 58}",20250506_180913_o3_high_exp-o3_ag-gpt_4o.csv
46,,36.0,"The cartoon shows two men in office attire. One man, standing with his arms crossed, looks at the other, who is visibly pregnant, with his shirt stretched tightly over his large belly. The pregnant man is speaking, seemingly addressing the other with a comment.",No one expects an immaculate conception until it happens to him.,The immaculate conception involved a virgin inexplicably getting pregnant. This caption plays on that to explain the man's inexplicable pregnancy.,"The humor hinges on an impossible reversal and a religious allusion. A visibly pregnant man—something biologically impossible—claims his condition is the result of an “immaculate conception,” the term Christians use for Mary’s miraculous, sex-free pregnancy. The familiar phrase “No one expects ­­­X until it happens to them” is tweaked to “him,” underscoring the absurdity that a man could face pregnancy at all. The line justifies the impossible situation with an equally unlikely miracle, blending office small-talk with biblical mythology. The clash of mundane corporate setting, an impossible male pregnancy, and a lofty theological explanation creates the comic surprise.",PASS,"The student's answer captures the key comedic element by discussing the religious allusion and the impossible situation, linking the unexpected male pregnancy to the concept of an ""immaculate conception."" The explanation also touches on the phrase modification that adds to the humor, aligning with the anticipated answer point's emphasis on the unexpected nature of the pregnancy explained through a miraculous event.",o3,"{""tokens_in"": 0, ""tokens_out"": 0}",gpt-4o,"{""tokens_in"": 472, ""tokens_out"": 85}",20250506_180913_o3_high_exp-o3_ag-gpt_4o.csv
48,,40.0,"The cartoon shows a woman in her underwear sitting up in bed, looking forward with a disgruntled expression. A large snow globe with a snowman inside is positioned next to her on the bed. The woman is speaking.","Well, that was abominable.","This plays on the phrase ""abominable snowman,"" a mythical creature","The humor hinges on a double meaning of “abominable.” In everyday speech it means “awful,” so the woman, apparently just after an intimate encounter, is bluntly criticizing how bad it was. But “Abominable” instantly evokes the “Abominable Snowman,” a mythical snowy creature. Because there is an oversized snow globe containing a snowman right beside her in bed, the reader is led to imagine that this snowman was her improbable partner. The caption simultaneously delivers a harsh bedroom review and a punny reference to a snow-related monster, tying the sexual disappointment to the snowy scene. The gag is the collision of bedroom talk and wintry wordplay.",PASS,"The student's answer successfully captures the key comedic element of the cartoon, which is the pun and wordplay involving ""abominable snowman."" The student explains how ""abominable"" is used both to critique the encounter and to reference the snow-related creature due to the presence of the snow globe, reflecting the anticipated answer point.",o3,"{""tokens_in"": 0, ""tokens_out"": 0}",gpt-4o,"{""tokens_in"": 459, ""tokens_out"": 82}",20250506_180913_o3_high_exp-o3_ag-gpt_4o.csv
51,,41.0,"In a grand church, there is a large bar stocked with bottles of liquor. A few patrons are seated at the bar, and sunbeams stream through the stained glass windows, dramatically illuminating one of the patrons. A couple dressed in formal church attire stands at the open doors, with the husband speaking.",Just don't order a Bloody Mary.,"This is a play on the dual meaning of ""Bloody Mary"", referring to both the alcoholic drink and the ghost of Mary I. of England, a common horror/supernatural character known for persecuting Protestants","The drawing mashes two normally separate worlds: a reverent church and a casual cocktail bar. The caption treats the church as if it’s just another tavern, warning the newcomer not to order a “Bloody Mary.” That drink name is funny here for two layered reasons. First, “Bloody Mary” is a popular brunch cocktail, so it fits a bar setting. But inside a church the words suddenly evoke sacred figures—the Virgin Mary and the “blood” central to Communion. Calling Mary “bloody” or requesting “blood” at the bar would sound blasphemous, even more so in the glow of stained-glass sunbeams. The humor lies in this double meaning: a perfectly ordinary drink order becomes a potentially sacrilegious faux-pas when the bar is bizarrely located in a sanctuary.",FAIL,"The student's answer primarily focuses on the juxtaposition of a church and a bar, emphasizing the potential sacrilegious nature of ordering a ""Bloody Mary"" in a church. However, the anticipated answer point specifically requires the dual meaning to include the ghost of Mary I of England, which is not addressed in the student's response. The student's mention of Virgin Mary and Communion blood does not align with the anticipated historical/supernatural reference to Mary I. Therefore, the student's answer does not explicitly cover the anticipated answer point.",o3,"{""tokens_in"": 0, ""tokens_out"": 0}",gpt-4o,"{""tokens_in"": 531, ""tokens_out"": 120}",20250506_180913_o3_high_exp-o3_ag-gpt_4o.csv
53,,41.0,"In a grand church, there is a large bar stocked with bottles of liquor. A few patrons are seated at the bar, and sunbeams stream through the stained glass windows, dramatically illuminating one of the patrons. A couple dressed in formal church attire stands at the open doors, with the husband speaking.",Finally—a faith-based initiative I can embrace.,"This refers to President George W. Bush's ""Faith-Based and Community Initiatives,"" a program that funds cetrain faith-based organizations","The scene mashes together two normally separate worlds: a lofty church sanctuary and a full-on cocktail bar. The husband borrows the Washington buzz-phrase “faith-based initiative,” coined for government programs that support religious charities, and applies it to this boozy set-up. His line means “At last—a religious project I can actually get behind,” implying he’s usually unenthusiastic about organized religion, but enthusiastic about drinking. The humor comes from the clash between sacred and profane (stained-glass shafts of light sanctifying bottles of liquor) and from repurposing a solemn policy term to describe something that panders to earthly appetites. It’s also a sly play on “embrace” and “spirits”: these “spirits” are alcoholic, not holy.",PASS,"The student's answer accurately recognizes the use of the term ""faith-based initiative,"" relating it to the concept of repurposing a Washington buzz-phrase for comedic effect. The student correctly identifies that the humor stems from the juxtaposition of religious and secular elements, as well as from the recontextualization of a policy term, aligning with the anticipated answer point which emphasizes a reference to faith-based government initiatives.",o3,"{""tokens_in"": 0, ""tokens_out"": 0}",gpt-4o,"{""tokens_in"": 508, ""tokens_out"": 97}",20250506_180913_o3_high_exp-o3_ag-gpt_4o.csv
60,,49.0,"In a bar, the bartender is talking on a wall phone phone behind the bar. A patron sitting at the bar looks behind him at a Catholic Priest, Protestant Pastor and Jewish Rabbi all walking into the bar.",I thought I told you to stop sending me jokes at work,"The setting strongly resembles a ""walks into a bar"" joke setup","The cartoon depicts the classic set-up line “A priest, a minister and a rabbi walk into a bar.” The bartender, seeing the three clergymen enter, phones someone and says, “I thought I told you to stop sending me jokes at work.” The humor comes from treating that old verbal formula as though the characters in the joke can actually be “sent” to the bar, turning an abstract joke intro into a literal workplace nuisance. The caption plays on the double meaning of “sending me jokes”––normally it means e-mailing or telling jokes, but here it’s taken literally: the caller has physically dispatched the joke’s cast to the bartender’s place of employment. The collision between everyday workplace frustration and the surreal manifestation of a stock joke set-up creates the comic twist.",PASS,"The student's answer effectively explains the classic joke setup involving a priest, a minister, and a rabbi walking into a bar and links it to the cartoon's depiction. The explanation explicitly includes the ""walks into a bar"" element as integral to the humor, thus covering the anticipated answer point.",o3,"{""tokens_in"": 0, ""tokens_out"": 0}",gpt-4o,"{""tokens_in"": 483, ""tokens_out"": 75}",20250506_180913_o3_high_exp-o3_ag-gpt_4o.csv
62,,49.0,"In a bar, the bartender is talking on a wall phone phone behind the bar. A patron sitting at the bar looks behind him at a Catholic Priest, Protestant Pastor and Jewish Rabbi all walking into the bar.",Stop me if you've heard this one.,This acknowledges the common joke setup of different faith leaders walking into a bar,"The standard setup for countless bar jokes begins, “A priest, a minister, and a rabbi walk into a bar ….” In the drawing those three clergymen really are entering the bar, so the scene itself is the literal embodiment of that familiar opening line. The caption—“Stop me if you’ve heard this one”—is the stock phrase a joke-teller uses before launching into a well-worn gag. Here it’s comically misplaced: the “joke” isn’t being told; it’s visibly unfolding in real life. The humor lies in the meta-gag: the cartoon acknowledges that everyone already knows this classic setup, yet presents it as happening for real, blending reality with the clichéd joke formula and poking fun at how overused the line is.",PASS,"The student's answer explicitly discusses the common joke setup involving three clergymen of different faiths walking into a bar. It also examines how the cartoon brings this classic joke setup to life, fulfilling the anticipated answer point.",o3,"{""tokens_in"": 0, ""tokens_out"": 0}",gpt-4o,"{""tokens_in"": 477, ""tokens_out"": 60}",20250506_180913_o3_high_exp-o3_ag-gpt_4o.csv
67,,53.0,"A man-sized bug with antennae and a hairy body is sitting upright in a bed next to a woman. The woman is reading a book, while the bug is reading a newspaper with four hands visible holding the sides of the newspaper. They appear to be a couple sharing a bed, each reading their own material under the covers, with a nightstand and lamp on either side of the bed. The woman is speaking.","Well, it's another thrilling night at the Samsas’.","The woman is drawing attention to the fact that despite her partner being a monster, their lives have become mundane","Kafka’s “The Metamorphosis” begins, “Gregor Samsa awoke one morning from uneasy dreams to find himself transformed into a gigantic insect.”  The caption treats that famous premise as if it’s now just ordinary married-life routine: the woman (apparently Mrs. Samsa) sighs, “Well, it’s another thrilling night at the Samsas’.”  The humor comes from the clash between the surreal horror of sharing a bed with a man-sized bug and the deadpan, domestic tone of someone bored by yet another quiet evening of reading in bed.  By framing the household of “the Samsas” like any other humdrum suburban couple, the caption deflates Kafka’s nightmarish scenario and turns it into sitcom banality, producing comic incongruity.",PASS,"The student's answer does explicitly cover the anticipated answer point by discussing how the routine domestic behavior is contrasted with the surreal scenario of living with a gigantic insect. This humorously mundane situation creates an incongruity with the horror of the situation, which aligns with the anticipated comedic element. The student's answer correctly identifies that the woman is highlighting the mundanity despite the circumstances.",o3,"{""tokens_in"": 0, ""tokens_out"": 0}",gpt-4o,"{""tokens_in"": 530, ""tokens_out"": 88}",20250506_180913_o3_high_exp-o3_ag-gpt_4o.csv
68,,53.0,"A man-sized bug with antennae and a hairy body is sitting upright in a bed next to a woman. The woman is reading a book, while the bug is reading a newspaper with four hands visible holding the sides of the newspaper. They appear to be a couple sharing a bed, each reading their own material under the covers, with a nightstand and lamp on either side of the bed. The woman is speaking.",Would your mother find chilled larvae in a light honey glaze too waspy?,"This plays on the dual meaning of ""waspy,"" which could refer to the insect or the slang ""WASP,"" meaning White Anglo-Saxon Protestant.","The cartoon treats the giant insect as an ordinary boyfriend or husband. The woman is planning a meal for his (insect) mother the way a human hostess would for prospective in-laws. Her suggested dish—“chilled larvae in a light honey glaze”—sounds like a chic hors d’oeuvre but is really bug cuisine, fitting the mother’s species. The punch line is the word “waspy.” In ordinary conversation “WASPy” means “upper-crust, White Anglo-Saxon Protestant,” the sort of genteel taste a hostess worries about. Here it is simultaneously a literal insect joke—larvae with honey might appeal more to a wasp than to whatever species her mate is. So the caption fuses etiquette anxiety (“Will your mom think this is too fancy/pretentious?”) with insect-world menu worries, while delivering a double pun on “wasp/WASP.” The humor comes from treating interspecies food preferences and upper-class manners as the same problem.",PASS,"The student's answer explicitly captures the dual meaning of ""waspy,"" touching on both the insect reference and the cultural slang for White Anglo-Saxon Protestant. This directly aligns with the anticipated answer point emphasizing the comedic use of the double entendre. Therefore, the student's response successfully addresses the key comedic element.",o3,"{""tokens_in"": 0, ""tokens_out"": 0}",gpt-4o,"{""tokens_in"": 580, ""tokens_out"": 76}",20250506_180913_o3_high_exp-o3_ag-gpt_4o.csv
71,,57.0,"Two men in a living room stand by a fireplace, above which a large, mounted fish is displayed. One man’s hand is inside the fish’s open mouth—indicating the fish is biting him. The other man stands nearby, holding a cup and looking on.","It's painful, but I couldn't stand another chorus of ‘Take Me to the River.’","This references Big Mouth Billy Bass, a classic novelty prop of a singing fish, singing ""Take Me to the River"" ","The caption plays on the novelty wall-mounted “singing fish” toys that belt out the Al Green/Talking Heads hit “Take Me to the River” when someone walks past. In the drawing, the fish isn’t just singing—it’s clamped onto the man’s hand. He explains that, although the bite hurts, it’s worth it to shut the fish up before it launches into that song yet again. The humor comes from 1) recognizing the over-familiar, mildly annoying gag gift, 2) exaggerating how far someone would go to silence it (allowing himself to be physically attacked), and 3) the incongruity of a taxidermy-style trophy acting like an aggressive, living jukebox. The contrast between a casual living-room scene and this absurd solution delivers the joke.",PASS,"The student’s answer explicitly identifies the comedic device as being based on the familiarity of a wall-mounted singing fish toy, specifically referencing ""Take Me to the River."" This captures the anticipated point of humor involving Big Mouth Billy Bass. The student’s expansion includes several facets of the humor, but importantly acknowledges the specific song and the novelty toy context.",o3,"{""tokens_in"": 0, ""tokens_out"": 0}",gpt-4o,"{""tokens_in"": 513, ""tokens_out"": 85}",20250506_180913_o3_high_exp-o3_ag-gpt_4o.csv
98,,82.0,"A naked man and woman are in a lush, tropical setting resembling the biblical Garden of Eden. The man is holding a phone to his ear and looking backward at a large hand extending from a cloud, which is pointing accusatorily downward at him. The woman looks alarmed or confused as she runs alongside him through tall grass away from the hand. In the background, a snake is wrapped around a tree trunk. Rays of light shine down dramatically.",I gotta go. ‘Mr. Wonderful’ is having one of his episodes.,"By referring to God as ""Mr. Wonderful"" and calling the divine judgement an ""episode,"" Adam is characterizing God as a flawed, overly dramatic individual","The drawing puts Adam and Eve’s expulsion scene into the present day: Adam has a smartphone while the divine hand descends to condemn them. Adam’s line—“I gotta go. ‘Mr. Wonderful’ is having one of his episodes”—treats God like an eccentric, over-dramatic relative whose periodic tantrums everyone must tiptoe around. Calling the Almighty “Mr. Wonderful” is a sarcastic understatement, and labeling the Fall of Man as just “one of his episodes” shrinks a cosmic act of judgment to the level of garden-variety moodiness. The humor comes from the anachronism (cell-phone chit-chat in Eden) and from the casual, dismissive way Adam talks about God’s wrath, recasting a foundational biblical catastrophe as the relatable nuisance of dealing with someone’s recurring meltdowns.",PASS,"The student's answer captures the key comedic element outlined in the anticipated answer point by explaining that Adam treats God as if He were a flawed, overly dramatic person, specifically noting the sarcasm and understatement in calling God ""Mr. Wonderful"" and referring to divine judgment as merely ""one of his episodes."" This matches the anticipated comedic logic.",o3,"{""tokens_in"": 0, ""tokens_out"": 0}",gpt-4o,"{""tokens_in"": 561, ""tokens_out"": 83}",20250506_180913_o3_high_exp-o3_ag-gpt_4o.csv
