idx,cartoonstock_id,contest_number,description,caption,element,explanation,autograder_judgment,autograder_reasoning,explainer_model,explainer_usage,autograder_model,autograder_usage,source_file
231,,678.0,"Two giraffes stand in a barren landscape with their necks twisted and intertwined. Their heads emerge from the tangled mess, looking in different directions. The background features gentle rolling hills, adding to the absurdity of the situation. One giraffe is speaking to the other.",I'm trying to see it from your point of view.,"By switching neck positions, they are literally switching point of view","The joke hinges on a clever visual pun that transforms the metaphorical expression ""seeing from someone else's point of view"" into a literal physical action. Normally, this phrase refers to understanding another person's perspective or opinion conceptually. Here, the giraffe has literally twisted and intertwined its extremely long neck with the other giraffe's in a physical attempt to position its eyes where the other's are located.

The humor derives from this literal interpretation of a figurative expression, made especially amusing by the giraffes' uniquely suited anatomy. Despite this extreme physical effort (their necks are completely tangled), they're still looking in different directions - suggesting that even with all this contortion, they still can't actually achieve the shared perspective they're seeking. This adds an ironic layer suggesting how difficult it can truly be to understand another's viewpoint, even when making extraordinary efforts.",PASS,The student's answer explicitly covers the anticipated answer point by explaining that the giraffes have intertwined their necks in an attempt to literally adopt each other's point of view. This captures the essence of the literal physical action that the anticipated answer point highlights.,claude-3-7-sonnet-latest,"{""tokens_in"": 205, ""tokens_out"": 575}",gpt-4o,"{""tokens_in"": 498, ""tokens_out"": 64}",20250416_204832_claude_thinking_budget_4096_exp-claude_3_7_sonnet_latest_ag-gpt_4o.csv
235,,681.0,"In a black-and-white cartoon, a man in a long-sleeve shirt and shorts, with large red crab claws instead of hands walks down a city street beside a woman who has her arms crossed and looks annoyed. The man appears frustrated. The background features a brick building with large windows. The woman is speaking.",You pinch me one more time and you’re going to find yourself in hot water.,"Typically ""hot water"" means being in trouble, but here literally means boiling him","The joke plays on the dual meaning created when the common idiom ""in hot water"" (meaning ""in trouble"") is applied to someone with crab claws. The caption reveals that the man with crab claws has been pinching the woman, explaining her annoyed expression and crossed arms. Her response cleverly combines:

1) A straightforward threat that he'll face consequences if he pinches her again
2) A dark culinary joke - crabs are literally cooked by being placed in hot water

The humor emerges from this wordplay that connects the man's physical attribute (crab claws) with a fitting punishment that references how actual crabs are prepared. The woman's frustration with what might be an uncontrollable trait of her companion creates an absurd relationship dynamic that's instantly recognizable despite the surreal premise.",PASS,"The student's answer explicitly covers the anticipated answer point by explaining the dual meaning of ""in hot water"" and how it relates to the man's crab claws, reflecting both the idiom of being in trouble and the literal culinary reference of crabs being boiled. The student's explanation aligns with the anticipated comedic device, demonstrating an understanding of the specific wordplay involved.",claude-3-7-sonnet-latest,"{""tokens_in"": 218, ""tokens_out"": 573}",gpt-4o,"{""tokens_in"": 505, ""tokens_out"": 86}",20250416_204832_claude_thinking_budget_4096_exp-claude_3_7_sonnet_latest_ag-gpt_4o.csv
239,,684.0,"A group of various monsters and creatures, including a dragon, an alien, and a polka-dotted, one-eyed being, are seated around a conference table. A human man in a suit stands smiling at the corner of the table, looking somewhat out of place among the fantastical beings. The scene appears to be a business meeting or discussion. The dragon, at the head of the table, is speaking.","Good, Human Resources is here.","""Human resources"" typically regards personell, but here, is literally the only human in the room of monsters","The humor in this caption hinges on a clever wordplay with ""Human Resources."" In typical workplace settings, Human Resources refers to the department handling employee management and relations. However, in this monster-populated business meeting, the caption creates a brilliant double meaning: the lone human isn't just from the HR department—he literally represents their ""human resources,"" suggesting he might be their only available human or a resource they utilize in some capacity.

The joke works because it subverts expectations by taking a familiar corporate term and giving it a literal interpretation in this monster context. There's also amusing irony in that monsters—typically feared by humans in stories—appear to have incorporated a human into their professional structure. The dragon's matter-of-fact tone (""Good, Human Resources is here"") adds to the humor by normalizing this unusual scenario, suggesting this is just business as usual in their monstrous corporate world.",PASS,"The student’s answer accurately identifies and explains the key comedic device, which is the double meaning and wordplay of ""Human Resources."" They note how the phrase usually pertains to a department but is humorously literal in this context, as the human is the only ""resource"" among monsters. This captures the anticipated answer's emphasis on the term being interpreted literally, in a setting where it usually isn't.",claude-3-7-sonnet-latest,"{""tokens_in"": 227, ""tokens_out"": 537}",gpt-4o,"{""tokens_in"": 543, ""tokens_out"": 95}",20250416_204832_claude_thinking_budget_4096_exp-claude_3_7_sonnet_latest_ag-gpt_4o.csv
242,,685.0,"In a forest, two hikers with backpacks and beanies look startled as they encounter a giant honey bear bottle, complete with a dispenser on its head, angrily approaching them. One hiker, a woman with braids, is speaking to the other, a man with a beard and glasses. ",I think we’re O.K.—honey doesn’t go bad.,"""Go bad"" typically means for food to spoil, but here refers to the bear being aggressive","The joke plays on multiple meanings of ""bad"" in this surreal encounter with a giant, angry honey bear container in the forest. The caption creates humor through the hiker's hilariously misguided logic: they're applying factual knowledge about honey's remarkable shelf-stability (honey famously doesn't spoil) to an entirely inappropriate context—an apparent physical threat. 

The comedy emerges from this category error: confusing honey's food-preservation properties with the aggressive ""bear"" container's intentions or temperament. The hiker is conflating ""going bad"" in the food spoilage sense with ""being bad"" in the threatening/dangerous sense. This reflects the human tendency to grasp at irrelevant knowledge when facing unexpected dangers.

There's also subtle irony in their misplaced confidence—the technical fact about honey's shelf life is correct but completely unhelpful in their current predicament. The deadpan delivery suggests a comical obliviousness to their actual danger, revealing how people sometimes retreat to trivia when confronted with absurd or threatening situations.",PASS,"The student's answer captures the comedic element of the caption by highlighting the dual meaning of ""bad"" as it relates both to food spoilage and to the threat posed by the bear. They effectively discuss the category error and the hiker's application of irrelevant knowledge, which aligns with the anticipated answer point. This demonstrates their understanding of the key comedic device in the caption.",claude-3-7-sonnet-latest,"{""tokens_in"": 214, ""tokens_out"": 554}",gpt-4o,"{""tokens_in"": 547, ""tokens_out"": 89}",20250416_204832_claude_thinking_budget_4096_exp-claude_3_7_sonnet_latest_ag-gpt_4o.csv
246,,688.0,"At a formal gathering, a stern-looking military officer with numerous medals and a cartoonishly long, receipt-like ribbon on his uniform holds a glass of wine. A woman in a black dress, also holding a glass of wine, is leaning in and speaking to him. Other guests are mingling in the background. The officer is speaking.",I was stationed at CVS during the war on drugs.,This imagines the war on drugs as a literal war with generals over drugs at a pharmacy,"This caption creates humor by cleverly connecting multiple elements. The joke links the officer's cartoonishly long ribbon (resembling CVS's infamously lengthy receipts) with the pharmacy chain, while simultaneously playing on the phrase ""war on drugs."" 

The humor works through this multi-layered wordplay: the ""war on drugs"" was a real government anti-drug campaign, but the caption reframes it as a literal military deployment to a pharmacy. The incongruity between a decorated military officer's serious service and the mundane setting of a CVS store creates absurdity. 

The visual connection is essential - his overly long ribbon decoration serves as the perfect stand-in for the notoriously excessive CVS receipts that have become a cultural joke. The officer is essentially wearing what appears to be his ""service record"" from CVS, suggesting his medals and honors come from working at a pharmacy rather than combat.

The caption succeeds by creating a surprising connection between the visual element (the long ribbon) and cultural references (CVS receipts and the war on drugs) that transforms the formal military scene into something unexpectedly comedic.",PASS,"The student's answer captures the anticipated answer point by explaining how the caption imagines the war on drugs as a literal military deployment to a CVS store. This is evidenced by the discussion of the officer's long ribbon (likened to a CVS receipt) and the reframing of the ""war on drugs"" as taking place in a pharmacy. The student's answer successfully identifies the absurdity and incongruity intended by the caption, aligning well with the key comedic element.",claude-3-7-sonnet-latest,"{""tokens_in"": 216, ""tokens_out"": 646}",gpt-4o,"{""tokens_in"": 567, ""tokens_out"": 108}",20250416_204832_claude_thinking_budget_4096_exp-claude_3_7_sonnet_latest_ag-gpt_4o.csv
247,,688.0,"At a formal gathering, a stern-looking military officer with numerous medals and a cartoonishly long, receipt-like ribbon on his uniform holds a glass of wine. A woman in a black dress, also holding a glass of wine, is leaning in and speaking to him. Other guests are mingling in the background. The officer is speaking.",It’s the price of freedom.,"While the ""price of freedon"" typically refers to sacrifices to uphold liberty, here is interpreted as a literal price with a receipt.","The humor centers on the visual joke of the cartoonishly long, receipt-like ribbon on the officer's uniform. The caption ""It's the price of freedom"" creates a perfect double meaning: literally, the ribbon resembles an absurdly long receipt or price tag, suggesting freedom comes with an excessive ""cost"" that's visibly displayed on his chest. Metaphorically, it plays on the common patriotic phrase about military sacrifice being ""the price of freedom.""

The joke works through this clever wordplay that transforms the officer's decoration from a symbol of honor into what appears to be an itemized bill. There's subtle social commentary about how we quantify patriotism and military service, while also poking fun at the sometimes ostentatious nature of military decorations. The formal setting adds an additional layer, as the officer is essentially making a self-important statement disguised as humility - he's simultaneously bragging about his service while pretending to be making a solemn observation about sacrifice.",PASS,"The student's answer explicitly covers the anticipated answer point by discussing the double meaning of ""the price of freedom."" The answer describes how the humor arises from interpreting the phrase as a literal price, with the ribbon resembling a receipt, effectively capturing the comedic element of the visual joke and wordplay.",claude-3-7-sonnet-latest,"{""tokens_in"": 211, ""tokens_out"": 603}",gpt-4o,"{""tokens_in"": 543, ""tokens_out"": 73}",20250416_204832_claude_thinking_budget_4096_exp-claude_3_7_sonnet_latest_ag-gpt_4o.csv
248,,689.0,"A knight in full armor, riding a checkered horse, is holding a lance that has skewered a car door. The knight faces a police officer who is holding a notepad and pen, seemingly about to write a ticket or report. The knight is speaking, possibly explaining himself.","But, officer, he did not yield!","This is a play on ""yield,"" meaning either to back down from a fight or stop in traffic ","The humor in this caption hinges on a clever wordplay around ""yield"" that bridges medieval combat and modern traffic rules. In contemporary driving, ""yield"" means to give way to other vehicles and failing to do so is a traffic violation. In a medieval jousting context, ""yield"" means to surrender or admit defeat.

The knight is justifying his attack on the car door by invoking traffic rules with knight's logic - he skewered the car door with his lance because the driver ""did not yield"" to him. The comedy emerges from the knight applying medieval combat ethics to modern traffic situations, treating a failure to yield right-of-way as legitimate grounds for lance combat.

The caption works especially well with the visual of the confused police officer attempting to process this explanation using modern law enforcement protocols while the knight believes he was simply enforcing the rules of the road as he understands them.",PASS,"The student's answer clearly captures the anticipated comedic element of wordplay around ""yield,"" describing how it humorously bridges the context of medieval combat and modern traffic rules. The student explains how the knight's medieval understanding of ""yield"" is applied to a modern situation, aligning with the anticipated answer point.",claude-3-7-sonnet-latest,"{""tokens_in"": 199, ""tokens_out"": 556}",gpt-4o,"{""tokens_in"": 516, ""tokens_out"": 75}",20250416_204832_claude_thinking_budget_4096_exp-claude_3_7_sonnet_latest_ag-gpt_4o.csv
249,,689.0,"A knight in full armor, riding a checkered horse, is holding a lance that has skewered a car door. The knight faces a police officer who is holding a notepad and pen, seemingly about to write a ticket or report. The knight is speaking, possibly explaining himself.",It used to be chivalrous to open doors for people.,"Chivalry is often associated with medieval times, but here also means polite courtesy","The humor in this caption plays on the contrast between medieval chivalry and modern reality. The knight has literally ""opened"" a car door by violently skewering it with his lance, and is now trying to justify this destructive act to a police officer by referencing the chivalrous tradition of opening doors for others. 

The joke works through this clever wordplay on ""opening doors"" - contrasting the polite social custom (holding a door open) with the knight's excessive, anachronistic interpretation (piercing it with a weapon). The phrase ""it used to be"" furthers the humor by suggesting the knight's confusion about why his ""chivalrous"" action isn't being appreciated in modern times.

The caption creates a perfect collision between the medieval world of knightly conduct and contemporary society with its cars and police, highlighting how absurdly out of place the knight's understanding of courtesy has become. The humor lies in watching someone from another era misapply their cultural norms to a world that has moved on without them.",PASS,"The student's answer explicitly captures the key comedic element, which is the clever wordplay on ""opening doors,"" and connects it to both the medieval and modern contexts of chivalry and courtesy. They emphasize the contrast and the knight's misinterpretation represented by skewering the car door, linking it to chivalry being out of place in modern society. The anticipated point about chivalry being associated with both medieval times and polite courtesy is addressed in their explanation.",claude-3-7-sonnet-latest,"{""tokens_in"": 203, ""tokens_out"": 578}",gpt-4o,"{""tokens_in"": 545, ""tokens_out"": 109}",20250416_204832_claude_thinking_budget_4096_exp-claude_3_7_sonnet_latest_ag-gpt_4o.csv
250,,690.0,"An astronaut in full space gear stands inside an elevator, facing a surprised bellhop who is holding the elevator door open. The scene takes place in a building lobby, with a potted plant and a directory visible on the wall. The bellhop is speaking to the astronaut.",Please watch your small step.,"This references Neil Armstrong's famous ""One small step for man"" quote","The joke plays on Neil Armstrong's famous quote when he first stepped on the moon: ""That's one small step for man, one giant leap for mankind."" The bellhop has taken the standard elevator warning ""please watch your step"" and cleverly modified it to acknowledge the astronaut's profession. The humor comes from applying this monumental space exploration language to the mundane action of stepping out of an elevator. The caption creates comedy through this unexpected juxtaposition of the extraordinary (space travel) with the ordinary (hotel service), while also showing how the bellhop is trying to be cleverly accommodating to his unusual guest. It's essentially a pun that connects the elevator step with one of history's most famous ""steps.""",PASS,"The student's answer explicitly references Neil Armstrong's quote, explaining how the bellhop's line plays on it and creates humor by juxtaposing space travel with a mundane situation. This directly covers the anticipated answer point regarding the famous quote.",claude-3-7-sonnet-latest,"{""tokens_in"": 197, ""tokens_out"": 491}",gpt-4o,"{""tokens_in"": 467, ""tokens_out"": 61}",20250416_204832_claude_thinking_budget_4096_exp-claude_3_7_sonnet_latest_ag-gpt_4o.csv
252,,691.0,"A couple is sitting in their living room, with the man using a laptop and the woman knitting. Outside the window, a large crowd of snowmen, some wearing hats and scarves, are peering in, seemingly watching the couple. The scene is set at night, with bare trees visible in the background. The woman knitting on the couch against the window looks back at the snowmen with a concerned expression, but the man, who is speaking, appears unfazed.","Well, he did say he’d be back again someday.","""I'll be back someday"" is a lyric from Frosty the Snowman","This caption cleverly references the famous line from the children's song ""Frosty the Snowman"" where Frosty, while melting away, promises ""I'll be back again someday."" The humor arises from transforming this innocent lyric into something more ominous. Instead of just one cheerful snowman returning as promised, an entire crowd of snowmen has appeared and is now eerily watching the couple through their window.

The joke works through the contrast between the man's casual, matter-of-fact delivery and the genuinely unsettling situation. His nonchalant attitude suggests he's connecting these creepy snowman stalkers to the beloved character's promise, treating this bizarre scenario as the natural fulfillment of Frosty's farewell words.

The caption creates comedy by subverting a nostalgic childhood reference and turning it into something vaguely threatening, while the husband seems completely unfazed by what should be a concerning development. It's the perfect blend of the familiar and the absurd—taking a wholesome cultural touchstone and giving it an unexpected, slightly dark twist.",PASS,"The student's answer explicitly covers the anticipated answer point by identifying the reference to the lyric ""I'll be back again someday"" from the song ""Frosty the Snowman."" The student explains that the humor arises from transforming this lyric with a dark twist, aligning with the anticipated comedic element.",claude-3-7-sonnet-latest,"{""tokens_in"": 245, ""tokens_out"": 549}",gpt-4o,"{""tokens_in"": 573, ""tokens_out"": 73}",20250416_204832_claude_thinking_budget_4096_exp-claude_3_7_sonnet_latest_ag-gpt_4o.csv
256,,695.0,"A slice of bread with a face, arms, and legs, wearing a bow tie, stands in front of a restaurant podium. Behind the podium is a surprised-looking host with a bald head and a bow tie, holding a pen and a notepad. The host is speaking to the bread, who looks disappointed.",You’re in luck. A slot for you just opened up in our kitchen.,The slot he is referring to is a toaster slot,"The humor lies in the complete reversal of the bread's expected restaurant experience. The anthropomorphized bread has clearly arrived dressed formally (with bow tie) hoping to dine as a customer, but instead, the host reveals that the bread can be ""accommodated"" in the kitchen—implying it will become food rather than be served food. The phrase ""a slot for you just opened up"" works as a clever double entendre, since bread literally goes into slots (toasters). The joke subverts expectations by transforming the bread's status from potential patron to potential ingredient. It's darkly comedic because what the restaurant host sees as good news (""you're in luck"") is actually the bread's worst-case scenario, explaining its disappointed expression. The caption perfectly captures the horrifying moment when the bread realizes it hasn't been recognized as a customer but as consumable.",PASS,"The student's answer clearly captures the anticipated answer point by explaining that the phrase ""a slot for you just opened up"" includes a clever double entendre involving a toaster slot, which is directly associated with bread. This satisfies the requirement of the anticipated comedic device related to the toaster reference.",claude-3-7-sonnet-latest,"{""tokens_in"": 215, ""tokens_out"": 534}",gpt-4o,"{""tokens_in"": 515, ""tokens_out"": 71}",20250416_204832_claude_thinking_budget_4096_exp-claude_3_7_sonnet_latest_ag-gpt_4o.csv
259,,697.0,"A man in tattered clothes and a blindfold ""walks the plank"" from a subway train onto the platform, while typical pirate captain with an eye patch, hat, parrot, and peg leg, along with a shirtless crew member with a bandana watch from the train's doorway. The scene is absurdly set in a modern subway station. The crew member is speaking from behind the captain.",No one crosses the Pirates of Penn Station.,"This replaces ""Penzance"" with ""Penn Station"" to address the train setting","The joke operates by transplanting classic pirate tropes (walking the plank, eye patches, parrots) into the unexpected setting of a modern subway system. The caption creates humor through the territorial assertion that these aren't just any pirates - they're specifically the ""Pirates of Penn Station,"" suggesting these swashbucklers have claimed this mundane transit hub as their domain. The word ""crosses"" functions as a clever double entendre - it refers both to betraying the pirates (which presumably led to the punishment) and literally crossing through their territory (Penn Station). The matter-of-fact delivery implies this is routine business for these urban buccaneers, as if commuters should naturally be aware of the dangerous pirates controlling this part of New York's transit system. The humor emerges from this absurd collision between historical pirate behavior and contemporary urban infrastructure.",FAIL,"The student's answer explains the comedic effect of placing traditional pirate tropes in the modern subway setting and discusses the humor from this blend. However, the anticipated answer point specifically focuses on the wordplay replacing ""Penzance"" with ""Penn Station,"" which the student's answer does not explicitly address. The student's focus on the setting and pirate tropes misses this specific pun-related element, leading to a failure to capture the anticipated answer point.",claude-3-7-sonnet-latest,"{""tokens_in"": 229, ""tokens_out"": 557}",gpt-4o,"{""tokens_in"": 528, ""tokens_out"": 102}",20250416_204832_claude_thinking_budget_4096_exp-claude_3_7_sonnet_latest_ag-gpt_4o.csv
