idx,cartoonstock_id,contest_number,description,caption,element,explanation,autograder_judgment,autograder_reasoning,explainer_model,explainer_usage,autograder_model,autograder_usage,source_file
173,,141.0,"Two angels stand facing each other in heaven, surrounded by a cloud-filled landscape. One angel has white, feathered wings and stands silently, listening. The other angel, with black, bat-like wings, is speaking to the white-winged angel. Both wear long white robes.",I only got halfway through my deathbed conversion.,The person's incomplete conversion resulted in their part angel/devil form.,"The humor in this caption plays on the concept of a ""deathbed conversion"" – the practice of sinners converting to faith in their final moments to secure salvation. The visual contrast between the two angels (one with traditional white wings, one with bat-like black wings) sets up the punchline perfectly. The black-winged angel's statement that they ""only got halfway through"" their deathbed conversion explains their unusual appearance – they began converting from sinner to saint, but died mid-process. The joke works on multiple levels: it treats spiritual transformation as a literal, physical change; it suggests heaven has a bureaucratic ""good enough"" admission policy; and it implies this partially-transformed soul is now stuck in an awkward in-between state for eternity. The caption cleverly bridges the visual incongruity of the cartoon while poking gentle fun at religious concepts of last-minute salvation.",PASS,"The student's answer explicitly discusses the person's transformation due to their incomplete deathbed conversion, resulting in the visual contrast of being part angel/devil. This captures the anticipated answer point about the physical form being a mix due to the incomplete process.",claude-3-7-sonnet-latest,"{""tokens_in"": 205, ""tokens_out"": 576}",gpt-4o,"{""tokens_in"": 506, ""tokens_out"": 63}",20250506_171410_claude_thinking_budget_8192_exp-claude_3_7_sonnet_latest_ag-gpt_4o.csv
177,,143.0,"In a hallway with closed doors, two businessmen in suits and ties walk past each other, each carrying a briefcase. One of the men has an inflated sex doll casually slung under his shoulder, its arms and legs sticking out. The other man glances at him with a neutral expression, as if trying to process the sight. The man carrying the doll is speaking.","Hey, you teach C.P.R. your way, and I'll teach it mine.","Typically, CPR is taught with a dummy, not a sex doll, to practice chest compressions","The joke operates through the juxtaposition of professionalism and impropriety. The humor stems from the businessman's attempt to normalize his obviously inappropriate presence of a sex doll in a workplace by presenting it as a legitimate CPR training tool. The caption creates a defensive justification that's transparently flimsy—no professional CPR trainer would use a sex doll, making the excuse both absurd and revealing.

The ""you teach your way, I'll teach mine"" framing suggests a false equivalence between proper professional conduct and completely inappropriate behavior. It portrays the man as believing his unconventional ""teaching method"" deserves the same respect as standard practice, highlighting his delusion or shamelessness.

The joke mines humor from workplace taboos—sex-related objects in professional settings—while presenting the carrier's attitude as casually defiant rather than embarrassed. The humor relies on the audience recognizing both the social violation and the inadequacy of the excuse, essentially witnessing someone trying to maintain professional dignity in an undignified situation.",PASS,"The student's answer correctly identifies the critical comedic device: the absurdity and impropriety of using a sex doll as a substitute for a CPR dummy, emphasizing that this substitution is what makes the situation and the humor work. It encapsulates the absurdity of teaching CPR with a sex doll, thus covering the anticipated comedic element.",claude-3-7-sonnet-latest,"{""tokens_in"": 234, ""tokens_out"": 587}",gpt-4o,"{""tokens_in"": 561, ""tokens_out"": 81}",20250506_171410_claude_thinking_budget_8192_exp-claude_3_7_sonnet_latest_ag-gpt_4o.csv
181,,144.0,"In a therapist’s office, a man reclines on a couch, wearing a fishing hat and waders, speaking to the therapist as if explaining something. The therapist sits nearby in an armchair, holding a notepad and pen, listening attentively. The room is filled with fish floating in the air, swimming around as though it were underwater. Both the therapist and the patient appear unfazed by the surreal presence of the fish.",I'm haunted by the faces of my victims.,"This phrase would typically be in therapy contexts like soldiers dealing with PTSD, or murderers in crime stories, after killing humans","The humor in this caption arises from the dramatic misdirection it creates. When we hear ""I'm haunted by the faces of my victims,"" we initially expect a dark confession from a disturbed individual. Instead, the visual context reveals that the ""victims"" are merely fish the man has caught (hence his fishing attire). 

The joke plays with the unexpected moral weight the fisherman places on his hobby. He's so consumed by guilt over fishing that he needs therapy, while the fish literally ""haunt"" him by swimming around the office. This creates a perfect marriage between the surreal visual (fish floating in air) and the patient's psychological state.

There's also humor in the incongruity between the serious, almost noir-like confession and the relatively mundane activity of fishing. By anthropomorphizing fish and treating their deaths with the gravity usually reserved for human tragedy, the caption creates absurd hyperbole.

The punchline ultimately reveals the man isn't a dangerous criminal - just an overly sensitive fisherman experiencing the most literal manifestation of fishing guilt possible.",PASS,"The student's answer explicitly captures the comedic element of playing with expectations related to serious therapy contexts, such as PTSD or murder confessions. The student correctly identifies the contrast between the expected human victims in such confessions and the actual fish, highlighting the absurdity and misdirection of the situation.",claude-3-7-sonnet-latest,"{""tokens_in"": 238, ""tokens_out"": 633}",gpt-4o,"{""tokens_in"": 579, ""tokens_out"": 73}",20250506_171410_claude_thinking_budget_8192_exp-claude_3_7_sonnet_latest_ag-gpt_4o.csv
182,,144.0,"In a therapist’s office, a man reclines on a couch, wearing a fishing hat and waders, speaking to the therapist as if explaining something. The therapist sits nearby in an armchair, holding a notepad and pen, listening attentively. The room is filled with fish floating in the air, swimming around as though it were underwater. Both the therapist and the patient appear unfazed by the surreal presence of the fish.",You think this is bad? I used to be a proctologist.,"The man sees the subject of his profession in his sleep, which for proctology, would be the gastrointestinal tract","The joke creates humor through unexpected professional comparison. In this surreal scene where fish are swimming through the air of a therapist's office, the patient (dressed as a fisherman) acknowledges the bizarre situation but dismisses it by comparing it to his supposedly worse former career as a proctologist. The punchline works by inviting the audience to imagine what a proctologist (who examines rectums) might ""see"" in their daily work that would make floating fish seem preferable by comparison. There's also a sly visual parallel between fishing (pulling things from water) and proctology (examining hidden areas), creating an absurd professional trajectory. The humor derives from the juxtaposition of the visible surrealism in the room against the implied, unmentioned visuals of proctology, leaving the audience to fill in the blank with something presumably more disturbing than fish swimming through air.",FAIL,"The student's answer focuses on the comparison between the two careers, using the surreal presence of the fish to highlight this contrast. However, it does not explicitly connect the presence of the fish as representative of seeing the subject of the profession in dreams, specifically relating this comedic element directly to the work of a proctologist. The student's answer instead elaborates on the humor through the juxtaposition and comparison, rather than the comedic device of seeing professional subjects in dreams.",claude-3-7-sonnet-latest,"{""tokens_in"": 242, ""tokens_out"": 543}",gpt-4o,"{""tokens_in"": 553, ""tokens_out"": 107}",20250506_171410_claude_thinking_budget_8192_exp-claude_3_7_sonnet_latest_ag-gpt_4o.csv
189,,148.0,"In a police lineup room, five figures stand in a row behind a glass pane. The lineup features a mix of mythological, religious, and supernatural figures, including a robed bearded man, a devil holding a trident, a Buddha-like figure, and others dressed in elaborate or deity-like attire. In front of the glass, a woman points toward the lineup while the police officer beside her, in uniform, speaks to her","By the way, we are not allowed to show the face or image of No. 6.","In Islam, it is forbidden to depict the Prophet Muhammad","This caption plays on the religious prohibition against depicting certain divine figures in some faiths (particularly the Islamic prohibition on depicting Muhammad). The humor comes from transplanting this serious religious restriction into the mundane, secular context of a police lineup. The officer is simultaneously treating the situation as both an ordinary criminal procedure and a matter requiring religious sensitivity. The joke gains an extra layer because we only see five figures in the lineup, suggesting that the unseen ""No. 6"" is intentionally obscured in accordance with religious law. This creates a delightful absurdity where law enforcement procedures accommodate theological considerations, while also implying that a divine figure might be a criminal suspect. The caption cleverly bridges sacred and profane worlds by treating the restriction on depicting holy figures as just another bureaucratic protocol to be followed during police work.",PASS,"The student's answer explicitly mentions the Islamic prohibition on depicting certain divine figures, particularly the Prophet Muhammad, which aligns with the anticipated answer point. The student connects the religious restriction with the context of the police lineup, capturing the comedic element of the situation.",claude-3-7-sonnet-latest,"{""tokens_in"": 243, ""tokens_out"": 570}",gpt-4o,"{""tokens_in"": 532, ""tokens_out"": 65}",20250506_171410_claude_thinking_budget_8192_exp-claude_3_7_sonnet_latest_ag-gpt_4o.csv
209,,662.0,"A wedding ceremony is taking place, but the bride and groom are dressed as vikings, complete with animal skins, viking helmet, wrapped footwear, and one holding a spear while the other holds a sword. They stand under a decorated archway, facing a minister who is reading from a book. On the left, bridesmaids in traditional dresses hold bouquets, and on the right, groomsmen in tuxedos stand attentively. One of the bridesmaids is turned back, speaking to another bridesmaid.",It’s about time they settled down and razed a village.,Vikings are known for destroying (razing) villages,"This caption plays on a familiar wedding sentiment with a Viking twist. The humor comes from a clever wordplay that subverts the common phrase ""settled down and raised a family"" by replacing ""raised"" with the similar-sounding ""razed"" (meaning destroyed). Since the couple is dressed as Vikings - who were historically known for pillaging villages - the caption suggests that their version of domestic bliss will involve destruction rather than construction.

The joke works on multiple levels: it acknowledges the incongruity of Viking attire at a modern wedding ceremony, while the bridesmaid's matter-of-fact delivery implies this Viking lifestyle is perfectly normal to their social circle. The humor lies in treating something violent (razing villages) as an expected, even respectable next step after marriage - a twisted version of traditional life progression. It creates a world where Viking raids are just ordinary marital activities, like buying a home or having children.",PASS,"The student's answer explicitly covers the anticipated answer point by mentioning that the couple is dressed as Vikings, who were historically known for pillaging villages. This implies the act of ""razing,"" which is central to the comedic twist of the caption.",claude-3-7-sonnet-latest,"{""tokens_in"": 261, ""tokens_out"": 548}",gpt-4o,"{""tokens_in"": 562, ""tokens_out"": 64}",20250506_171410_claude_thinking_budget_8192_exp-claude_3_7_sonnet_latest_ag-gpt_4o.csv
212,,664.0,"In a courtroom, a judge leans forward, angrily speaking to a man dressed in a magician's outfit complete with a top hat and wand, who is seated in the witness stand. A woman stands nearby holding a document, observing the interaction. The scene is set with the American flag and another flag in the background, adding to the formal courtroom atmosphere. The judge is speaking.",When was the last time you saw either half of her?,This references the classic magic trick of sawing an assistant in half,"This caption cleverly plays on the classic magician's trick of ""sawing a woman in half."" The joke hinges on the premise that the magician actually performed this illusion literally rather than as a trick, and has now landed in legal trouble because he can't locate either portion of his assistant. The judge's question implies that a woman has gone missing—or more accurately, two halves of a woman have gone missing—after a magic performance gone wrong.

The humor emerges from the absurd literalization of a well-known illusion and the resulting legal consequences. By placing the magician in a courtroom setting, the caption creates a delightful collision between the fantastical world of magic and the serious realm of law. The woman holding documents is likely an attorney or court official in this scenario, perhaps presenting evidence of the magician's negligence in keeping track of his assistant's bifurcated parts.

The caption transforms a harmless stage illusion into a surreal legal case about missing body parts, creating a darkly comic scenario where magic tricks have real-world consequences.",PASS,"The student's answer explicitly discusses the comedic element of the classic magician's trick of ""sawing a woman in half,"" referencing how the caption plays on this by implying it was done literally. This aligns with the anticipated answer point, which focuses on this specific magic trick reference.",claude-3-7-sonnet-latest,"{""tokens_in"": 227, ""tokens_out"": 569}",gpt-4o,"{""tokens_in"": 559, ""tokens_out"": 71}",20250506_171410_claude_thinking_budget_8192_exp-claude_3_7_sonnet_latest_ag-gpt_4o.csv
213,,665.0,"Two sharks are facing each other in the ocean. A person, visible only from the waist down, is standing on the back one of the sharks. They have a slightly bewildered expression. The shark carrying the person is speaking.",How about some help carrying the groceries?,"To the sharks, the person is the groceries","The humor stems from the absurd domestication of a predator-prey relationship. Rather than the expected scenario where sharks are dangerous predators, we see one shark incongruously being used as transportation by a human. The caption cleverly transforms this bizarre situation into a mundane domestic complaint.

The shark carrying the person speaks to the other shark as if they're a couple or roommates returning from shopping, with one partner frustrated about doing all the work. There's comedic incongruity in applying everyday household dynamics to apex marine predators.

The joke operates on multiple levels: the shark views the human not as potential prey but as ""groceries"" they're inconveniently stuck carrying; there's role reversal where the predator is serving its prey; and there's the absurdity of sharks having domestic disputes. The caption creates a completely unexpected frame for interpreting the visual elements, reimagining a potentially terrifying ocean scenario as a slice of mundane domestic life complete with the universal complaint about uneven distribution of household labor.",PASS,"The student's answer successfully covers the key comedic element by discussing how the person is referred to as ""groceries"" in the context of the sharks' conversation. The student's explanation that the shark views the human as ""groceries"" they are stuck carrying shows their understanding of the joke's play on the shark's perspective. There is explicit mention of the human being seen as ""groceries,"" which aligns with the anticipated answer point.",claude-3-7-sonnet-latest,"{""tokens_in"": 189, ""tokens_out"": 596}",gpt-4o,"{""tokens_in"": 507, ""tokens_out"": 101}",20250506_171410_claude_thinking_budget_8192_exp-claude_3_7_sonnet_latest_ag-gpt_4o.csv
222,,672.0,"In a doctor's office, a man with a rat's head, dressed in a lab coat and tie, sits behind a cluttered desk with a computer, papers, and a prescription pad. He is handing a prescription to a patient seated across from him. The walls are adorned with framed certificates. The rat-headed doctor appears to be speaking.","Trust me, I know the plague when I see it.",The doctor is diagnosing him with the plague,"The humor in this caption plays on the historical association between rats and the bubonic plague. Rats (and their fleas) were primary vectors for spreading the ""Black Death"" that devastated medieval Europe. 

By having a rat-headed doctor claim expertise about the plague, the caption creates ironic tension - this character belongs to the very species infamous for transmitting the disease. It's like a fox claiming special insight about henhouse security.

The phrase ""Trust me"" becomes darkly comedic - why would a patient trust plague diagnosis from a rat? The doctor essentially admits to intimate familiarity with a disease his kind helped proliferate, transforming what would normally be reassuring medical expertise into an unsettling reminder of the doctor's rodent nature.

The caption cleverly subverts the expected doctor-patient dynamic by turning the doctor's presumed medical knowledge into something more sinister - recognition born from being part of the problem rather than the solution.",FAIL,"The student's answer does not explicitly discuss the anticipated answer point, which is that the doctor is diagnosing the patient with the plague. Instead, the student's response focuses more on the ironic and historical connection between rats and the bubonic plague, along with the darkly comedic and sinister implications of the rat-headed doctor's knowledge. This does not directly cover the specific comedic element of the doctor's diagnosis of the plague.",claude-3-7-sonnet-latest,"{""tokens_in"": 217, ""tokens_out"": 589}",gpt-4o,"{""tokens_in"": 518, ""tokens_out"": 95}",20250506_171410_claude_thinking_budget_8192_exp-claude_3_7_sonnet_latest_ag-gpt_4o.csv
232,,679.0,"A king with a long beard and a crown sits on a throne surrounded by various potted cacti and a Venus flytrap. A knight in armor stands to the right, holding a sword and speaking to the king. The scene is set in a desert-like environment, with the king appearing contemplative.","Well, after you beheaded the groundskeeper, we had to go with something low-maintenance.",This mocks kings' tendencies to execute people for minor things,"The humor stems from the juxtaposition between a horrific act (the king beheading the groundskeeper) and the mundane, practical consequence (switching to low-maintenance plants). The knight delivers this dark news with a casual, matter-of-fact tone that normalizes the king's violent behavior as merely an inconvenience requiring a practical workaround.

The caption cleverly explains why the throne room is filled with cacti and a Venus flytrap – plants requiring minimal care – while simultaneously revealing the king's tyrannical nature. There's an implied criticism of leadership here: the king's impulsive cruelty created a staffing problem that his subordinates had to solve pragmatically.

The humor relies on the absurd workplace logic applied to a medieval setting: ""Since you executed our gardener, we had to pivot to a desert landscaping strategy."" It's funny precisely because it treats something horrific (execution) as just an everyday management challenge, highlighting the bizarre power dynamics of castle life.",FAIL,"The student's answer highlights the juxtaposition between the king's violent behavior and the practical solution of adopting low-maintenance plants. However, it focuses on the absurdity and management logic without explicitly mocking the tendency of kings to execute people for trivial reasons. The emphasis is more on the absurd resolution to a tyrannical act rather than critiquing the habit of execution for minor offenses.",claude-3-7-sonnet-latest,"{""tokens_in"": 217, ""tokens_out"": 598}",gpt-4o,"{""tokens_in"": 534, ""tokens_out"": 92}",20250506_171410_claude_thinking_budget_8192_exp-claude_3_7_sonnet_latest_ag-gpt_4o.csv
254,,692.0,"In a surreal costume shop, a wolf dressed in a sheep costume stands on a pedestal, admiring itself in a mirror. Nearby, a man in a suit is holding various animal costumes, including a zebra, goat, and unicorn. The scene is filled with an array of animal disguises, some hanging from the ceiling and others draped over furniture. The wolf is speaking.",Perfect! I'm surprising someone for dinner.,"""Surprising someone for dinner"" typically implies they get dinner together, but here, the wolf surprises them to kill and eat them as his dinner","This caption plays on the classic ""wolf in sheep's clothing"" idiom, creating dark humor through clever misdirection. The wolf's statement ""Perfect! I'm surprising someone for dinner"" contains an intentional double meaning. On the surface, it could mean the wolf is attending a dinner and wants to surprise other guests with its costume. However, the predatory implication is that the wolf isn't going to dinner – it's planning to make someone into dinner by using the sheep disguise to hunt unsuspecting prey.

The humor stems from this sinister wordplay around ""surprising someone for dinner"" versus ""surprising someone AS dinner."" The caption cleverly maintains the wolf's natural predatory character while placing it in the modern, mundane context of shopping for costumes. The wolf's enthusiasm (""Perfect!"") about its deceptive plan adds to the dark comedy, as it casually discusses its hunting strategy as if it were simply choosing an outfit for a social occasion.",PASS,"The student's answer explicitly discusses the double meaning of ""surprising someone for dinner"" by stating that the wolf is planning to make someone into dinner instead of simply attending a dinner. This captures the dark humor and misdirection involved in the anticipated answer point.",claude-3-7-sonnet-latest,"{""tokens_in"": 224, ""tokens_out"": 588}",gpt-4o,"{""tokens_in"": 552, ""tokens_out"": 66}",20250506_171410_claude_thinking_budget_8192_exp-claude_3_7_sonnet_latest_ag-gpt_4o.csv
262,,700.0,"A centaur, dressed in a suit, stands at a pharmacy counter holding a coffee cup, speaking to a pharmacist behind the counter holding a pill bottle. The pharmacy shelves are filled with various bottles and boxes of medication. There is a bench to the right of the centaur. The pharmacist is speaking, unfazed by the centaur.","They didn’t specify which one, but your insurance will only cover half.","Covering half typically means paying for half of the cost, but here refers to the two halves of the man","The joke plays on the dual nature of a centaur (half-human, half-horse) by combining it with the common frustration of health insurance limitations. When the pharmacist says ""your insurance will only cover half,"" there's a deliberate ambiguity about which ""half"" is covered—either half the cost of the medication (the standard insurance meaning) or medication for only one half of the centaur's body (human or horse). 

The humor comes from applying literal bureaucratic logic to a mythological creature, creating an absurd intersection of fantasy and mundane modern problems. The joke works by treating the centaur as just another customer dealing with insurance restrictions, while simultaneously acknowledging its hybrid nature. It's also amusing that the pharmacist delivers this news matter-of-factly, as if insurance policies for centaurs are completely routine.",PASS,"The student’s answer explicitly covers the key comedic element by discussing the centaur's dual nature leading to ambiguity about which ""half"" is covered, whether it is the cost of medication or one half of the centaur’s body. This captures the intended comedic twist involving insurance coverage of ""half"" as it applies to a centaur.",claude-3-7-sonnet-latest,"{""tokens_in"": 222, ""tokens_out"": 565}",gpt-4o,"{""tokens_in"": 522, ""tokens_out"": 83}",20250506_171410_claude_thinking_budget_8192_exp-claude_3_7_sonnet_latest_ag-gpt_4o.csv
