idx,cartoonstock_id,contest_number,description,caption,element,explanation,autograder_judgment,autograder_reasoning,explainer_model,explainer_usage,autograder_model,autograder_usage,source_file
77,,59.0,"A man, seated at his desk in an office, is on the phone with a slightly anxious expression. Behind him, hanging on the wall, is a large clock where the usual numbers are replaced by punctuation and symbols (like #, @, %). A framed family photo hangs nearby, and a potted plant sits beside the desk, completing the office setting.",Let me call you back in an umlaut.,"Consistent with the clock, the man is referring to a quantity of time by a grammatical mark.","The joke plays on the absurdity of using typographical symbols as units of time. In the cartoon, the office clock has punctuation marks and symbols instead of numbers, creating a bizarre timekeeping system. The humor comes from the man casually saying he'll call back ""in an umlaut"" (the diacritic mark ""¨"" used over vowels in some languages) as if it were a perfectly normal time measurement, like ""in an hour"" or ""in a minute."" The comedy lies in the man treating this nonsensical system as completely ordinary within his professional environment. It creates a surreal mini-universe where language symbols have replaced conventional time units, yet business continues as usual. The juxtaposition of the mundane office setting with this strange linguistic timekeeping elevates the absurdity while the man's matter-of-fact delivery suggests everyone in his world understands exactly what ""an umlaut"" of time means.",PASS,"The student's answer explicitly identifies the comedic device as using typographical symbols (like an umlaut) as units of time, in line with the clock's punctuation instead of numbers. This is consistent with the anticipated answer point that highlights the absurdity of using a grammatical mark to measure time.",claude-3-7-sonnet-latest,"{""tokens_in"": 220, ""tokens_out"": 574}",gpt-4o,"{""tokens_in"": 537, ""tokens_out"": 73}",20250416_204832_claude_thinking_budget_4096_exp-claude_3_7_sonnet_latest_ag-gpt_4o.csv
80,,61.0,"A doctor wearing a head mirror and standing behind a desk is in a typical doctor's offide. However, a giant hand is reaching through the doorway, facing up. The doctor is reaching over the desk to check the enormous hand's pulse.",I don't know why you're so jolly—your cholesterol is through the roof.,"This is a play on words. While ""through the roof"" typically means very elevated levels, here the giant patient is literally breaking through the roof.","The joke juxtaposes the surreal image of a giant hand in a doctor's office with an utterly mundane medical interaction. The humor stems from the doctor treating this extraordinary appendage as a routine patient, speaking to it as if the hand represents a complete person with both physical conditions and emotional states (""jolly""). 

The caption creates comedy through incongruity: while the visual shows a pulse check on a giant hand—already absurd—the doctor casually mentions cholesterol problems, adding another layer of medical discussion that normalizes the bizarre scenario. 

There's also humor in the implication that the hand's owner is cheerful despite poor health, creating a personality for someone we only see represented by a hand. The doctor's matter-of-fact tone in the face of such a ridiculous scenario epitomizes classic New Yorker cartoon humor—treating the surreal as mundane.

The caption essentially performs a comedic pivot from the visual absurdity we expect the joke to be about, instead landing on ordinary health advice that might be given to any regular-sized, complete human patient.",FAIL,"The student's answer focuses on the juxtaposition of the surreal image with a mundane interaction, the incongruity between the doctor's casual tone and the bizarre scenario, and the humor in treating the hand as a complete person. However, it does not address the specific play on words involving the phrase ""through the roof"" and its double meaning in this context. The anticipated answer point highlights the literal interpretation of the phrase due to the giant hand, which the student's response does not explicitly discuss.",claude-3-7-sonnet-latest,"{""tokens_in"": 201, ""tokens_out"": 584}",gpt-4o,"{""tokens_in"": 553, ""tokens_out"": 112}",20250416_204832_claude_thinking_budget_4096_exp-claude_3_7_sonnet_latest_ag-gpt_4o.csv
81,,62.0,"In an office setting, a man in a suit is seated behind his desk, observing a chaotic scene. Another man, bent forward with an expression of rage, is being ridden by a woman who’s perched on his back like a rodeo rider, arm raised triumphantly, holding on to his tie. The man behind the desk is speaking.",This new M.B.A. crop is so hard to break.,"This would typically refer to ""breaking in"" newly hired employees to the company culture, but in this scene, refers to taming or ""breaking"" a horse","The joke plays on rodeo terminology to satirize corporate culture. ""Breaking"" refers to the process of training a wild horse to be ridden, and the caption cleverly applies this concept to new MBA graduates entering the workforce. The visual literally depicts someone being ""ridden"" like a bucking bronco, with his tie serving as reins.

The humor comes from the implication that new business school graduates, despite their prestigious education, are like untamed animals that need to be ""broken"" to fit into corporate culture. The word ""crop"" furthers this metaphor, treating the MBAs as livestock or agricultural products rather than educated professionals.

This caption creates comedy through the unexpected comparison between polished business professionals and wild animals, while commenting on corporate power dynamics where new employees must be subdued and molded to fit organizational expectations. It subverts our expectations about MBA graduates being ready-made corporate material.",PASS,"The student's answer explicitly identifies the use of rodeo terminology and the metaphor of ""breaking"" as it applies to new MBA graduates, both key comedic elements highlighted in the anticipated answer point. The answer notes the connection between the depicted scene and the idea of taming or ""breaking"" a horse, which aligns with the anticipated answer's focus on this element.",claude-3-7-sonnet-latest,"{""tokens_in"": 221, ""tokens_out"": 554}",gpt-4o,"{""tokens_in"": 544, ""tokens_out"": 87}",20250416_204832_claude_thinking_budget_4096_exp-claude_3_7_sonnet_latest_ag-gpt_4o.csv
85,,65.0,"In a business setting, a mixure of business people and cartoonish robots sit around a board room table, taking a vote. All of the robots are raising their hands, while only one human is nervously raising his hand, sitting between two robots. At the head of the table, an old man leading the table leans over and yells furiously at the human raising his hand.","You're voting with your pacemaker again, Hargrove!","This is a direct twist on ""voting with your heart""","This caption creates humor by suggesting an unexpected technological influence on human decision-making. The joke hinges on the idea that Hargrove's electronic pacemaker is causing him to vote in alignment with the robots rather than with his fellow humans. The pacemaker—a medical device meant to regulate heartbeats—is humorously portrayed as overriding Hargrove's free will, creating an electronic ""alliance"" with the robots. 

The humor works on multiple levels: it plays on fears about technology controlling humans, suggests the comical notion that electronic devices might have their own voting bloc, and provides an absurdist explanation for why one person would side with machines. There's also implied commentary on groupthink and conformity in corporate settings.

The punchline cleverly explains the visual (why only one human is voting with the robots) through an unexpected technological conspiracy involving an implanted medical device, creating a satisfying ""aha"" moment that ties the cartoon elements together.",FAIL,"The student's answer focuses on the broader comedic elements of technological influence and unexpected behavior but does not explicitly cover the anticipated answer point of the twist on ""voting with your heart."" The specific wordplay of ""voting with your heart"" being interpreted as voting with a pacemaker is key to the humor but is not addressed in the student's explanation.",claude-3-7-sonnet-latest,"{""tokens_in"": 227, ""tokens_out"": 572}",gpt-4o,"{""tokens_in"": 541, ""tokens_out"": 85}",20250416_204832_claude_thinking_budget_4096_exp-claude_3_7_sonnet_latest_ag-gpt_4o.csv
95,,79.0,"Two men in suits are standing on a sidewalk near a fire hydrant, looking up at an apartment building. All the windows on the building are rotated 90 degrees, so they appear sideways, including a man leaning out of one window, who is also rotated to match the window’s orientation. The two men on the sidewalk appear perplexed or curious about the unusual building.",Looks like another side-rise is springing up.,"This is a play on ""high-rise"" style appartments. Because the building is sideways, the roof would be on the side.","This caption creates humor through clever wordplay by transforming the familiar term ""high-rise"" into ""side-rise"" to describe the sideways-oriented building. The joke works because it treats the absurdly sideways architecture as if it's merely the latest trend in urban development rather than a physical impossibility. The phrase ""another side-rise is springing up"" mimics the resigned tone people use when discussing rapid urban development and gentrification, suggesting this bizarre architectural choice is just one more in a series of questionable building trends. The humor comes from the men's matter-of-fact reaction to something completely surreal, implying that city dwellers have become so accustomed to strange architectural innovations that even sideways buildings barely warrant surprise. It's effectively satirizing both modern architecture and how quickly people normalize the absurd in urban environments.",PASS,"The student's answer captures the key comedic element of the anticipated answer point. It identifies the wordplay on ""high-rise"" to ""side-rise"" and addresses the building's orientation being sideways as a humorous twist, matching the anticipated explanation of the roof being on the side due to the building's orientation.",claude-3-7-sonnet-latest,"{""tokens_in"": 228, ""tokens_out"": 537}",gpt-4o,"{""tokens_in"": 523, ""tokens_out"": 76}",20250416_204832_claude_thinking_budget_4096_exp-claude_3_7_sonnet_latest_ag-gpt_4o.csv
96,,79.0,"Two men in suits are standing on a sidewalk near a fire hydrant, looking up at an apartment building. All the windows on the building are rotated 90 degrees, so they appear sideways, including a man leaning out of one window, who is also rotated to match the window’s orientation. The two men on the sidewalk appear perplexed or curious about the unusual building.",The elevator takes some getting used to.,"While an elevator typically goes up and down, given the sideways building, we can imagine it goes side to side","The joke creates a logical (though absurd) explanation for why all the windows and the resident are rotated 90 degrees: the building's elevator apparently operates sideways, forcing inhabitants to adapt to a perpendicular lifestyle. The humor works through the juxtaposition of something completely impossible (sideways living) with the understated, matter-of-fact delivery suggesting this is merely an inconvenience that ""takes some getting used to."" The caption cleverly implies that the building's inhabitants have simply adjusted to this bizarre architectural quirk, and that the confused onlookers are witnessing the result of functional adaptation rather than a surreal impossibility. By framing an absurd situation as a minor adjustment issue, the joke plays on the human tendency to normalize even the most outlandish circumstances.",PASS,"The student's answer explicitly discusses the comedic effect of the building's sideways orientation, including the conceptualization of a ""sideways elevator."" While the phrasing differs slightly, the student captures the anticipated point that the elevator operates in an absurd or unusual manner to fit the sideways logic of the building. This aligns with the anticipated answer point by addressing the humor derived from the sideways operation of the elevator and living space.",claude-3-7-sonnet-latest,"{""tokens_in"": 224, ""tokens_out"": 492}",gpt-4o,"{""tokens_in"": 507, ""tokens_out"": 97}",20250416_204832_claude_thinking_budget_4096_exp-claude_3_7_sonnet_latest_ag-gpt_4o.csv
109,,92.0,"A man and a woman stand on a city sidewalk. The man is reaching into his pocket as if to give something to a dolphin standing upright on its tail, which is holding out a cup in a begging gesture. The woman, appearing angry, is yelling at the man, likely in protest of his action.","Give him money, and you feed him today; teach him how to earn money by somersaulting on cue, and you feed him for life.","This is a play on the addage about ""Give a man a fish...""","This caption riffs on the familiar proverb ""Give a man a fish, and you feed him for a day; teach a man to fish, and you feed him for life."" The humor comes from applying this wisdom about human self-sufficiency to a begging dolphin in an urban setting. Instead of suggesting the dolphin learn to fish (which would be the obvious parallel, and something dolphins naturally do), the caption proposes teaching the dolphin to perform tricks for money—playing on the common exploitation of dolphins in marine shows. The joke works on multiple levels: it highlights the absurdity of a dolphin panhandling in the city, comments on our tendency to commodify animal behaviors for entertainment, and reframes what appears to be the woman's moral objection as pragmatic career advice for the dolphin. There's also irony in suggesting that training the dolphin to perform for humans constitutes ""self-sufficiency"" when it would actually create a different form of dependency.",PASS,"The student's answer explicitly covers the anticipated answer point by identifying the play on the adage ""Give a man a fish, and you feed him for a day; teach a man to fish, and you feed him for life"" as the basis of the humor. The student correctly recognizes this comedic device and expands on it by discussing the absurdity and irony present in the cartoon and caption.",claude-3-7-sonnet-latest,"{""tokens_in"": 231, ""tokens_out"": 585}",gpt-4o,"{""tokens_in"": 547, ""tokens_out"": 93}",20250416_204832_claude_thinking_budget_4096_exp-claude_3_7_sonnet_latest_ag-gpt_4o.csv
112,,96.0,"A pregnant woman, wearing primitive clothing, sits on a large tree branch or vine, holding her belly and speaking. Tarzan, shirtless and wearing a loincloth, stands nearby, leaning against a tree. The background features trees and jungle foliage.","Well, you'll be a monkey's uncle.","This a literal twist on the idiom, ""well I'll be a monkey's uncle""","The joke plays on the common expression ""I'll be a monkey's uncle,"" which is typically used to express surprise or disbelief. Here, the caption cleverly transforms this figurative idiom into a literal statement that perfectly fits Tarzan's unique backstory. Since Tarzan was famously raised by apes in the jungle, he has a familial relationship with primates. The pregnant woman is informing Tarzan that he will literally become an ""uncle"" to monkeys - suggesting either that his ""adopted"" ape family will have offspring, or playfully implying something about their own child's connection to the jungle world. The humor emerges from this perfect alignment between a common expression and Tarzan's unusual life circumstances, creating a pun that works on multiple levels.",PASS,"The student’s answer explicitly identifies the comedic element of the literal twist on the expression ""I'll be a monkey's uncle."" The explanation discusses how the idiom is cleverly tied to Tarzan’s backstory, aligning with the anticipated answer point about the pun's dual meaning—both figurative and literal.",claude-3-7-sonnet-latest,"{""tokens_in"": 199, ""tokens_out"": 519}",gpt-4o,"{""tokens_in"": 480, ""tokens_out"": 76}",20250416_204832_claude_thinking_budget_4096_exp-claude_3_7_sonnet_latest_ag-gpt_4o.csv
118,,102.0,"In an outdoor setting, two dogs are sitting on the grass, watching as another dog, standing upright like a human, throws a stick into the distance. The upright dog appears to mimic the typical action of a person playing fetch with dogs. The seated dogs look confused or uncertain.",He's his own best friend.,"This plays on the common phrase, ""A dog is a man's best friend""","This caption cleverly plays on the well-known phrase ""dog is man's best friend."" In the cartoon, we see a dog who has adopted human behavior by standing upright and throwing a stick—essentially taking on the role that a human normally would in a game of fetch. The humor comes from this role reversal and the implied self-sufficiency of the upright dog. By stating ""He's his own best friend,"" the caption suggests that this dog has eliminated the need for human companionship by becoming both the human and the dog in the traditional fetch relationship. He's serving as both the thrower (typically the human role) and the dog simultaneously, creating a paradoxical situation where he's fulfilling both sides of the ""best friend"" dynamic. The confused looks from the other dogs heighten the humor by emphasizing how unusual this self-contained friendship is in the dog world.",PASS,"The student's answer explicitly addresses the anticipated comedic element by discussing the play on the phrase ""dog is man's best friend."" They elaborate on how the cartoon's humor derives from the role reversal where a dog fulfills both the human and dog roles in a fetch game, directly tying back to the familiar phrase. Therefore, the key comedic point is covered.",claude-3-7-sonnet-latest,"{""tokens_in"": 198, ""tokens_out"": 513}",gpt-4o,"{""tokens_in"": 501, ""tokens_out"": 84}",20250416_204832_claude_thinking_budget_4096_exp-claude_3_7_sonnet_latest_ag-gpt_4o.csv
121,,104.0,"Two angels, complete with wings and halos, sit on a street curb against a brick wall, drinking from bottles. A police car with two officers, also angels with wings and halos, drives in front of them. The scene is parially a dirty city with trash cans and a boarded up window, and partially swirling clouds reminiscent of heaven.","Except here it's always good cop, good cop.","While the typical phrase is ""good cop, bad cop,"" because everyone in heaven is presumably good, there is only good cop","The joke plays on the familiar interrogation technique known as ""good cop, bad cop,"" where one officer acts friendly while the other is aggressive. In this heavenly version of a gritty urban scene, the caption cleverly suggests that since all involved are angels (presumed to be inherently virtuous), there can only be ""good cops""—no bad ones exist in heaven. 

The humor comes from applying earthly law enforcement dynamics to a celestial realm, suggesting that even in paradise, some policing is necessary. The contrast between the sordid urban setting (drinking on the street, trash, boarded windows) and the divine nature of its inhabitants creates a delightful absurdity. 

The caption also wryly implies that despite being in heaven, some behaviors still require policing, but the approach must necessarily be gentler than on Earth. It's a playful commentary on both police tactics and the expected moral purity of heavenly beings.",PASS,"The student's answer captures the key comedic element of the anticipated answer point by discussing the substitution of ""bad cop"" with ""good cop"" due to the heavenly setting, where all characters are inherently good, leading to only ""good cops"" existing. The student effectively explains the joke's basis in the twist of the familiar phrase ""good cop, bad cop"" to fit a celestial scenario where no one is bad.",claude-3-7-sonnet-latest,"{""tokens_in"": 221, ""tokens_out"": 558}",gpt-4o,"{""tokens_in"": 538, ""tokens_out"": 98}",20250416_204832_claude_thinking_budget_4096_exp-claude_3_7_sonnet_latest_ag-gpt_4o.csv
123,,106.0,"In a laboratory, a man in a lab coat is holding a stack of papers and reading from one of them, with a clipboard under one arm. Beside him, a monkey is using a typewrighter on a desyk, with half of a page sticking out. Behind them, several monkeys are in cages stacked on top of each other, holding the bars of the cage. One monkey in a cage is reading from a stack of papers. ",Have you considered writing this story in the third monkey rather than the first monkey?,"This is a subversion of the typical phrases ""first person"" and ""third person,"" where the writer is a monkey, not a person","This caption creates humor by cleverly transforming the traditional literary concept of ""first person"" versus ""third person"" narrative voice into ""first monkey"" versus ""third monkey."" The joke works on multiple levels: it subverts the famous ""infinite monkey theorem"" (monkeys randomly typing eventually producing Shakespeare) by suggesting these monkeys are engaged in deliberate storytelling with editorial considerations. It elevates the monkey from test subject to author receiving professional feedback from the scientist, who's acting as an editor. The caption implies a sophisticated creative writing process among the primates, complete with narrative perspective choices. The humor stems from this absurd role reversal and the unexpected application of literary terminology to monkey subjects, creating a world where simian literature has its own grammatical rules parallel to human writing. It's essentially a linguistic pun that transforms the power dynamics of the laboratory setting into a writer's workshop for monkeys.",PASS,"The student's answer explicitly covers the key comedic element, which is the subversion of the typical phrases ""first person"" and ""third person"" by replacing ""person"" with ""monkey."" The student correctly identifies this as a linguistic pun and explains the role reversal where monkeys engage in deliberate storytelling, which captures the anticipated answer point.",claude-3-7-sonnet-latest,"{""tokens_in"": 244, ""tokens_out"": 542}",gpt-4o,"{""tokens_in"": 562, ""tokens_out"": 82}",20250416_204832_claude_thinking_budget_4096_exp-claude_3_7_sonnet_latest_ag-gpt_4o.csv
127,,108.0,"A caveman is sweeping inside his garage-like wooden structure with a shop-like display, while two others stand inside a rock cave, speaking to each other. Volcanic activity in the background emphasizes the prehistoric setting",He's always thinking outside the rock.,"This is a play on the phrase ""thinking outside the box""","The joke plays on the modern phrase ""thinking outside the box,"" which refers to creative or unconventional thinking. Here, the phrase is cleverly adapted to the prehistoric setting by substituting ""rock"" for ""box,"" creating an anachronistic wordplay that works on multiple levels.

The humor comes from applying modern corporate jargon to caveman times, with the visual evidence right in the cartoon: one caveman has literally moved beyond living in a rock cave by creating a more sophisticated wooden structure with shop-like features. He's physically ""outside the rock"" while also being figuratively more innovative than his cave-dwelling peers.

The caption wittily suggests that even in prehistoric times, there were early adopters and innovators who distinguished themselves from the crowd—a commentary on human progress that spans from the Stone Age to our modern obsession with innovation and disruption.",PASS,"The student's answer explicitly mentions the play on the phrase ""thinking outside the box,"" identifies the substitution of ""rock"" for ""box"" in the caption, and explains how this contributes to the humor. Thus, the key comedic element of wordplay is captured in the student's response.",claude-3-7-sonnet-latest,"{""tokens_in"": 185, ""tokens_out"": 514}",gpt-4o,"{""tokens_in"": 485, ""tokens_out"": 72}",20250416_204832_claude_thinking_budget_4096_exp-claude_3_7_sonnet_latest_ag-gpt_4o.csv
