idx,cartoonstock_id,contest_number,description,caption,element,explanation,autograder_judgment,autograder_reasoning,explainer_model,explainer_usage,autograder_model,autograder_usage,source_file
3,,2.0,"A group of adults dressed in business attire are seated around a table in a meeting. However, the scene is inside of a bus or subway car, with handles and windows. The person at the head of the table is speaking.","Frank called to say he'll be late, he's stuck at the office.",This is specifically a wordplay reversing the more common phrase “being late to the office while stuck in transit”.,"The humor flips the usual excuse. We expect a commuter to be “late to the office because he’s stuck on the train.” In the drawing, however, the “office” is literally a conference-room table set up inside a subway car; the staff conducts meetings while riding. So when the speaker says Frank “will be late, he’s stuck at the office,” the words describe the opposite of the normal situation: Frank can’t get to the moving conference because he’s back in a conventional, stationary office. The mismatch between corporate routine and public transit, plus the reversed excuse, creates the joke.",PASS,"The student's answer captures the key comedic element of wordplay by explaining how the usual phrase about being late due to being stuck in transit is reversed to being late because someone is stuck in the office. The explanation discusses the inversion of the typical situation, aligning with the anticipated answer point. Thus, it covers the anticipated comedic device adequately.",o3,"{""tokens_in"": 88147, ""tokens_out"": 182698}",gpt-4o,"{""tokens_in"": 456, ""tokens_out"": 82}",20250506_180913_o3_high_exp-o3_ag-gpt_4o.csv
8,,7.0,"In a bedroom, a couple is in bed. The wife is sitting upright, while the husband who is speaking is laying down. Next to the bed is a nightstand under a window. Through the window is a view of outer space, with all of Earth visible. The window is open with the curtains drawn.",You always get like this when there's a full Earth.,"This caption reverses the idea of a ""full moon"" with a ""full earth""","The caption riffs on the familiar cliché that “people act crazy when there’s a full Moon.”  The drawing flips the viewpoint: the couple’s bedroom is somewhere off-planet—likely on the Moon—so the celestial body dominating the night sky is not the Moon but Earth.  The husband’s line, “You always get like this when there’s a full Earth,” substitutes “Earth” for “Moon,” treating Earth’s fully lit disk as the lunar equivalent of a “full Moon.”  The humor comes from this perspective reversal: what is a commonplace marital complaint on Earth becomes an identical complaint from a moon-dweller, exposing the arbitrariness of the superstition while giving an everyday domestic gripe a cosmic scale.",PASS,"The student's answer effectively discusses the key comedic element, which is the reversal of the idea of a ""full moon"" with a ""full earth."" The student's explanation incorporates how the comic flips the viewpoint and substitutes ""Earth"" for ""Moon,"" capturing the essence of the humor in the caption.",o3,"{""tokens_in"": 0, ""tokens_out"": 0}",gpt-4o,"{""tokens_in"": 491, ""tokens_out"": 75}",20250506_180913_o3_high_exp-o3_ag-gpt_4o.csv
22,,20.0,"In a living room cocktail party setting, two couples in nice clothes are standing in a circle, holding champagne glasses. However one of the men is miniature, only reaching knee-hight. The other couple looks down on the tiny man, while the woman he is with is cheerfully speaking to the other couple. ",We met at the mini bar.,"This combines the typical phrase ""we met at a bar"" with the term minibar, because the man himself is miniature.","The caption turns the common party question “So, where did you two meet?” into a pun. Normally, a “minibar” is the little fridge of drinks in a hotel room. But because the woman’s partner is literally miniature, “mini bar” also pictures a bar scaled to his tiny stature. The line cleverly fuses these two meanings—hotel minibar and undersized drinking venue—while echoing the routine reply “We met at the bar.” The humor comes from that unexpected double entendre and the visual proof standing knee-high beside her.",PASS,"The student's answer captures the anticipated comedic element by explaining how the caption involves a pun and double entendre. The explanation highlights both interpretations of ""mini bar""—the common hotel minibar and the idea of a bar for someone miniature in stature—thus covering the anticipated answer point's focus on the miniature aspect and the play on words. The student also notes the humor arising from this double meaning, aligning with the anticipated answer point.",o3,"{""tokens_in"": 0, ""tokens_out"": 0}",gpt-4o,"{""tokens_in"": 457, ""tokens_out"": 100}",20250506_180913_o3_high_exp-o3_ag-gpt_4o.csv
27,,25.0,"In a social setting, several people are standing in a room wearing business attire and holding drinks. Two couples face each other, but the man in one of the couples is dressed in a full, vintage-style deep-sea diving suit, complete with a helmet and a hose attached to the back, looking somewhat uncomfortable.",This suit looked way better in the store.,"This is a play on words on ""suit,"" as in a formal suit or a diving suit.","The humor rests on the double meaning of “suit.” In normal cocktail-party small talk, someone might complain that a newly bought business suit looked better in the store than it does on them at the party. Here, however, the man has shown up in a gigantic, antiquated deep-sea diving suit—ludicrously out of place amid well-dressed partygoers. By treating this bizarre piece of gear as just another piece of formal wear that didn’t translate well from the dressing room to real life, he applies a banal fashion cliché to an absurd situation, creating comic incongruity.",PASS,"The student's answer directly addresses the double meaning of ""suit,"" elaborating on the comedic effect of using an unexpected type of suit (a diving suit) in a formal setting where a business suit would be expected. This captures the anticipated comedic element of wordplay on ""suit.""",o3,"{""tokens_in"": 0, ""tokens_out"": 0}",gpt-4o,"{""tokens_in"": 469, ""tokens_out"": 73}",20250506_180913_o3_high_exp-o3_ag-gpt_4o.csv
30,,27.0,"Several men in suits are seated around a boardroom table with coffee mugs and documents. At the head of the table, one man is standing with his arms crossed. Everyone seated has a parrot sitting on their shoulder. One seated person with a parrot is speaking angrily to the man to his left.",We have to find a better way to record our meetings.,Parrots are known to repeat language,"The joke turns on the double meaning of “record.” In offices, meetings are normally “recorded” with minutes or audio devices. Parrots, however, “record” only by mindlessly repeating what they’ve heard. The cartoon shows every executive with a parrot on his shoulder as if the birds are the firm’s official recording system. The speaker’s earnest complaint—“We have to find a better way to record our meetings”—treats this absurd, piratical setup as a legitimate but sub-optimal business practice, exposing the ridiculous mismatch between a modern boardroom’s needs and a parrot’s crude mimicry. The humor comes from that deadpan corporate seriousness applied to a ludicrous, literal solution.",PASS,"The student's answer explicitly covers the key comedic element by explaining that parrots ""record"" by repeating what they hear, which aligns with the anticipated point that parrots are known to repeat language.",o3,"{""tokens_in"": 0, ""tokens_out"": 0}",gpt-4o,"{""tokens_in"": 482, ""tokens_out"": 54}",20250506_180913_o3_high_exp-o3_ag-gpt_4o.csv
33,,29.0,"A bald man in glasses and a suit points at a chart on an easel with a stick. The chart appears to be a map with two distinct cell-like patterns, one in the middle resembling clusters of ovals and another on the sides with a denser, smaller pattern. To the left, another man in a suit stands beside the easel, holding or steadying it, while on the right, a seated individual listens attentively. In the window in the background, the Washington Monument is visible.","The inland tortellini are still with you, sir, but you're losing support with the coastal risottos.",This caption interprets the blobs on the chart as representing a nation of pasta,"The scene mimics a political briefing in Washington: a suit-and-pointer analyst explains a map of the country to a candidate or office-holder. Normally he’d say something like “You’re solid with rural voters but slipping on the coasts.” Instead, he treats Italian dishes as voting blocs: inland tortellini vs. coastal risottos. The clusters on the chart resemble little stuffed pasta and rice grains, so the foods plausibly “appear” on the map. The humor comes from substituting absurd culinary categories for real electoral demographics while keeping the grave campaign-pollster tone (“still with you, sir... losing support”). It lampoons how strategists slice the electorate into ever-narrower tribes and turns that technocratic language into a ridiculous discussion about pasta.",PASS,"The student's answer clearly captures the key comedic element: interpreting the blobs on the chart as representing pasta dishes, treating these foods as voting blocs, and maintaining a political tone. The answer describes how the humor arises from this culinary and political juxtaposition, consistent with the anticipated answer point.",o3,"{""tokens_in"": 0, ""tokens_out"": 0}",gpt-4o,"{""tokens_in"": 548, ""tokens_out"": 72}",20250506_180913_o3_high_exp-o3_ag-gpt_4o.csv
36,,30.0,"In a doctor’s office, a doctor wearing a lab coat and head mirror is speaking to a patient seated across the desk. The patient, dressed in a suit, is facing the doctor, seemingly engaged in conversation. However, standing behind the doctor is a mysterious figure wearing a trench coat, hat, and dark glasses, with their hands in their pockets. The desk between them holds a stethoscope, a notepad, a pen on a stand, and another small object.",That rash will need constant monitoring.,"While a private investigator typically monitors a person's whereabouts, in this setting, they are monitoring a rash.","The doctor’s line is a commonplace piece of medical advice: a skin rash “needs constant monitoring.” The humor comes from the incongruous visual detail that, right as he says this, a suspicious trench-coated figure—looking every bit like a private eye or government spook—stands behind him. The caption’s phrase “constant monitoring” thus gains a second, literal meaning: the rash won’t just be watched by the patient or doctor; it already has its own round-the-clock surveillance agent. The joke hinges on the double meaning of “monitoring” (routine medical observation vs. cloak-and-dagger surveillance) and the absurd escalation of a minor dermatological problem being treated like a national-security threat.",PASS,"The student’s answer explores the double meaning of “monitoring,” which involves a private investigator-like figure monitoring a rash, similar to how they would monitor a person's whereabouts. This explanation aligns with the key comedic element of the anticipated answer point.",o3,"{""tokens_in"": 0, ""tokens_out"": 0}",gpt-4o,"{""tokens_in"": 518, ""tokens_out"": 64}",20250506_180913_o3_high_exp-o3_ag-gpt_4o.csv
37,,30.0,"In a doctor’s office, a doctor wearing a lab coat and head mirror is speaking to a patient seated across the desk. The patient, dressed in a suit, is facing the doctor, seemingly engaged in conversation. However, standing behind the doctor is a mysterious figure wearing a trench coat, hat, and dark glasses, with their hands in their pockets. The desk between them holds a stethoscope, a notepad, a pen on a stand, and another small object.","Instead of an expensive, invasive procedure, we've decided to beat it out of you.","This plays on the phrase “beat it out of you,” taking it as literally removing something instead of its figurative meaning of coercing information.","The humor hinges on an incongruous substitution of medical treatment with a gangster-style interrogation. In a medical setting you expect the doctor to propose a costly, “invasive” surgical procedure. Instead, he offers a different kind of “non-invasive” solution: having the trench-coated tough guy behind him physically “beat it out of you.” The phrase “beat it out of you” normally means forcing someone to reveal information through violence; here it’s twisted to mean pounding an illness out of the patient. The visual of the looming enforcer and the doctor’s clinical tone heighten the absurd clash between professional medicine and street coercion, creating the joke.",PASS,"The student’s answer captures the anticipated answer point by identifying the humor in the literal interpretation of “beat it out of you.” They highlight the comedic element of the phrase being used to describe a medical procedure, thus addressing the key comedic device. The explanation of replacing a medical treatment with a physical beating shows an understanding of the literal versus figurative play on words, matching the anticipated point.",o3,"{""tokens_in"": 0, ""tokens_out"": 0}",gpt-4o,"{""tokens_in"": 526, ""tokens_out"": 93}",20250506_180913_o3_high_exp-o3_ag-gpt_4o.csv
40,,32.0,"In the cartoon, a person dressed in a full rabbit costume, carrying a briefcase and reading a sheet of paper, walks down a hallway in a typical office setting. Two business-suited colleagues stand nearby, looking somewhat puzzled, while another person peeks out from an office doorway.","Well, at least somebody remembered about casual Good Friday.","Play on words, mixing ""casual friday"" with ""Good Friday""","The humor hinges on a mash-up of two office customs/holidays. Many workplaces have “Casual Friday,” when staff may ditch suits for jeans. The speaker swaps in “Good Friday,” the solemn Christian holiday that falls two days before Easter. Because Easter’s secular mascot is the Easter Bunny, one employee has shown up in an over-the-top “casual” outfit—a full rabbit suit—thinking that’s the appropriate way to mark “Casual Good Friday.” The baffled coworkers highlight how wildly the costume overshoots the modest dress-down that would normally be expected. The gag comes from the absurd literalism: treating a holy day as just another relaxed dress code day and choosing the most on-the-nose costume possible.",PASS,"The student's answer explicitly covers the anticipated answer point. It identifies the wordplay involving the mix-up between ""Casual Friday"" and ""Good Friday"" and explains how this mix-up leads to the absurd situation of the employee wearing a full rabbit suit. The explanation clearly addresses the comedic element of the play on words.",o3,"{""tokens_in"": 0, ""tokens_out"": 0}",gpt-4o,"{""tokens_in"": 483, ""tokens_out"": 79}",20250506_180913_o3_high_exp-o3_ag-gpt_4o.csv
46,,36.0,"The cartoon shows two men in office attire. One man, standing with his arms crossed, looks at the other, who is visibly pregnant, with his shirt stretched tightly over his large belly. The pregnant man is speaking, seemingly addressing the other with a comment.",No one expects an immaculate conception until it happens to him.,The immaculate conception involved a virgin inexplicably getting pregnant. This caption plays on that to explain the man's inexplicable pregnancy.,"The humor hinges on an impossible reversal and a religious allusion. A visibly pregnant man—something biologically impossible—claims his condition is the result of an “immaculate conception,” the term Christians use for Mary’s miraculous, sex-free pregnancy. The familiar phrase “No one expects ­­­X until it happens to them” is tweaked to “him,” underscoring the absurdity that a man could face pregnancy at all. The line justifies the impossible situation with an equally unlikely miracle, blending office small-talk with biblical mythology. The clash of mundane corporate setting, an impossible male pregnancy, and a lofty theological explanation creates the comic surprise.",PASS,"The student's answer captures the key comedic element by discussing the religious allusion and the impossible situation, linking the unexpected male pregnancy to the concept of an ""immaculate conception."" The explanation also touches on the phrase modification that adds to the humor, aligning with the anticipated answer point's emphasis on the unexpected nature of the pregnancy explained through a miraculous event.",o3,"{""tokens_in"": 0, ""tokens_out"": 0}",gpt-4o,"{""tokens_in"": 472, ""tokens_out"": 85}",20250506_180913_o3_high_exp-o3_ag-gpt_4o.csv
47,,36.0,"The cartoon shows two men in office attire. One man, standing with his arms crossed, looks at the other, who is visibly pregnant, with his shirt stretched tightly over his large belly. The pregnant man is speaking, seemingly addressing the other with a comment.",The ultrasound says it's a keg of Bud Light.,"This explains the man's large belly as a beer belly, not a pregnancy","The joke hinges on the classic gag that a man’s “beer belly” resembles a pregnancy. By placing a suited office worker in the unmistakably pregnant pose and having him treat it like an ordinary medical pregnancy (“The ultrasound says…”), the caption fuses two incompatible ideas: masculine beer-drinking bloat and obstetric procedure. Instead of announcing a baby’s sex or due date, the “expectant father” reports that the scan revealed a keg of Bud Light—the very cause of his swollen abdomen. The humor comes from (1) the absurd literalization of a beer belly as an actual gestation, (2) the deadpan, clinical language used to describe something ridiculous, and (3) the specific brand shout-out, which grounds the fantasy in familiar frat-culture beer, sharpening the incongruity. Overall, it’s a playful reversal of pregnancy conventions applied to male overindulgence.",PASS,"The student's answer explicitly covers the anticipated answer point by explaining that the man's large belly is a beer belly and not a pregnancy. The student describes the belly resembling a pregnancy and the humor arising from treating a beer belly as an actual gestation, aligning with the anticipated answer point that focuses on the explanation of the large belly as a beer belly.",o3,"{""tokens_in"": 0, ""tokens_out"": 0}",gpt-4o,"{""tokens_in"": 512, ""tokens_out"": 84}",20250506_180913_o3_high_exp-o3_ag-gpt_4o.csv
48,,40.0,"The cartoon shows a woman in her underwear sitting up in bed, looking forward with a disgruntled expression. A large snow globe with a snowman inside is positioned next to her on the bed. The woman is speaking.","Well, that was abominable.","This plays on the phrase ""abominable snowman,"" a mythical creature","The humor hinges on a double meaning of “abominable.” In everyday speech it means “awful,” so the woman, apparently just after an intimate encounter, is bluntly criticizing how bad it was. But “Abominable” instantly evokes the “Abominable Snowman,” a mythical snowy creature. Because there is an oversized snow globe containing a snowman right beside her in bed, the reader is led to imagine that this snowman was her improbable partner. The caption simultaneously delivers a harsh bedroom review and a punny reference to a snow-related monster, tying the sexual disappointment to the snowy scene. The gag is the collision of bedroom talk and wintry wordplay.",PASS,"The student's answer successfully captures the key comedic element of the cartoon, which is the pun and wordplay involving ""abominable snowman."" The student explains how ""abominable"" is used both to critique the encounter and to reference the snow-related creature due to the presence of the snow globe, reflecting the anticipated answer point.",o3,"{""tokens_in"": 0, ""tokens_out"": 0}",gpt-4o,"{""tokens_in"": 459, ""tokens_out"": 82}",20250506_180913_o3_high_exp-o3_ag-gpt_4o.csv
51,,41.0,"In a grand church, there is a large bar stocked with bottles of liquor. A few patrons are seated at the bar, and sunbeams stream through the stained glass windows, dramatically illuminating one of the patrons. A couple dressed in formal church attire stands at the open doors, with the husband speaking.",Just don't order a Bloody Mary.,"This is a play on the dual meaning of ""Bloody Mary"", referring to both the alcoholic drink and the ghost of Mary I. of England, a common horror/supernatural character known for persecuting Protestants","The drawing mashes two normally separate worlds: a reverent church and a casual cocktail bar. The caption treats the church as if it’s just another tavern, warning the newcomer not to order a “Bloody Mary.” That drink name is funny here for two layered reasons. First, “Bloody Mary” is a popular brunch cocktail, so it fits a bar setting. But inside a church the words suddenly evoke sacred figures—the Virgin Mary and the “blood” central to Communion. Calling Mary “bloody” or requesting “blood” at the bar would sound blasphemous, even more so in the glow of stained-glass sunbeams. The humor lies in this double meaning: a perfectly ordinary drink order becomes a potentially sacrilegious faux-pas when the bar is bizarrely located in a sanctuary.",FAIL,"The student's answer primarily focuses on the juxtaposition of a church and a bar, emphasizing the potential sacrilegious nature of ordering a ""Bloody Mary"" in a church. However, the anticipated answer point specifically requires the dual meaning to include the ghost of Mary I of England, which is not addressed in the student's response. The student's mention of Virgin Mary and Communion blood does not align with the anticipated historical/supernatural reference to Mary I. Therefore, the student's answer does not explicitly cover the anticipated answer point.",o3,"{""tokens_in"": 0, ""tokens_out"": 0}",gpt-4o,"{""tokens_in"": 531, ""tokens_out"": 120}",20250506_180913_o3_high_exp-o3_ag-gpt_4o.csv
52,,41.0,"In a grand church, there is a large bar stocked with bottles of liquor. A few patrons are seated at the bar, and sunbeams stream through the stained glass windows, dramatically illuminating one of the patrons. A couple dressed in formal church attire stands at the open doors, with the husband speaking.",Hey! Who ya gotta pray to to get a drink around here?,"This plays on the common phrase, ""Who do you have to [verb] to get a drink around here""?","The humor comes from mashing together two very different milieus—church and bar. In a crowded saloon people gripe, “Who do you have to sleep with/bribe to get a drink around here?” The caption swaps in “pray” because the bar is inexplicably inside a cathedral, where prayer is the normal way to ask for something. The husband treats prayer as the transactional method for speeding up bar service, turning a sacred act into a customer complaint. The sacred architecture, stained-glass sunbeam and formal Sunday clothes clash with the mundane frustration of ordering booze, and that incongruity is the joke.",PASS,"The student's answer captures the key comedic element by discussing the incongruity and wordplay involved in swapping ""pray"" into a common phrase typically used in a bar context. The student describes how this swap injects humor by treating prayer as a form of customer service interaction, thus covering the anticipated answer point that focuses on the altered phrase.",o3,"{""tokens_in"": 0, ""tokens_out"": 0}",gpt-4o,"{""tokens_in"": 477, ""tokens_out"": 83}",20250506_180913_o3_high_exp-o3_ag-gpt_4o.csv
54,,46.0,"The cartoon depicts a shareholder meeting, with a banner reading “Welcome Stockholders.” However, the board members sitting on stage are all completely naked, and one man, also naked, is speaking at the podium. ","If all goes well, we'll get them back after the audit.",The board members specifically are naked because they had to lose their clothes for “transparency” during the audit.,"The caption riffs on two finance idioms.  
1. “Lose your shirt” means to suffer big financial losses; the naked executives have quite literally lost their shirts.  
2. An audit is said to “expose” a company’s books; here the executives are exposed in the most literal way.  
By saying, “If all goes well, we’ll get them back after the audit,” the speaker treats clothing as something the auditors are temporarily withholding, implying that once the company passes scrutiny—or recovers financially—their shirts (and the rest of their clothes) will be returned. The humor comes from turning figurative corporate language into a physical sight gag.",PASS,"The student’s answer explicitly discusses the nudity of the board members in the context of financial idioms related to loss and exposure, which connect to the idea of “transparency” during an audit. This captures the anticipated comedic element by linking their lack of clothing to the process of an audit's scrutiny and transparency. Although the wording differs, the essential comedic logic of linking nudity to transparency is present.",o3,"{""tokens_in"": 0, ""tokens_out"": 0}",gpt-4o,"{""tokens_in"": 465, ""tokens_out"": 97}",20250506_180913_o3_high_exp-o3_ag-gpt_4o.csv
